Dates,URL,News,Price Direction Up,Price Direction Constant,Price Direction Down,Asset Comparision,Past Information,Future Information,Price Sentiment,econ_themes,hybrid_text,cluster,x,y
28-01-2016,http://www.marketwatch.com/story/april-gold-down-20-cents-to-settle-at-111610oz-2016-01-28,"april gold down 20 cents to settle at $1,116.10/oz",0,0,1,0,1,0,negative,"['settle', '116 10', 'april', 'oz', 'gold 20 cents']","april gold down 20 cents to settle at $1,116.10/oz settle 116 10 april oz gold 20 cents",21,0.4792112,0.039362676
13-09-2017,http://www.marketwatch.com/story/gold-prices-snap-brief-slide-take-new-aim-at-one-year-highs-2017-09-13,gold suffers third straight daily decline,0,0,1,0,1,0,negative,"['straight', 'suffers', 'daily', 'decline', 'gold']",gold suffers third straight daily decline straight suffers daily decline gold,-1,-0.04938788,0.11358359
26-07-2016,http://www.marketwatch.com/story/gold-futures-edge-up-after-two-session-decline-2016-07-26,Gold futures edge up after two-session decline,1,0,0,0,1,0,positive,"['session', 'gold', 'decline', 'edge', 'gold futures']",Gold futures edge up after two-session decline session gold decline edge gold futures,-1,-0.09629032,-0.43770486
28-02-2018,https://www.metalsdaily.com/link/277199/dent-research-is-golds-day-in-the-sun-coming-soon.htm,dent research : is gold's day in the sun coming soon?,0,0,0,0,0,1,none,"['coming', 'soon', 'day sun', 'research gold', 'dent research']",dent research : is gold's day in the sun coming soon? coming soon day sun research gold dent research,-1,-0.094294965,0.06953794
06-09-2017,http://www.marketwatch.com/story/gold-steadies-near-best-mark-in-a-year-after-dovish-fed-view-stalls-dollar-2017-09-06,"Gold snaps three-day rally as Trump, lawmakers reach debt-ceiling deal",0,0,1,0,1,0,negative,"['snaps day', 'gold', 'lawmakers reach', 'rally trump', 'debt ceiling deal']","Gold snaps three-day rally as Trump, lawmakers reach debt-ceiling deal snaps day gold lawmakers reach rally trump debt ceiling deal",-1,-0.114196524,0.11927834
16-08-2016,http://www.marketwatch.com/story/dec-gold-climbs-940-or-07-to-settle-at-135690oz-2016-08-16,"Dec. gold climbs $9.40, or 0.7%, to settle at $1,356.90/oz",1,0,0,0,1,0,positive,"['dec', '40 settle', 'climbs', 'gold', '356 90 oz']","Dec. gold climbs $9.40, or 0.7%, to settle at $1,356.90/oz dec 40 settle climbs gold 356 90 oz",21,0.44029927,0.060084384
24-09-2013,https://economictimes.indiatimes.com/markets/commodities/gold-falls-by-rs-25-on-sluggish-demand-global-cues/articleshow/22998672.cms,"gold falls by rs 25 on sluggish demand, global cues",0,0,1,0,1,0,negative,"['global cues', '25', 'rs', 'sluggish demand', 'gold falls']","gold falls by rs 25 on sluggish demand, global cues global cues 25 rs sluggish demand gold falls",19,-0.11188017,0.17733994
23-09-2016,http://www.marketwatch.com/story/gold-futures-fall-for-the-session-but-gain-for-the-week-2016-09-23,"Gold futures fall for the session, but gain for the week",1,0,1,0,1,0,positive,"['fall', 'session', 'gain', 'week', 'gold futures']","Gold futures fall for the session, but gain for the week fall session gain week gold futures",-1,-0.049719855,-0.42089885
21-10-2012,https://www.thehindubusinessline.com/opinion/columns/g-chandrashekhar/gold-struggles-silver-slides-base-metals-falter/article20517742.ece1,"Gold struggles; silver slides, base metals falter",0,1,0,1,1,0,neutral,"['falter', 'base', 'slides', 'metals', 'gold struggles silver']","Gold struggles; silver slides, base metals falter falter base slides metals gold struggles silver",-1,-0.110019065,0.10050073
16-03-2018,http://www.marketwatch.com/story/april-gold-holds-slight-gain-up-250-or-02-at-132020oz-2018-03-16,"april gold holds slight gain, up $2.50, or 0.2%, at $1320.20/oz.",1,0,0,0,1,0,positive,"['1320', 'slight', 'gain 50', '20 oz', 'april gold holds']","april gold holds slight gain, up $2.50, or 0.2%, at $1320.20/oz. 1320 slight gain 50 20 oz april gold holds",21,0.38587028,0.13277169
04-02-2009,http://www.marketwatch.com/story/feb-gold-ends-up-960-11,"feb. gold ends up $9.60, or 1.1%, at $901.60 an ounce",1,0,0,0,1,0,positive,"['ends', '901 60', 'feb', 'gold', 'ounce']","feb. gold ends up $9.60, or 1.1%, at $901.60 an ounce ends 901 60 feb gold ounce",21,0.47898293,0.09320027
28-07-2017,https://economictimes.indiatimes.com/markets/commodities/news/gold-trades-in-red-in-early-trade-eyes-near-term-range-at-rs-28300-28600/articleshow/59803537.cms,"gold trades in red in early trade; eyes near-term range at rs 28,300-28,600",0,0,1,0,1,0,negative,"['gold', 'rs 28 300', 'near term range', 'red early', 'early trade eyes']","gold trades in red in early trade; eyes near-term range at rs 28,300-28,600 gold rs 28 300 near term range red early early trade eyes",-1,-0.078403346,0.050733414
31-10-2011,http://www.marketwatch.com/story/gold-loses-13-but-logs-monthly-gain-of-63-2011-10-31,"gold loses 1.3%, but logs monthly gain of 6.3%",1,0,1,0,1,0,positive,"['loses', 'gold', 'monthly gain', 'loses logs', 'logs monthly']","gold loses 1.3%, but logs monthly gain of 6.3% loses gold monthly gain loses logs logs monthly",-1,0.0055803657,0.02003526
21-09-2013,https://www.moneycontrol.com/news/business/markets/-1668497.html,gold recovery? here's one way to play it,1,0,0,0,0,1,positive,"['way', 'play', 'recovery', 'gold', 'gold recovery way']",gold recovery? here's one way to play it way play recovery gold gold recovery way,-1,-0.10964374,0.14746998
22-09-2017,https://economictimes.indiatimes.com/markets/commodities/news/gold-prices-rebound-rs-350-on-global-cues-weak-rupee/articleshow/60794262.cms,"gold prices rebound rs 350 on global cues, weak rupee",1,0,0,1,1,0,positive,"['global cues', '350', 'rebound', 'weak rupee', 'gold prices']","gold prices rebound rs 350 on global cues, weak rupee global cues 350 rebound weak rupee gold prices",-1,-0.15825413,0.10375227
11-05-2016,https://www.moneycontrol.com/news/trends/24x7booking-trends/can-investmentgold-sensexppfs-givesame-returns-999662.html,"can investment in gold, sensex & ppfs give the same returns?",0,0,0,0,0,1,none,"['gold', 'returns', 'sensex', 'investment', 'ppfs returns']","can investment in gold, sensex & ppfs give the same returns? gold returns sensex investment ppfs returns",-1,-0.253339,0.014955379
14-05-2013,https://economictimes.indiatimes.com/news/economy/indicators/gold-rush-spooks-economy-as-trade-deficit-surges-to-17-8-bn/articleshow/20040266.cms,gold rush spooks economy as trade deficit surges to $17.8 bn,1,0,0,0,1,0,positive,"['bn', 'rush spooks', 'deficit surges 17', 'gold', 'economy trade deficit']",gold rush spooks economy as trade deficit surges to $17.8 bn bn rush spooks deficit surges 17 gold economy trade deficit,-1,-0.15060584,0.11020794
04-09-2018,https://www.thehindubusinessline.com/markets/gold/gold-futures-down-at-rs-30244/article24861849.ece,"Gold futures down at Rs 30,244 ",0,0,1,0,1,0,negative,"['rs', '30', '30 244', 'gold', 'futures']","Gold futures down at Rs 30,244  rs 30 30 244 gold futures",23,0.022221506,-0.36941493
04-09-2018,https://www.metalsdaily.com/link/282776/state-street-gold-likely-to-climb-back-to-$1-350-an-ounce-by-the-end-of-2018.htm,"state street : gold likely to climb back to $1,350 an ounce by the end of 2018",1,0,0,0,1,0,positive,"['street', '350', 'state', 'ounce end 2018', 'gold likely climb']","state street : gold likely to climb back to $1,350 an ounce by the end of 2018 street 350 state ounce end 2018 gold likely climb",-1,0.22826718,0.03027109
09-12-2016,http://www.investing.com/news/commodities-news/gold-prices-slip-lower-as-dollar-remains-supported-446716,gold prices slip lower as dollar remains supported,0,0,1,1,1,0,negative,"['remains', 'supported', 'lower', 'gold prices', 'prices slip lower']",gold prices slip lower as dollar remains supported remains supported lower gold prices prices slip lower,-1,-0.02438254,-0.0050388947
03-02-2017,https://www.moneycontrol.com/news/business/stocks/gold-to-trade28670-29160-range-achiievers-equities-948756.html,gold to trade in 28670-29160 range: achiievers equities,0,1,0,0,0,1,neutral,"['achiievers', 'range', '28670 29160', 'equities', 'gold trade']",gold to trade in 28670-29160 range: achiievers equities achiievers range 28670 29160 equities gold trade,3,0.034435913,0.10993467
19-06-2015,https://www.thehindubusinessline.com/markets/gold/gold-holds-firm-near-1200-on-dovish-fed/article7332525.ece,"Gold holds firm near $1,200 on dovish Fed",0,1,0,0,1,0,neutral,"['near 200', 'gold', 'fed', 'dovish', 'holds firm near']","Gold holds firm near $1,200 on dovish Fed near 200 gold fed dovish holds firm near",-1,-0.0004799664,0.016145341
25-09-2017,http://www.marketwatch.com/story/gold-prices-finish-at-a-more-than-one-week-high-2017-09-25,Gold prices finish at a more than one-week high,1,0,0,0,1,0,positive,"['finish', 'high', 'week', 'prices', 'gold prices']",Gold prices finish at a more than one-week high finish high week prices gold prices,-1,0.017620638,-0.040088534
28-02-2018,https://www.metalsdaily.com/link/277185/india-is-gold-a-good-investment-in-a-volatile-market.htm,india : is gold a good investment in a volatile market?,0,0,0,0,0,1,none,"['good', 'volatile', 'india', 'investment', 'gold good']",india : is gold a good investment in a volatile market? good volatile india investment gold good,-1,-0.23207358,0.11375758
13-12-2012,http://www.marketwatch.com/story/gold-futures-down-over-20oz-ahead-of-settlement-2012-12-13,gold futures down over $20/oz ahead of settlement,0,0,1,0,1,0,negative,"['ahead', '20', 'oz', 'settlement', 'gold futures']",gold futures down over $20/oz ahead of settlement ahead 20 oz settlement gold futures,-1,0.1710503,-0.4390509
30-01-2017,http://www.marketwatch.com/story/gold-holds-modest-gains-up-310-or-03-at-119150oz-after-data-2017-01-30,"Gold holds modest gains, up $3.10, or 0.3%, at $1,191.50/oz. after data",1,0,0,0,1,0,positive,"['191 50', 'holds modest', 'gains 10', 'gold', 'oz data']","Gold holds modest gains, up $3.10, or 0.3%, at $1,191.50/oz. after data 191 50 holds modest gains 10 gold oz data",-1,0.30486923,0.17785093
15-03-2006,http://www.marketwatch.com/story/april-gold-up-140-to-end-the-day-at-55440oz-in-ny-2006-03-15,april gold up $1.40 to end the day at $554.40/oz in ny,1,0,0,0,1,0,positive,"['554', '40 oz', 'ny', 'end day', 'april gold']",april gold up $1.40 to end the day at $554.40/oz in ny 554 40 oz ny end day april gold,21,0.41569024,0.0620915
01-11-2011,https://www.moneycontrol.com/news/business/stocks/-1946461.html,"Gold, Silver may trade lower today: Angel Commodities",0,0,1,1,1,0,negative,"['today', 'angel', 'lower', 'commodities', 'gold silver trade']","Gold, Silver may trade lower today: Angel Commodities today angel lower commodities gold silver trade",8,-0.09104213,0.1160587
26-10-2017,http://www.marketwatch.com/story/kaz-minerals-lifts-copper-gold-guidance-2017-10-26,"KAZ Minerals lifts copper, gold guidance",1,0,0,1,1,0,positive,"['guidance', 'lifts', 'kaz', 'minerals', 'copper gold guidance']","KAZ Minerals lifts copper, gold guidance guidance lifts kaz minerals copper gold guidance",-1,-0.25336877,0.124726675
28-02-2017,http://www.marketwatch.com/story/gold-little-changed-after-data-2017-02-28,Gold little-changed after data,0,1,0,0,1,0,neutral,"['little', 'changed', 'data', 'gold', 'changed data']",Gold little-changed after data little changed data gold changed data,-1,-0.09414586,0.16135624
27-11-2017,https://www.metalsdaily.com/link/274264/germany-why-gold-market-in-germany-is-thriving.htm,germany : why gold market in germany is thriving,1,0,0,0,1,0,positive,"['thriving', 'market', 'germany', 'gold', 'germany gold market']",germany : why gold market in germany is thriving thriving market germany gold germany gold market,-1,-0.18255512,0.2058107
19-06-2009,http://www.marketwatch.com/story/august-gold-ends-up-160-or-02-at-93620,"august gold ends up $1.60, or 0.2%, at $936.20",1,0,0,0,1,0,positive,"['936 20', 'ends', '60', 'gold', 'august']","august gold ends up $1.60, or 0.2%, at $936.20 936 20 ends 60 gold august",21,0.3694105,0.04793679
14-04-2010,http://www.marketwatch.com/story/gold-futures-at-highest-since-early-december-2010-04-14,gold futures at highest since early december,1,0,0,0,1,0,positive,"['early', 'gold', 'highest', 'december', 'futures']",gold futures at highest since early december early gold highest december futures,-1,-0.032006502,-0.43501306
22-12-2004,http://www.marketwatch.com/story/gold-futures-close-narrowly-lower-2004-12-22,gold futures close narrowly lower,0,0,1,0,1,0,negative,"['lower', 'gold', 'narrowly', 'futures close', 'gold futures']",gold futures close narrowly lower lower gold narrowly futures close gold futures,-1,-0.11141772,-0.50594485
23-11-2018,https://www.moneycontrol.com/news/business/commodities/gold-edges-up-ahead-of-g20-meeting-set-to-post-second-weekly-gain-3212401.html,Gold edges up ahead of G20 meeting; set to post second weekly gain,1,0,0,0,1,0,positive,"['second weekly', 'gain', 'meeting set post', 'gold', 'edges ahead g20']",Gold edges up ahead of G20 meeting; set to post second weekly gain second weekly gain meeting set post gold edges ahead g20,-1,-0.15024284,-0.019121647
03-12-2004,http://www.marketwatch.com/story/feb-gold-falls-10c-to-45220oz-in-morning-ny-trade-2004-12-03,feb gold falls 10c to $452.20/oz in morning ny trade,0,0,1,0,1,0,negative,"['10c 452', 'feb', 'ny trade', '20 oz morning', 'gold falls']",feb gold falls 10c to $452.20/oz in morning ny trade 10c 452 feb ny trade 20 oz morning gold falls,21,0.38730168,0.074656814
30-05-2000,http://www.marketwatch.com/story/gold-little-changed-copper-sinks,gold little changed; copper sinks,0,1,0,1,1,0,neutral,"['little', 'changed', 'gold', 'sinks', 'changed copper']",gold little changed; copper sinks little changed gold sinks changed copper,-1,-0.020057127,0.13912174
07-01-2013,https://www.moneycontrol.com/news/business/markets/-1701983.html,gold swings between gains and drops on stronger dollar,1,0,1,1,1,0,positive,"['stronger', 'swings', 'dollar', 'drops', 'gold swings gains']",gold swings between gains and drops on stronger dollar stronger swings dollar drops gold swings gains,-1,-0.07835618,0.08932833
20-06-2018,https://www.metalsdaily.com/link/280600/charts-gold-gld-etf-update-breakdown-.htm,charts : gold gld etf update - breakdown ?,0,0,0,0,0,1,none,"['breakdown', 'gold', 'gld', 'etf update', 'charts']",charts : gold gld etf update - breakdown ? breakdown gold gld etf update charts,-1,-0.18064672,0.019761205
19-12-2011,http://www.marketwatch.com/story/feb-gold-down-120-to-close-at-159670oz-2011-12-19,"feb. gold down $1.20 to close at $1,596.70/oz",0,0,1,0,1,0,negative,"['596 70', 'feb', 'oz', 'gold', '20 close']","feb. gold down $1.20 to close at $1,596.70/oz 596 70 feb oz gold 20 close",21,0.41932976,-0.004526481
19-01-2005,http://www.marketwatch.com/story/philly-gold-and-silver-index-falls-05-to-end-at-9353-2005-01-19,philly gold and silver index falls 0.5% to end at 93.53,0,0,1,1,1,0,negative,"['falls', 'end 93', 'index', 'philly', 'gold silver']",philly gold and silver index falls 0.5% to end at 93.53 falls end 93 index philly gold silver,7,0.04612671,0.009248048
19-10-2016,http://www.marketwatch.com/story/dec-gold-settles-at-126990oz-up-7-or-06-2016-10-19,"Dec. gold settles at $1,269.90/oz, up $7, or 0.6%",1,0,0,0,1,0,positive,"['dec', '90', '269', 'oz', 'gold settles']","Dec. gold settles at $1,269.90/oz, up $7, or 0.6% dec 90 269 oz gold settles",21,0.48195106,-0.019439429
21-03-2018,http://www.investing.com/news/commodities-news/gold-prices-hold-onto-gains-ahead-of-fomc-statement-1352279,Gold Prices Hold onto Gains Ahead of FOMC Statement,0,1,0,0,1,0,neutral,"['ahead', 'statement', 'fomc', 'prices hold gains', 'gold prices']",Gold Prices Hold onto Gains Ahead of FOMC Statement ahead statement fomc prices hold gains gold prices,-1,-0.10610972,0.005918324
10-08-2017,http://www.marketwatch.com/story/december-gold-trades-08-higher-at-1289oz-2017-08-10,"December gold trades 0.8% higher at $1,289/oz.",1,0,0,0,1,0,positive,"['289', 'december', 'gold', 'oz', 'trades higher']","December gold trades 0.8% higher at $1,289/oz. 289 december gold oz trades higher",-1,0.3370943,0.038618356
21-05-2018,https://www.metalsdaily.com/link/279813/gold-bulls-push-for-the-exits-on-strong-dollar-and-lack-of-fear.htm,gold bulls push for the exits on strong dollar and lack of fear,0,0,1,1,1,0,negative,"['strong', 'push exits', 'dollar', 'lack fear', 'bulls']",gold bulls push for the exits on strong dollar and lack of fear strong push exits dollar lack fear bulls,-1,-0.11636758,0.055060852
14-04-2010,http://www.marketwatch.com/story/gold-ends-05-higher-at-115960-an-ounce-2010-04-14,"gold ends 0.5% higher, at $1,159.60 an ounce",1,0,0,0,1,0,positive,"['ends', 'higher', '159 60', 'ounce', 'gold ends']","gold ends 0.5% higher, at $1,159.60 an ounce ends higher 159 60 ounce gold ends",21,0.33538765,0.06155113
26-03-2015,"http://www.investing.com/news/commodities-news/gold-futures-soar-above-$1,200,-amid-escalating-conflict-in-yemen-334368","gold futures soar above $1,200, amid escalating conflict in yemen",1,0,0,0,1,0,positive,"['escalating', '200 amid', 'soar', 'yemen', 'gold futures']","gold futures soar above $1,200, amid escalating conflict in yemen escalating 200 amid soar yemen gold futures",-1,0.056093484,-0.24810201
23-05-2013,http://www.marketwatch.com/story/gold-falls-after-fed-talk-boosts-dollar-2013-05-22,gold settles at its highest level in a week,1,0,0,0,1,0,positive,"['highest', 'week', 'level week', 'gold', 'settles']",gold settles at its highest level in a week highest week level week gold settles,20,0.04044126,-0.046749383
18-08-2017,https://economictimes.indiatimes.com/markets/commodities/news/gold-steady-buoyed-by-geopolitical-worries/articleshow/60112652.cms,"gold prices rise for a third day, buoyed by geopolitical worries",1,0,0,0,1,0,positive,"['buoyed', 'worries', 'rise day', 'geopolitical', 'gold prices']","gold prices rise for a third day, buoyed by geopolitical worries buoyed worries rise day geopolitical gold prices",-1,-0.13036363,0.13292888
01-12-2017,https://www.thehindubusinessline.com/markets/gold/gold-holds-near-312-week-low-as-investors-opt-for-riskier-assets/article9978905.ece,Gold holds near 3-1/2 week low as investors opt for riskier assets,0,1,1,0,1,0,negative,"['opt riskier', 'low', 'near week', 'assets', 'gold holds near']",Gold holds near 3-1/2 week low as investors opt for riskier assets opt riskier low near week assets gold holds near,-1,-0.060865223,-0.0153841
16-02-2018,http://www.marketwatch.com/story/firmer-gold-futures-head-for-weekly-gain-2018-02-16,"gold ends higher, logs biggest weekly gain since 2016",1,0,0,0,1,0,positive,"['biggest', 'weekly', 'gain 2016', 'higher logs', 'gold ends']","gold ends higher, logs biggest weekly gain since 2016 biggest weekly gain 2016 higher logs gold ends",-1,-0.06957808,0.0039340854
16-06-2017,http://www.marketwatch.com/story/august-gold-rises-02-at-125750oz-2017-06-16,"August gold rises 0.2% at $1,257.50/oz.",1,0,0,0,1,0,positive,"['257 50', 'rises', '50 oz', 'gold', 'august']","August gold rises 0.2% at $1,257.50/oz. 257 50 rises 50 oz gold august",21,0.38280404,0.20208806
21-04-2004,http://www.marketwatch.com/story/gold-futures-at-seven-week-low-2004-04-21,gold futures at seven-week low,0,0,1,0,1,0,negative,"['seven', 'low', 'futures', 'seven week', 'gold futures']",gold futures at seven-week low seven low futures seven week gold futures,-1,-0.058914423,-0.4982472
27-09-2017,https://economictimes.indiatimes.com/markets/commodities/news/gold-prices-steady-after-hawkish-yellen-comments/articleshow/60849877.cms,gold edges down as dollar gains on fed rate hike view,0,0,1,1,1,0,negative,"['view', 'gains', 'hike', 'fed rate', 'gold edges']",gold edges down as dollar gains on fed rate hike view view gains hike fed rate gold edges,-1,-0.16419739,0.0474642
20-09-2018,https://www.metalsdaily.com/link/284308/van-eck-tighter-global-monetary-policy-to-support-gold-market.htm,van eck : tighter global monetary policy to support gold market,1,0,0,0,0,1,positive,"['policy support', 'tighter global', 'van eck', 'monetary', 'support gold market']",van eck : tighter global monetary policy to support gold market policy support tighter global van eck monetary support gold market,-1,-0.13148981,0.09411827
06-06-2018,https://www.thehindubusinessline.com/markets/gold/gold-rebounds-to-rs-31860-on-firm-global-cues/article24095236.ece,"Gold rebounds to Rs 31,860 on firm global cues",1,0,0,0,1,0,positive,"['rs', 'cues', '31 860', 'firm global', 'gold rebounds']","Gold rebounds to Rs 31,860 on firm global cues rs cues 31 860 firm global gold rebounds",-1,-0.114625536,0.20833334
29-07-2016,http://www.marketwatch.com/story/december-gold-gains-410-or-03-to-134530oz-2016-07-29,"december gold gains $4.10, or 0.3%, to $1,345.30/oz.",1,0,0,0,1,0,positive,"['10 345 30', 'oz', 'gains', 'december', 'gold']","december gold gains $4.10, or 0.3%, to $1,345.30/oz. 10 345 30 oz gains december gold",21,0.39943373,0.09917144
11-09-2017,http://www.marketwatch.com/story/gold-prices-settle-at-lowest-level-in-more-than-a-week-2017-09-11,gold prices settle at lowest level in more than a week,0,0,1,0,1,0,negative,"['week', 'settle', 'lowest level', 'prices settle', 'gold prices']",gold prices settle at lowest level in more than a week week settle lowest level prices settle gold prices,-1,0.057754487,-0.12633017
29-09-2010,http://www.marketwatch.com/story/dec-gold-down-30-cents-at-1310oz-on-globex-2010-09-29,"dec. gold down 30 cents at $1,310/oz on globex",0,0,1,0,1,0,negative,"['310', 'oz', 'dec', 'globex', 'gold 30 cents']","dec. gold down 30 cents at $1,310/oz on globex 310 oz dec globex gold 30 cents",21,0.3599047,0.102165066
13-09-2016,http://www.marketwatch.com/story/dec-gold-settles-at-132370oz-down-190-or-01-2016-09-13,"Dec. gold settles at $1,323.70/oz, down $1.90, or 0.1%",0,0,1,0,1,0,negative,"['323 70', 'dec', 'gold', 'settles', '70 oz 90']","Dec. gold settles at $1,323.70/oz, down $1.90, or 0.1% 323 70 dec gold settles 70 oz 90",21,0.5188606,0.013667971
22-02-2017,http://www.marketwatch.com/story/gold-jumps-03-from-settlement-price-after-fed-minutes-to-123740-an-ounce-2017-02-22,"Gold jumps 0.3% from settlement price after Fed minutes to $1,237.40 an ounce",1,0,0,0,1,0,positive,"['minutes 237', 'jumps', '40 ounce', 'gold', 'settlement price fed']","Gold jumps 0.3% from settlement price after Fed minutes to $1,237.40 an ounce minutes 237 jumps 40 ounce gold settlement price fed",-1,0.2637841,-0.047036693
08-01-2010,http://www.marketwatch.com/story/gold-lost-1-to-112180-an-ounce-2010-01-08,"gold lost 1% to $1,121.80 an ounce",0,0,1,0,1,0,negative,"['lost', '80', 'gold', 'lost 121 80', 'ounce']","gold lost 1% to $1,121.80 an ounce lost 80 gold lost 121 80 ounce",-1,0.3146475,0.17532182
09-03-2016,http://www.marketwatch.com/story/gold-futures-fall-for-a-third-straight-session-2016-03-09,gold futures fall for a third straight session,0,0,1,0,1,0,negative,"['straight', 'fall', 'session', 'futures fall', 'gold futures']",gold futures fall for a third straight session straight fall session futures fall gold futures,-1,-0.05099404,-0.49632275
31-08-2011,http://www.marketwatch.com/story/gold-has-best-monthly-performance-since-nov-2009-2011-08-31,gold has best monthly performance since nov. 2009,1,0,0,0,1,0,positive,"['best', '2009', 'gold', 'performance nov', 'monthly performance']",gold has best monthly performance since nov. 2009 best 2009 gold performance nov monthly performance,-1,-0.14065175,0.11687191
02-10-2017,http://www.marketwatch.com/story/gold-prices-settle-at-lowest-level-in-nearly-8-weeks-2017-10-02,gold prices settle at lowest level in nearly 8 weeks,0,0,1,0,1,0,negative,"['nearly', 'weeks', 'lowest level', 'prices settle', 'gold prices']",gold prices settle at lowest level in nearly 8 weeks nearly weeks lowest level prices settle gold prices,-1,0.072105065,-0.10462457
0201-04-27,http://www.marketwatch.com/story/gold-futures-climb-back-above-1200oz-on-comex-2015-04-27,"gold futures climb back above $1,200/oz on comex",1,0,0,0,1,0,positive,"['climb', '200', 'oz', 'comex', 'gold futures']","gold futures climb back above $1,200/oz on comex climb 200 oz comex gold futures",-1,0.15214191,-0.33810622
02-10-2003,http://www.marketwatch.com/story/metals-shares-turn-higher-gold-futures-still-lower-2003-10-02,metals shares turn higher; gold futures still lower,0,0,1,0,1,0,negative,"['turn', 'lower', 'metals', 'shares turn higher', 'gold futures']",metals shares turn higher; gold futures still lower turn lower metals shares turn higher gold futures,-1,-0.1994951,-0.33025616
18-06-2012,https://economictimes.indiatimes.com/markets/commodities/gold-declines-first-time-in-seven-days-after-greek-elections/articleshow/14241472.cms,gold declines first time in seven days after greek elections,0,0,1,0,1,0,negative,"['time', 'seven days', 'elections', 'greek', 'gold declines']",gold declines first time in seven days after greek elections time seven days elections greek gold declines,-1,-0.06281715,0.055942263
26-10-2017,https://economictimes.indiatimes.com/markets/commodities/news/gold-edges-up-as-dollar-eases-ahead-of-ecb-meeting/articleshow/61233638.cms,gold gains on weaker dollar; markets brace for ecb decision,1,0,0,1,1,0,positive,"['weaker', 'gains', 'gold', 'dollar markets', 'brace ecb decision']",gold gains on weaker dollar; markets brace for ecb decision weaker gains gold dollar markets brace ecb decision,-1,-0.096371785,0.122095704
12-12-2017,http://www.marketwatch.com/story/gold-holds-modest-loss-after-ppi-report-2017-12-12,gold holds modest loss after ppi report,0,0,1,0,1,0,negative,"['report', 'modest', 'loss', 'ppi', 'gold holds']",gold holds modest loss after ppi report report modest loss ppi gold holds,-1,-0.079551995,0.081101835
28-11-2017,http://www.marketwatch.com/story/february-gold-contract-notches-highest-settlement-in-over-a-week-2017-11-28,February gold contract notches highest settlement in over a week,1,0,0,0,1,0,positive,"['week', 'february', 'gold', 'contract notches', 'highest settlement']",February gold contract notches highest settlement in over a week week february gold contract notches highest settlement,-1,0.005552605,-0.11642167
27-07-2017,http://www.marketwatch.com/story/august-gold-climbs-by-1060-or-09-to-settle-at-1260oz-2017-07-27,"August gold climbs by $10.60, or 0.9%, to settle at $1,260/oz",1,0,0,0,1,0,positive,"['10', '60 settle', 'august', '260 oz', 'gold climbs']","August gold climbs by $10.60, or 0.9%, to settle at $1,260/oz 10 60 settle august 260 oz gold climbs",21,0.40114546,0.09688905
23-03-2010,http://www.marketwatch.com/story/gold-finishes-higher-at-110370oz-2010-03-23,"gold finishes higher at $1,103.70/oz",1,0,0,0,1,0,positive,"['103 70', 'finishes', 'higher', 'oz', 'gold']","gold finishes higher at $1,103.70/oz 103 70 finishes higher oz gold",-1,0.3125484,0.13633564
11-01-2018,https://www.metalsdaily.com/link/275678/debt-global-debt-surges-gold-and-silver-investors-patience-will-soon-pay-off.htm,debt : global debt surges - gold and silver investors' patience will soon pay off,1,0,0,1,0,1,positive,"['silver', 'surges gold', 'patience soon pay', 'investors', 'debt global debt']",debt : global debt surges - gold and silver investors' patience will soon pay off silver surges gold patience soon pay investors debt global debt,-1,-0.25515497,0.16594583
22-04-2008,http://www.marketwatch.com/story/gold-futures-open-higher-as-dollar-drops-2008-04-22,"gold futures open higher, as dollar drops",1,0,0,1,1,0,positive,"['dollar', 'drops', 'gold', 'open higher', 'futures open']","gold futures open higher, as dollar drops dollar drops gold open higher futures open",-1,-0.061896615,-0.4080008
08-03-2011,http://www.marketwatch.com/story/gold-declines-as-gadhafi-reportedly-exiting-2011-03-08,gold futures close with a more than $7 loss,0,0,1,0,1,0,negative,"['close', 'gold', 'loss', 'gold futures', 'futures close loss']",gold futures close with a more than $7 loss close gold loss gold futures futures close loss,-1,-0.0035620183,-0.5220901
30-08-2017,http://www.marketwatch.com/story/gold-prices-slip-from-11-month-highs-as-dollar-steadies-2017-08-30,"gold surrenders 11-month highs on stronger dollar, upbeat economic data",0,0,1,1,1,0,negative,"['economic data', 'month highs stronger', 'gold', 'surrenders 11', 'dollar upbeat economic']","gold surrenders 11-month highs on stronger dollar, upbeat economic data economic data month highs stronger gold surrenders 11 dollar upbeat economic",-1,-0.011860475,0.1315115
09-10-2013,http://www.marketwatch.com/story/gold-edges-up-in-electronic-trade-post-fed-minutes-2013-10-09,gold edges up in electronic trade post-fed minutes,1,0,0,0,1,0,positive,"['post', 'minutes', 'fed', 'electronic trade', 'gold edges electronic']",gold edges up in electronic trade post-fed minutes post minutes fed electronic trade gold edges electronic,-1,-0.12894386,0.041326605
12-06-2018,https://www.metalsdaily.com/link/280454/when-will-golds-summer-doldrums-end-history-says-pretty-soon.htm,when will gold's 'summer doldrums' end? history says pretty soon,0,0,0,0,0,1,none,"['says pretty', 'end history', 'gold', 'pretty soon', 'summer doldrums']",when will gold's 'summer doldrums' end? history says pretty soon says pretty end history gold pretty soon summer doldrums,-1,-0.0686678,-0.040237546
29-06-2017,http://www.marketwatch.com/story/gold-stages-a-retreat-as-government-bond-yields-jolt-higher-2017-06-29,Gold ends lower as rise in government bond yields dulls investment interest,0,0,1,0,1,0,negative,"['lower rise', 'dulls', 'investment', 'gold ends', 'government bond yields']",Gold ends lower as rise in government bond yields dulls investment interest lower rise dulls investment gold ends government bond yields,-1,-0.23041609,0.060159758
23-08-2013,https://www.moneycontrol.com/news/business/markets/-1649259.html,gold jewellery exports fall 70% in july,0,0,0,1,1,0,none,"['70', 'july', 'fall', 'gold jewellery', 'exports fall']",gold jewellery exports fall 70% in july 70 july fall gold jewellery exports fall,-1,0.012218997,-0.0007880479
29-04-2011,https://www.moneycontrol.com/news/business/markets/-2104243.html,"silver, gold near lifetime highs, dollar loses ground",0,0,1,1,1,0,negative,"['highs', 'lifetime', 'ground', 'dollar loses', 'silver gold near']","silver, gold near lifetime highs, dollar loses ground highs lifetime ground dollar loses silver gold near",-1,-0.018327266,0.005830027
23-07-2012,http://www.marketwatch.com/story/african-barrick-gold-production-declines-2012-07-23,african barrick gold production declines,0,0,0,0,1,0,none,"['production', 'african', 'declines', 'barrick', 'gold production declines']",african barrick gold production declines production african declines barrick gold production declines,-1,-0.026971638,0.15061788
14-06-2016,https://www.thehindubusinessline.com/markets/gold/gold-futures-down-at-rs-30568-on-weak-global-cues/article8727972.ece,"Gold futures down at Rs 30,568 on weak global cues",0,0,1,0,1,0,negative,"['cues', '30 568', 'rs 30', 'weak global', 'gold futures']","Gold futures down at Rs 30,568 on weak global cues cues 30 568 rs 30 weak global gold futures",22,-0.13555074,-0.31124413
05-05-2004,http://www.marketwatch.com/story/metals-shares-fall-but-gold-futures-edge-up-2004-05-05,"metals shares fall, but gold futures edge up",1,0,0,0,1,0,positive,"['edge', 'fall', 'metals', 'shares fall', 'gold futures']","metals shares fall, but gold futures edge up edge fall metals shares fall gold futures",-1,-0.1751668,-0.3430271
27-06-2008,http://www.marketwatch.com/story/august-gold-ends-up-1620-at-93130-an-ounce-on-nymex-2008-06-27,august gold ends up $16.20 at $931.30 an ounce on nymex,1,0,0,0,1,0,positive,"['16 20 931', 'nymex', 'august', '931 30 ounce', 'gold ends']",august gold ends up $16.20 at $931.30 an ounce on nymex 16 20 931 nymex august 931 30 ounce gold ends,21,0.39942247,0.040613994
29-01-2004,http://www.marketwatch.com/story/gold-futures-fall-under-400-first-time-since-dec-2-2004-01-29,"gold futures fall under $400, first time since dec. 2",0,0,1,0,1,0,negative,"['time', 'dec', 'fall', '400', 'gold futures']","gold futures fall under $400, first time since dec. 2 time dec fall 400 gold futures",-1,0.09591092,-0.443511
03-11-2016,https://economictimes.indiatimes.com/markets/commodities/news/ghana-makes-government-certificate-mandatory-for-exporting-dore-gold/articleshow/55221442.cms,ghana makes government certificate mandatory for exporting dore gold,0,0,0,0,1,0,none,"['makes government', 'exporting', 'ghana', 'dore gold', 'certificate mandatory']",ghana makes government certificate mandatory for exporting dore gold makes government exporting ghana dore gold certificate mandatory,-1,-0.24405336,0.1625404
05-01-2018,http://www.marketwatch.com/story/gold-holds-modest-loss-after-ism-services-data-2018-01-05,gold holds modest loss after ism services data,0,0,1,0,1,0,negative,"['modest', 'services data', 'loss', 'gold holds', 'ism services data']",gold holds modest loss after ism services data modest services data loss gold holds ism services data,-1,-0.16677983,0.11833015
18-08-2016,http://www.marketwatch.com/story/gold-gains-on-hope-the-fed-will-lift-rates-slowly-2016-08-18,gold notches two-week high on expectations fed will lift rates slowly,1,0,0,0,1,0,positive,"['week high expectations', 'fed', 'lift rates', 'rates slowly', 'gold notches']",gold notches two-week high on expectations fed will lift rates slowly week high expectations fed lift rates rates slowly gold notches,-1,-0.15498033,-0.0661937
07-12-2012,https://www.moneycontrol.com/news/business/markets/-1736071.html,gold prices gain in major metros in india,1,0,0,0,1,0,positive,"['major', 'india', 'metros', 'prices gain', 'gold prices']",gold prices gain in major metros in india major india metros prices gain gold prices,13,-0.14003962,0.063981466
03-05-2018,http://www.marketwatch.com/story/gold-futures-mark-first-gain-in-four-sessions-2018-05-03,gold futures mark first gain in four sessions,1,0,0,0,1,0,positive,"['sessions', 'mark', 'gain', 'futures', 'gold futures']",gold futures mark first gain in four sessions sessions mark gain futures gold futures,-1,-0.06335511,-0.41882133
06-11-2007,http://www.marketwatch.com/story/gold-sets-fresh-multi-decade-high-of-8152ounce-up-44-2007-11-06,"gold sets fresh multi-decade high of $815.2/ounce, up $4.4",1,0,0,0,1,0,positive,"['sets fresh multi', 'decade', 'sets', 'gold', 'high 815 ounce']","gold sets fresh multi-decade high of $815.2/ounce, up $4.4 sets fresh multi decade sets gold high 815 ounce",-1,0.26519352,0.08701471
01-12-2011,https://www.moneycontrol.com/news/business/stocks/-1249899.html,Support for MCX Gold Feb at Rs 28800: Kotak Commodity,0,0,0,1,1,0,none,"['feb', '28800', 'kotak', 'commodity', 'support mcx']",Support for MCX Gold Feb at Rs 28800: Kotak Commodity feb 28800 kotak commodity support mcx,-1,-0.14818433,0.01732698
24-04-2014,http://www.marketwatch.com/story/microsoft-ceo-sees-gold-rush-in-the-cloud-2014-04-24,microsoft ceo sees 'gold rush' in the cloud,0,0,0,0,0,1,none,"['sees', 'cloud', 'rush', 'microsoft', 'ceo sees gold']",microsoft ceo sees 'gold rush' in the cloud sees cloud rush microsoft ceo sees gold,-1,-0.24688184,0.13573056
26-01-2017,http://www.marketwatch.com/story/gold-trades-at-multiweek-lows-as-stocks-try-to-push-deeper-into-record-territory-2017-01-26,gold ends at lowest level in over 2 weeks as dollar strengthens,0,0,1,1,1,0,negative,"['strengthens', 'weeks', 'lowest level', 'dollar', 'gold ends']",gold ends at lowest level in over 2 weeks as dollar strengthens strengthens weeks lowest level dollar gold ends,-1,0.07289149,-0.004169047
07-04-2016,https://economictimes.indiatimes.com/markets/commodities/gold-silver-bounce-on-global-cues-jewellers-buying/articleshow/51729892.cms,"gold, silver bounce on global cues, jewellers buying",1,0,0,1,1,0,positive,"['global', 'bounce', 'cues', 'gold silver', 'jewellers buying']","gold, silver bounce on global cues, jewellers buying global bounce cues gold silver jewellers buying",-1,-0.1567762,0.16891336
16-12-2013,http://www.marketwatch.com/story/gold-inches-higher-ahead-of-fed-meeting-2013-12-16,gold scores gain for second session in a row,1,0,0,0,1,0,positive,"['row', 'second', 'gold', 'scores gain', 'gain second session']",gold scores gain for second session in a row row second gold scores gain gain second session,-1,-0.07190647,0.08827027
20-02-2015,https://www.thehindubusinessline.com/markets/commodities/jewellers-want-gold-import-duty-cut-to-2/article6917217.ece,Jewellers want gold import duty cut to 2%,0,0,0,0,1,0,none,"['want', 'cut', 'gold', 'jewellers', 'import duty']",Jewellers want gold import duty cut to 2% want cut gold jewellers import duty,-1,-0.037804894,0.060150973
13-09-2013,https://economictimes.indiatimes.com/markets/commodities/gold-heads-for-worst-week-in-2-months-on-syria-fed/articleshow/22537802.cms,"gold heads for worst week in 2 months on syria, fed",0,0,1,0,1,0,negative,"['worst', 'week months', 'heads', 'gold', 'syria fed']","gold heads for worst week in 2 months on syria, fed worst week months heads gold syria fed",-1,-0.100632444,-0.037267588
05-08-2011,https://economictimes.indiatimes.com/markets/commodities/gold-hits-new-high-of-rs-24350-silver-sheds-rs-3100/articleshow/9493458.cms,"gold hits new high of rs 24,350; silver sheds rs 3,100",1,0,0,1,1,0,positive,"['hits new high', 'sheds', 'rs 24 350', 'silver', 'gold hits new']","gold hits new high of rs 24,350; silver sheds rs 3,100 hits new high sheds rs 24 350 silver gold hits new",-1,-0.086388715,0.11075559
01-11-2005,http://www.marketwatch.com/story/dec-gold-falls-410-to-46280oz-in-morning-ny-trade-2005-11-01,dec gold falls $4.10 to $462.80/oz in morning ny trade,0,0,1,0,1,0,negative,"['ny', 'trade', 'falls 10 462', '80 oz morning', 'dec gold']",dec gold falls $4.10 to $462.80/oz in morning ny trade ny trade falls 10 462 80 oz morning dec gold,21,0.40128207,0.047575127
09-12-2016,http://www.marketwatch.com/story/gold-headed-for-weekly-loss-as-market-digs-in-for-expected-fed-rate-hike-2016-12-09,"Gold at 10-month low, down 5 weeks in a row",0,0,1,0,1,0,negative,"['row', 'low', 'weeks', 'gold 10', 'month low weeks']","Gold at 10-month low, down 5 weeks in a row row low weeks gold 10 month low weeks",-1,0.06821847,0.004866883
13-04-2018,https://www.metalsdaily.com/link/278550/abc-refinery-gains-shanghai-gold-exchange-accreditation.htm,abc refinery gains shanghai gold exchange accreditation,0,0,0,0,1,0,none,"['abc', 'gold', 'shanghai', 'refinery gains', 'exchange accreditation']",abc refinery gains shanghai gold exchange accreditation abc gold shanghai refinery gains exchange accreditation,-1,-0.19091135,0.11241058
24-10-2011,https://www.moneycontrol.com/news/business/markets/-2018061.html,Spot Gold rates move up today,1,0,0,0,1,0,positive,"['today', 'spot', 'gold', 'rates', 'gold rates today']",Spot Gold rates move up today today spot gold rates gold rates today,-1,-0.01879213,0.09023697
04-02-2016,"http://www.investing.com/news/commodities-news/gold-jumps-above-$1,150-as-u.s.-dollar-collapses-to-3-month-low-383291","gold jumps above $1,150 as u.s. dollar collapses to 3-month low",1,0,0,1,1,0,positive,"['month', '150', 'jumps', 'gold', 'dollar collapses']","gold jumps above $1,150 as u.s. dollar collapses to 3-month low month 150 jumps gold dollar collapses",-1,0.17159294,0.04649995
07-12-2016,http://www.marketwatch.com/story/gold-snaps-back-to-back-drop-as-dollar-rally-stalls-ahead-of-central-bank-meetings-2016-12-07,Gold futures end higher after back-to-back drop,1,0,0,0,1,0,positive,"['higher', 'end', 'drop', 'futures', 'gold futures']",Gold futures end higher after back-to-back drop higher end drop futures gold futures,-1,-0.105823345,-0.50517416
06-07-2018,https://www.metalsdaily.com/link/280988/natixis-look-for-gold-to-rally-in-september-as-usd-weakens.htm,natixis : look for gold to rally in september as usd weakens,1,0,0,1,1,0,positive,"['september', 'look gold', 'rally', 'natixis look', 'usd weakens']",natixis : look for gold to rally in september as usd weakens september look gold rally natixis look usd weakens,-1,-0.051818654,0.11904752
24-10-2017,https://economictimes.indiatimes.com/markets/commodities/news/silver-steals-the-shine-as-gold-loses-lustre/articleshow/61197914.cms,silver steals the shine as gold loses lustre,0,0,1,1,1,0,negative,"['loses', 'steals', 'lustre', 'silver', 'shine gold']",silver steals the shine as gold loses lustre loses steals lustre silver shine gold,-1,-0.1842002,0.24245587
20-09-2006,http://www.marketwatch.com/story/kinross-gold-agrees-500-million-credit-facility-2006-09-20,kinross gold agrees $500 million credit facility,0,0,0,0,1,0,none,"['agrees', 'facility', '500 million', 'credit', 'kinross']",kinross gold agrees $500 million credit facility agrees facility 500 million credit kinross,-1,0.0012406111,0.11007671
10-10-2017,http://www.marketwatch.com/story/dec-gold-settles-at-129380oz-up-880-or-07-2017-10-10,"Dec. gold settles at $1,293.80/oz, up $8.80, or 0.7%",1,0,0,0,1,0,positive,"['dec', '293', 'settles', '80 oz 80', 'gold']","Dec. gold settles at $1,293.80/oz, up $8.80, or 0.7% dec 293 settles 80 oz 80 gold",21,0.50091016,0.0035445988
08-06-2009,http://www.marketwatch.com/story/gold-ends-at-two-week-low-as-dollar-strengthens-2009-06-08,gold ends at two-week low as dollar continues to strengthen,0,0,1,1,1,0,negative,"['strengthen', 'low', 'week', 'dollar continues', 'gold ends']",gold ends at two-week low as dollar continues to strengthen strengthen low week dollar continues gold ends,-1,0.04631999,-0.00944674
29-08-2016,https://www.moneycontrol.com/news/business/markets/gold-futures-fall-024global-cues-969333.html,gold futures fall 0.24% on global cues,0,0,1,0,1,0,negative,"['24', 'fall', 'global', 'cues', 'gold futures']",gold futures fall 0.24% on global cues 24 fall global cues gold futures,22,-0.06552949,-0.33818746
06-07-2018,https://www.moneycontrol.com/news/business/stocks/gold-prices-to-trade-lower-today-angel-commodities-15-2679051.html,Gold prices to trade lower today: Angel Commodities,0,0,1,0,0,1,negative,"['today', 'lower', 'angel', 'commodities', 'gold prices trade']",Gold prices to trade lower today: Angel Commodities today lower angel commodities gold prices trade,8,-0.062266186,0.108901516
25-06-2012,https://www.moneycontrol.com/news/business/markets/-1374289.html,gold rates: mcx goldguinea july contract declines,0,0,1,0,1,0,negative,"['rates', 'july', 'mcx', 'contract declines', 'goldguinea']",gold rates: mcx goldguinea july contract declines rates july mcx contract declines goldguinea,1,0.009016126,-0.025108345
09-01-2018,https://www.metalsdaily.com/link/275586/india-jewellers-bullion-traders-spar-over-gold-import-duty-.htm,india : jewellers & bullion traders spar over gold import duty,0,0,0,0,1,0,none,"['spar', 'bullion', 'india', 'jewellers', 'import duty']",india : jewellers & bullion traders spar over gold import duty spar bullion india jewellers import duty,-1,-0.25471368,0.061007913
12-03-2013,https://www.moneycontrol.com/news/business/stocks/-1213935.html,gold prices may slip to rs 28745-27850: mangal keshav,0,0,1,0,1,0,negative,"['keshav', '28745 27850', 'mangal', 'prices slip', 'gold prices']",gold prices may slip to rs 28745-27850: mangal keshav keshav 28745 27850 mangal prices slip gold prices,-1,-0.03681463,0.041937537
17-07-2001,http://www.marketwatch.com/story/gold-issues-futures-prices-inch-up,"gold issues, futures prices inch up",1,0,0,0,1,0,positive,"['inch', 'issues', 'gold', 'futures prices', 'issues futures prices']","gold issues, futures prices inch up inch issues gold futures prices issues futures prices",-1,-0.087047465,-0.33321357
20-07-2017,http://www.marketwatch.com/story/august-gold-settles-at-124550oz-up-350-or-03-2017-07-20,"August gold settles at $1,245.50/oz, up $3.50, or 0.3%",1,0,0,0,1,0,positive,"['245 50', 'settles', 'august', 'gold', '50 oz 50']","August gold settles at $1,245.50/oz, up $3.50, or 0.3% 245 50 settles august gold 50 oz 50",21,0.53289783,0.086024605
08-01-2018,http://www.investing.com/news/commodities-news/gold-prices-remain-lower-on-stronger-us-dollar-1075121,Gold Prices Remain Lower on Stronger U.S. Dollar,0,1,1,1,1,0,negative,"['remain', 'lower', 'stronger', 'prices remain', 'gold prices']",Gold Prices Remain Lower on Stronger U.S. Dollar remain lower stronger prices remain gold prices,14,-0.038113177,0.09883733
05-01-2018,http://www.investing.com/news/commodities-news/gold-prices-pull-back-from-4month-highs-1065773,gold prices pull back from 4-month highs,0,0,1,0,1,0,negative,"['pull', 'month', 'highs', 'prices', 'gold prices']",gold prices pull back from 4-month highs pull month highs prices gold prices,-1,-0.037031516,0.056590132
06-01-2014,http://www.marketwatch.com/story/feb-gold-down-370-or-03-at-123490oz-2014-01-06,"feb. gold down $3.70, or 0.3%, at $1,234.90/oz",0,0,1,0,1,0,negative,"['70 234 90', '234', 'feb', 'oz', 'gold']","feb. gold down $3.70, or 0.3%, at $1,234.90/oz 70 234 90 234 feb oz gold",21,0.4610101,0.07801093
02-08-2016,http://www.marketwatch.com/story/december-gold-gains-850-or-06-at-136850oz-2016-08-02,"December gold gains $8.50, or 0.6%, at $1,368.50/oz.",1,0,0,0,1,0,positive,"['50 368', 'oz', 'december', 'gains', 'gold']","December gold gains $8.50, or 0.6%, at $1,368.50/oz. 50 368 oz december gains gold",21,0.41702235,0.1206188
17-05-2006,http://www.marketwatch.com/story/gold-futures-climb-above-700-an-ounce-in-morning-dealings-2006-05-17,gold futures climb above $700 an ounce in morning dealings,1,0,0,0,1,0,positive,"['dealings', 'morning', 'ounce', 'climb 700', 'gold futures']",gold futures climb above $700 an ounce in morning dealings dealings morning ounce climb 700 gold futures,-1,0.106397614,-0.3171494
14-01-2016,https://www.moneycontrol.com/news/business/markets/gold-etfs-record-rs-900-cr-outflow2015-aum-down-20-1050379.html,gold etfs record rs 900 cr outflow in 2015; aum down 20%,0,0,1,0,1,0,negative,"['cr outflow', 'gold', '2015 aum', 'record rs 900', 'etfs record']",gold etfs record rs 900 cr outflow in 2015; aum down 20% cr outflow gold 2015 aum record rs 900 etfs record,-1,-0.116621874,0.046612732
04-09-2013,https://www.moneycontrol.com/news/business/markets/-1613919.html,gold may touch rs 35500/10gms in few days: kishore narne,0,0,0,0,0,1,none,"['35500', '10gms days', 'touch rs', 'gold', 'kishore narne']",gold may touch rs 35500/10gms in few days: kishore narne 35500 10gms days touch rs gold kishore narne,-1,0.00044327974,0.02461809
20-08-2018,https://www.metalsdaily.com/link/282340/how-trumpenomics-torpedoed-gold-prices.htm,how trumpenomics torpedoed gold prices,0,0,0,0,1,0,none,"['torpedoed', 'prices', 'trumpenomics', 'trumpenomics torpedoed', 'gold prices']",how trumpenomics torpedoed gold prices torpedoed prices trumpenomics trumpenomics torpedoed gold prices,-1,-0.097498655,0.095847905
20-07-2017,http://www.marketwatch.com/story/august-gold-off-05-at-125390oz-2017-07-20,"august gold off 0.5% at $1,253.90/oz.",0,0,1,0,1,0,negative,"['253 90', 'august', 'oz', '90 oz', 'gold']","august gold off 0.5% at $1,253.90/oz. 253 90 august oz 90 oz gold",21,0.45856184,0.13211372
26-06-2017,http://www.marketwatch.com/story/august-gold-down-10-or-08-to-settle-at-124640oz-2017-06-26,"August gold down $10, or 0.8%, to settle at $1,246.40/oz",0,0,1,0,1,0,negative,"['246', 'settle', 'august', '40 oz', 'gold 10']","August gold down $10, or 0.8%, to settle at $1,246.40/oz 246 settle august 40 oz gold 10",21,0.4995581,0.028855648
28-03-2017,http://www.marketwatch.com/story/april-gold-down-160-or-01-at-125410oz-after-highs-above-1258-2017-03-28,"April gold down $1.60, or 0.1%, at $1,254.10/oz after highs above $1,258",0,0,1,0,1,0,negative,"['60 254 10', 'highs', '258', '10 oz', 'april gold']","April gold down $1.60, or 0.1%, at $1,254.10/oz after highs above $1,258 60 254 10 highs 258 10 oz april gold",21,0.44868982,0.065582454
09-01-2017,http://www.marketwatch.com/story/feb-gold-settles-at-118490oz-up-1150-or-about-1-2017-01-09,"Feb. gold settles at $1,184.90/oz, up $11.50, or about 1%",1,0,0,0,1,0,positive,"['11 50', 'feb', '184 90', 'oz', 'gold settles']","Feb. gold settles at $1,184.90/oz, up $11.50, or about 1% 11 50 feb 184 90 oz gold settles",21,0.51720494,0.012021899
01-03-2011,http://www.marketwatch.com/story/gold-oil-hold-to-gains-after-ism-data-2011-03-01,"gold, oil hold to gains after ism data",0,1,0,1,1,0,neutral,"['hold', 'data', 'gold', 'ism data', 'oil hold gains']","gold, oil hold to gains after ism data hold data gold ism data oil hold gains",-1,-0.21337248,0.14278516
25-09-2014,http://www.marketwatch.com/story/price-fixing-of-gold-oil-to-become-a-crime-in-uk-2014-09-25,"price-fixing of gold, oil to become a crime in u.k.",0,0,0,1,0,1,none,"['fixing', 'price', 'crime', 'oil crime', 'fixing gold oil']","price-fixing of gold, oil to become a crime in u.k. fixing price crime oil crime fixing gold oil",-1,-0.09750391,0.15325947
08-07-2008,http://www.marketwatch.com/story/gold-holds-steady-as-dollar-firms-2008-07-08,gold holds steady as dollar firms,0,1,0,1,1,0,neutral,"['holds', 'firms', 'steady', 'gold', 'dollar firms']",gold holds steady as dollar firms holds firms steady gold dollar firms,-1,-0.14364654,0.16214868
10-10-2000,http://www.marketwatch.com/story/gold-gains-on-dollar-weakness-200010101628220,gold gains on dollar weakness,1,0,0,1,1,0,positive,"['gains', 'weakness', 'gold', 'dollar weakness', 'gold gains dollar']",gold gains on dollar weakness gains weakness gold dollar weakness gold gains dollar,-1,-0.13497388,0.19696605
16-11-2017,https://economictimes.indiatimes.com/markets/commodities/news/gold-rate-today-gold-silver-down-in-morning-trade/articleshow/61669183.cms,"gold rate today: gold, silver down in morning trade",0,0,1,1,1,0,negative,"['today', 'trade', 'morning', 'silver', 'gold rate']","gold rate today: gold, silver down in morning trade today trade morning silver gold rate",8,-0.014336005,0.060375035
03-05-2013,https://www.thehindubusinessline.com/economy/modern-medicine-strikes-gold/article23104606.ece,Modern medicine strikes gold,0,0,0,0,1,0,none,"['strikes', 'modern', 'gold', 'medicine strikes', 'modern medicine']",Modern medicine strikes gold strikes modern gold medicine strikes modern medicine,-1,-0.12048435,0.1537795
26-05-2010,http://www.marketwatch.com/story/gold-prices-gain-along-with-stock-futures-2010-05-26,gold prices gain along with stock futures,1,0,0,0,1,0,positive,"['gain', 'gold', 'futures', 'prices gain stock', 'gold prices']",gold prices gain along with stock futures gain gold futures prices gain stock gold prices,-1,-0.15827462,-0.30315572
24-04-2001,http://www.marketwatch.com/story/metals-issues-climb-gold-steadies,metals issues climb; gold steadies,0,1,0,0,1,0,neutral,"['issues', 'climb', 'steadies', 'gold', 'metals issues']",metals issues climb; gold steadies issues climb steadies gold metals issues,-1,-0.2525093,0.08415495
11-09-2008,http://www.marketwatch.com/story/gold-falls-for-ninth-day-as-dollar-rises-vs-euro-2008-09-11-1491339,gold falls for ninth day as dollar rises vs. euro,0,0,1,1,1,0,negative,"['day', 'ninth', 'vs euro', 'gold falls', 'dollar rises vs']",gold falls for ninth day as dollar rises vs. euro day ninth vs euro gold falls dollar rises vs,-1,-0.00048847497,0.052048173
21-03-2018,http://www.marketwatch.com/story/gold-futures-finish-at-a-1-week-high-ahead-of-fed-decision-2018-03-21,gold futures finish at a 1-week high ahead of fed decision,1,0,0,0,1,0,positive,"['high', 'week', 'finish', 'ahead fed decision', 'gold futures']",gold futures finish at a 1-week high ahead of fed decision high week finish ahead fed decision gold futures,-1,-0.12171763,-0.4490325
20-02-2018,https://www.metalsdaily.com/link/276928/fred-hickey-buy-gold.htm,fred hickey - buy gold,1,0,0,0,0,1,positive,"['buy', 'fred', 'gold', 'buy gold', 'hickey']",fred hickey - buy gold buy fred gold buy gold hickey,-1,-0.07385759,0.21869639
07-09-2017,http://www.marketwatch.com/story/december-gold-up-03-at-134330oz-2017-09-07,"December gold up 0.3% at $1,343.30/oz.",1,0,0,0,1,0,positive,"['343', '30', 'oz', 'december', 'gold']","December gold up 0.3% at $1,343.30/oz. 343 30 oz december gold",21,0.40811926,0.13747081
05-12-2017,http://www.marketwatch.com/story/this-is-your-brain-on-bitcoin-2017-12-04,Here's what's driving bitcoin buyers' rush to 'millennial gold',0,0,0,1,1,0,none,"['rush', 'buyers', 'gold', 'driving bitcoin', 'millennial']",Here's what's driving bitcoin buyers' rush to 'millennial gold' rush buyers gold driving bitcoin millennial,-1,-0.1713315,0.12127694
20-05-2013,https://www.thehindubusinessline.com/markets/gold/more-steps-to-curb-gold-imports-if-needed/article20616153.ece,"More steps' to curb gold imports, if needed",0,0,0,0,1,0,none,"['needed', 'curb', 'steps', 'imports needed', 'curb gold imports']","More steps' to curb gold imports, if needed needed curb steps imports needed curb gold imports",-1,-0.15683761,0.09443259
27-11-2017,http://www.marketwatch.com/story/dec-gold-settles-at-129440oz-up-710-or-06-2017-11-27,"Dec. gold settles at $1,294.40/oz, up $7.10, or 0.6%",1,0,0,0,1,0,positive,"['294 40', '10', 'dec', 'oz', 'gold settles']","Dec. gold settles at $1,294.40/oz, up $7.10, or 0.6% 294 40 10 dec oz gold settles",21,0.5045401,-0.00930199
24-02-2004,http://www.marketwatch.com/story/canadian-stocks-close-lower-gold-gains-limit-losses-2004-02-24,gold shares buoy bay street,1,0,0,0,1,0,positive,"['buoy', 'street', 'shares', 'bay', 'gold shares']",gold shares buoy bay street buoy street shares bay gold shares,-1,-0.12841572,0.19690421
12-05-2011,http://www.marketwatch.com/story/gold-ends-higher-silver-down-2-after-steep-loss-2011-05-12,gold ends higher; silver down 2% after steep loss,0,0,1,1,1,0,negative,"['higher', 'ends', 'gold', 'steep loss', 'higher silver steep']",gold ends higher; silver down 2% after steep loss higher ends gold steep loss higher silver steep,-1,-0.013681695,0.016232565
02-02-2017,http://www.marketwatch.com/story/gold-futures-log-highest-settlement-since-mid-november-2017-02-02,Gold futures log highest settlement since mid-November,1,0,0,0,1,0,positive,"['mid', 'log', 'november', 'highest settlement', 'gold futures']",Gold futures log highest settlement since mid-November mid log november highest settlement gold futures,24,-0.016898945,-0.44813883
26-11-2009,https://economictimes.indiatimes.com/articleshow/5272001.cms,"gold closes above rs 18,000-level on strong global cues",1,0,0,0,1,0,positive,"['cues', '18 000', 'closes rs', 'gold', 'level strong global']","gold closes above rs 18,000-level on strong global cues cues 18 000 closes rs gold level strong global",-1,-0.19202246,0.022172391
15-10-2008,https://economictimes.indiatimes.com/articleshow/3596693.cms,"gold ends lower at rs 13,130",0,0,1,0,1,0,negative,"['ends', 'lower', 'gold', '13 130', 'lower rs']","gold ends lower at rs 13,130 ends lower gold 13 130 lower rs",-1,-0.012618452,0.011154272
01-11-2018,https://www.thehindubusinessline.com/markets/gold/gold-glitters-ahead-of-dhanteras-diwali/article25389853.ece,"Gold glitters ahead of Dhanteras, Diwali",1,0,0,0,1,0,positive,"['ahead', 'gold', 'dhanteras', 'glitters', 'diwali']","Gold glitters ahead of Dhanteras, Diwali ahead gold dhanteras glitters diwali",-1,-0.118609436,0.04604967
08-04-2015,https://www.thehindubusinessline.com/markets/gold/gold-holds-above-1200oz-on-weaker-dollar-before-fed-minutes/article7080656.ece,"Gold holds above $1,200/oz on weaker dollar before Fed minutes",0,1,0,1,1,0,neutral,"['minutes', 'weaker', 'holds 200', 'oz', 'dollar fed']","Gold holds above $1,200/oz on weaker dollar before Fed minutes minutes weaker holds 200 oz dollar fed",-1,0.19216655,0.07189609
06-07-2012,https://economictimes.indiatimes.com/markets/commodities/gold-silver-encounter-profit-selling-global-cues/articleshow/14719497.cms,"gold, silver encounter profit-selling, global cues",0,0,1,1,1,0,negative,"['encounter', 'cues', 'profit selling', 'profit selling global', 'gold silver']","gold, silver encounter profit-selling, global cues encounter cues profit selling profit selling global gold silver",-1,-0.16708058,0.21172954
17-10-2013,https://www.thehindubusinessline.com/markets/gold/gold-surges-most-in-four-weeks-on-dagong-us-downgrade/article23101423.ece,Gold surges most in four weeks on Dagong US downgrade,1,0,0,0,1,0,positive,"['weeks', 'surges', 'downgrade', 'gold', 'dagong']",Gold surges most in four weeks on Dagong US downgrade weeks surges downgrade gold dagong,-1,-0.08833674,-0.0022653192
03-08-2014,http://www.investing.com/news/commodities-news/gold---silver---copper-futures---weekly-outlook:-august-4---8-300301,Gold / Silver / Copper futures - weekly outlook: August 4 - 8,0,0,0,1,1,0,none,"['outlook', 'august', 'weekly', 'futures', 'gold silver copper']",Gold / Silver / Copper futures - weekly outlook: August 4 - 8 outlook august weekly futures gold silver copper,16,-0.06585023,-0.33830494
17-03-2017,http://www.marketwatch.com/story/april-gold-settles-at-123020bbl-up-310-or-03-2017-03-17,"April gold settles at $1,230.20/bbl, up $3.10, or 0.3%",1,0,0,0,1,0,positive,"['10', '230', 'bbl', 'april', 'gold settles']","April gold settles at $1,230.20/bbl, up $3.10, or 0.3% 10 230 bbl april gold settles",21,0.3606913,-0.0375361
09-11-2015,http://www.investing.com/news/commodities-news/gold-prices-gain-in-asia-as-china-cpi-up-less-than-expected-370485,Gold prices gain in Asia as China CPI up less than expected,1,0,0,0,1,0,positive,"['expected', 'gain', 'asia', 'china cpi', 'gold prices']",Gold prices gain in Asia as China CPI up less than expected expected gain asia china cpi gold prices,-1,-0.18030867,0.17054053
04-05-2018,http://www.marketwatch.com/story/gold-futures-end-slightly-higher-but-tally-a-third-straight-weekly-loss-2018-05-04,"gold futures end slightly higher, but tally a third straight weekly loss",1,0,0,0,1,0,positive,"['tally', 'straight weekly', 'end slightly higher', 'loss', 'gold futures']","gold futures end slightly higher, but tally a third straight weekly loss tally straight weekly end slightly higher loss gold futures",-1,-0.05404736,-0.40068322
02-03-2017,http://www.marketwatch.com/story/have-a-question-about-gold-ask-the-author-of-precious-metals-investing-for-dummies-now-2017-03-01,have a question about gold? ask the author of 'precious metals investing for dummies' now,0,0,0,0,1,0,none,"['ask', 'dummies', 'metals', 'investing', 'author precious']",have a question about gold? ask the author of 'precious metals investing for dummies' now ask dummies metals investing author precious,-1,-0.123793766,0.09424023
07-12-2018,https://www.metalsdaily.com/link/287611/sharps-pixley-chinese-gold-demand-slipping-but-still-up-y-o-y.htm,sharps pixley: chinese gold demand slipping - but still up y-o-y,1,0,0,0,1,0,positive,"['slipping', 'sharps', 'chinese', 'pixley', 'gold demand']",sharps pixley: chinese gold demand slipping - but still up y-o-y slipping sharps chinese pixley gold demand,-1,-0.12496348,0.22348654
13-10-2017,https://www.moneycontrol.com/news/business/stocks/expect-gold-to-trade-sideways-sushil-finance-23-2411961.html,Expect Gold to trade sideways: Sushil Finance,0,1,0,0,0,1,neutral,"['sushil', 'trade', 'sideways', 'finance', 'expect gold']",Expect Gold to trade sideways: Sushil Finance sushil trade sideways finance expect gold,-1,-0.20629883,0.023649428
31-07-2017,https://economictimes.indiatimes.com/markets/commodities/news/today-gold-price-track-today-gold-rate-latest-trends-and-news/articleshow/59842239.cms,today gold price: track today gold rate latest trends and news,0,0,0,0,1,0,none,"['rate', 'today', 'track today', 'latest trends', 'gold price']",today gold price: track today gold rate latest trends and news rate today track today latest trends gold price,-1,-0.05582401,0.13971674
24-10-2011,https://www.thehindubusinessline.com/companies/dhanteras-this-season-it-is-lightweight-gold-silver/article20352567.ece1,"Dhanteras: This season, it is lightweight gold, silver",0,0,0,1,1,0,none,"['season', 'lightweight', 'gold', 'dhanteras', 'lightweight gold silver']","Dhanteras: This season, it is lightweight gold, silver season lightweight gold dhanteras lightweight gold silver",-1,-0.047108315,0.099977985
27-11-2009,http://www.marketwatch.com/story/behind-golds-flash-oils-a-true-performer-2009-11-27,"hiding behind gold's flashy moves, oil's the true performer",1,0,0,0,1,0,positive,"['true', 'performer', 'flashy', 'moves oil', 'hiding gold']","hiding behind gold's flashy moves, oil's the true performer true performer flashy moves oil hiding gold",-1,-0.19178495,0.072655834
02-05-2012,http://www.marketwatch.com/story/gold-oil-trade-lower-as-jobs-data-weigh-2012-05-02,"gold, oil trade lower as jobs data weigh",0,0,1,1,1,0,negative,"['trade', 'lower', 'jobs data', 'data weigh', 'gold oil']","gold, oil trade lower as jobs data weigh trade lower jobs data data weigh gold oil",-1,-0.20528853,0.092389144
06-08-2018,https://www.metalsdaily.com/link/249559/sge-daily-shanghai-gold-benchmark-price.htm,sge : daily shanghai gold benchmark price,0,0,0,0,1,0,none,"['daily', 'gold', 'shanghai', 'sge', 'benchmark price']",sge : daily shanghai gold benchmark price daily gold shanghai sge benchmark price,-1,-0.100343086,0.028112248
05-03-2008,http://www.marketwatch.com/story/gold-futures-rise-as-dollar-edges-lower-2008-03-05,"gold futures rise, as dollar edges lower",1,0,0,1,1,0,positive,"['rise', 'edges', 'dollar', 'edges lower', 'gold futures']","gold futures rise, as dollar edges lower rise edges dollar edges lower gold futures",-1,-0.15738562,-0.3435142
13-02-2017,http://www.marketwatch.com/story/gold-suffers-from-biggest-single-day-dollar-and-percentage-loss-since-jan-25-2017-02-13,Gold suffers from biggest single-day dollar and percentage loss since Jan. 25,0,0,1,1,1,0,negative,"['jan 25', 'suffers biggest single', 'gold', 'percentage loss', 'day dollar percentage']",Gold suffers from biggest single-day dollar and percentage loss since Jan. 25 jan 25 suffers biggest single gold percentage loss day dollar percentage,-1,0.05122082,-0.02869182
12-09-2014,https://www.moneycontrol.com/news/business/markets/expect-downward-movegold-astromoneyguru-1292343.html,expect downward move in gold: astromoneyguru,0,0,1,0,0,1,negative,"['expect', 'downward', 'gold', 'astromoneyguru', 'gold astromoneyguru']",expect downward move in gold: astromoneyguru expect downward gold astromoneyguru gold astromoneyguru,-1,-0.10278101,0.054694813
11-04-2018,https://www.metalsdaily.com/link/278472/rjo-futures-gold-versus-silver-q2-to-benefit-the-white-metals.htm,rjo futures : gold versus silver: q2 to benefit the white metals,0,0,0,1,1,0,none,"['q2 benefit white', 'metals', 'rjo', 'futures', 'gold versus']",rjo futures : gold versus silver: q2 to benefit the white metals q2 benefit white metals rjo futures gold versus,-1,-0.16479068,-0.22949344
31-10-2017,http://www.marketwatch.com/story/gold-prices-end-the-month-with-a-loss-of-about-11-2017-10-31,Gold prices end the month with a loss of about 1.1%,0,0,1,0,1,0,negative,"['end', 'month', 'loss', 'prices end', 'gold prices']",Gold prices end the month with a loss of about 1.1% end month loss prices end gold prices,-1,0.09072816,-0.101335645
23-02-2016,http://www.marketwatch.com/story/april-gold-settles-at-122260oz-on-comex-up-1250-or-1-2016-02-23,"april gold settles at $1,222.60/oz on comex, up $12.50, or 1%",1,0,0,0,1,0,positive,"['12 50', 'comex', 'april', '222 60 oz', 'gold settles']","april gold settles at $1,222.60/oz on comex, up $12.50, or 1% 12 50 comex april 222 60 oz gold settles",21,0.4620719,-0.021875545
16-04-2010,http://www.marketwatch.com/story/june-gold-down-117-or-1-after-sentiment-data-2010-04-16,"june gold down $11.7, or 1%, after sentiment data",0,0,1,0,1,0,negative,"['11', 'data', 'june', 'gold', 'sentiment data']","june gold down $11.7, or 1%, after sentiment data 11 data june gold sentiment data",-1,0.17301397,0.08060344
22-11-2017,https://www.metalsdaily.com/link/274139/hong-kong-worlds-top-jeweler-reveals-growing-appetite-for-gold-in-china.htm,hong kong : world's top jeweler reveals growing appetite for gold in china,0,0,0,0,0,1,none,"['reveals growing appetite', 'kong', 'china', 'gold', 'jeweler reveals growing']",hong kong : world's top jeweler reveals growing appetite for gold in china reveals growing appetite kong china gold jeweler reveals growing,-1,-0.20764855,0.25383416
18-09-2017,https://economictimes.indiatimes.com/markets/expert-view/low-inflation-phase-not-for-realty-gold-hence-investors-rushing-to-equity-ashwini-agarwal-ashmore-investment/articleshow/60728397.cms,"low inflation phase not for realty, gold; hence investors rushing to equity: ashwini agarwal, ashmore investment",0,0,1,0,1,0,negative,"['investors rushing equity', 'agarwal ashmore', 'phase realty gold', 'ashwini agarwal', 'low inflation phase']","low inflation phase not for realty, gold; hence investors rushing to equity: ashwini agarwal, ashmore investment investors rushing equity agarwal ashmore phase realty gold ashwini agarwal low inflation phase",-1,-0.1487683,0.08583787
18-04-2018,https://www.moneycontrol.com/news/business/gold-slips-as-dollar-steadies-on-positive-us-data-2551103.html,Gold slips as dollar steadies on positive US data,0,0,1,1,1,0,negative,"['data', 'positive', 'steadies', 'slips', 'dollar']",Gold slips as dollar steadies on positive US data data positive steadies slips dollar,-1,-0.026658557,0.15844208
17-09-2015,http://www.investing.com/news/commodities-news/gold-prices-jump-in-early-asia-as-fed-hold-steady-citing-global-weakness-362250,gold prices jump in early asia as fed hold steady citing global weakness,1,0,0,0,1,0,positive,"['hold steady citing', 'fed', 'global weakness', 'early asia', 'prices jump']",gold prices jump in early asia as fed hold steady citing global weakness hold steady citing fed global weakness early asia prices jump,-1,-0.18909058,0.10257025
02-09-2011,https://www.moneycontrol.com/news/business/stocks/-2044881.html,"intraday strategy for gold, nickel, lead: angel broking",0,0,0,0,1,0,none,"['angel', 'broking', 'intraday strategy', 'nickel lead', 'strategy gold']","intraday strategy for gold, nickel, lead: angel broking angel broking intraday strategy nickel lead strategy gold",-1,-0.19058335,0.16031446
15-12-2016,http://www.marketwatch.com/story/gold-futures-settle-at-lowest-level-since-early-february-2016-12-15,Gold futures settle at lowest level since early February,0,0,1,0,1,0,negative,"['february', 'gold', 'level early', 'lowest', 'futures settle']",Gold futures settle at lowest level since early February february gold level early lowest futures settle,-1,0.013872638,-0.4303344
26-11-2014,http://www.marketwatch.com/story/gold-hovers-near-1200-level-again-2014-11-26,"gold ends lower, still flirting with $1,200 level",0,0,1,0,1,0,negative,"['flirting', 'lower flirting', '200', 'level', 'gold ends']","gold ends lower, still flirting with $1,200 level flirting lower flirting 200 level gold ends",-1,0.012217581,0.010843232
06-11-2009,http://www.marketwatch.com/story/gold-may-be-flying-but-this-gold-stocks-a-turkey-2009-11-06,"gold may be flying, but this gold stock's a turkey",0,0,0,0,1,0,none,"['flying', 'gold', 'turkey', 'stock', 'gold stock turkey']","gold may be flying, but this gold stock's a turkey flying gold turkey stock gold stock turkey",-1,-0.16970092,0.016487457
07-11-2011,https://economictimes.indiatimes.com/markets/commodities/gold-silver-start-week-on-firm-note-rise-on-global-cues/articleshow/10641646.cms,"gold, silver start week on firm note, rise on global cues",1,0,0,1,1,0,positive,"['cues', 'rise global', 'start week', 'firm note', 'gold silver']","gold, silver start week on firm note, rise on global cues cues rise global start week firm note gold silver",-1,-0.2016993,0.15545024
05-09-2016,http://www.marketwatch.com/story/gold-silver-gain-on-more-bets-the-fed-will-take-it-slow-on-raising-rates-2016-09-05,"Gold, silver gain on more bets the Fed will take it slow on raising rates",1,0,0,1,1,0,positive,"['raising', 'rates', 'gain bets', 'gold silver', 'fed slow']","Gold, silver gain on more bets the Fed will take it slow on raising rates raising rates gain bets gold silver fed slow",-1,-0.1647216,0.02741376
31-10-2018,https://www.moneycontrol.com/news/business/commodities/gold-industry-sees-prices-rising-to-1532oz-over-12-months-3107261.html,"Gold industry sees prices rising to $1,532/oz over 12 months",1,0,0,0,1,0,positive,"['rising 532', '12 months', 'oz', 'industry sees prices', 'gold industry sees']","Gold industry sees prices rising to $1,532/oz over 12 months rising 532 12 months oz industry sees prices gold industry sees",-1,0.19927524,0.07402382
02-06-2009,http://www.marketwatch.com/story/gold-reclaims-980-mark-silver-approaches-16-2009-06-02,gold rises as dollar weakens anew; silver ends near $16,1,0,0,1,1,0,positive,"['weakens anew', 'rises', 'ends near 16', 'silver', 'dollar weakens']",gold rises as dollar weakens anew; silver ends near $16 weakens anew rises ends near 16 silver dollar weakens,-1,0.029967874,0.12545297
08-03-2018,http://www.investing.com/news/commodities-news/gold-prices-edge-higher-with-all-eyes-on-us-tariffs-1331130,Gold Prices Edge Higher With All Eyes on U.S. Tariffs,1,0,0,0,1,0,positive,"['eyes', 'higher', 'edge', 'tariffs', 'gold prices']",Gold Prices Edge Higher With All Eyes on U.S. Tariffs eyes higher edge tariffs gold prices,-1,-0.17403483,0.058402684
20-08-2008,http://www.marketwatch.com/story/december-gold-up-590-to-82270-an-ounce-on-globex-2008-08-20,december gold up $5.90 to $822.70 an ounce on globex,1,0,0,0,1,0,positive,"['90 822 70', 'december', 'globex', 'gold', 'ounce']",december gold up $5.90 to $822.70 an ounce on globex 90 822 70 december globex gold ounce,21,0.4191227,0.13406378
12-04-2016,https://www.thehindubusinessline.com/markets/gold/gold-at-3week-high-as-dollar-struggles-amid-us-rate-outlook/article8465611.ece,Gold at 3-week high as dollar struggles amid US rate outlook,1,1,0,1,1,0,positive,"['outlook', 'amid rate', 'struggles', 'week high', 'gold']",Gold at 3-week high as dollar struggles amid US rate outlook outlook amid rate struggles week high gold,-1,-0.0012513399,0.07191476
27-04-2018,http://www.marketwatch.com/story/june-gold-up-02-at-131990oz-2018-04-27,"june gold up 0.2% at $1,319.90/oz.",1,0,0,0,1,0,positive,"['90', '319 90', 'june', 'oz', 'gold']","june gold up 0.2% at $1,319.90/oz. 90 319 90 june oz gold",21,0.42630088,0.15842524
16-11-2012,https://www.moneycontrol.com/news/business/stocks/-1715221.html,sell mcx gold dec around rs 31500; target rs 31170: geojit,0,0,0,0,1,0,none,"['target rs', 'mcx', 'gold dec', 'sell', '31170 geojit']",sell mcx gold dec around rs 31500; target rs 31170: geojit target rs mcx gold dec sell 31170 geojit,4,0.068269804,0.09205582
22-11-2011,https://www.moneycontrol.com/news/business/markets/-1329767.html,MCX GOLD February contract moves up,1,0,0,0,1,0,positive,"['moves', 'february', 'gold', 'contract moves', 'mcx']",MCX GOLD February contract moves up moves february gold contract moves mcx,1,-0.08291552,0.006105572
29-05-2018,http://www.marketwatch.com/story/august-gold-trades-at-130010oz-down-890-or-07-2018-05-29,"august gold trades at $1,300.10/oz, down $8.90, or 0.7%",0,0,1,0,1,0,negative,"['90', 'august', '10 oz', 'trades 300', 'gold trades']","august gold trades at $1,300.10/oz, down $8.90, or 0.7% 90 august 10 oz trades 300 gold trades",-1,0.3626775,0.04556811
12-11-2018,https://www.moneycontrol.com/news/business/commodities/gold-futures-up-0-36-on-positive-global-cues-3149011.html,Gold futures up 0.36% on positive global cues,1,0,0,0,1,0,positive,"['36', 'cues', 'positive global', 'futures', 'gold futures']",Gold futures up 0.36% on positive global cues 36 cues positive global futures gold futures,22,-0.07221377,-0.33359045
25-04-2017,https://www.thehindubusinessline.com/markets/gold/gold-futures-dip-to-rs-29012-on-weak-global-cues/article9662048.ece,"Gold futures dip to Rs 29,012 on weak global cues",0,0,1,0,1,0,negative,"['cues', 'rs 29 012', 'dip', 'weak global', 'gold futures']","Gold futures dip to Rs 29,012 on weak global cues cues rs 29 012 dip weak global gold futures",22,-0.18119061,-0.29599887
11-10-2011,https://www.moneycontrol.com/news/business/markets/-2110837.html,MCX GOLDPETAL Nov contract up marginally,1,0,0,0,1,0,positive,"['nov', 'marginally', 'goldpetal', 'mcx', 'contract marginally']",MCX GOLDPETAL Nov contract up marginally nov marginally goldpetal mcx contract marginally,1,-0.07991293,-0.15586409
05-12-2017,https://economictimes.indiatimes.com/markets/commodities/news/gold-holds-steady-amid-softer-dollar/articleshow/61926365.cms,gold holds steady amid softer dollar,0,1,0,1,1,0,neutral,"['amid', 'softer', 'dollar', 'holds steady', 'gold holds steady']",gold holds steady amid softer dollar amid softer dollar holds steady gold holds steady,-1,-0.011888072,0.13710701
17-04-2011,https://www.thehindubusinessline.com/markets/gold/Assets-under-Gold-ETFs-up-nearly-three-fold/article20192306.ece,Assets under Gold ETFs up nearly three fold,1,0,0,0,1,0,positive,"['nearly', 'fold', 'gold', 'etfs', 'assets gold etfs']",Assets under Gold ETFs up nearly three fold nearly fold gold etfs assets gold etfs,-1,-0.22161299,0.05057678
09-12-2016,http://www.marketwatch.com/story/gold-marks-new-session-lows-as-us-dollar-index-trades-near-days-highs-2016-12-09,Gold marks new session lows as U.S. dollar index trades near day's highs,0,0,1,1,1,0,negative,"['day highs', 'gold marks', 'trades near', 'new session lows', 'dollar index']",Gold marks new session lows as U.S. dollar index trades near day's highs day highs gold marks trades near new session lows dollar index,-1,-0.024849169,-0.0052680373
14-12-2017,https://economictimes.indiatimes.com/markets/commodities/news/gold-edges-up-as-dollar-holds-steady/articleshow/62062152.cms,gold rises to 1-week high as dollar holds steady,1,0,0,1,1,0,positive,"['holds', 'week', 'gold', 'rises week high', 'dollar holds steady']",gold rises to 1-week high as dollar holds steady holds week gold rises week high dollar holds steady,-1,0.035671666,0.08605708
03-09-2012,http://www.marketwatch.com/story/gold-adds-to-gains-after-weak-china-data-2012-09-03,gold adds to gains after weak china data,1,0,0,0,1,0,positive,"['adds', 'weak', 'china', 'china data', 'gold adds gains']",gold adds to gains after weak china data adds weak china china data gold adds gains,-1,-0.2507909,0.22274354
02-11-2018,http://www.marketwatch.com/story/gold-prices-fall-for-the-session-to-post-a-modest-loss-for-the-week-2018-11-02,gold prices fall for the session to post a modest loss for the week,0,0,1,0,1,0,negative,"['modest', 'session post', 'week', 'prices fall', 'gold prices']",gold prices fall for the session to post a modest loss for the week modest session post week prices fall gold prices,-1,0.09956214,-0.040849715
17-10-2016,https://economictimes.indiatimes.com/markets/commodities/news/commodity-watch-gold-silver-rise-sugar-slides-in-futures-trade/articleshow/54893359.cms,"commodity watch: gold, silver rise; sugar slides in futures trade",1,0,0,1,1,0,positive,"['watch', 'rise sugar', 'slides futures', 'gold silver', 'futures trade']","commodity watch: gold, silver rise; sugar slides in futures trade watch rise sugar slides futures gold silver futures trade",-1,-0.20045753,-0.21964902
23-01-2014,https://www.thehindubusinessline.com/opinion/columns/gnanasekaar-t/article5610125.ece,"Look to buy gold on dips to $1,240",0,0,1,0,1,0,negative,"['look', 'look buy', 'dips', '240', 'buy gold']","Look to buy gold on dips to $1,240 look look buy dips 240 buy gold",-1,0.035154805,0.12958823
24-06-2013,http://www.marketwatch.com/story/goldmans-prior-end-2013-gold-call-was-1435oz-2013-06-24,"goldman's prior end-2013 gold call was $1,435/oz",0,0,0,0,1,0,none,"['prior', 'end', '2013', '435 oz', 'goldman']","goldman's prior end-2013 gold call was $1,435/oz prior end 2013 435 oz goldman",-1,0.15466623,-0.010206625
10-01-2017,http://www.marketwatch.com/story/gold-futures-pare-gains-but-still-finish-at-a-6-week-high-2017-01-10,"Gold futures pare gains, but still finish at a 6-week high",1,0,0,0,1,0,positive,"['finish', 'pare', 'week high', 'gains', 'gold futures']","Gold futures pare gains, but still finish at a 6-week high finish pare week high gains gold futures",-1,-0.11683814,-0.3642723
26-04-2010,http://www.marketwatch.com/story/gold-survives-goldman-sachs-bugs-rejoice-2010-04-26,gold survives goldman sachs,0,0,0,0,1,0,none,"['survives', 'sachs', 'gold', 'goldman', 'gold survives']",gold survives goldman sachs survives sachs gold goldman gold survives,-1,-0.20225891,0.063963294
02-03-2009,http://www.marketwatch.com/story/gold-futures-up-1220-95470-ounce,gold futures up $12.20 at $954.70 an ounce,1,0,0,0,1,0,positive,"['70', '12 20 954', 'ounce', 'gold', 'futures']",gold futures up $12.20 at $954.70 an ounce 70 12 20 954 ounce gold futures,26,0.29823846,-0.33625424
11-05-2018,https://www.metalsdaily.com/link/279528/reserve-bank-of-india-adds-25-tonnes-of-gold-to-forex-reserves-in-q4.htm,reserve bank of india adds 2.5 tonnes of gold to forex reserves in q4,0,0,0,0,1,0,none,"['gold', 'india adds', 'bank', 'india adds tonnes', 'reserves q4']",reserve bank of india adds 2.5 tonnes of gold to forex reserves in q4 gold india adds bank india adds tonnes reserves q4,-1,-0.13246793,0.07926513
04-10-2017,https://www.thehindubusinessline.com/markets/gold/gold-futures-rise-to-rs-29416/article9886195.ece,"Gold futures rise to Rs 29,416",1,0,0,0,1,0,positive,"['rise', 'rs', '29 416', 'gold', 'futures']","Gold futures rise to Rs 29,416 rise rs 29 416 gold futures",23,-0.0626121,-0.34908164
29-06-2005,http://www.marketwatch.com/story/cboe-gold-index-closes-at-842-up-4-2005-06-29,"cboe gold index closes at 84.2, up 4%",1,0,0,0,1,0,positive,"['84', 'closes', 'cboe', 'index closes', 'gold index']","cboe gold index closes at 84.2, up 4% 84 closes cboe index closes gold index",6,-0.047987886,-0.030319989
21-08-2017,http://www.marketwatch.com/story/dec-gold-settles-at-129670oz-up-510-or-04-2017-08-21,"Dec. gold settles at $1,296.70/oz, up $5.10, or 0.4%",1,0,0,0,1,0,positive,"['10', 'dec', 'oz', '296 70 oz', 'gold settles']","Dec. gold settles at $1,296.70/oz, up $5.10, or 0.4% 10 dec oz 296 70 oz gold settles",21,0.5286156,0.023294292
23-08-2006,http://www.marketwatch.com/story/moodys-revises-pilgrims-pride-outlook-on-gold-kist-bid-2006-08-23,moody's revises pilgrim's pride outlook on gold kist bid,0,0,0,0,1,0,none,"['pride', 'moody', 'outlook gold', 'revises pilgrim', 'kist bid']",moody's revises pilgrim's pride outlook on gold kist bid pride moody outlook gold revises pilgrim kist bid,-1,-0.14401212,0.14183614
24-04-2017,http://www.marketwatch.com/story/june-gold-futures-fall-1160-or-09-to-settle-at-127750-an-ounce-2017-04-24,"june gold futures fall $11.60, or 0.9%, to settle at $1,277.50 an ounce",0,0,1,0,1,0,negative,"['11 60', 'settle', '277 50 ounce', 'june gold', 'futures fall']","june gold futures fall $11.60, or 0.9%, to settle at $1,277.50 an ounce 11 60 settle 277 50 ounce june gold futures fall",21,0.38508743,-0.331106
29-04-2011,https://economictimes.indiatimes.com/markets/commodities/gold-prices-soar-but-buyers-bet-on-akshaya-tritiya/articleshow/8113514.cms,gold prices soar but buyers bet on akshaya tritiya,1,0,0,0,1,0,positive,"['bet', 'tritiya', 'akshaya', 'prices soar buyers', 'gold prices']",gold prices soar but buyers bet on akshaya tritiya bet tritiya akshaya prices soar buyers gold prices,-1,-0.084467165,0.16127902
06-10-2017,http://www.marketwatch.com/story/gold-future-extend-losses-after-jobs-report-2017-10-06,Gold future extend losses after jobs report,0,0,1,0,1,0,negative,"['extend', 'jobs', 'report', 'gold future', 'losses jobs report']",Gold future extend losses after jobs report extend jobs report gold future losses jobs report,-1,-0.24974929,-0.13581932
11-11-2016,http://www.marketwatch.com/story/dec-gold-drops-3340-or-26-to-1233oz-2016-11-11,"Dec. gold drops $33.40, or 2.6%, to $1,233/oz",0,0,1,0,1,0,negative,"['33 40 233', 'dec', 'oz', 'gold', 'drops']","Dec. gold drops $33.40, or 2.6%, to $1,233/oz 33 40 233 dec oz gold drops",21,0.431921,0.05888664
28-08-2018,https://www.metalsdaily.com/link/282552/hedge-funds-kept-betting-against-gold-even-as-prices-began-rally.htm,hedge funds kept betting against gold even as prices began rally,0,0,0,0,1,0,none,"['began', 'rally', 'funds kept', 'hedge', 'gold prices']",hedge funds kept betting against gold even as prices began rally began rally funds kept hedge gold prices,-1,-0.19369741,-0.023979902
27-10-2008,http://www.marketwatch.com/story/dec-gold-reverses-losses-gaining-06-to-73470-an-ounce-2008-10-27,"dec. gold reverses losses, gaining 0.6% to $734.70 an ounce",0,0,1,0,1,0,negative,"['gaining', '734 70', 'ounce', 'dec gold', 'reverses losses']","dec. gold reverses losses, gaining 0.6% to $734.70 an ounce gaining 734 70 ounce dec gold reverses losses",-1,0.27131867,0.045139782
24-02-2016,http://www.marketwatch.com/story/gold-futures-mark-their-highest-settlement-since-feb-11-2016-02-24,gold futures mark their highest settlement since feb. 11,1,0,0,0,1,0,positive,"['11', 'feb', 'mark', 'highest settlement', 'gold futures']",gold futures mark their highest settlement since feb. 11 11 feb mark highest settlement gold futures,24,-0.018821567,-0.365908
16-08-2017,https://economictimes.indiatimes.com/markets/commodities/news/current-gold-rate-check-out-current-gold-price/articleshow/60082325.cms,current gold rate: check out current gold price,0,0,0,0,1,0,none,"['check', 'price', 'check current', 'rate check current', 'gold price']",current gold rate: check out current gold price check price check current rate check current gold price,-1,-0.037846833,0.10556483
18-04-2018,https://www.metalsdaily.com/link/278697/2018-gold-price-could-hit-$1450.htm,2018 gold price 'could hit $1450',0,0,0,0,0,1,none,"['hit', '2018', 'price', '1450', 'gold price']",2018 gold price 'could hit $1450' hit 2018 price 1450 gold price,-1,0.14735614,-0.043938786
11-01-2017,http://www.marketwatch.com/story/gold-holds-at-a-six-week-best-as-markets-await-donald-trumps-press-conference-2017-01-11,"gold rallies to finish near $1,200 as trump fuels market uncertainty",1,0,0,0,1,0,positive,"['near 200', 'trump fuels', 'gold', 'market uncertainty', 'rallies finish near']","gold rallies to finish near $1,200 as trump fuels market uncertainty near 200 trump fuels gold market uncertainty rallies finish near",-1,0.04737492,-0.09843506
07-11-2011,http://www.marketwatch.com/story/gold-futures-climb-to-top-1780-an-ounce-2011-11-07,"gold tops $1,790 to end at over six-week high",1,0,0,0,1,0,positive,"['end', 'tops', '790', 'week high', 'gold']","gold tops $1,790 to end at over six-week high end tops 790 week high gold",-1,0.16842757,0.004506752
01-07-2013,https://economictimes.indiatimes.com/markets/commodities/gold-futures-rebound-on-firm-global-cues/articleshow/20855498.cms,gold futures rebound on firm global cues,1,0,0,0,1,0,positive,"['cues', 'firm', 'global', 'rebound', 'gold futures']",gold futures rebound on firm global cues cues firm global rebound gold futures,-1,-0.2445713,-0.29127458
22-01-2018,http://www.marketwatch.com/story/gold-prices-on-track-to-settle-lower-for-the-session-2018-01-22,gold prices on track to settle lower for the session,0,0,1,0,1,0,negative,"['track', 'settle', 'lower session', 'prices track', 'gold prices']",gold prices on track to settle lower for the session track settle lower session prices track gold prices,-1,0.10259323,-0.02405373
02-05-2018,https://www.thehindubusinessline.com/markets/commodities/fading-aura-gold-set-for-further-correction/article23751906.ece,Fading aura: Gold set for further correction,0,0,1,0,0,1,negative,"['correction', 'set correction', 'aura', 'gold set', 'fading']",Fading aura: Gold set for further correction correction set correction aura gold set fading,-1,-0.09742396,0.042972174
20-10-2014,http://www.investing.com/news/commodities-news/gold-prices-rebound-in-asia-ahead-of-china-q3-gdp-313643,gold prices rebound in asia ahead of china q3 gdp,1,0,0,0,1,0,positive,"['q3', 'rebound', 'gdp', 'asia ahead china', 'gold prices']",gold prices rebound in asia ahead of china q3 gdp q3 rebound gdp asia ahead china gold prices,-1,-0.21485251,0.15580899
0201-04-14,http://www.marketwatch.com/story/gold-oil-hold-on-to-gains-post-bernanke-2010-04-14,"gold, oil hold on to gains post bernanke",1,0,0,1,1,0,positive,"['post', 'hold', 'gains', 'bernanke', 'gold oil']","gold, oil hold on to gains post bernanke post hold gains bernanke gold oil",-1,-0.17517504,0.09058927
06-10-2015,https://www.moneycontrol.com/news/business/markets/mcx-goldguinea-november-contract-rises-1344541.html,mcx goldguinea november contract rises,1,0,0,0,1,0,positive,"['rises', 'november', 'contract', 'goldguinea', 'mcx']",mcx goldguinea november contract rises rises november contract goldguinea mcx,1,-0.091814324,0.0004388839
06-10-2016,http://www.marketwatch.com/story/gold-futures-mark-lowest-settlement-since-early-june-2016-10-06,Gold futures mark lowest settlement since early June,0,0,1,0,1,0,negative,"['mark', 'gold', 'early june', 'futures', 'lowest settlement early']",Gold futures mark lowest settlement since early June mark gold early june futures lowest settlement early,24,0.058852956,-0.3935312
09-11-2011,https://www.moneycontrol.com/news/business/markets/-1837729.html,"Gold prices trading higher in Chennai, Ahmedabad market",1,0,0,0,1,0,positive,"['higher', 'ahmedabad', 'chennai', 'prices trading', 'gold prices']","Gold prices trading higher in Chennai, Ahmedabad market higher ahmedabad chennai prices trading gold prices",-1,-0.16720167,0.10055717
28-10-2009,http://www.marketwatch.com/story/gold-futures-remain-lower-after-durable-goods-2009-10-28,gold futures remain lower after durable goods,0,0,1,0,1,0,negative,"['lower', 'goods', 'durable', 'futures remain lower', 'gold futures remain']",gold futures remain lower after durable goods lower goods durable futures remain lower gold futures remain,-1,-0.17253542,-0.4568789
14-06-2006,http://www.marketwatch.com/story/gold-kist-started-at-hold-at-stifel-nicolaus-2006-06-14,gold kist started at hold at stifel nicolaus,0,1,0,0,1,0,neutral,"['started', 'stifel', 'gold', 'nicolaus', 'kist started hold']",gold kist started at hold at stifel nicolaus started stifel gold nicolaus kist started hold,-1,-0.08480781,0.12563726
24-11-2017,https://www.metalsdaily.com/link/274257/golds-47-year-bull-market.htm,gold's 47-year bull market,0,0,0,0,1,0,none,"['47', '47 year', 'gold', 'market', 'year bull']",gold's 47-year bull market 47 47 year gold market year bull,-1,0.0009997934,0.14845061
10-04-2018,https://www.metalsdaily.com/link/278430/dubai-loses-glitter-as-vat-tax-crimps-demand-in-city-of-gold.htm,dubai loses glitter as vat tax crimps demand in city of gold,0,0,1,0,1,0,negative,"['demand city', 'crimps demand', 'vat tax', 'dubai loses', 'loses glitter']",dubai loses glitter as vat tax crimps demand in city of gold demand city crimps demand vat tax dubai loses loses glitter,-1,-0.11416249,0.111502305
29-05-2008,http://www.marketwatch.com/story/gold-newsletters-remain-too-bullish-2008-05-29,sanguine about gold,1,0,0,0,1,0,positive,[],sanguine about gold ,-1,-0.09942924,0.23808801
18-07-2016,http://www.marketwatch.com/story/no-haven-bid-for-gold-after-failed-turkey-coup-attempt-2016-07-18,gold ends narrowly higher as 'many uncertainties' plague the market,1,0,0,0,1,0,positive,"['plague', 'narrowly', 'market', 'higher uncertainties', 'gold ends']",gold ends narrowly higher as 'many uncertainties' plague the market plague narrowly market higher uncertainties gold ends,-1,-0.11859201,0.029627386
22-05-2015,http://www.marketwatch.com/story/june-gold-last-at-120390oz-on-comex-down-20-cents-2015-05-22,"june gold last at $1,203.90/oz on comex, down 20 cents",0,0,1,0,1,0,negative,"['203', 'comex', 'june', 'oz', '20 cents']","june gold last at $1,203.90/oz on comex, down 20 cents 203 comex june oz 20 cents",21,0.3519343,0.0626152
04-05-2017,http://www.marketwatch.com/story/june-gold-down-15-at-123040oz-2017-05-04,"June gold down 1.5% at $1,230.40/oz.",0,0,1,0,1,0,negative,"['40', '230', 'june', 'oz', 'gold']","June gold down 1.5% at $1,230.40/oz. 40 230 june oz gold",21,0.41506636,0.0837649
21-09-2016,http://www.marketwatch.com/story/gold-aims-for-third-straight-win-as-dollar-wavers-2016-09-21,gold scores third straight win; edges up more after fed decision,1,0,0,0,1,0,positive,"['straight', 'scores', 'win edges', 'gold', 'fed decision']",gold scores third straight win; edges up more after fed decision straight scores win edges gold fed decision,-1,-0.19160292,0.08670321
24-08-2017,http://www.marketwatch.com/story/gold-slips-on-stronger-dollar-ahead-of-jackson-hole-central-bank-meet-up-2017-08-24,Gold settles lower as investors look to Jackson Hole,0,0,1,0,1,0,negative,"['look', 'lower', 'investors look', 'jackson hole', 'gold settles']",Gold settles lower as investors look to Jackson Hole look lower investors look jackson hole gold settles,-1,-0.04595825,0.014250189
16-05-2016,https://economictimes.indiatimes.com/markets/commodities/news/gold-rises-rs-67-in-futures-trade-on-global-cues/articleshow/52290137.cms,gold rises rs 67 in futures trade on global cues,1,0,0,0,1,0,positive,"['rs', '67', 'global cues', 'gold rises', 'futures trade global']",gold rises rs 67 in futures trade on global cues rs 67 global cues gold rises futures trade global,22,-0.18433818,-0.21818602
08-05-2009,http://www.marketwatch.com/story/gold-falls-as-jobs-data-reduce-economic-worries-2009-05-08,gold falls as jobs data clip economic worries,0,0,1,0,1,0,negative,"['worries', 'economic', 'falls', 'data clip', 'jobs data']",gold falls as jobs data clip economic worries worries economic falls data clip jobs data,-1,-0.21654841,0.16316828
22-10-2011,https://economictimes.indiatimes.com/markets/commodities/festive-demand-lifts-up-gold-silver-prices/articleshow/10452730.cms,festive demand lifts up gold & silver prices,1,0,0,1,1,0,positive,"['lifts', 'prices', 'demand', 'festive', 'gold silver prices']",festive demand lifts up gold & silver prices lifts prices demand festive gold silver prices,-1,-0.10542745,0.23221232
08-09-2009,http://www.marketwatch.com/story/gold-futures-up-850-at-100520-an-ounce-2009-09-08,"gold futures up $8.50 at $1,005.20 an ounce",1,0,0,0,1,0,positive,"['50', '005 20', 'ounce', 'futures', 'gold futures']","gold futures up $8.50 at $1,005.20 an ounce 50 005 20 ounce futures gold futures",26,0.2753312,-0.36385074
13-06-2016,https://www.thehindubusinessline.com/markets/gold/gold-hits-4week-high-as-central-bank-meetings-brexit-vote-shake-stocks/article8723872.ece,"Gold hits 4-week high as central bank meetings, Brexit vote shake stocks",1,0,0,0,1,0,positive,"['central bank', 'hits week high', 'gold', 'shake stocks', 'meetings brexit vote']","Gold hits 4-week high as central bank meetings, Brexit vote shake stocks central bank hits week high gold shake stocks meetings brexit vote",-1,-0.17034683,0.014572665
22-10-2010,http://www.marketwatch.com/story/gold-closes-a-tad-lower-at-132510oz-2010-10-22,"gold closes a tad lower at $1,325.10/oz",0,0,1,0,1,0,negative,"['tad', '325 10', 'closes tad lower', 'oz', 'gold closes']","gold closes a tad lower at $1,325.10/oz tad 325 10 closes tad lower oz gold closes",-1,0.34170163,0.024769314
21-05-2012,https://economictimes.indiatimes.com/news/economy/finance/lower-oil-prices-and-weaker-gold-demand-positive-for-current-account-deficit/articleshow/13360637.cms,lower oil prices and weaker gold demand positive for current account deficit,0,0,1,1,1,0,negative,"['positive current', 'gold', 'prices weaker', 'oil prices', 'account deficit']",lower oil prices and weaker gold demand positive for current account deficit positive current gold prices weaker oil prices account deficit,-1,-0.15061542,0.11330783
10-06-2013,https://www.moneycontrol.com/news/business/stocks/-1713651.html,"karvy advises to sell gold, silver",0,0,1,1,0,1,negative,"['advises', 'sell', 'silver', 'karvy', 'advises sell gold']","karvy advises to sell gold, silver advises sell silver karvy advises sell gold",-1,-0.18294972,0.10964656
12-09-2012,http://www.marketwatch.com/story/oil-gold-push-higher-after-german-court-ruling-2012-09-12,"oil, gold push higher after german court ruling",1,0,0,1,1,0,positive,"['push', 'court ruling', 'oil', 'gold', 'higher german court']","oil, gold push higher after german court ruling push court ruling oil gold higher german court",-1,-0.1644299,0.09070365
19-08-2014,"http://www.investing.com/news/commodities-news/gold-falls-on-upbeat-u.s.-housing,-inflation-data-304297","Gold falls on upbeat U.S. housing, inflation data",0,0,1,0,1,0,negative,"['data', 'upbeat', 'falls', 'gold', 'housing inflation']","Gold falls on upbeat U.S. housing, inflation data data upbeat falls gold housing inflation",-1,-0.056765996,0.17198761
27-09-2018,https://www.metalsdaily.com/link/284494/inflation-long-term-evidence-gold-and-inflation.htm,inflation : long-term evidence: gold and inflation,0,0,0,0,1,0,none,"['term', 'long', 'evidence', 'inflation', 'gold inflation']",inflation : long-term evidence: gold and inflation term long evidence inflation gold inflation,-1,-0.17869835,0.13669911
21-05-2010,https://economictimes.indiatimes.com/articleshow/5955669.cms,akshay tritiya gold sales to beat last year's record,0,0,0,0,1,0,none,"['beat year', 'record', 'akshay', 'tritiya', 'gold sales']",akshay tritiya gold sales to beat last year's record beat year record akshay tritiya gold sales,-1,-0.114748254,0.25067452
31-05-2018,https://www.metalsdaily.com/link/280064/gold-prices-edge-higher-on-weaker-dollar-trade-tensions.htm,"gold prices edge higher on weaker dollar, trade tensions",1,0,0,1,1,0,positive,"['edge', 'higher weaker', 'tensions', 'dollar trade', 'gold prices']","gold prices edge higher on weaker dollar, trade tensions edge higher weaker tensions dollar trade gold prices",-1,-0.13277756,0.14739007
24-08-2015,https://www.thehindubusinessline.com/markets/gold/gold-stands-tall-as-china-fears-fuel-safehaven-draw/article7574516.ece,Gold stands tall as China fears fuel safe-haven draw,1,0,0,0,1,0,positive,"['haven draw', 'stands tall', 'gold', 'fuel safe', 'china fears']",Gold stands tall as China fears fuel safe-haven draw haven draw stands tall gold fuel safe china fears,-1,-0.25984162,-0.003404662
19-04-2013,http://www.marketwatch.com/story/gold-futures-turn-lower-ahead-of-comex-close-2013-04-19,gold futures turn lower ahead of comex close,0,0,1,0,1,0,negative,"['lower', 'turn', 'ahead', 'comex close', 'gold futures']",gold futures turn lower ahead of comex close lower turn ahead comex close gold futures,-1,-0.16986659,-0.44513905
29-08-2017,http://www.marketwatch.com/story/golds-2016-peak-now-looks-easy-to-reach-after-the-metals-big-breakout-2017-08-29,Gold's 2016 peak now looks easy to reach after the metal's big breakout,1,0,0,0,0,1,positive,"['2016', 'easy reach', 'metal', 'big breakout', 'peak looks easy']",Gold's 2016 peak now looks easy to reach after the metal's big breakout 2016 easy reach metal big breakout peak looks easy,-1,-0.165631,0.12429316
27-07-2016,http://www.marketwatch.com/story/gold-climbs-as-fed-policy-statement-looms-2016-07-27,"Gold settles higher, but seesaws after Fed statement",1,0,0,0,1,0,positive,"['statement', 'higher', 'seesaws', 'fed', 'gold settles higher']","Gold settles higher, but seesaws after Fed statement statement higher seesaws fed gold settles higher",-1,-0.096705526,0.00171002
13-04-2016,https://www.moneycontrol.com/news/business/economy/indias-2015-16-gold-imports-drop-16-report-1023018.html,india's 2015-16 gold imports drop 16%: report,0,0,0,0,1,0,none,"['2015 16', 'gold', 'india', 'drop 16 report', 'imports drop']",india's 2015-16 gold imports drop 16%: report 2015 16 gold india drop 16 report imports drop,-1,-0.10293756,0.12446174
24-08-2004,http://www.marketwatch.com/story/dec-gold-down-14-at-40710-2004-08-24,dec gold down 1.4% at $407.10,0,0,1,0,1,0,negative,"['10', '407', 'dec', 'gold', 'gold 407']",dec gold down 1.4% at $407.10 10 407 dec gold gold 407,-1,0.28867555,0.008026674
20-01-2017,http://www.marketwatch.com/story/feb-gold-settles-at-120490oz-up-340-or-03-2017-01-20,"Feb. gold settles at $1,204.90/oz, up $3.40, or 0.3%",1,0,0,0,1,0,positive,"['40', 'feb', 'settles', 'gold', '204 90 oz']","Feb. gold settles at $1,204.90/oz, up $3.40, or 0.3% 40 feb settles gold 204 90 oz",21,0.5083556,0.050385132
15-08-2018,http://www.marketwatch.com/story/heres-why-gold-might-die-out-as-an-investment-2018-08-15,here's why gold might die out as an investment,0,0,1,0,0,1,negative,"['die', 'gold', 'investment', 'die investment', 'gold die']",here's why gold might die out as an investment die gold investment die investment gold die,-1,-0.17174676,-0.021940999
07-04-2008,http://www.marketwatch.com/story/gold-futures-rally-as-other-commodities-also-rise-2008-04-07,"gold futures rally, as other commodities also rise",1,0,0,0,1,0,positive,"['rise', 'gold', 'rally', 'futures', 'commodities rise']","gold futures rally, as other commodities also rise rise gold rally futures commodities rise",-1,-0.23658173,-0.23451424
03-12-2018,http://www.marketwatch.com/story/gold-futures-mark-highest-settlement-in-a-month-2018-12-03,gold futures mark highest settlement in a month,1,0,0,0,1,0,positive,"['mark', 'highest', 'month', 'settlement', 'gold futures']",gold futures mark highest settlement in a month mark highest month settlement gold futures,24,0.0006878078,-0.39734513
18-04-2011,http://www.marketwatch.com/story/gold-advances-oil-posts-losses-after-us-outlook-2011-04-18,"gold advances, oil posts losses after u.s. outlook",1,0,0,1,1,0,positive,"['outlook', 'advances', 'gold', 'oil posts', 'losses outlook']","gold advances, oil posts losses after u.s. outlook outlook advances gold oil posts losses outlook",-1,-0.15947455,-0.017693236
29-07-2016,http://www.marketwatch.com/story/gold-pops-higher-after-weak-us-gdp-data-2016-07-29,gold futures gain nearly 3% for the month,1,0,0,0,1,0,positive,"['nearly', 'gain', 'month', 'gain nearly month', 'gold futures']",gold futures gain nearly 3% for the month nearly gain month gain nearly month gold futures,-1,-0.019326568,-0.33427602
13-05-2005,http://www.marketwatch.com/story/apollo-gold-cut-to-underperform-by-bmo-nesbitt-2005-05-13,apollo gold cut to underperform by bmo nesbitt,0,0,0,0,1,0,none,"['underperform', 'cut', 'bmo', 'nesbitt', 'apollo gold']",apollo gold cut to underperform by bmo nesbitt underperform cut bmo nesbitt apollo gold,-1,-0.0958394,0.07742738
27-11-2018,https://www.metalsdaily.com/link/287273/mining-top-gold-miners-production-cost-still-provides-floor-in-the-market-price.htm,mining : top gold miners production cost still provides floor in the market price,0,0,1,0,1,0,negative,"['provides floor', 'gold', 'market price', 'production cost', 'mining gold miners']",mining : top gold miners production cost still provides floor in the market price provides floor gold market price production cost mining gold miners,-1,-0.08359191,0.075787306
17-01-2017,https://www.moneycontrol.com/news/business/stocks/gold-to-trade28372-28686-range-achiievers-equities-945638.html,gold to trade in 28372-28686 range: achiievers equities,0,1,0,0,0,1,neutral,"['achiievers', 'range', '28372 28686', 'equities', 'gold trade']",gold to trade in 28372-28686 range: achiievers equities achiievers range 28372 28686 equities gold trade,3,0.023688361,0.13649401
12-08-2013,https://economictimes.indiatimes.com/markets/commodities/gold-rebounds-to-hit-four-month-high-silver-spurts/articleshow/21781514.cms,gold rebounds to hit four-month high; silver spurts,1,0,0,1,1,0,positive,"['high', 'month', 'spurts', 'silver', 'gold rebounds hit']",gold rebounds to hit four-month high; silver spurts high month spurts silver gold rebounds hit,-1,-0.14524226,0.15365951
06-07-2017,http://www.marketwatch.com/story/gold-holds-slight-gain-after-data-2017-07-06,Gold holds slight gain after data,1,0,0,0,1,0,positive,"['slight', 'holds slight', 'data', 'gold', 'gain data']",Gold holds slight gain after data slight holds slight data gold gain data,-1,-0.14703801,0.19355384
25-10-2005,http://www.marketwatch.com/story/gold-etfs-higher-in-early-trade-2005-10-25,gold etfs higher in early trade,1,0,0,0,1,0,positive,"['early', 'trade', 'gold', 'etfs higher', 'etfs higher early']",gold etfs higher in early trade early trade gold etfs higher etfs higher early,-1,-0.20145145,0.012194924
11-06-2009,http://www.marketwatch.com/story/august-gold-falls-04-to-95130-an-ounce,august gold falls 0.4% to $951.30 an ounce,0,0,1,0,1,0,negative,"['951 30', 'falls', 'august', 'gold', '951 30 ounce']",august gold falls 0.4% to $951.30 an ounce 951 30 falls august gold 951 30 ounce,21,0.45388228,0.15039611
22-12-2017,http://www.marketwatch.com/story/february-gold-up-03-at-127480-an-ounce-2017-12-22,"february gold up 0.3% at 1,274.80 an ounce",1,0,0,0,1,0,positive,"['274', '80', 'february', 'gold', 'ounce']","february gold up 0.3% at 1,274.80 an ounce 274 80 february gold ounce",21,0.3847921,0.1969832
17-08-2017,https://economictimes.indiatimes.com/markets/commodities/news/gold-edges-up-after-gaining-on-softer-dollar/articleshow/60096001.cms,"gold edges up on softer dollar, palladium at 16-year peak",1,0,0,1,1,0,positive,"['16 year', 'year peak', 'dollar', 'edges softer', 'palladium']","gold edges up on softer dollar, palladium at 16-year peak 16 year year peak dollar edges softer palladium",-1,-0.010161281,0.06747694
20-10-2011,https://www.moneycontrol.com/news/business/markets/-2048613.html,MCX GOLD Dec contract trading lower,0,0,1,0,1,0,negative,"['gold', 'dec', 'mcx', 'contract trading', 'contract trading lower']",MCX GOLD Dec contract trading lower gold dec mcx contract trading contract trading lower,1,-0.061939575,-0.11136812
19-09-2005,http://www.marketwatch.com/story/dec-gold-climbs-460-to-46790oz-a-9-mo-high-2005-09-19,"dec gold climbs $4.60 to $467.90/oz, a 9-mo high",1,0,0,0,1,0,positive,"['mo', 'dec', 'climbs 60', 'gold', '467 90 oz']","dec gold climbs $4.60 to $467.90/oz, a 9-mo high mo dec climbs 60 gold 467 90 oz",21,0.3871485,0.06855425
14-03-2017,http://www.investing.com/news/commodities-news/gold-stays-close-to-6-week-low-as-investors-await-fed-outcome-466024,gold stays close to 6-week low as investors await fed outcome,0,0,1,0,1,0,negative,"['stays close', 'week', 'await fed outcome', 'low investors', 'gold stays']",gold stays close to 6-week low as investors await fed outcome stays close week await fed outcome low investors gold stays,-1,-0.08677819,-0.18057272
07-08-2014,"http://www.investing.com/news/commodities-news/gold-rises-on-ukraine-unease,-though-u.s.-data-cap-gains-301962","gold rises on ukraine unease, though u.s. data cap gains",1,0,0,0,1,0,positive,"['unease', 'gains', 'ukraine', 'data cap', 'gold rises']","gold rises on ukraine unease, though u.s. data cap gains unease gains ukraine data cap gold rises",-1,-0.20969844,0.22421952
16-10-2015,https://www.moneycontrol.com/news/business/markets/gold-futures-down-043weak-global-cues-1302211.html,gold futures down 0.43% on weak global cues,0,0,1,0,1,0,negative,"['43', 'cues', 'weak global', 'futures', 'gold futures']",gold futures down 0.43% on weak global cues 43 cues weak global futures gold futures,22,-0.10573983,-0.3769401
12-12-2015,https://www.thehindubusinessline.com/markets/gold/gold-surges-by-rs-290-on-global-cues-reclaims-rs-26000level/article7980637.ece,"Gold surges by Rs 290 on global cues; reclaims Rs 26,000-level",1,0,0,0,1,0,positive,"['gold', '26 000 level', 'global cues reclaims', 'rs 290', 'surges rs']","Gold surges by Rs 290 on global cues; reclaims Rs 26,000-level gold 26 000 level global cues reclaims rs 290 surges rs",-1,-0.21320865,0.102256
10-12-2015,http://www.marketwatch.com/story/gold-ends-lower-as-bearish-sentiment-takes-hold-2015-12-10,gold ends lower as bearish sentiment takes hold,0,0,1,0,1,0,negative,"['lower', 'hold', 'bearish', 'sentiment takes', 'gold ends']",gold ends lower as bearish sentiment takes hold lower hold bearish sentiment takes gold ends,-1,-0.12555781,0.086080834
04-01-2013,http://www.marketwatch.com/story/gold-falls-15-on-day-down-04-on-week-2013-01-04,"gold falls 1.5% on day, down 0.4% on week",0,0,1,0,1,0,negative,"['day', 'week', 'falls', 'gold', 'gold falls']","gold falls 1.5% on day, down 0.4% on week day week falls gold gold falls",-1,0.13664375,0.04204389
20-12-2013,http://www.marketwatch.com/story/gold-futures-climb-but-end-the-week-down-25-2013-12-20,"gold futures climb, but end the week down 2.5%",1,0,1,0,1,0,positive,"['end', 'week', 'climb', 'futures', 'gold futures']","gold futures climb, but end the week down 2.5% end week climb futures gold futures",-1,-0.052607387,-0.46575165
12-01-2016,https://www.thehindubusinessline.com/markets/gold/gold-edges-up-after-2day-decline-china-concerns-support/article8095482.ece,"Gold edges up after 2-day decline, China concerns support",1,0,1,0,1,0,positive,"['day', 'edges', 'concerns support', 'gold', 'decline china']","Gold edges up after 2-day decline, China concerns support day edges concerns support gold decline china",-1,-0.20709026,0.036752276
26-10-2015,https://www.thehindubusinessline.com/markets/gold/gold-struggles-on-firmer-dollar-fed-rate-hike-fears/article7805233.ece,"Gold struggles on firmer dollar, Fed rate hike fears",0,0,1,1,1,0,negative,"['rate', 'struggles', 'hike fears', 'gold', 'dollar fed rate']","Gold struggles on firmer dollar, Fed rate hike fears rate struggles hike fears gold dollar fed rate",-1,-0.13938582,0.025697928
30-04-2008,http://www.marketwatch.com/story/june-gold-up-1040-at-87550-an-ounce-on-nymex-2008-04-30,june gold up $10.40 at $875.50 an ounce on nymex,1,0,0,0,1,0,positive,"['10 40 875', 'june', '50 ounce', 'nymex', 'gold']",june gold up $10.40 at $875.50 an ounce on nymex 10 40 875 june 50 ounce nymex gold,21,0.35041136,0.083498
21-10-2016,http://www.marketwatch.com/story/dec-gold-gains-20-cents-to-settle-at-126770oz-for-the-session-2016-10-21,"Dec. gold gains 20 cents to settle at $1,267.70/oz for the session",1,0,0,0,1,0,positive,"['oz session', 'settle 267 70', 'dec gold', 'gains 20', 'cents']","Dec. gold gains 20 cents to settle at $1,267.70/oz for the session oz session settle 267 70 dec gold gains 20 cents",21,0.41199452,0.0033133477
21-10-2011,https://economictimes.indiatimes.com/markets/commodities/seasonal-demand-pushes-up-gold-by-rs-375-silver-by-rs-400/articleshow/10440725.cms,seasonal demand pushes up gold by rs 375; silver by rs 400,1,0,0,1,1,0,positive,"['seasonal', 'gold', 'demand pushes', 'rs 400', '375 silver']",seasonal demand pushes up gold by rs 375; silver by rs 400 seasonal gold demand pushes rs 400 375 silver,-1,0.00231193,0.121393695
27-11-2018,https://www.thehindubusinessline.com/markets/gold/gold-edges-lower-as-dollar-holds-steady/article25603607.ece,Gold edges lower as dollar holds steady,0,0,1,1,1,0,negative,"['holds', 'lower', 'edges', 'dollar holds steady', 'gold edges lower']",Gold edges lower as dollar holds steady holds lower edges dollar holds steady gold edges lower,-1,-0.03256716,0.07218132
16-08-2017,http://www.marketwatch.com/story/gold-prices-turn-higher-ahead-of-comex-settlement-2017-08-16,Gold prices turn higher ahead of Comex settlement,1,0,0,0,1,0,positive,"['turn', 'settlement', 'ahead comex', 'prices turn higher', 'gold prices']",Gold prices turn higher ahead of Comex settlement turn settlement ahead comex prices turn higher gold prices,-1,-0.093531,-0.07747415
17-07-2014,"http://www.investing.com/news/commodities-news/gold,-silver-edge-higher-ahead-of-u.s.-jobless-claims,-housing-data-295731","Gold, silver edge higher ahead of U.S. jobless claims, housing data",1,0,0,1,1,0,positive,"['edge higher ahead', 'jobless', 'housing data', 'gold silver', 'claims housing']","Gold, silver edge higher ahead of U.S. jobless claims, housing data edge higher ahead jobless housing data gold silver claims housing",-1,-0.20155518,0.15823442
30-11-2011,http://www.marketwatch.com/story/gold-futures-add-1980-to-173320-2011-11-30,"gold futures add $19.80 to $1,733.20",1,0,0,0,1,0,positive,"['add', '733', 'gold', '19 80 733', 'futures']","gold futures add $19.80 to $1,733.20 add 733 gold 19 80 733 futures",-1,0.089168295,-0.3233485
16-10-2017,https://economictimes.indiatimes.com/markets/commodities/news/the-curious-case-of-this-years-high-gold-imports/articleshow/61097165.cms,the curious case of this year's high gold imports,0,0,0,0,1,0,none,"['case', 'curious', 'year high', 'gold', 'imports']",the curious case of this year's high gold imports case curious year high gold imports,-1,-0.14503542,0.12826468
08-02-2013,http://www.marketwatch.com/story/gold-logs-modest-losses-for-the-day-and-week-2013-02-08,gold logs modest losses for the day and week,0,0,1,0,1,0,negative,"['modest', 'day', 'gold', 'logs', 'losses day week']",gold logs modest losses for the day and week modest day gold logs losses day week,-1,-0.031314313,-0.013241634
06-04-2018,https://www.thehindubusinessline.com/markets/gold/gold-rises-on-safe-haven-buying/article23451897.ece,Gold rises on safe-haven buying,1,0,0,0,1,0,positive,"['haven', 'safe', 'buying', 'rises safe haven', 'gold rises']",Gold rises on safe-haven buying haven safe buying rises safe haven gold rises,-1,-0.16019449,0.11116355
13-07-2011,http://www.marketwatch.com/story/gold-options-fear-traders-turn-to-gold-miners-2011-07-13,gold options 'fear' traders turn to gold miners,0,0,1,0,0,1,negative,"['turn', 'miners', 'fear', 'gold options', 'options fear traders']",gold options 'fear' traders turn to gold miners turn miners fear gold options options fear traders,-1,-0.18863207,0.010632582
17-10-2017,http://www.marketwatch.com/story/dec-gold-declines-by-1680-or-13-to-settle-at-128620oz-2017-10-17,"Dec. gold declines by $16.80, or 1.3%, to settle at $1,286.20/oz",0,0,1,0,1,0,negative,"['settle 286', '16 80', 'gold', '20 oz', 'dec gold declines']","Dec. gold declines by $16.80, or 1.3%, to settle at $1,286.20/oz settle 286 16 80 gold 20 oz dec gold declines",21,0.46034718,-0.039320365
17-11-2014,http://www.marketwatch.com/story/gold-slips-210-to-settle-at-118350oz-2014-11-17,"gold slips $2.10 to settle at $1,183.50/oz",0,0,1,0,1,0,negative,"['10', '183 50', 'settle', 'oz', 'gold slips']","gold slips $2.10 to settle at $1,183.50/oz 10 183 50 settle oz gold slips",-1,0.39987648,0.013221465
15-05-2017,http://www.marketwatch.com/story/june-gold-trades-680-or-06-higher-at-123450oz-2017-05-15,"June gold trades $6.80, or 0.6%, higher at $1,234.50/oz.",1,0,0,0,1,0,positive,"['234 50', '80 higher', 'june', 'oz', 'gold trades']","June gold trades $6.80, or 0.6%, higher at $1,234.50/oz. 234 50 80 higher june oz gold trades",21,0.33801395,0.03219994
27-10-2011,https://www.thehindubusinessline.com/markets/gold/gold-futures-down-at-rs-27477-on-profit-taking/article23063013.ece,"Gold futures down at Rs 27,477 on profit-taking",0,0,1,0,1,0,negative,"['taking', 'rs', '27 477', 'profit taking', 'gold futures']","Gold futures down at Rs 27,477 on profit-taking taking rs 27 477 profit taking gold futures",-1,-0.0012938082,-0.29904234
15-06-2017,https://economictimes.indiatimes.com/markets/commodities/news/get-gold-at-a-discount-now/articleshow/59156566.cms,get gold at a discount now,0,0,0,0,1,0,none,[],get gold at a discount now ,-1,0.05110912,0.09897335
16-12-2004,http://www.marketwatch.com/story/gold-futures-dull-hold-above-440-2004-12-16,"gold futures dull, hold above $440",0,1,0,0,1,0,neutral,"['hold', 'dull', '440', 'futures', 'gold futures']","gold futures dull, hold above $440 hold dull 440 futures gold futures",-1,0.01961559,-0.38595337
23-08-2017,http://www.marketwatch.com/story/dec-gold-gains-370-or-03-to-settle-at-129470oz-2017-08-23,"Dec. gold gains $3.70, or 0.3%, to settle at $1,294.70/oz",1,0,0,0,1,0,positive,"['dec', '294 70', 'settle', 'oz', 'gold gains']","Dec. gold gains $3.70, or 0.3%, to settle at $1,294.70/oz dec 294 70 settle oz gold gains",21,0.41298968,-0.0024036095
29-09-2014,http://www.investing.com/news/commodities-news/gold-prices-push-higher-amid-hong-kong-unrest-311100,Gold prices push higher amid Hong Kong unrest,1,0,0,0,1,0,positive,"['higher amid', 'push', 'unrest', 'hong', 'gold prices']",Gold prices push higher amid Hong Kong unrest higher amid push unrest hong gold prices,-1,-0.14236933,0.16721655
15-09-2010,http://www.marketwatch.com/story/gold-closes-02-down-at-126870oz-2010-09-15,"gold closes 0.2% down at $1,268.70/oz",0,0,1,0,1,0,negative,"['268 70', 'oz', 'closes 268', 'gold', '70 oz']","gold closes 0.2% down at $1,268.70/oz 268 70 oz closes 268 gold 70 oz",21,0.3761559,0.016556375
10-02-2017,http://www.marketwatch.com/story/gold-pares-losses-by-the-finish-gains-12-for-the-week-2017-02-10,"Gold pares losses by the finish, gains 1.2% for the week",1,0,0,0,1,0,positive,"['finish', 'pares', 'gold', 'gains week', 'losses finish gains']","Gold pares losses by the finish, gains 1.2% for the week finish pares gold gains week losses finish gains",-1,0.0054893047,0.004412465
29-11-2017,https://economictimes.indiatimes.com/markets/commodities/news/gold-rate-today-gold-silver-trade-higher-in-morning-deals/articleshow/61845734.cms,"gold rate today: gold, silver trade higher in morning deals",1,0,0,1,1,0,positive,"['rate', 'morning', 'deals', 'today gold', 'silver trade higher']","gold rate today: gold, silver trade higher in morning deals rate morning deals today gold silver trade higher",8,-0.077508934,0.057582133
07-06-2012,http://www.marketwatch.com/story/anz-cuts-12-gold-outlook-cites-dollar-headwinds-2012-06-07,"anz cuts '12 gold outlook, cites dollar headwinds",0,0,1,1,0,1,negative,"['cuts 12', 'outlook', 'anz', 'headwinds', 'cites dollar']","anz cuts '12 gold outlook, cites dollar headwinds cuts 12 outlook anz headwinds cites dollar",-1,0.02639234,0.0616967
10-01-2001,http://www.marketwatch.com/story/gold-closes-lower-palladium-rises,"gold closes lower, palladium rises",0,0,1,1,1,0,negative,"['lower', 'rises', 'closes', 'gold', 'palladium']","gold closes lower, palladium rises lower rises closes gold palladium",-1,-0.11451249,-0.03474118
12-10-2006,http://www.marketwatch.com/story/gold-kist-rejects-pilgrims-pride-offer-as-inadequate-2006-10-12-1291249,gold kist rejects pilgrim's pride offer as inadequate,0,0,0,0,1,0,none,"['offer', 'inadequate', 'pilgrim', 'pride', 'kist rejects']",gold kist rejects pilgrim's pride offer as inadequate offer inadequate pilgrim pride kist rejects,-1,-0.08295731,0.12800181
29-11-2017,http://www.marketwatch.com/story/feb-gold-drops-13-or-1-to-settle-at-128620oz-2017-11-29,waiting for gold to bottom? Watch this group of bulls,0,0,1,0,1,0,negative,"['watch', 'group', 'waiting', 'gold watch', 'bulls']",waiting for gold to bottom? Watch this group of bulls watch group waiting gold watch bulls,-1,-0.19604655,0.09836795
12-02-2013,https://www.thehindubusinessline.com/markets/gold/gold-silver-skid-on-profit-taking-global-cues/article23089456.ece,"Gold, silver skid on profit-taking, global cues",0,0,1,1,1,0,negative,"['taking', 'cues', 'skid', 'gold silver', 'profit taking global']","Gold, silver skid on profit-taking, global cues taking cues skid gold silver profit taking global",-1,-0.211807,0.17308718
18-02-2015,http://www.marketwatch.com/story/gold-futures-settle-at-lowest-level-since-jan-2-2015-02-18,gold futures settle at lowest level since jan. 2,0,0,1,0,1,0,negative,"['level', 'jan', 'lowest', 'settle', 'gold futures']",gold futures settle at lowest level since jan. 2 level jan lowest settle gold futures,-1,-0.0136898905,-0.4651931
15-10-2010,http://www.marketwatch.com/story/crude-oil-higher-gold-futures-lower-after-data-2010-10-15,"crude oil higher, gold futures lower after data",0,0,1,1,1,0,negative,"['gold', 'crude', 'futures', 'lower data', 'oil higher']","crude oil higher, gold futures lower after data gold crude futures lower data oil higher",-1,-0.18190408,-0.3116049
11-04-2017,http://www.marketwatch.com/story/gold-futures-mark-highest-finish-in-about-5-months-2017-04-11,Gold futures mark highest finish in about 5 months,1,0,0,0,1,0,positive,"['mark', 'finish', 'months', 'highest', 'gold futures']",Gold futures mark highest finish in about 5 months mark finish months highest gold futures,27,-0.074097596,-0.41572624
28-03-2017,http://www.marketwatch.com/story/gold-prices-end-with-a-slight-loss-as-us-equities-dollar-gain-ground-2017-03-28,"Gold prices end with a slight loss as U.S. equities, dollar gain ground",0,0,1,1,1,0,negative,"['equities', 'gain ground', 'slight loss', 'prices end', 'gold prices']","Gold prices end with a slight loss as U.S. equities, dollar gain ground equities gain ground slight loss prices end gold prices",-1,-0.04663658,0.04023403
0200-09-30,http://www.marketwatch.com/story/iamgold-deal-for-gold-field-non-sadc-assets-2004-09-30,iamgold deal for gold field non-sadc assets,0,0,0,0,1,0,none,"['field non', 'gold', 'deal', 'iamgold', 'non sadc assets']",iamgold deal for gold field non-sadc assets field non gold deal iamgold non sadc assets,-1,-0.08443704,0.125279
03-05-2018,https://www.metalsdaily.com/link/279312/india-rising-gold-prices-keep-indias-jewellery-buyers-at-bay.htm,india : rising gold prices keep india's jewellery buyers at bay,1,0,0,0,1,0,positive,"['bay', 'rising', 'buyers', 'prices india jewellery', 'gold prices india']",india : rising gold prices keep india's jewellery buyers at bay bay rising buyers prices india jewellery gold prices india,-1,-0.16827191,0.21307692
11-05-2017,http://www.marketwatch.com/story/gold-futures-trim-gain-after-jobless-claims-ppi-data-2017-05-11,"Gold futures trim gain after jobless claims, PPI data",1,0,0,0,1,0,positive,"['gold', 'futures', 'trim gain', 'ppi data', 'gain jobless claims']","Gold futures trim gain after jobless claims, PPI data gold futures trim gain ppi data gain jobless claims",-1,-0.18695897,-0.24127293
28-11-2011,https://www.moneycontrol.com/news/business/markets/-1283083.html,MCX GOLD Dec contract trading higher,1,0,0,0,1,0,positive,"['dec', 'gold', 'higher', 'mcx', 'contract trading higher']",MCX GOLD Dec contract trading higher dec gold higher mcx contract trading higher,1,-0.108602054,-0.0538207
03-04-2006,http://www.marketwatch.com/story/gold-prices-climb-over-8-an-ounce-in-afternoon-trading-2006-04-03,gold prices climb over $8 an ounce in afternoon trading,1,0,0,0,1,0,positive,"['climb', 'afternoon', 'trading', 'ounce', 'gold prices']",gold prices climb over $8 an ounce in afternoon trading climb afternoon trading ounce gold prices,-1,0.16482846,0.08868833
19-12-2011,https://www.thehindubusinessline.com/markets/gold/gold-futures-extends-losses/article23072023.ece,Gold futures extends losses,0,0,1,0,1,0,negative,"['extends', 'gold', 'losses', 'futures', 'gold futures extends']",Gold futures extends losses extends gold losses futures gold futures extends,-1,-0.23254545,-0.36240017
06-03-2018,https://www.metalsdaily.com/link/277422/graham-birch-this-gold-guy-managed-$40-billion-at-blackrock--but-quit-to-run-a-farm-instead.htm,graham birch : this gold guy managed $40 billion at blackrock - but quit to run a farm instead,0,0,0,0,1,0,none,"['birch', 'gold guy', 'run farm instead', 'blackrock quit', 'managed 40 billion']",graham birch : this gold guy managed $40 billion at blackrock - but quit to run a farm instead birch gold guy run farm instead blackrock quit managed 40 billion,-1,-0.1130569,0.12126016
03-10-2018,https://www.moneycontrol.com/news/business/commodities/gold-prices-rise-on-softer-dollar-italy-budget-woes-3007841.html,"Gold prices rise on softer dollar, Italy budget woes",1,0,0,1,1,0,positive,"['softer', 'rise', 'italy', 'budget woes', 'gold prices rise']","Gold prices rise on softer dollar, Italy budget woes softer rise italy budget woes gold prices rise",-1,-0.096668616,0.15338783
17-08-2011,http://www.marketwatch.com/story/gold-futures-climb-9-edge-back-up-toward-1800-2011-08-17,"gold futures climb $9, edge back up toward $1,800",1,0,0,0,1,0,positive,"['edge', '800', 'climb', 'futures', 'gold futures']","gold futures climb $9, edge back up toward $1,800 edge 800 climb futures gold futures",-1,0.010138482,-0.4177066
17-02-2011,https://economictimes.indiatimes.com/markets/commodities/gold-demand-in-india-rose-by-66-to-963-tonnes-in-2010-wgc/articleshow/7516741.cms,gold demand in india rose by 66% to 963 tonnes in 2010: wgc,0,0,0,0,1,0,none,"['66 963', '2010', 'wgc', 'india rose', 'gold demand']",gold demand in india rose by 66% to 963 tonnes in 2010: wgc 66 963 2010 wgc india rose gold demand,11,-0.10077456,0.18004
28-10-2011,https://www.moneycontrol.com/news/business/markets/-1981949.html,MCX GOLDGUINEA Nov contract down marginally,0,0,1,0,1,0,negative,"['nov', 'marginally', 'mcx', 'goldguinea', 'contract marginally']",MCX GOLDGUINEA Nov contract down marginally nov marginally mcx goldguinea contract marginally,1,-0.07457504,-0.12691471
15-01-2004,http://www.marketwatch.com/story/mining-indexes-end-at-mid-november-level-gold-sinks-3-2004-01-15,mining indexes slump on gold slide,0,0,1,0,1,0,negative,"['slide', 'gold', 'mining', 'indexes', 'slump']",mining indexes slump on gold slide slide gold mining indexes slump,-1,-0.19475971,0.01633519
06-09-2016,http://www.marketwatch.com/story/gold-gains-as-dollar-dips-amid-fed-interest-rate-uncertainty-2016-09-06,Gold ends near 3-week high as dollar sinks,1,0,0,1,1,0,positive,"['near', 'week high', 'sinks', 'dollar', 'gold ends']",Gold ends near 3-week high as dollar sinks near week high sinks dollar gold ends,-1,0.10017197,-0.025648668
26-06-2018,https://www.metalsdaily.com/link/280700/gold-and-silver-edge-lower-while-stocks-tumble.htm,gold and silver edge lower while stocks tumble,0,0,1,1,1,0,negative,"['edge', 'tumble', 'gold silver', 'lower stocks', 'stocks tumble']",gold and silver edge lower while stocks tumble edge tumble gold silver lower stocks stocks tumble,-1,-0.19570862,0.04310728
01-12-2017,https://www.metalsdaily.com/link/274478/gold-prices-rip-higher-following-rpts-former-trump-nat-sec-advisor-cooperating-with-special-prosecutor.htm,gold prices rip higher following rpts former trump nat. sec. advisor cooperating with special prosecutor,1,0,0,0,1,0,positive,"['prosecutor', 'rpts trump nat', 'rip higher', 'sec advisor cooperating', 'gold prices']",gold prices rip higher following rpts former trump nat. sec. advisor cooperating with special prosecutor prosecutor rpts trump nat rip higher sec advisor cooperating gold prices,-1,-0.11611206,0.101531304
12-10-2016,http://www.marketwatch.com/story/dec-gold-trades-at-125540oz-up-from-125380-settlement-2016-10-12,"Dec. gold trades at $1,255.40/oz, up from $1,253.80 settlement",1,0,0,0,1,0,positive,"['255 40', 'oz', 'trades', 'dec gold', '253 80 settlement']","Dec. gold trades at $1,255.40/oz, up from $1,253.80 settlement 255 40 oz trades dec gold 253 80 settlement",21,0.39661926,-0.001217179
28-10-2011,http://www.marketwatch.com/story/gold-futures-give-up-europe-deal-gains-2011-10-28,gold futures give up europe-deal gains,1,0,0,0,1,0,positive,"['deal', 'gains', 'europe', 'gold', 'futures europe deal']",gold futures give up europe-deal gains deal gains europe gold futures europe deal,-1,-0.14857171,-0.35148913
22-08-2016,http://www.marketwatch.com/story/going-for-gold-olympic-triumphs-literally-losing-value-at-rio-games-2016-08-08,Going for gold: Olympic triumphs literally losing value at Rio Games,0,0,0,0,1,0,none,"['literally losing', 'losing value', 'triumphs literally', 'rio', 'gold olympic']",Going for gold: Olympic triumphs literally losing value at Rio Games literally losing losing value triumphs literally rio gold olympic,-1,-0.12783366,0.19643128
12-03-2018,https://www.metalsdaily.com/link/277595/why-investors-are-quietly-turning-bearish-on-gold-prices.htm,why investors are quietly turning bearish on gold prices,0,0,0,0,1,0,none,"['turning', 'quietly', 'bearish', 'investors', 'gold prices']",why investors are quietly turning bearish on gold prices turning quietly bearish investors gold prices,-1,-0.18359047,0.1304765
19-10-2016,http://www.marketwatch.com/story/gold-futures-log-highest-finish-since-oct-3-2016-10-19,Gold futures log highest finish since Oct. 3,1,0,0,0,1,0,positive,"['finish', 'oct', 'log', 'highest', 'gold futures']",Gold futures log highest finish since Oct. 3 finish oct log highest gold futures,27,-0.09404396,-0.39958864
14-02-2017,http://www.marketwatch.com/story/gold-holds-early-gains-after-ppi-report-2017-02-14,Gold holds early gains after PPI report,1,0,0,0,1,0,positive,"['early', 'report', 'gains', 'ppi', 'gold holds']",Gold holds early gains after PPI report early report gains ppi gold holds,-1,-0.133722,0.10225618
09-04-2018,https://www.moneycontrol.com/news/business/rbi-followed-due-process-in-notifying-8020-gold-scheme-says-former-deputy-guv-hr-khan-2545571.html,"rbi followed due process in notifying 80:20 gold scheme, says former deputy guv hr khan",0,0,0,0,1,0,none,"['deputy guv hr', 'process notifying', '80 20', 'gold scheme says', 'rbi followed process']","rbi followed due process in notifying 80:20 gold scheme, says former deputy guv hr khan deputy guv hr process notifying 80 20 gold scheme says rbi followed process",-1,-0.122460686,0.0702611
05-01-2013,https://www.thehindubusinessline.com/markets/gold/Gold-silver-rebound-on-aggressive-buying/article20562203.ece,"Gold, silver rebound on aggressive buying",1,0,0,1,1,0,positive,"['aggressive', 'buying', 'rebound', 'aggressive buying', 'gold silver']","Gold, silver rebound on aggressive buying aggressive buying rebound aggressive buying gold silver",-1,-0.17013897,0.2089456
19-10-2015,http://www.marketwatch.com/story/dec-gold-loses-1030-or-09-to-settle-at-117280oz-on-comex-2015-10-19,"dec. gold loses $10.30, or 0.9%, to settle at $1,172.80/oz on comex",0,0,1,0,1,0,negative,"['settle', '172 80', 'loses 10 30', '80 oz comex', 'dec gold']","dec. gold loses $10.30, or 0.9%, to settle at $1,172.80/oz on comex settle 172 80 loses 10 30 80 oz comex dec gold",21,0.3831463,-0.011588208
05-09-2017,http://www.marketwatch.com/story/thisand-not-north-koreais-why-scared-investors-are-buying-gold-2017-09-05-17103011,This-and not North Korea-is why scared investors are buying gold,1,0,0,0,0,1,positive,"['north', 'gold', 'korea', 'scared investors', 'scared investors buying']",This-and not North Korea-is why scared investors are buying gold north gold korea scared investors scared investors buying,-1,-0.27629727,0.07071389
02-02-2015,https://www.moneycontrol.com/news/business/markets/gold-prices-rise-for-second-dayjewellers-buying-1287999.html,gold prices rise for second day on jewellers' buying,1,0,0,0,1,0,positive,"['second', 'rise second', 'day', 'jewellers buying', 'gold prices rise']",gold prices rise for second day on jewellers' buying second rise second day jewellers buying gold prices rise,-1,-0.04734891,0.11085864
03-01-2005,http://www.marketwatch.com/story/feb-gold-down-770-at-43070oz-in-ny-2005-01-03,feb gold down $7.70 at $430.70/oz in ny,0,0,1,0,1,0,negative,"['70 430 70', 'ny', 'oz', 'feb', 'gold']",feb gold down $7.70 at $430.70/oz in ny 70 430 70 ny oz feb gold,21,0.41772884,0.08494251
23-10-2018,https://www.moneycontrol.com/news/business/commodities/gold-nudges-up-as-asian-shares-edge-lower-3073471.html,Gold nudges up as Asian shares edge lower,1,0,0,0,1,0,positive,"['lower', 'nudges', 'gold', 'shares edge', 'asian shares']",Gold nudges up as Asian shares edge lower lower nudges gold shares edge asian shares,-1,-0.210913,0.09266634
17-07-2008,http://www.marketwatch.com/story/gold-futures-fall-tracking-tumble-in-oil-prices-2008-07-17,"gold futures fall, tracking tumble in oil prices",0,0,1,1,1,0,negative,"['fall tracking', 'gold', 'tracking tumble', 'futures', 'oil prices']","gold futures fall, tracking tumble in oil prices fall tracking gold tracking tumble futures oil prices",-1,-0.13581623,-0.25376758
06-12-2004,http://www.marketwatch.com/story/gold-prices-close-lower-on-dollar-strength-2004-12-06,gold prices dull on dollar strength,0,0,1,1,1,0,negative,"['strength', 'dollar', 'dull', 'prices dull', 'gold prices']",gold prices dull on dollar strength strength dollar dull prices dull gold prices,-1,-0.060099386,0.21387841
16-09-2011,https://www.moneycontrol.com/news/business/markets/-2108747.html,"gold falls 2% on central banks' action, euro hopes",0,0,1,0,1,0,negative,"['central', 'hopes', 'falls', 'gold', 'banks action euro']","gold falls 2% on central banks' action, euro hopes central hopes falls gold banks action euro",-1,-0.008819237,-0.008379899
06-11-2008,https://economictimes.indiatimes.com/articleshow/3678913.cms,gold sparkles again,1,0,0,0,1,0,positive,[],gold sparkles again ,-1,-0.10629738,0.13052645
21-08-2015,http://www.marketwatch.com/story/gold-climbs-to-six-and-a-half-week-high-2015-08-21,gold scores biggest weekly gain since january,1,0,0,0,1,0,positive,"['biggest', 'january', 'gold', 'scores', 'weekly gain']",gold scores biggest weekly gain since january biggest january gold scores weekly gain,-1,-0.020321354,0.09882245
13-10-2017,https://economictimes.indiatimes.com/markets/bonds/government-fixes-rate-at-rs-2987/gm-for-sovereign-gold-bond/articleshow/61072714.cms,government fixes rate at rs 2987/gm for sovereign gold bond,0,0,0,0,1,0,none,"['2987', 'government fixes', 'rate rs', 'gm sovereign', 'gold bond']",government fixes rate at rs 2987/gm for sovereign gold bond 2987 government fixes rate rs gm sovereign gold bond,-1,-0.08196691,0.10808844
05-10-2017,https://www.moneycontrol.com/news/business/stocks/gold-prices-to-trade-volatile-angel-commodities-2405523.html,gold prices to trade volatile: angel commodities,1,0,1,0,0,1,positive,"['angel', 'trade', 'volatile', 'commodities', 'gold prices']",gold prices to trade volatile: angel commodities angel trade volatile commodities gold prices,8,-0.08367049,0.12561
30-05-2018,https://www.metalsdaily.com/link/280056/when-will-gold-finally-return-to-a-bull-market.htm,when will gold finally return to a bull market?,0,0,0,0,0,1,none,"['finally', 'return', 'bull', 'market', 'gold finally return']",when will gold finally return to a bull market? finally return bull market gold finally return,-1,-0.093857676,-0.0042667165
07-12-2016,http://www.marketwatch.com/story/gold-appetite-hit-a-5-year-high-in-november-as-prices-tumbled-2016-12-06,Gold appetite hit a 5-year high in November as prices tumbled,1,0,0,0,1,0,positive,"['year high', 'appetite', 'gold', 'prices tumbled', 'november prices tumbled']",Gold appetite hit a 5-year high in November as prices tumbled year high appetite gold prices tumbled november prices tumbled,-1,-0.019357972,0.04789359
0200-04-16,http://www.marketwatch.com/story/june-gold-down-02-or-140-at-68850oz-in-ny-2007-04-16,"june gold down 0.2%, or $1.40, at $688.50/oz in ny",0,0,1,0,1,0,negative,"['40 688 50', 'ny', 'june', 'oz', 'gold']","june gold down 0.2%, or $1.40, at $688.50/oz in ny 40 688 50 ny june oz gold",21,0.44127893,0.08676905
08-02-2017,http://www.marketwatch.com/story/april-gold-climbs-340-or-03-to-settle-at-123950oz-2017-02-08,"April gold climbs $3.40, or 0.3%, to settle at $1,239.50/oz",1,0,0,0,1,0,positive,"['climbs', 'settle 239', '50 oz', 'gold', 'april']","April gold climbs $3.40, or 0.3%, to settle at $1,239.50/oz climbs settle 239 50 oz gold april",21,0.40285373,0.04793906
12-10-2016,https://www.moneycontrol.com/news/business/markets/gold-steadyeasing-dollar-fed-minutesfocus-957837.html,gold steady on easing dollar; fed minutes in focus,0,1,0,1,1,0,neutral,"['focus', 'minutes', 'gold', 'steady easing', 'easing dollar fed']",gold steady on easing dollar; fed minutes in focus focus minutes gold steady easing easing dollar fed,-1,-0.087675855,0.067324504
12-03-2018,https://www.moneycontrol.com/news/business/commodities/more-upside-seen-in-gold-prices-buy-futures-above-rs-30450-for-target-rs-30600-2525871.html,"More upside seen in gold prices; buy futures above Rs 30,450 for target Rs 30,600",1,0,0,0,1,0,positive,"['target rs', '30 450', 'prices buy', 'futures', 'upside seen gold']","More upside seen in gold prices; buy futures above Rs 30,450 for target Rs 30,600 target rs 30 450 prices buy futures upside seen gold",-1,-0.052993573,-0.2165328
29-10-2015,http://www.marketwatch.com/story/gold-slumps-over-1-in-wake-of-fed-meeting-2015-10-29,gold slumps over 1% in wake of fed meeting,0,0,1,0,1,0,negative,"['wake', 'meeting', 'slumps', 'gold', 'fed']",gold slumps over 1% in wake of fed meeting wake meeting slumps gold fed,-1,-0.08608464,-0.029007629
20-02-2018,https://www.metalsdaily.com/link/276958/singapore-firm-to-mint-islamic-cryptocurrency-backed-by-gold.htm,singapore firm to mint islamic cryptocurrency backed by gold,0,0,0,0,1,0,none,"['islamic', 'firm', 'mint', 'singapore', 'cryptocurrency backed gold']",singapore firm to mint islamic cryptocurrency backed by gold islamic firm mint singapore cryptocurrency backed gold,-1,-0.13960806,0.12784518
22-10-2010,http://www.marketwatch.com/story/gold-inches-down-ends-week-with-34-loss-2010-10-22,"gold inches down, ends week with 3.4% loss",0,0,1,0,1,0,negative,"['ends', 'inches', 'week', 'gold', 'week loss']","gold inches down, ends week with 3.4% loss ends inches week gold week loss",-1,0.08902992,-0.026361987
28-07-2005,http://www.marketwatch.com/story/dec-gold-climbs-280-to-43330oz-in-ny-2005-07-28,dec gold climbs $2.80 to $433.30/oz in ny,1,0,0,0,1,0,positive,"['433 30', 'ny', 'oz', 'climbs 80', 'dec gold']",dec gold climbs $2.80 to $433.30/oz in ny 433 30 ny oz climbs 80 dec gold,21,0.38449585,0.113336876
26-09-2017,http://www.marketwatch.com/story/gold-prices-settle-lower-after-two-session-gain-2017-09-26,Gold prices settle lower after two-session gain,0,0,1,0,1,0,negative,"['lower', 'session', 'gain', 'gold prices', 'prices settle lower']",Gold prices settle lower after two-session gain lower session gain gold prices prices settle lower,-1,0.051372632,-0.056141004
30-11-2016,http://www.marketwatch.com/story/gold-prices-sink-nearly-8-in-november-for-worst-monthly-loss-in-2016-2016-11-30,Gold prices sink nearly 8% in November for worst monthly loss in 2016,0,0,1,0,1,0,negative,"['2016', 'sink nearly', 'november worst', 'monthly loss', 'gold prices']",Gold prices sink nearly 8% in November for worst monthly loss in 2016 2016 sink nearly november worst monthly loss gold prices,-1,0.067004114,-0.0714668
17-10-2011,https://www.moneycontrol.com/news/business/markets/-2069331.html,"Gain seen in gold prices in Mumbai, Delhi market",1,0,0,0,1,0,positive,"['seen', 'gain', 'delhi', 'prices mumbai', 'gold prices']","Gain seen in gold prices in Mumbai, Delhi market seen gain delhi prices mumbai gold prices",-1,-0.11023678,0.14802113
08-10-2018,https://www.metalsdaily.com/link/284866/the-spxgold-ratio.htm,the spx/gold ratio,0,0,0,0,1,0,none,"['gold', 'ratio', 'spx', 'gold ratio', 'spx gold']",the spx/gold ratio gold ratio spx gold ratio spx gold,-1,-0.04611581,0.15056305
30-06-2017,http://www.marketwatch.com/story/gold-prices-end-the-session-lower-but-tally-a-gain-for-the-first-half-of-the-year-2017-06-30,"Gold prices end the session lower, but tally a gain for the first half of the year",1,0,1,0,1,0,positive,"['session lower', 'tally', 'gain', 'half year', 'gold prices end']","Gold prices end the session lower, but tally a gain for the first half of the year session lower tally gain half year gold prices end",-1,0.10014358,0.01460883
01-09-2017,http://www.marketwatch.com/story/dec-gold-gains-820-or-06-to-settle-at-133040oz-2017-09-01,"Dec. gold gains $8.20, or 0.6%, to settle at $1,330.40/oz",1,0,0,0,1,0,positive,"['settle', '330 40', 'oz', 'gains 20', 'dec gold']","Dec. gold gains $8.20, or 0.6%, to settle at $1,330.40/oz settle 330 40 oz gains 20 dec gold",21,0.4530437,0.013267525
27-08-2010,http://www.marketwatch.com/story/oil-trades-below-73-gold-reverses-after-bernanke-2010-08-27,"oil trades below $73, gold reverses after bernanke",0,1,0,1,1,0,neutral,"['73', 'gold', 'bernanke', 'reverses', 'oil trades']","oil trades below $73, gold reverses after bernanke 73 gold bernanke reverses oil trades",-1,-0.018879078,0.013180986
26-10-2017,http://www.marketwatch.com/story/gold-prices-log-lowest-settlement-since-early-august-2017-10-26,Gold prices log lowest settlement since early August,0,0,1,0,1,0,negative,"['early', 'august', 'settlement', 'log lowest', 'gold prices']",Gold prices log lowest settlement since early August early august settlement log lowest gold prices,-1,0.15773202,-0.11833395
03-09-2013,https://www.moneycontrol.com/news/business/stocks/-1619747.html,buy gold on dips; may test rs 33250: nirmal bang,0,0,0,0,1,0,none,"['33250', 'rs', 'nirmal', 'dips test', 'buy gold']",buy gold on dips; may test rs 33250: nirmal bang 33250 rs nirmal dips test buy gold,-1,-0.06279096,0.12751321
19-07-2017,http://www.marketwatch.com/story/golds-win-streak-at-risk-as-dollar-crawls-up-from-10-month-lows-2017-07-19,Gold extends its streak of gains to four sessions by a hair,1,0,0,0,1,0,positive,"['extends', 'sessions', 'hair', 'gold', 'extends streak gains']",Gold extends its streak of gains to four sessions by a hair extends sessions hair gold extends streak gains,-1,-0.10900635,0.14145507
21-12-2012,http://www.marketwatch.com/story/gold-silver-and-oil-markets-hope-for-better-year-2012-12-21,"gold, silver and oil markets hope for better year",0,0,0,1,0,1,none,"['better', 'year', 'hope better', 'oil markets', 'gold silver oil']","gold, silver and oil markets hope for better year better year hope better oil markets gold silver oil",-1,-0.21064413,0.061053164
26-08-2014,http://www.investing.com/news/commodities-news/gold-gains-as-dollar-rally-takes-a-breather-305690,gold gains as dollar rally takes a breather,1,0,0,1,1,0,positive,"['takes', 'breather', 'dollar', 'rally', 'gold gains dollar']",gold gains as dollar rally takes a breather takes breather dollar rally gold gains dollar,-1,-0.09250036,0.14759064
17-06-2015,"http://www.investing.com/news/commodities-news/gold-prices-up-in-asia-as-fed-holds-steady,-eyes-on-eurogroup-ahead-347100","Gold prices up in Asia as Fed holds steady, eyes on Eurogroup ahead",1,0,0,0,1,0,positive,"['ahead', 'eyes eurogroup', 'asia', 'fed holds steady', 'gold prices']","Gold prices up in Asia as Fed holds steady, eyes on Eurogroup ahead ahead eyes eurogroup asia fed holds steady gold prices",-1,-0.25058237,0.09323429
0200-09-16,http://www.marketwatch.com/story/spot-gold-quoted-at-40410-in-asia-2004-09-16,spot gold quoted at $404.10 in asia,1,0,0,0,1,0,positive,"['10', 'quoted', '404', 'asia', 'spot gold']",spot gold quoted at $404.10 in asia 10 quoted 404 asia spot gold,10,0.043640345,0.13316427
09-07-2011,https://economictimes.indiatimes.com/markets/commodities/gold-rises-to-rs-22570-silver-to-rs-54700-on-global-cues/articleshow/9162030.cms,"gold rises to rs 22,570, silver to rs 54,700 on global cues",1,0,0,1,1,0,positive,"['cues', 'rs 54', '700 global', '22 570 silver', 'gold rises']","gold rises to rs 22,570, silver to rs 54,700 on global cues cues rs 54 700 global 22 570 silver gold rises",-1,-0.09409757,0.14953059
12-08-2009,http://www.marketwatch.com/story/gold-slightly-lower-as-investors-await-fed-2009-08-12,gold slightly lower as investors await fed,0,0,1,0,1,0,negative,"['await', 'slightly', 'gold', 'lower investors', 'investors await fed']",gold slightly lower as investors await fed await slightly gold lower investors investors await fed,-1,-0.15021817,-0.058308125
26-10-2017,https://economictimes.indiatimes.com/markets/commodities/news/gold-trades-higher-as-dollar-eases-ahead-of-ecb-meeting/articleshow/61235513.cms,gold trades higher as dollar eases,1,0,0,1,1,0,positive,"['higher', 'trades', 'eases', 'gold', 'dollar eases']",gold trades higher as dollar eases higher trades eases gold dollar eases,-1,-0.10045874,0.15000108
29-08-2017,https://economictimes.indiatimes.com/markets/commodities/news/gold-climbs-to-9-5-month-high-on-rising-north-korea-tensions/articleshow/60269287.cms,gold climbs to 9.5 month high as north korea tensions escalate,1,0,0,0,1,0,positive,"['month', 'high north', 'tensions escalate', 'korea', 'gold climbs']",gold climbs to 9.5 month high as north korea tensions escalate month high north tensions escalate korea gold climbs,-1,-0.17074418,0.08055207
20-09-2017,http://www.investing.com/news/commodities-news/commodities--gold-prices-bounce-back-on-softer-dollar-ahead-of-fed-530809,commodities - gold prices bounce back on softer dollar ahead of fed,1,0,0,1,1,0,positive,"['bounce', 'softer', 'dollar ahead', 'fed', 'commodities gold prices']",commodities - gold prices bounce back on softer dollar ahead of fed bounce softer dollar ahead fed commodities gold prices,-1,-0.10496938,-0.0030646846
12-10-2015,http://www.marketwatch.com/story/gold-ends-higher-posts-best-settlement-price-since-july-2015-10-12,"gold ends higher, posts best settlement price since july",1,0,0,0,1,0,positive,"['best', 'july', 'higher posts', 'settlement price', 'gold ends']","gold ends higher, posts best settlement price since july best july higher posts settlement price gold ends",-1,0.040622666,-0.111403584
26-11-2018,https://www.moneycontrol.com/news/business/stocks/gold-prices-to-trade-higher-today-angel-commodities-31-3218701.html,Gold prices to trade higher today: Angel Commodities,1,0,0,0,0,1,positive,"['today', 'higher', 'angel', 'commodities', 'gold prices trade']",Gold prices to trade higher today: Angel Commodities today higher angel commodities gold prices trade,8,-0.09389867,0.14554653
18-02-2013,https://www.thehindubusinessline.com/markets/gold/Gold-futures-up-at-Rs-3022610-gm/article20579971.ece,"Gold futures up at Rs 30,226/10 gm",1,0,0,0,1,0,positive,"['10', 'gm', 'rs', '30 226 10', 'gold futures']","Gold futures up at Rs 30,226/10 gm 10 gm rs 30 226 10 gold futures",23,-0.011048272,-0.37011296
23-04-2018,http://www.marketwatch.com/story/gold-futures-settle-at-lowest-level-in-nearly-4-weeks-2018-04-23,correct: gold futures settle at lowest level in more than 4 weeks,0,0,1,0,1,0,negative,"['level', 'correct', 'weeks', 'correct gold futures', 'futures settle lowest']",correct: gold futures settle at lowest level in more than 4 weeks level correct weeks correct gold futures futures settle lowest,-1,-0.033560842,-0.42664456
20-09-2009,https://economictimes.indiatimes.com/articleshow/5033156.cms,"gold to hover around rs 16,000 this week",0,1,0,0,1,0,neutral,"['week', '000', 'hover', 'rs 16', 'gold']","gold to hover around rs 16,000 this week week 000 hover rs 16 gold",-1,0.047107935,0.04060636
0200-03-15,http://www.marketwatch.com/story/gold-futures-up-over-3-an-ounce-in-afternoon-dealings-2006-03-15,gold futures up over $3 an ounce in afternoon dealings,1,0,0,0,1,0,positive,"['dealings', 'afternoon', 'ounce', 'gold', 'futures']",gold futures up over $3 an ounce in afternoon dealings dealings afternoon ounce gold futures,-1,0.16466852,-0.3514455
10-03-2017,http://www.marketwatch.com/story/gold-prices-down-9-sessions-lose-2-for-the-week-2017-03-10,"gold prices down 9 sessions, lose 2% for the week",0,0,1,0,1,0,negative,"['sessions', 'lose', 'week', 'prices sessions', 'gold prices']","gold prices down 9 sessions, lose 2% for the week sessions lose week prices sessions gold prices",-1,0.0708998,-0.0658962
27-01-2010,http://www.marketwatch.com/story/feb-gold-rises-340-to-108790oz-on-globex-2010-01-27,"feb. gold rises $3.40 to $1,087.90/oz on globex",1,0,0,0,1,0,positive,"['40 087 90', 'rises', 'feb', 'globex', '90 oz']","feb. gold rises $3.40 to $1,087.90/oz on globex 40 087 90 rises feb globex 90 oz",-1,0.35537034,0.15970881
28-04-2014,http://www.marketwatch.com/story/gold-rises-into-week-of-heavy-earnings-data-2014-04-28,"gold settles back under $1,300 an ounce",0,0,1,0,1,0,negative,"['300', 'settles', 'gold', 'ounce', 'gold settles']","gold settles back under $1,300 an ounce 300 settles gold ounce gold settles",-1,0.37919545,0.0034833625
25-01-2005,http://www.marketwatch.com/story/philly-gold-and-silver-index-falls-27-to-end-at-9176-2005-01-25,philly gold and silver index falls 2.7% to end at 91.76,0,0,1,1,1,0,negative,"['falls', 'index', 'end 91 76', 'philly', 'gold silver']",philly gold and silver index falls 2.7% to end at 91.76 falls index end 91 76 philly gold silver,7,0.03493063,0.021792822
10-04-2014,http://www.investing.com/news/commodities-news/gold-extends-gains-as-fed-minutes-reveal-weak-pricing-concerns-276998,Gold extends gains as Fed minutes reveal weak pricing concerns,1,0,0,0,1,0,positive,"['extends', 'reveal weak', 'pricing concerns', 'fed minutes', 'gold extends gains']",Gold extends gains as Fed minutes reveal weak pricing concerns extends reveal weak pricing concerns fed minutes gold extends gains,-1,-0.16944149,0.03265361
06-01-2012,http://www.marketwatch.com/story/oil-turns-lower-gold-holds-gain-after-jobs-2012-01-06,"oil turns lower, gold holds gain after jobs",1,0,0,1,1,0,positive,"['holds', 'turns', 'gain jobs', 'lower gold', 'oil turns lower']","oil turns lower, gold holds gain after jobs holds turns gain jobs lower gold oil turns lower",-1,-0.19021155,0.09638612
23-11-2016,http://www.marketwatch.com/story/dec-gold-at-119030oz-in-electronic-trading-up-from-118930-settlement-2016-11-23,"Dec. gold at $1,190.30/oz in electronic trading, up from $1,189.30 settlement",1,0,0,0,1,0,positive,"['190 30', 'oz electronic', 'gold', '189 30 settlement', 'electronic trading']","Dec. gold at $1,190.30/oz in electronic trading, up from $1,189.30 settlement 190 30 oz electronic gold 189 30 settlement electronic trading",21,0.30660504,0.018936351
01-06-2012,http://www.marketwatch.com/story/aug-gold-up-58-at-162220-after-162320-high-2012-06-01,"aug. gold up $58 at $1,622.20 after $1,623.20 high",1,0,0,0,1,0,positive,"['aug', 'high', 'gold', '20 623 20', '58 622']","aug. gold up $58 at $1,622.20 after $1,623.20 high aug high gold 20 623 20 58 622",-1,0.28201383,0.1048751
01-09-2016,http://www.marketwatch.com/story/dec-gold-gains-3-or-02-to-131440oz-2016-09-01,"Dec. gold gains $3, or 0.2%, to $1,314.40/oz",1,0,0,0,1,0,positive,"['dec', '314 40', 'oz', 'gains', 'gold']","Dec. gold gains $3, or 0.2%, to $1,314.40/oz dec 314 40 oz gains gold",21,0.35942727,0.14655758
09-04-2012,https://economictimes.indiatimes.com/markets/commodities/gold-silver-rise-on-wedding-season-demand/articleshow/12596614.cms,"gold, silver rise on wedding season demand",1,0,0,1,1,0,positive,"['rise', 'season', 'demand', 'wedding', 'gold silver']","gold, silver rise on wedding season demand rise season demand wedding gold silver",-1,-0.058021642,0.11254931
02-11-2004,http://www.marketwatch.com/story/dec-gold-closes-at-42080oz-down-740-2004-11-02,"dec gold closes at $420.80/oz, down $7.40",0,0,1,0,1,0,negative,"['420', 'dec', 'closes', 'gold', '80 oz 40']","dec gold closes at $420.80/oz, down $7.40 420 dec closes gold 80 oz 40",21,0.41250026,-0.035761043
12-08-2005,http://www.marketwatch.com/story/philadelphia-goldsilver-index-ends-at-9996-up-05-on-day-2005-08-12,"philadelphia gold/silver index ends at 99.96, up 0.5% on day",1,0,0,1,1,0,positive,"['ends', '99 96 day', 'index', 'philadelphia', 'gold silver']","philadelphia gold/silver index ends at 99.96, up 0.5% on day ends 99 96 day index philadelphia gold silver",7,0.11384709,-0.006714672
19-09-2016,http://www.marketwatch.com/story/dec-gold-settles-at-131780oz-up-760-or-06-2016-09-19,"Dec. gold settles at $1,317.80/oz, up $7.60, or 0.6%",1,0,0,0,1,0,positive,"['dec', '317 80', '60', 'oz', 'gold settles']","Dec. gold settles at $1,317.80/oz, up $7.60, or 0.6% dec 317 80 60 oz gold settles",21,0.5189159,0.013002843
20-07-2010,http://www.marketwatch.com/story/gold-ends-floor-trade-up-98-at-11917-an-ounce-2010-07-20,gold ends floor trade up $9.8 at $1191.7 an ounce,1,0,0,0,1,0,positive,"['1191', 'floor', 'trade', 'ounce', 'gold ends']",gold ends floor trade up $9.8 at $1191.7 an ounce 1191 floor trade ounce gold ends,-1,0.33110863,0.0628757
30-08-2017,https://economictimes.indiatimes.com/markets/commodities/news/gold-plunges-rs-350-on-weak-global-cues-low-local-demand/articleshow/60291789.cms,"gold plunges rs 350 on weak global cues, low local demand",0,0,1,0,1,0,negative,"['350', 'weak global cues', 'gold', 'plunges rs', 'low local demand']","gold plunges rs 350 on weak global cues, low local demand 350 weak global cues gold plunges rs low local demand",-1,-0.15913168,0.0899528
24-10-2012,http://www.marketwatch.com/story/gold-futures-trade-near-sessions-low-of-170120-2012-10-24,"gold futures trade near session's low of $1,701.20",0,0,1,0,1,0,negative,"['near', '701 20', 'gold', 'session low', 'futures trade']","gold futures trade near session's low of $1,701.20 near 701 20 gold session low futures trade",-1,0.121885315,-0.3830688
16-06-2018,https://www.moneycontrol.com/news/business/markets/love-for-yellow-metal-we-need-of-spot-gold-exchanges-in-the-country-2597271.html,love for yellow metal? we need of spot gold exchanges in the country,0,0,0,0,1,0,none,"['spot', 'country', 'exchanges', 'love yellow', 'metal need']",love for yellow metal? we need of spot gold exchanges in the country spot country exchanges love yellow metal need,-1,-0.13595834,0.12296732
09-10-2018,https://www.metalsdaily.com/link/284843/charts-gold-bearish-bias-while-price-contained-below-$1215.htm,charts : gold: bearish bias while price contained below $1215,0,0,1,0,1,0,negative,"['contained', 'bearish', '1215', 'charts', 'bias price']",charts : gold: bearish bias while price contained below $1215 contained bearish 1215 charts bias price,-1,0.021550372,0.09524906
04-05-2017,http://www.marketwatch.com/story/gold-holds-lower-after-jobless-claims-report-other-data-2017-05-04,"Gold holds lower after jobless-claims report, other data",0,0,1,0,1,0,negative,"['lower', 'jobless', 'report data', 'gold holds', 'lower jobless claims']","Gold holds lower after jobless-claims report, other data lower jobless report data gold holds lower jobless claims",-1,-0.12880535,0.16261345
11-03-2009,http://www.marketwatch.com/story/gold-futures-rise-above-900-dollar,gold futures rise above $900 as dollar falls,1,0,0,1,1,0,positive,"['rise', 'falls', '900', 'dollar', 'gold futures']",gold futures rise above $900 as dollar falls rise falls 900 dollar gold futures,-1,0.004628107,-0.36943677
16-11-2018,https://www.metalsdaily.com/link/287021/5-signs-before-gold-takes-off.htm,5 signs before gold takes off,0,0,0,0,0,1,none,"['takes', 'signs', 'gold', 'gold takes', 'signs gold']",5 signs before gold takes off takes signs gold gold takes signs gold,-1,-0.06931851,0.17381898
10-07-2017,https://www.thehindubusinessline.com/markets/gold/gold-plunges-to-rs-28780-silver-slumps-below-rs-37000mark/article9757692.ece,"Gold plunges to Rs 28,780; silver slumps below Rs 37,000-mark",0,0,1,1,1,0,negative,"['28 780', '37 000 mark', 'slumps', 'silver', 'plunges rs']","Gold plunges to Rs 28,780; silver slumps below Rs 37,000-mark 28 780 37 000 mark slumps silver plunges rs",-1,0.019982323,0.13289571
04-03-2009,http://www.marketwatch.com/story/gold-stays-lower-after-feds-beige,gold stays lower after fed's beige book,0,0,1,0,1,0,negative,"['stays', 'book', 'beige', 'lower fed', 'gold stays lower']",gold stays lower after fed's beige book stays book beige lower fed gold stays lower,-1,-0.06845976,0.054474562
28-12-2016,http://www.marketwatch.com/story/gold-futures-try-for-two-week-highs-even-as-dollar-gains-2016-12-28,Gold futures score two-week highs even as dollar extends climb,1,0,0,1,1,0,positive,"['score', 'week', 'extends climb', 'highs dollar', 'gold futures']",Gold futures score two-week highs even as dollar extends climb score week extends climb highs dollar gold futures,-1,-0.13282952,-0.31146067
22-11-2004,http://www.marketwatch.com/story/gold-prices-edge-closer-to-450-2004-11-22,gold prices edge closer to $450,1,0,0,0,1,0,positive,"['closer', 'edge', 'prices', '450', 'gold prices']",gold prices edge closer to $450 closer edge prices 450 gold prices,-1,0.07735743,-0.051499575
25-05-2018,https://www.moneycontrol.com/news/business/commodity-outlook-oil-prices-likely-to-trend-lower-key-support-for-gold-around-rs-31300-silver-at-rs-40600-2575735.html,"Commodity outlook: Oil prices likely to trend lower; key support for gold around Rs 31,300, silver at Rs 40,600",0,0,1,1,1,0,negative,"['likely trend lower', '31 300 silver', 'key support gold', 'commodity outlook', 'oil prices']","Commodity outlook: Oil prices likely to trend lower; key support for gold around Rs 31,300, silver at Rs 40,600 likely trend lower 31 300 silver key support gold commodity outlook oil prices",-1,-0.1057359,0.018381938
25-09-2012,https://www.moneycontrol.com/news/business/markets/-1942859.html,mcx goldpetal oct contract up marginally,1,0,0,0,1,0,positive,"['marginally', 'oct', 'goldpetal', 'mcx', 'contract marginally']",mcx goldpetal oct contract up marginally marginally oct goldpetal mcx contract marginally,1,-0.039925747,-0.1105873
08-05-2018,http://www.marketwatch.com/story/gold-prices-move-slightly-higher-as-us-stocks-trade-broadly-lower-2018-05-08,gold prices move slightly higher as u.s. stocks trade broadly lower,1,0,0,0,1,0,positive,"['trade', 'broadly', 'slightly higher', 'stocks', 'gold prices']",gold prices move slightly higher as u.s. stocks trade broadly lower trade broadly slightly higher stocks gold prices,-1,-0.14134261,0.09485645
06-10-2009,http://www.marketwatch.com/story/gold-etf-rises-to-all-time-high-2009-10-06,gold etf rises to all-time high,1,0,0,0,1,0,positive,"['time', 'high', 'rises time high', 'etf', 'gold etf']",gold etf rises to all-time high time high rises time high etf gold etf,-1,-0.25029173,-0.0012853369
03-01-2013,http://www.marketwatch.com/story/fed-minutes-weigh-on-stocks-gold-while-boosting-treasurys-dollar-2013-01-03,"fed minutes weigh on stocks, gold while boosting treasurys, dollar",0,0,1,1,1,0,negative,"['minutes', 'gold', 'boosting', 'weigh stocks', 'treasurys dollar']","fed minutes weigh on stocks, gold while boosting treasurys, dollar minutes gold boosting weigh stocks treasurys dollar",-1,-0.169978,0.11070387
27-11-2018,https://www.metalsdaily.com/link/287272/gold-prices-may-fall-as-fed-commentary-boosts-the-us-dollar.htm,gold prices may fall as fed commentary boosts the us dollar,0,0,1,1,1,0,negative,"['boosts', 'commentary', 'fall', 'prices fall fed', 'gold prices']",gold prices may fall as fed commentary boosts the us dollar boosts commentary fall prices fall fed gold prices,-1,-0.11033589,0.078559
23-10-2018,https://www.moneycontrol.com/news/business/commodities/gold-goes-up-rs-86-on-positive-global-cues-3074361.html,Gold goes up Rs 86 on positive global cues,1,0,0,0,1,0,positive,"['rs', 'cues', '86', 'positive global', 'gold goes']",Gold goes up Rs 86 on positive global cues rs cues 86 positive global gold goes,-1,-0.1412404,0.20087695
01-06-2017,http://www.marketwatch.com/story/gold-pulls-back-as-private-sector-hiring-data-up-prospects-for-higher-interest-rates-2017-06-01,Gold pulls back as private-sector hiring data up prospects for higher interest rates,1,0,0,0,1,0,positive,"['data', 'rates', 'prospects higher', 'gold pulls private', 'private sector hiring']",Gold pulls back as private-sector hiring data up prospects for higher interest rates data rates prospects higher gold pulls private private sector hiring,-1,-0.24685931,0.16544443
20-06-2014,"http://www.investing.com/news/commodities-news/gold-holds-onto-gains-from-iraq-concerns,-fed-language-290785","Gold holds onto gains from Iraq concerns, Fed language",1,0,0,0,1,0,positive,"['language', 'gains', 'concerns fed', 'iraq concerns', 'gold holds']","Gold holds onto gains from Iraq concerns, Fed language language gains concerns fed iraq concerns gold holds",-1,-0.22681966,0.13650945
21-09-2005,http://www.marketwatch.com/story/dec-gold-closes-at-47320-highest-since-late-1987-2005-09-21,"dec gold closes at $473.20, highest since late 1987",1,0,0,0,1,0,positive,"['473 20', 'late 1987', 'highest', 'dec', 'gold closes']","dec gold closes at $473.20, highest since late 1987 473 20 late 1987 highest dec gold closes",-1,0.18725513,-0.076839775
10-11-2018,https://www.moneycontrol.com/news/business/markets/gold-prices-soften-on-lacklustre-demand-global-cues-3146281.html,"Gold prices soften on lacklustre demand, global cues",0,0,1,0,1,0,negative,"['cues', 'soften', 'lacklustre', 'demand global', 'gold prices']","Gold prices soften on lacklustre demand, global cues cues soften lacklustre demand global gold prices",-1,-0.1511224,0.16546059
13-04-2018,https://www.metalsdaily.com/link/278563/us-mint-sales-of-us-mint-american-eagle-gold-silver-coins-fall-in-march.htm,"us mint : sales of us mint american eagle gold, silver coins fall in march",0,0,0,1,1,0,none,"['silver', 'march', 'american eagle gold', 'coins fall', 'mint sales']","us mint : sales of us mint american eagle gold, silver coins fall in march silver march american eagle gold coins fall mint sales",-1,0.10873778,0.22743121
07-08-2015,http://www.marketwatch.com/story/gold-rebounds-from-jobs-inspired-slide-2015-08-07,gold rebounds from jobs-inspired slide,1,0,0,0,1,0,positive,"['inspired', 'jobs', 'rebounds jobs', 'slide', 'gold rebounds']",gold rebounds from jobs-inspired slide inspired jobs rebounds jobs slide gold rebounds,-1,-0.21198505,0.19792284
23-10-2008,http://www.marketwatch.com/story/golds-recent-slump-bewilders-investors-2008-10-23,gold's recent slump bewilders investors,0,0,1,0,1,0,negative,"['recent', 'bewilders', 'slump', 'gold', 'investors']",gold's recent slump bewilders investors recent bewilders slump gold investors,-1,-0.16009092,0.029836357
03-11-2016,http://www.marketwatch.com/story/dec-gold-loses-490-or-04-to-settle-at-130330oz-2016-11-03,"Dec. gold loses $4.90, or 0.4%, to settle at $1,303.30/oz",0,0,1,0,1,0,negative,"['dec', 'settle', '303 30', 'oz', 'gold loses 90']","Dec. gold loses $4.90, or 0.4%, to settle at $1,303.30/oz dec settle 303 30 oz gold loses 90",21,0.45011866,-0.007446021
14-11-2017,https://www.metalsdaily.com/link/273896/gold-prices-look-to-fate-of-us-tax-cuts-for-direction-yellen-to-speak.htm,"gold prices look to fate of us tax cuts for direction, yellen to speak",0,0,0,0,1,0,none,"['fate tax', 'yellen speak', 'cuts direction', 'prices look', 'gold prices']","gold prices look to fate of us tax cuts for direction, yellen to speak fate tax yellen speak cuts direction prices look gold prices",-1,-0.14896242,-0.0043535978
22-10-2010,http://www.marketwatch.com/story/canadian-stocks-eke-out-gains-2010-10-22,canadian stocks eke out gains as gold miners rebound,0,0,0,0,1,0,none,"['miners', 'canadian', 'rebound', 'stocks eke', 'gains gold']",canadian stocks eke out gains as gold miners rebound miners canadian rebound stocks eke gains gold,-1,-0.23395044,0.15081011
22-09-2017,https://economictimes.indiatimes.com/markets/commodities/news/gold-rate-per-gram-check-out-current-gold-price-per-gram/articleshow/60790666.cms,gold rate per gram: check out current gold price per gram,0,0,0,0,1,0,none,"['check current', 'check', 'price', 'rate gram', 'gold price']",gold rate per gram: check out current gold price per gram check current check price rate gram gold price,-1,0.054132685,0.16242072
12-07-2018,https://www.moneycontrol.com/news/business/personal-finance/gold-prices-under-pressure-heres-what-investors-should-do-2701781.html,Gold prices under pressure; here's what investors should do,0,0,1,0,1,0,negative,"['pressure', 'prices', 'gold', 'investors', 'gold prices pressure']",Gold prices under pressure; here's what investors should do pressure prices gold investors gold prices pressure,-1,-0.13668609,0.1262295
11-07-2018,http://www.investing.com/news/commodities-news/gold-prices-fall-on-firmer-dollar-1524809,gold prices fall on firmer dollar,0,0,1,1,1,0,negative,"['fall', 'firmer', 'gold', 'prices fall', 'gold prices']",gold prices fall on firmer dollar fall firmer gold prices fall gold prices,14,-0.035313472,0.10723546
29-12-2011,https://www.moneycontrol.com/news/business/markets/-1103623.html,india gold demand improves slightly after prices drop,0,0,1,0,1,0,negative,"['slightly', 'improves', 'india', 'prices drop', 'gold demand']",india gold demand improves slightly after prices drop slightly improves india prices drop gold demand,-1,-0.14862706,0.18015349
27-12-2017,http://www.marketwatch.com/story/gold-settles-higher-amid-broad-commodity-rally-2017-12-27,gold settles higher amid broad commodity rally,1,0,0,1,1,0,positive,"['broad', 'higher amid', 'rally', 'commodity', 'gold settles higher']",gold settles higher amid broad commodity rally broad higher amid rally commodity gold settles higher,-1,-0.12489207,0.03348153
05-07-2016,http://www.marketwatch.com/story/silver-extends-rally-gold-tags-along-as-stocks-sink-2016-07-05,"silver, gold rally to highest level since 2014",1,0,0,1,1,0,positive,"['2014', 'level', 'highest', 'rally', 'silver gold']","silver, gold rally to highest level since 2014 2014 level highest rally silver gold",-1,-0.14842561,0.14539877
14-06-2018,https://www.metalsdaily.com/link/280502/gold-pushes-above-$1-300-as-dollar-eases-ahead-of-ecb-policy-update.htm,"gold pushes above $1,300 as dollar eases ahead of ecb policy update",1,0,0,1,1,0,positive,"['gold', 'pushes 300', 'policy update', 'dollar eases', 'ahead ecb']","gold pushes above $1,300 as dollar eases ahead of ecb policy update gold pushes 300 policy update dollar eases ahead ecb",-1,0.06882551,0.08341552
16-11-2016,https://economictimes.indiatimes.com/markets/commodities/news/gold-wipes-off-losses-trading-marginally-higher-in-early-trade/articleshow/55451075.cms,"gold wipes off losses, trading marginally higher in early trade",0,0,1,0,1,0,negative,"['wipes', 'trade', 'higher early', 'gold', 'losses trading marginally']","gold wipes off losses, trading marginally higher in early trade wipes trade higher early gold losses trading marginally",-1,-0.15800871,-0.0010108054
29-08-2013,http://www.marketwatch.com/story/is-gold-about-to-make-a-run-to-new-highs-2013-08-29,is gold about to make a run to new highs?,0,0,0,0,0,1,none,"['make', 'new', 'make run new', 'highs', 'gold']",is gold about to make a run to new highs? make new make run new highs gold,-1,-0.15824157,0.077867985
09-04-2014,http://www.marketwatch.com/story/june-gold-down-320-or-02-to-end-at-130590oz-2014-04-09,"june gold down $3.20, or 0.2%, to end at $1,305.90/oz",0,0,1,0,1,0,negative,"['end', '305 90', 'june', '90 oz', 'gold']","june gold down $3.20, or 0.2%, to end at $1,305.90/oz end 305 90 june 90 oz gold",21,0.45289135,0.034234434
08-03-2010,http://www.marketwatch.com/story/april-gold-falls-20-cents-to-112380oz-on-globe-2010-03-08,"april gold falls 20 cents to $1,123.80/oz on globe",0,0,1,0,1,0,negative,"['globe', '123 80 oz', 'falls 20', 'april', 'cents']","april gold falls 20 cents to $1,123.80/oz on globe globe 123 80 oz falls 20 april cents",-1,0.3839062,0.11804061
07-03-2018,http://www.marketwatch.com/story/gold-slips-as-dollar-gains-gives-up-initial-cohn-exit-boost-2018-03-07,"gold settles lower, extends loss after fed beige book",0,0,1,0,1,0,negative,"['book', 'lower extends', 'beige', 'extends loss fed', 'gold settles']","gold settles lower, extends loss after fed beige book book lower extends beige extends loss fed gold settles",-1,-0.032361202,-0.004846111
21-08-2011,https://www.thehindubusinessline.com/markets/commodities/gold-import-may-cross-1000-tonne-mark-this-year-analysts/article20325642.ece1,"Gold import may cross 1,000-tonne mark this year: Analysts",0,0,0,0,1,0,none,"['000', 'tonne', 'mark year', 'analysts', 'import cross']","Gold import may cross 1,000-tonne mark this year: Analysts 000 tonne mark year analysts import cross",-1,-0.100952856,0.092974864
20-08-2015,http://www.marketwatch.com/story/gold-futures-log-highest-settlement-since-mid-july-on-comex-2015-08-20,gold futures log highest settlement since mid-july on comex,1,0,0,0,1,0,positive,"['gold', 'mid july', 'comex', 'futures log', 'highest settlement']",gold futures log highest settlement since mid-july on comex gold mid july comex futures log highest settlement,24,-0.016361713,-0.41032314
15-12-2004,http://www.marketwatch.com/story/gold-climbs-to-one-week-high-2004-12-15,gold climbs to one-week high,1,0,0,0,1,0,positive,"['high', 'week', 'gold', 'climbs week', 'gold climbs']",gold climbs to one-week high high week gold climbs week gold climbs,-1,-0.080215976,0.0041051432
02-06-2017,http://www.marketwatch.com/story/august-gold-edges-slightly-higher-at-127150oz-up-01-2017-06-02,"August gold edges slightly higher at $1,271.50/oz, up 0.1%",1,0,0,0,1,0,positive,"['slightly', '271 50', '50 oz', 'edges slightly higher', 'august gold']","August gold edges slightly higher at $1,271.50/oz, up 0.1% slightly 271 50 50 oz edges slightly higher august gold",-1,0.34665436,0.17627138
16-02-2018,https://www.moneycontrol.com/news/business/commodities/commoditiesmoneycontrol-gold-prices-near-highest-since-august-2016-2509629.html,Commodities@Moneycontrol: Gold prices near highest since August 2016,1,0,0,0,1,0,positive,"['2016', 'highest august', 'moneycontrol', 'commodities', 'gold prices near']",Commodities@Moneycontrol: Gold prices near highest since August 2016 2016 highest august moneycontrol commodities gold prices near,-1,0.031640813,-0.049705625
17-08-2007,https://economictimes.indiatimes.com/articleshow/2286645.cms,"gold shines, silver fades",1,0,0,1,1,0,positive,"['gold', 'fades', 'shines', 'silver', 'silver fades']","gold shines, silver fades gold fades shines silver silver fades",-1,-0.13663577,0.17590365
23-09-2008,http://www.marketwatch.com/story/gold-futures-end-lower-as-us-dollar-rises-vs-rivals-2008-09-23,"gold futures end lower, as u.s. dollar rises vs. rivals",0,0,1,1,1,0,negative,"['lower', 'end', 'rivals', 'dollar rises vs', 'gold futures']","gold futures end lower, as u.s. dollar rises vs. rivals lower end rivals dollar rises vs gold futures",-1,-0.07715598,-0.29776126
06-12-2017,https://economictimes.indiatimes.com/markets/commodities/news/gold-rate-today-gold-trades-lower-in-morning-deals-silver-up/articleshow/61943247.cms,gold rate today: gold trades lower in morning deals; silver up,0,0,1,1,1,0,negative,"['morning', 'deals', 'silver', 'rate today', 'gold trades lower']",gold rate today: gold trades lower in morning deals; silver up morning deals silver rate today gold trades lower,8,-0.026953861,-0.007864088
22-10-2011,https://www.thehindubusinessline.com/markets/gold/Gold-silver-spurt-on-festive-offtake-global-cues/article20351877.ece,"Gold, silver spurt on festive offtake, global cues",1,0,0,1,1,0,positive,"['festive', 'spurt', 'offtake global', 'global cues', 'gold silver']","Gold, silver spurt on festive offtake, global cues festive spurt offtake global global cues gold silver",-1,-0.19250758,0.10813953
16-11-2016,http://www.investing.com/news/commodities-news/gold-prices-gain-in-asia-as-support-continues-despite-fed-hike-views-441604,gold prices gain in asia as support continues despite fed hike views,1,0,0,0,1,0,positive,"['hike views', 'gain', 'continues despite fed', 'asia', 'gold prices']",gold prices gain in asia as support continues despite fed hike views hike views gain continues despite fed asia gold prices,-1,-0.25927317,0.12252838
15-10-2010,http://www.marketwatch.com/story/gold-oil-hold-on-to-losses-after-consumer-data-2010-10-15,"gold, oil hold on to losses after consumer data",0,0,1,1,1,0,negative,"['hold', 'data', 'consumer', 'gold oil', 'oil hold losses']","gold, oil hold on to losses after consumer data hold data consumer gold oil oil hold losses",-1,-0.21174015,0.11135399
07-10-2016,http://www.marketwatch.com/story/december-gold-rises-1-at-126510-2016-10-07,"December gold rises 1% at $1,265.10",1,0,0,0,1,0,positive,"['10', '265', 'rises', 'gold', 'december']","December gold rises 1% at $1,265.10 10 265 rises gold december",21,0.23489268,0.109105244
26-08-2016,http://www.marketwatch.com/story/dec-gold-gains-130-or-01-for-the-session-to-finish-at-132590oz-2016-08-26,"Dec. gold gains $1.30, or 0.1%, for the session to finish at $1,325.90/oz",1,0,0,0,1,0,positive,"['session finish', '325 90', 'oz', 'gains 30', 'dec gold']","Dec. gold gains $1.30, or 0.1%, for the session to finish at $1,325.90/oz session finish 325 90 oz gains 30 dec gold",-1,0.42972964,0.012589179
27-10-2011,https://economictimes.indiatimes.com/markets/commodities/gold-climbs-as-europe-woes-spur-demand/articleshow/10504611.cms,gold climbs as europe woes spur demand,1,0,0,0,1,0,positive,"['woes', 'spur', 'europe', 'demand', 'gold climbs']",gold climbs as europe woes spur demand woes spur europe demand gold climbs,-1,-0.22314264,0.14142781
13-08-2013,https://www.moneycontrol.com/news/business/economy/-1599269.html,"changes in duties on gold, silver to be announced today",0,0,0,1,1,0,none,"['today', 'duties', 'announced', 'changes duties', 'gold silver']","changes in duties on gold, silver to be announced today today duties announced changes duties gold silver",-1,-0.17816868,0.08373957
13-09-2009,https://economictimes.indiatimes.com/articleshow/5004674.cms,gold gains on investment buying,1,0,0,0,1,0,positive,"['buying', 'gold', 'gains', 'investment buying', 'gold gains investment']",gold gains on investment buying buying gold gains investment buying gold gains investment,-1,-0.21988924,0.1371492
02-08-2013,http://www.marketwatch.com/story/gold-where-to-draw-the-line-in-the-sand-after-jobs-data-2013-08-02,gold: where to draw the line in the sand after jobs data,0,0,0,0,1,0,none,"['draw', 'line', 'gold', 'jobs data', 'sand jobs data']",gold: where to draw the line in the sand after jobs data draw line gold jobs data sand jobs data,-1,-0.2149446,0.04287211
03-07-2007,http://www.marketwatch.com/story/august-gold-closes-at-65540oz-down-380-in-ny-2007-07-03,"august gold closes at $655.40/oz, down $3.80 in ny",0,0,1,0,1,0,negative,"['655', 'ny', 'closes', '40 oz', 'august gold']","august gold closes at $655.40/oz, down $3.80 in ny 655 ny closes 40 oz august gold",21,0.41016847,0.03575419
01-09-2016,http://www.marketwatch.com/story/december-gold-down-490-or-04-at-130650oz-2016-09-01,"December gold down $4.90, or 0.4%, at $1,306.50/oz.",0,0,1,0,1,0,negative,"['90 306 50', '306 50', 'oz', 'december', 'gold']","December gold down $4.90, or 0.4%, at $1,306.50/oz. 90 306 50 306 50 oz december gold",21,0.46466684,0.043457508
03-11-2016,http://www.marketwatch.com/story/gold-drops-below-1300-as-stocks-stabilize-2016-11-03,"Gold futures suffer first loss in 3 sessions, but keep grip on $1,300",0,0,1,0,1,0,negative,"['suffer', 'grip', '300', 'loss sessions', 'gold futures']","Gold futures suffer first loss in 3 sessions, but keep grip on $1,300 suffer grip 300 loss sessions gold futures",-1,-0.024609998,-0.4117074
23-02-2017,http://www.marketwatch.com/story/gold-snaps-losing-streak-as-fed-rate-hike-speed-gets-a-rethink-2017-02-23,Gold ends at 3-month high as dollar wobbles,1,0,0,1,1,0,positive,"['high', 'wobbles', 'ends month', 'dollar', 'gold ends month']",Gold ends at 3-month high as dollar wobbles high wobbles ends month dollar gold ends month,-1,0.055643752,0.036653757
03-03-2016,https://www.thehindubusinessline.com/markets/gold/third-tranche-of-gold-bond-scheme-coming-soon-shaktikanta-das/article8309535.ece,Third tranche of gold bond scheme coming soon: Shaktikanta Das,0,0,0,0,1,0,none,"['soon', 'tranche', 'gold', 'shaktikanta das', 'bond scheme']",Third tranche of gold bond scheme coming soon: Shaktikanta Das soon tranche gold shaktikanta das bond scheme,-1,-0.28001153,0.015441656
01-11-2006,http://www.marketwatch.com/story/dec-gold-up-1250-or-21-to-close-at-61930oz-2006-11-01,"dec. gold up $12.50, or 2.1%, to close at $619.30/oz",1,0,0,0,1,0,positive,"['619', 'dec', '50 close', 'oz', 'gold']","dec. gold up $12.50, or 2.1%, to close at $619.30/oz 619 dec 50 close oz gold",21,0.47235477,-0.0081665665
14-11-2017,http://www.marketwatch.com/story/dec-gold-climbs-4-or-03-to-settle-at-128290oz-2017-11-14,"Dec. gold climbs $4, or 0.3%, to settle at $1,282.90/oz",1,0,0,0,1,0,positive,"['dec', 'settle', '282 90', '90 oz', 'gold climbs']","Dec. gold climbs $4, or 0.3%, to settle at $1,282.90/oz dec settle 282 90 90 oz gold climbs",21,0.42550278,0.0007669553
25-02-2010,http://www.marketwatch.com/story/australian-shares-edge-up-boosted-by-gold-miners-2010-02-25,"australian shares edge up, boosted by gold miners",1,0,0,0,1,0,positive,"['boosted', 'australian', 'edge', 'shares', 'gold miners']","australian shares edge up, boosted by gold miners boosted australian edge shares gold miners",-1,-0.22186594,0.108828396
19-02-2013,https://economictimes.indiatimes.com/markets/commodities/the-shining-truth-gold-price-isnt-made-in-india/articleshow/18567581.cms,the shining truth: gold price isn't made in india,0,0,0,0,1,0,none,"['isn', 'truth', 'shining', 'india', 'gold price']",the shining truth: gold price isn't made in india isn truth shining india gold price,-1,-0.1472293,0.20361705
23-07-2008,https://economictimes.indiatimes.com/articleshow/3266722.cms,"gold glitters, but there're few takers",1,0,0,0,1,0,positive,"['takers', 'gold', 'glitters', 'glitters takers', 'gold glitters']","gold glitters, but there're few takers takers gold glitters glitters takers gold glitters",-1,-0.13285932,0.19058679
24-06-2013,https://www.moneycontrol.com/news/business/stocks/-1818707.html,gold may slip to rs 26500: nirmal bang,0,0,1,0,1,0,negative,"['bang', '26500', 'slip rs', 'nirmal', 'gold']",gold may slip to rs 26500: nirmal bang bang 26500 slip rs nirmal gold,-1,-0.10890399,0.08860412
09-08-2018,https://www.thehindubusinessline.com/markets/gold/gold-slips-to-rs-30560-on-muted-demand-weak-global-cues/article24641371.ece,"Gold slips to Rs 30,560 on muted demand, weak global cues ",0,0,1,0,1,0,negative,"['rs', '30 560', 'slips', 'weak global cues', 'muted demand weak']","Gold slips to Rs 30,560 on muted demand, weak global cues  rs 30 560 slips weak global cues muted demand weak",19,-0.11085565,0.086696185
07-08-2006,http://www.marketwatch.com/story/gold-futures-up-340-at-653-an-ounce-2006-08-07,gold futures up $3.40 at $653 an ounce,1,0,0,0,1,0,positive,"['40 653', '653', 'gold', 'ounce', 'futures']",gold futures up $3.40 at $653 an ounce 40 653 653 gold ounce futures,26,0.30599695,-0.32014626
20-03-2018,http://www.investing.com/news/commodities-news/gold-prices-push-lower-on-dollar-strength-1349942,Gold Prices Push Lower on Dollar Strength,0,0,1,1,1,0,negative,"['lower', 'strength', 'push', 'dollar', 'gold prices']",Gold Prices Push Lower on Dollar Strength lower strength push dollar gold prices,-1,-0.043173872,0.14402275
15-11-2012,http://www.marketwatch.com/story/gold-futures-drop-16-to-settle-at-171380-2012-11-15,"gold futures drop $16 to settle at $1,713.80",0,0,1,0,1,0,negative,"['713 80', 'settle', 'gold', '16', 'futures drop']","gold futures drop $16 to settle at $1,713.80 713 80 settle gold 16 futures drop",-1,0.22304215,-0.37415037
05-01-2017,http://www.marketwatch.com/story/feb-gold-gains-16-or-14-to-settle-at-a-118130oz-2017-01-05,"feb. gold gains $16, or 1.4%, to settle at a $1,181.30/oz",1,0,0,0,1,0,positive,"['16', 'settle', 'feb', '181 30 oz', 'gold gains']","feb. gold gains $16, or 1.4%, to settle at a $1,181.30/oz 16 settle feb 181 30 oz gold gains",21,0.42384362,0.027014304
10-09-2018,https://www.moneycontrol.com/news/world/gold-holds-losses-on-rate-hike-views-trade-worries-2935021.html,"Gold holds losses on rate hike views, trade worries",0,0,1,0,1,0,negative,"['worries', 'trade', 'hike views', 'losses rate', 'gold holds']","Gold holds losses on rate hike views, trade worries worries trade hike views losses rate gold holds",-1,-0.21816292,0.031064749
22-03-2017,http://www.marketwatch.com/story/april-gold-settles-at-124970oz-up-320-or-03-2017-03-22,"April gold settles at $1,249.70/oz, up $3.20, or 0.3%",1,0,0,0,1,0,positive,"['20', '249 70', 'oz', 'april', 'gold settles']","April gold settles at $1,249.70/oz, up $3.20, or 0.3% 20 249 70 oz april gold settles",21,0.5120338,0.010258526
19-07-2011,http://www.marketwatch.com/story/gold-futures-down-1070-at-159040-an-ounce-2011-07-19,"gold futures down $10.70 at $1,590.40 an ounce",0,0,1,0,1,0,negative,"['40', '10 70 590', 'ounce', 'futures', 'gold futures']","gold futures down $10.70 at $1,590.40 an ounce 40 10 70 590 ounce futures gold futures",26,0.3209228,-0.3791964
16-10-2017,https://www.thehindubusinessline.com/markets/silver-drops-to-rs-41400-per-kg-gold-steady-at-rs-30850/article9908441.ece,"Silver drops to Rs 41,400 per kg; gold steady at Rs 30,850",0,0,1,1,1,0,negative,"['30 850', '400 kg', 'gold steady', 'drops rs 41', 'silver drops']","Silver drops to Rs 41,400 per kg; gold steady at Rs 30,850 30 850 400 kg gold steady drops rs 41 silver drops",17,0.0749207,0.12578785
17-05-2002,http://www.marketwatch.com/story/dollar-plunge-propels-gold-stocks-2002-05-17,dollar plunge propels gold stocks,1,0,0,1,1,0,positive,"['propels', 'dollar', 'stocks', 'plunge', 'gold stocks']",dollar plunge propels gold stocks propels dollar stocks plunge gold stocks,-1,-0.14201093,0.024366785
04-06-2018,https://www.metalsdaily.com/link/280169/charts-gold-enters-decisive-zone-amid-growing-geopolitics-while-on-downward-trend.htm,charts : gold enters decisive zone amid growing geopolitics while on downward trend,0,0,1,0,0,1,negative,"['enters decisive', 'zone amid growing', 'charts', 'gold', 'geopolitics downward trend']",charts : gold enters decisive zone amid growing geopolitics while on downward trend enters decisive zone amid growing charts gold geopolitics downward trend,-1,-0.2461085,0.06998883
28-06-2012,https://www.moneycontrol.com/news/business/stocks/-1360441.html,"short gold, silver on rally, says karvy commodities broking",1,0,0,1,1,0,positive,"['says karvy', 'broking', 'rally', 'commodities', 'short gold silver']","short gold, silver on rally, says karvy commodities broking says karvy broking rally commodities short gold silver",-1,-0.17017654,0.15703188
22-07-2016,https://www.thehindubusinessline.com/markets/gold/gold-holds-on-to-overnight-gains-as-stocks-dollar-retreat/article8885223.ece,"Gold holds on to overnight gains as stocks, dollar retreat",1,1,0,1,1,0,positive,"['dollar', 'retreat', 'overnight', 'gains stocks', 'gold holds']","Gold holds on to overnight gains as stocks, dollar retreat dollar retreat overnight gains stocks gold holds",-1,-0.0957397,-0.040461898
09-11-2005,http://www.marketwatch.com/story/dec-gold-closes-near-a-two-week-high-up-520-at-46750oz-2005-11-09,"dec gold closes near a two-week high, up $5.20 at $467.50/oz",1,0,0,0,1,0,positive,"['high 20', 'dec', 'gold', '467 50 oz', 'closes near week']","dec gold closes near a two-week high, up $5.20 at $467.50/oz high 20 dec gold 467 50 oz closes near week",21,0.384098,-0.05972831
21-11-2013,http://www.marketwatch.com/story/4-reasons-gold-is-poised-for-a-comeback-2013-11-21,4 reasons gold is poised for a comeback,1,0,0,0,0,1,positive,"['poised', 'reasons', 'comeback', 'gold', 'reasons gold']",4 reasons gold is poised for a comeback poised reasons comeback gold reasons gold,-1,-0.22415616,0.15399724
13-04-2016,https://economictimes.indiatimes.com/news/economy/policy/govt-raises-import-tariff-value-of-gold-silver/articleshow/51815737.cms,"govt raises import tariff value of gold, silver",0,0,0,1,1,0,none,"['raises', 'govt', 'import', 'value gold silver', 'tariff value']","govt raises import tariff value of gold, silver raises govt import value gold silver tariff value",5,-0.18320939,0.1978774
13-06-2011,http://www.marketwatch.com/story/gold-silver-settle-at-multi-week-lows-2011-06-13,"gold, silver settle at multi-week lows",0,0,1,1,1,0,negative,"['week', 'settle', 'lows', 'multi week', 'gold silver']","gold, silver settle at multi-week lows week settle lows multi week gold silver",-1,0.043291926,-0.026358105
19-03-2018,http://www.investing.com/news/commodities-news/gold-prices-hover-at-2week-lows-on-dollar-strength-1347364,gold prices hover at 2-week lows on dollar strength,0,1,0,1,1,0,neutral,"['strength', 'week', 'hover', 'lows dollar', 'gold prices']",gold prices hover at 2-week lows on dollar strength strength week hover lows dollar gold prices,-1,0.016594991,0.047833726
07-06-2006,http://www.marketwatch.com/story/gold-closes-at-7-week-low-as-dollar-continues-higher-2006-06-07,gold closes at 7-week low as dollar continues higher,0,0,1,1,1,0,negative,"['continues', 'low', 'week', 'dollar continues higher', 'gold closes week']",gold closes at 7-week low as dollar continues higher continues low week dollar continues higher gold closes week,-1,0.06152658,-0.08273414
22-02-2018,http://www.marketwatch.com/story/gold-notches-back-to-back-gain-amid-pullback-in-dollar-bond-yields-2018-02-22,"gold notches back-to-back gain amid pullback in dollar, bond yields",1,0,0,1,1,0,positive,"['gold', 'gain amid', 'notches', 'pullback', 'dollar bond yields']","gold notches back-to-back gain amid pullback in dollar, bond yields gold gain amid notches pullback dollar bond yields",-1,-0.13413653,0.0146383345
10-04-2017,http://www.marketwatch.com/story/gold-settles-lower-after-posting-gains-over-the-last-two-sessions-2017-04-10,Gold settles lower after posting gains over the last two sessions,0,0,1,0,1,0,negative,"['sessions', 'posting', 'lower', 'gains', 'gold settles']",Gold settles lower after posting gains over the last two sessions sessions posting lower gains gold settles,-1,0.05323869,-0.026558384
10-01-2013,http://www.marketwatch.com/story/gold-futures-rise-on-china-exports-softer-dollar-2013-01-10,"gold ends 1.4% higher on china exports, weak dollar",1,0,0,1,1,0,positive,"['ends', 'weak', 'china', 'dollar', 'higher china exports']","gold ends 1.4% higher on china exports, weak dollar ends weak china dollar higher china exports",-1,-0.06416991,0.07721054
28-10-2016,http://www.marketwatch.com/story/gold-futures-end-with-a-gain-of-07-for-the-week-2016-10-28,Gold futures end with a gain of 0.7% for the week,1,0,0,0,1,0,positive,"['gain', 'end', 'week', 'futures', 'gold futures']",Gold futures end with a gain of 0.7% for the week gain end week futures gold futures,27,0.02346988,-0.4437083
08-08-2011,http://www.marketwatch.com/story/3-trades-avoid-bonds-sell-gold-buy-blue-chips-2011-08-08,"3 trades: avoid bonds, sell gold, buy blue chips",0,0,0,0,1,0,none,"['blue', 'chips', 'avoid bonds', 'trades avoid', 'sell gold buy']","3 trades: avoid bonds, sell gold, buy blue chips blue chips avoid bonds trades avoid sell gold buy",-1,-0.24321674,0.1092459
06-06-2014,"http://www.investing.com/news/commodities-news/gold-futures-hold-steady,-eyes-on-u.s.-data-288357","Gold futures hold steady, eyes on U.S. data",0,1,0,0,1,0,neutral,"['hold', 'steady', 'eyes data', 'data', 'gold futures']","Gold futures hold steady, eyes on U.S. data hold steady eyes data data gold futures",-1,-0.2178846,-0.29528275
22-01-2013,https://economictimes.indiatimes.com/news/economy/foreign-trade/government-hikes-import-duty-on-gold-etfs-to-park-some-holdings-with-banks/articleshow/18116755.cms,government hikes import duty on gold; etfs to park some holdings with banks,0,0,0,0,1,0,none,"['gold', 'park holdings banks', 'import duty', 'etfs', 'government hikes']",government hikes import duty on gold; etfs to park some holdings with banks gold park holdings banks import duty etfs government hikes,-1,-0.29043823,0.059206143
08-08-2012,http://www.marketwatch.com/story/gains-for-dollar-weigh-on-gold-prices-2012-08-08,"gold inches higher on data, stimulus hopes",1,0,0,0,1,0,positive,"['hopes', 'inches', 'gold', 'stimulus', 'higher data']","gold inches higher on data, stimulus hopes hopes inches gold stimulus higher data",-1,-0.07924253,0.14302914
29-08-2017,https://www.thehindubusinessline.com/markets/gold/gold-jumps-to-rs-30450-silver-recaptures-rs-41kmark/article9835014.ece,"Gold jumps to Rs 30,450; silver recaptures Rs 41K-mark",1,0,0,1,1,0,positive,"['30 450', 'silver', 'recaptures rs', '41k mark', 'gold jumps']","Gold jumps to Rs 30,450; silver recaptures Rs 41K-mark 30 450 silver recaptures rs 41k mark gold jumps",-1,0.027808473,0.14727107
22-07-2016,https://www.moneycontrol.com/news/business/markets/gold-climbsglobal-cues-silver-tops-rs-46000-mark-979830.html,"gold climbs on global cues; silver tops rs 46,000 mark",1,0,0,1,1,0,positive,"['cues', '000 mark', 'tops rs 46', 'gold', 'climbs global']","gold climbs on global cues; silver tops rs 46,000 mark cues 000 mark tops rs 46 gold climbs global",-1,-0.13378288,0.14591898
23-09-2013,http://www.marketwatch.com/story/gold-futures-extend-losses-to-a-second-session-2013-09-23,gold futures extend losses to a second session,0,0,1,0,1,0,negative,"['second', 'session', 'gold', 'extend losses', 'futures extend']",gold futures extend losses to a second session second session gold extend losses futures extend,-1,-0.14655915,-0.39903226
10-11-2016,http://www.investing.com/news/commodities-news/gold-prices-gain-slightly-in-asia-as-markets-await-demand-cues-439794,gold prices gain slightly in asia as markets await demand cues,1,0,0,0,1,0,positive,"['await demand', 'gain slightly', 'asia', 'demand cues', 'gold prices']",gold prices gain slightly in asia as markets await demand cues await demand gain slightly asia demand cues gold prices,12,-0.16417076,0.16213548
08-08-2011,https://www.thehindubusinessline.com/companies/Golds-glitter-remains-despite-the-price-rise/article20318855.ece,"Gold's glitter remains, despite the price rise",0,1,0,0,1,0,neutral,"['despite', 'rise', 'price', 'gold', 'glitter remains despite']","Gold's glitter remains, despite the price rise despite rise price gold glitter remains despite",-1,-0.004251808,0.099041045
09-03-2018,https://www.metalsdaily.com/link/277499/london-clearing-five-banks-open-up-trillion-dollar-gold-club.htm,london clearing : five banks open up trillion dollar gold club,0,0,0,1,1,0,none,"['club', 'london', 'trillion', 'dollar gold', 'clearing banks open']",london clearing : five banks open up trillion dollar gold club club london trillion dollar gold clearing banks open,-1,-0.11083047,0.07124245
20-01-2012,http://www.marketwatch.com/story/gold-futures-turn-higher-up-02-2012-01-20,"gold futures turn higher, up 0.2%",1,0,0,0,1,0,positive,"['turn', 'higher', 'gold', 'futures turn higher', 'gold futures']","gold futures turn higher, up 0.2% turn higher gold futures turn higher gold futures",-1,-0.08801824,-0.38716412
17-10-2018,https://www.moneycontrol.com/news/business/commodities/gold-prices-hold-steady-as-investors-wait-for-fed-minutes-3053711.html,Gold prices hold steady as investors wait for Fed minutes,0,1,0,0,1,0,neutral,"['minutes', 'fed', 'hold steady', 'investors wait', 'gold prices']",Gold prices hold steady as investors wait for Fed minutes minutes fed hold steady investors wait gold prices,-1,-0.1710306,0.021933325
05-07-2013,http://www.marketwatch.com/story/in-the-seconds-before-jobs-report-e-mini-futures-jumped-gold-futures-oscillated-wildly-nanex-2013-07-05,"in the seconds before jobs report, e-mini futures jumped, gold futures oscillated 'wildly': nanex",0,0,0,0,1,0,none,"['report mini', 'jumped gold', 'seconds jobs', 'oscillated wildly nanex', 'futures']","in the seconds before jobs report, e-mini futures jumped, gold futures oscillated 'wildly': nanex report mini jumped gold seconds jobs oscillated wildly nanex futures",-1,-0.16610172,-0.34274763
22-03-2013,https://www.moneycontrol.com/news/business/markets/-1162145.html,gold eyes biggest weekly gain in months on cyprus woes,1,0,0,0,1,0,positive,"['woes', 'biggest weekly', 'gain months', 'cyprus', 'gold eyes']",gold eyes biggest weekly gain in months on cyprus woes woes biggest weekly gain months cyprus gold eyes,-1,-0.17174901,0.08879978
11-10-2017,https://economictimes.indiatimes.com/markets/stocks/news/gold-rate-today-track-gold-price-in-india/articleshow/61032727.cms,gold rate today: track gold price in india,0,0,0,0,1,0,none,"['today', 'track', 'rate', 'india', 'gold price']",gold rate today: track gold price in india today track rate india gold price,-1,-0.05917719,0.13774389
18-01-2017,http://www.marketwatch.com/story/this-gold-plays-breakout-looks-enticing-as-trump-swats-at-the-dollar-2017-01-18-9103012,This gold play's breakout looks enticing as Trump swats at the dollar,0,0,0,1,1,0,none,"['enticing', 'trump', 'play', 'breakout looks', 'swats dollar']",This gold play's breakout looks enticing as Trump swats at the dollar enticing trump play breakout looks swats dollar,-1,-0.05652743,0.09937618
17-01-2011,https://www.moneycontrol.com/news/business/markets/-1275539.html,india gold seen falling further,0,0,1,0,1,0,negative,"['seen', 'falling', 'india', 'gold', 'india gold seen']",india gold seen falling further seen falling india gold india gold seen,-1,-0.21423526,0.13824789
06-12-2013,http://www.marketwatch.com/story/gold-futures-erase-most-losses-to-trade-down-260-2013-12-06,gold futures erase most losses to trade down $2.60,0,0,1,0,1,0,negative,"['60', 'trade', 'erase', 'losses', 'gold futures']",gold futures erase most losses to trade down $2.60 60 trade erase losses gold futures,-1,-0.009950504,-0.37073213
04-10-2012,https://www.moneycontrol.com/news/business/stocks/-1871701.html,gold looks strong at current levels: karvy,1,0,0,0,0,1,positive,"['looks', 'levels', 'strong current', 'karvy', 'gold looks strong']",gold looks strong at current levels: karvy looks levels strong current karvy gold looks strong,-1,-0.21884339,0.2043972
18-09-2017,http://www.marketwatch.com/story/gold-prices-mark-fifth-decline-in-six-sessions-2017-09-18,Gold prices mark fifth decline in six sessions,0,0,1,0,1,0,negative,"['sessions', 'mark', 'decline sessions', 'fifth', 'gold prices']",Gold prices mark fifth decline in six sessions sessions mark decline sessions fifth gold prices,-1,0.10126068,0.010701872
17-07-2013,http://www.marketwatch.com/story/gold-tiptoes-lower-with-bernanke-on-deck-2013-07-17,"gold prices end lower after failed run at $1,300",0,0,1,0,1,0,negative,"['lower', 'end', 'run 300', 'failed run', 'gold prices']","gold prices end lower after failed run at $1,300 lower end run 300 failed run gold prices",-1,0.059629694,-0.047601745
26-08-2015,https://www.thehindubusinessline.com/markets/gold/gold-silver-dip-further-on-weak-global-cues/article7583180.ece,"Gold, silver dip further on weak global cues",0,0,1,1,1,0,negative,"['weak', 'global', 'dip', 'cues', 'gold silver']","Gold, silver dip further on weak global cues weak global dip cues gold silver",-1,-0.19690873,0.08664943
29-01-2017,http://www.investing.com/news/commodities-news/gold-prices-gain-in-asia-as-trump-travel-policy-noted-456436,gold prices gain in asia as trump travel policy noted,1,0,0,0,1,0,positive,"['gain', 'trump', 'asia', 'travel policy noted', 'gold prices']",gold prices gain in asia as trump travel policy noted gain trump asia travel policy noted gold prices,-1,-0.20276171,0.0905951
30-05-2013,http://www.marketwatch.com/story/aug-gold-gains-1820-or-13-to-1410oz-2013-05-30,"aug. gold gains $18.20, or 1.3%, to $1,410/oz",1,0,0,0,1,0,positive,"['18', 'aug', 'gold', 'gains', '410 oz']","aug. gold gains $18.20, or 1.3%, to $1,410/oz 18 aug gold gains 410 oz",-1,0.3785451,0.1411924
05-05-2017,http://www.marketwatch.com/story/june-gold-futures-up-620-or-05-to-123490-an-ounce-2017-05-05,"June gold futures up $6.20, or 0.5%, to $1,234.90 an ounce",1,0,0,0,1,0,positive,"['20 234', 'june', '90 ounce', 'gold', 'futures']","June gold futures up $6.20, or 0.5%, to $1,234.90 an ounce 20 234 june 90 ounce gold futures",26,0.3157276,-0.34445924
02-12-2009,http://www.marketwatch.com/story/gold-futures-up-1220-at-121240-an-ounce-2009-12-02,"gold futures up $12.20 at $1,212.40 an ounce",1,0,0,0,1,0,positive,"['40', '12 20 212', 'ounce', 'futures', 'gold futures']","gold futures up $12.20 at $1,212.40 an ounce 40 12 20 212 ounce futures gold futures",26,0.30715036,-0.33501774
19-01-2012,https://www.thehindubusinessline.com/economy/Gold-Customs-duty-hike-a-revenue-measure/article20386895.ece,Gold: Customs duty hike a revenue measure,0,0,0,0,1,0,none,"['measure', 'hike', 'gold', 'hike revenue', 'customs duty']",Gold: Customs duty hike a revenue measure measure hike gold hike revenue customs duty,-1,-0.16438164,0.12137213
10-08-2018,http://www.marketwatch.com/story/gold-heads-for-daily-weekly-loss-as-haven-dollar-lifted-by-turkeys-unease-2018-08-10,gold closes slightly lower as dollar's jump outweighs turkey contagion fear,0,0,1,0,1,0,negative,"['slightly lower', 'jump outweighs', 'contagion fear', 'turkey', 'gold closes']",gold closes slightly lower as dollar's jump outweighs turkey contagion fear slightly lower jump outweighs contagion fear turkey gold closes,-1,-0.023248203,0.069966905
05-12-2016,http://www.marketwatch.com/story/gold-settles-down-130-or-01-at-117650-an-ounce-2016-12-05,"Gold settles down $1.30, or 0.1%, at $1,176.50 an ounce",0,0,1,0,1,0,negative,"['176 50', '30', 'settles', 'gold', 'ounce']","Gold settles down $1.30, or 0.1%, at $1,176.50 an ounce 176 50 30 settles gold ounce",21,0.4875834,0.042775728
17-04-2013,http://www.marketwatch.com/story/commonweath-bank-cuts-fy13-gold-price-view-by-3-2013-04-17,commonweath bank cuts fy13 gold price view by 3%,0,0,0,0,1,0,none,"['view', 'commonweath', 'fy13', 'bank cuts', 'gold price']",commonweath bank cuts fy13 gold price view by 3% view commonweath fy13 bank cuts gold price,-1,-0.035825834,0.017484829
30-11-2018,https://www.moneycontrol.com/news/business/stocks/gold-prices-to-trade-sideways-today-angel-commodities-16-3237591.html,Gold prices to trade sideways today: Angel Commodities,0,1,0,0,0,1,neutral,"['sideways', 'today angel', 'trade', 'commodities', 'gold prices']",Gold prices to trade sideways today: Angel Commodities sideways today angel trade commodities gold prices,8,-0.06868816,0.09349821
10-11-2017,https://www.metalsdaily.com/link/273758/state-street-fed-rate-hikes-next-year-wont-be-enough-to-unsettle-gold-prices-.htm,state street : fed rate hikes next year won't be enough to unsettle gold prices,0,0,0,0,0,1,none,"['state', 'prices', 'hikes year', 'won unsettle gold', 'street fed rate']",state street : fed rate hikes next year won't be enough to unsettle gold prices state prices hikes year won unsettle gold street fed rate,-1,-0.09231132,-0.01204747
04-03-2012,https://www.thehindubusinessline.com/opinion/columns/gnanasekaar-t/article2960934.ece,"Gold may consolidate, move higher",1,0,0,0,1,0,positive,"['higher', 'gold', 'consolidate', 'consolidate higher', 'gold consolidate']","Gold may consolidate, move higher higher gold consolidate consolidate higher gold consolidate",-1,-0.18553439,0.053503253
10-03-2010,http://www.marketwatch.com/story/gold-copper-rise-after-strong-chinese-data-2010-03-10,"gold, copper rise after strong chinese data",1,0,0,1,1,0,positive,"['strong', 'rise', 'data', 'chinese data', 'gold copper']","gold, copper rise after strong chinese data strong rise data chinese data gold copper",-1,-0.25288945,0.16288242
27-09-2017,https://economictimes.indiatimes.com/markets/commodities/news/gold-silver-down-in-early-trade/articleshow/60851338.cms,"gold, silver down in early trade",0,0,1,1,1,0,negative,"['early', 'trade', 'gold', 'early trade', 'silver']","gold, silver down in early trade early trade gold early trade silver",-1,-0.06031794,0.15063262
25-06-2015,http://www.investing.com/news/commodities-news/gold-prices-gain-in-asia-as-investors-eye-last-minute-greece-debt-talks-348323,Gold prices gain in Asia as investors eye last-minute Greece debt talks,1,0,0,0,1,0,positive,"['minute greece', 'investors eye', 'debt talks', 'gain asia', 'gold prices']",Gold prices gain in Asia as investors eye last-minute Greece debt talks minute greece investors eye debt talks gain asia gold prices,-1,-0.259665,0.17076585
15-11-2018,https://economictimes.indiatimes.com/news/economy/indicators/october-trade-gap-widens-to-17-1-billion-despite-decline-in-gold-imports/articleshow/66637775.cms,October trade deficit widens to $ 17.13 billion despite decline in gold imports,0,0,1,0,1,0,negative,"['17 13 billion', 'imports', 'october trade', 'decline gold', 'deficit widens']",October trade deficit widens to $ 17.13 billion despite decline in gold imports 17 13 billion imports october trade decline gold deficit widens,-1,-0.08316555,0.05589044
14-09-2015,http://www.marketwatch.com/story/gold-nudges-higher-ahead-of-feds-key-rate-decision-2015-09-14,gold scores gain to start week ahead of fed rate decision,1,0,0,0,1,0,positive,"['start', 'rate decision', 'week ahead', 'fed rate', 'gold scores gain']",gold scores gain to start week ahead of fed rate decision start rate decision week ahead fed rate gold scores gain,-1,-0.095034346,-0.0017004684
16-02-2017,http://www.marketwatch.com/story/gold-fields-swings-to-profit-lifts-dividend-2017-02-16,"Gold Fields swings to profit, lifts dividend",0,0,0,0,1,0,none,"['swings', 'fields', 'gold', 'dividend', 'profit lifts dividend']","Gold Fields swings to profit, lifts dividend swings fields gold dividend profit lifts dividend",-1,-0.21124196,0.08527622
27-02-2013,https://www.moneycontrol.com/news/business/markets/-1290865.html,gold imports likely to fall on lower inflation: rajan,0,0,1,0,1,0,negative,"['likely', 'fall', 'imports', 'rajan', 'lower inflation']",gold imports likely to fall on lower inflation: rajan likely fall imports rajan lower inflation,-1,-0.1338562,0.037909765
04-08-2010,http://www.marketwatch.com/story/gold-futures-up-1140-at-119870-an-ounce-2010-08-04,"gold futures up $11.40 at $1,198.70 an ounce",1,0,0,0,1,0,positive,"['40 198 70', '11', 'ounce', 'futures', 'gold futures']","gold futures up $11.40 at $1,198.70 an ounce 40 198 70 11 ounce futures gold futures",26,0.30538648,-0.3640659
0201-03-21,http://www.marketwatch.com/story/gold-taps-intraday-highs-as-us-dollar-index-drops-to-days-lows-2017-03-21,Gold taps intraday highs as U.S. Dollar Index drops to day's lows,1,0,0,1,1,0,positive,"['taps', 'gold', 'drops day', 'intraday highs', 'dollar index']",Gold taps intraday highs as U.S. Dollar Index drops to day's lows taps gold drops day intraday highs dollar index,-1,0.023629874,0.08305276
08-01-2015,http://www.investing.com/news/commodities-news/gold-prices-dip-in-asia-with-focus-on-upcoming-u.s.-jobs-data-322688,gold prices dip in asia with focus on upcoming u.s. jobs data,0,0,1,0,1,0,negative,"['upcoming', 'gold', 'asia focus', 'jobs data', 'prices dip']",gold prices dip in asia with focus on upcoming u.s. jobs data upcoming gold asia focus jobs data prices dip,-1,-0.16480795,0.084323704
07-09-2004,http://www.marketwatch.com/story/dec-gold-closes-at-39940oz-down-310-for-the-day-2004-09-07,"dec gold closes at $399.40/oz, down $3.10 for the day",0,0,1,0,1,0,negative,"['10 day', '399 40', 'oz', 'dec', 'gold closes']","dec gold closes at $399.40/oz, down $3.10 for the day 10 day 399 40 oz dec gold closes",21,0.39203,-0.04690987
05-05-2011,http://www.marketwatch.com/story/randgold-gold-output-up-24-on-year-2011-05-05,randgold gold output up 24% on year,1,0,0,0,1,0,positive,"['output', 'year', '24 year', 'gold output', 'randgold']",randgold gold output up 24% on year output year 24 year gold output randgold,-1,-0.031593487,0.026379287
30-06-2011,http://www.marketwatch.com/story/gold-ends-lower-silver-copper-gain-2011-06-30,"gold ends lower; silver, copper gain",0,0,1,1,1,0,negative,"['lower', 'ends', 'gain', 'gold', 'lower silver copper']","gold ends lower; silver, copper gain lower ends gain gold lower silver copper",-1,-0.07612843,0.10609007
10-09-2018,http://www.marketwatch.com/story/gold-futures-settle-below-1200-for-the-second-time-in-a-week-2018-09-10,"gold futures settle below $1,200 for the second time in a week",0,0,1,0,1,0,negative,"['time week', 'second time', '200', 'settle', 'gold futures']","gold futures settle below $1,200 for the second time in a week time week second time 200 settle gold futures",-1,0.1316544,-0.43240225
13-03-2017,http://www.marketwatch.com/story/gold-prices-end-streak-of-losses-finish-higher-for-the-session-2017-03-13,"Gold prices end streak of losses, finish higher for the session",1,0,0,0,1,0,positive,"['session', 'streak', 'prices end', 'losses finish higher', 'gold prices']","Gold prices end streak of losses, finish higher for the session session streak prices end losses finish higher gold prices",-1,-0.009556189,-0.082329065
30-01-2012,https://www.moneycontrol.com/news/business/markets/-1977811.html,"today's commodity basket: gold, zinc, silver, copper",0,0,0,1,1,0,none,"['today', 'basket', 'zinc', 'silver copper', 'commodity']","today's commodity basket: gold, zinc, silver, copper today basket zinc silver copper commodity",-1,-0.13763756,0.17226475
19-09-2018,https://www.metalsdaily.com/link/284268/silvers-discount-to-gold-is-the-biggest-since-the-1990s.htm,silver's discount to gold is the biggest since the 1990s,0,0,0,0,1,0,none,"['biggest', '1990s', 'discount', 'gold biggest', 'silver']",silver's discount to gold is the biggest since the 1990s biggest 1990s discount gold biggest silver,-1,-0.035364255,0.0852571
15-02-2013,https://www.thehindubusinessline.com/markets/gold/gold-futures-down-at-rs-30383-per-10-gm/article23093273.ece,"Gold futures down at Rs 30,383 per 10 gm",0,0,1,0,1,0,negative,"['383 10', 'gm', 'gold', 'rs 30', 'futures']","Gold futures down at Rs 30,383 per 10 gm 383 10 gm gold rs 30 futures",23,0.027189508,-0.38734913
05-08-2016,http://www.marketwatch.com/story/gold-sinks-after-payrolls-report-shows-a-strong-july-gain-2016-08-05,Gold sinks after payrolls report shows a strong July gain,0,0,1,0,1,0,negative,"['gain', 'shows strong', 'july', 'payrolls report shows', 'gold sinks']",Gold sinks after payrolls report shows a strong July gain gain shows strong july payrolls report shows gold sinks,-1,-0.04160385,0.09345132
22-09-2017,http://www.investing.com/news/commodities-news/commodities--gold-prices-regain-ground-on-north-korean-threats-531742,commodities - gold prices regain ground on north korean threats,1,0,0,0,1,0,positive,"['threats', 'north', 'korean', 'regain ground', 'commodities gold prices']",commodities - gold prices regain ground on north korean threats threats north korean regain ground commodities gold prices,-1,-0.17566325,0.068223536
22-07-2016,http://www.marketwatch.com/story/eldorado-gold-downgraded-to-neutral-from-outperform-at-credit-suisse-2016-07-22,eldorado gold downgraded to neutral from outperform at credit suisse,0,0,1,0,1,0,negative,"['suisse', 'gold', 'eldorado', 'outperform credit', 'downgraded neutral']",eldorado gold downgraded to neutral from outperform at credit suisse suisse gold eldorado outperform credit downgraded neutral,-1,-0.09026034,0.11256273
24-07-2018,http://www.investing.com/news/commodities-news/gold-prices-edge-down-as-dollar-steadies-1541817,gold prices edge down as dollar steadies,0,0,1,1,1,0,negative,"['edge', 'steadies', 'gold', 'prices edge dollar', 'gold prices']",gold prices edge down as dollar steadies edge steadies gold prices edge dollar gold prices,-1,-0.07749069,0.11430693
20-01-2005,http://www.marketwatch.com/story/spot-gold-quoted-at-42130-down-40c-from-new-york-2005-01-20,"spot gold quoted at $421.30, down 40c from new york",0,0,1,0,1,0,negative,"['quoted', '421 30', 'york', '30 40c new', 'spot gold']","spot gold quoted at $421.30, down 40c from new york quoted 421 30 york 30 40c new spot gold",9,0.23477827,0.11053415
30-07-2010,https://economictimes.indiatimes.com/markets/commodities/gold-down-on-dollar-firmness-oil-range-bound-copper-steady/articleshow/6237019.cms,"gold down on dollar firmness, oil range-bound, copper steady",0,0,1,1,1,0,negative,"['range bound', 'firmness', 'oil range', 'copper steady', 'gold dollar']","gold down on dollar firmness, oil range-bound, copper steady range bound firmness oil range copper steady gold dollar",-1,-0.021920718,0.014633171
10-08-2017,http://www.marketwatch.com/story/gold-settles-at-2-month-high-amid-geopolitical-tensions-2017-08-10,Gold settles at 2-month high amid geopolitical tensions,1,0,0,0,1,0,positive,"['high amid', 'month', 'tensions', 'geopolitical', 'gold settles month']",Gold settles at 2-month high amid geopolitical tensions high amid month tensions geopolitical gold settles month,-1,-0.028834507,0.012875974
13-09-2006,https://economictimes.indiatimes.com/articleshow/1984875.cms,gold buying gains pace as prices move south,1,0,0,0,1,0,positive,"['pace', 'prices', 'south', 'gold', 'buying gains']",gold buying gains pace as prices move south pace prices south gold buying gains,-1,-0.11914061,0.1214529
14-01-2004,http://www.marketwatch.com/story/nymex-gold-ends-with-a-2-loss,nymex gold ends with a $2 loss,0,0,1,0,1,0,negative,"['ends', 'gold', 'loss', 'nymex', 'nymex gold']",nymex gold ends with a $2 loss ends gold loss nymex nymex gold,-1,0.009717271,-0.05239573
21-11-2012,http://www.marketwatch.com/story/gold-climbs-but-remains-below-1730oz-2012-11-21,"gold climbs, but remains below $1,730/oz",1,0,0,0,1,0,positive,"['remains', 'remains 730', 'oz', 'gold', 'climbs']","gold climbs, but remains below $1,730/oz remains remains 730 oz gold climbs",-1,0.28972083,0.13375999
26-07-2017,http://www.marketwatch.com/story/antofagasta-gold-copper-production-rises-2017-07-26,"Antofagasta gold, copper production rises",0,0,0,1,1,0,none,"['rises', 'production', 'gold', 'antofagasta', 'copper production']","Antofagasta gold, copper production rises rises production gold antofagasta copper production",-1,-0.056958944,0.17504828
19-06-2018,https://www.metalsdaily.com/link/280588/gold-pinned-at-2018-lows-draws-scant-trade-linked-haven-demand.htm,"gold pinned at 2018 lows, draws scant trade-linked haven demand",0,0,0,0,1,0,none,"['draws scant', 'trade linked', '2018 lows', 'haven demand', 'gold pinned']","gold pinned at 2018 lows, draws scant trade-linked haven demand draws scant trade linked 2018 lows haven demand gold pinned",-1,-0.07532006,0.060849562
18-01-2005,http://www.marketwatch.com/story/feb-gold-up-60c-at-42360oz-in-ny-2005-01-18,feb gold up 60c at $423.60/oz in ny,1,0,0,0,1,0,positive,"['423 60', 'ny', 'oz', 'gold', '60c']",feb gold up 60c at $423.60/oz in ny 423 60 ny oz gold 60c,-1,0.4180112,0.13992636
24-06-2010,http://www.marketwatch.com/story/canadian-markets-close-lower-rims-profits-grow-2010-06-24,canadian markets close down; gold stocks hold slight gain,1,0,0,0,1,0,positive,"['gain', 'hold slight', 'canadian', 'markets close', 'gold stocks']",canadian markets close down; gold stocks hold slight gain gain hold slight canadian markets close gold stocks,-1,-0.16050617,0.02220551
18-10-2012,https://www.moneycontrol.com/news/business/markets/-1954729.html,gold declines first time in three days before eu summit,0,0,1,0,1,0,negative,"['time', 'days', 'eu', 'summit', 'gold declines']",gold declines first time in three days before eu summit time days eu summit gold declines,-1,-0.06530801,0.0022757798
0200-09-26,http://www.marketwatch.com/story/december-gold-down-450-at-73440-an-ounce-on-nymex-2007-09-26,december gold down $4.50 at $734.40 an ounce on nymex,0,0,1,0,1,0,negative,"['50 734', 'december', '734 40 ounce', 'nymex', 'gold']",december gold down $4.50 at $734.40 an ounce on nymex 50 734 december 734 40 ounce nymex gold,21,0.3839382,0.049277093
17-01-2014,http://www.marketwatch.com/story/contrarian-investors-fight-off-the-gold-bears-2014-01-17,gold contrarians say it's time to start buying,1,0,0,0,0,1,positive,"['say', 'say time start', 'contrarians', 'gold', 'start buying']",gold contrarians say it's time to start buying say say time start contrarians gold start buying,-1,-0.08926718,0.097904064
14-09-2017,http://www.investing.com/news/commodities-news/commodities--gold-prices-hold-steady-ahead-of-us-inflation-data-528712,Commodities - Gold Prices Hold Steady Ahead of U.S. Inflation Data,0,1,0,0,1,0,neutral,"['ahead', 'hold', 'steady', 'inflation data', 'commodities gold prices']",Commodities - Gold Prices Hold Steady Ahead of U.S. Inflation Data ahead hold steady inflation data commodities gold prices,-1,-0.10980646,0.042909335
18-10-2017,https://economictimes.indiatimes.com/markets/commodities/news/gold-price-chart-find-all-the-latest-gold-rate-chart-and-news/articleshow/61128409.cms,gold price chart: find all the latest gold rate chart and news,0,0,0,0,1,0,none,"['rate', 'news', 'latest', 'chart', 'gold price']",gold price chart: find all the latest gold rate chart and news rate news latest chart gold price,-1,-0.060491584,0.065231085
21-09-2017,http://www.marketwatch.com/story/gold-drops-1470-or-11-to-130170-an-ounce-2017-09-21,"Gold drops $14.70, or 1.1%, to $1,301.70 an ounce",0,0,1,0,1,0,negative,"['14', '70 301 70', 'gold', 'ounce', 'drops']","Gold drops $14.70, or 1.1%, to $1,301.70 an ounce 14 70 301 70 gold ounce drops",-1,0.39648426,0.059333023
14-09-2010,http://www.marketwatch.com/story/us-stocks-pushing-modestly-higher-amid-treasury-gold-buying-2010-09-14,"us stocks pushing modestly higher amid treasury, gold buying",0,0,0,0,1,0,none,"['higher amid', 'modestly', 'pushing', 'stocks', 'treasury gold buying']","us stocks pushing modestly higher amid treasury, gold buying higher amid modestly pushing stocks treasury gold buying",-1,-0.17902344,0.14779843
07-07-2017,http://www.marketwatch.com/story/august-gold-down-02-at-122110oz-2017-07-07,"august gold down 0.2% at $1,221.10/oz.",0,0,1,0,1,0,negative,"['10', '221 10', 'august', 'gold', 'oz']","august gold down 0.2% at $1,221.10/oz. 10 221 10 august gold oz",21,0.46558505,0.17290688
16-10-2014,http://www.investing.com/news/commodities-news/gold-prices-steady-in-early-asia-ahead-of-light-data-day-in-the-region-313298,gold prices steady in early asia ahead of light data day in the region,0,1,0,0,1,0,neutral,"['light data', 'gold', 'data day region', 'prices steady', 'early asia ahead']",gold prices steady in early asia ahead of light data day in the region light data gold data day region prices steady early asia ahead,-1,-0.14109893,0.06950993
19-08-2015,https://www.thehindubusinessline.com/markets/gold/silver-slumps-by-rs-655kg-on-heavy-selling-gold-eases/article7557925.ece,Silver slumps by Rs 655/kg on heavy selling; gold eases,0,1,0,1,1,0,neutral,"['kg heavy', 'rs 655', 'slumps', 'silver', 'selling gold eases']",Silver slumps by Rs 655/kg on heavy selling; gold eases kg heavy rs 655 slumps silver selling gold eases,-1,-0.04478085,0.24320151
21-08-2015,http://www.marketwatch.com/story/gold-futures-up-06-on-day-climbs-42-on-week-2015-08-21,"gold futures up 0.6% on day, climbs 4.2% on week",1,0,0,0,1,0,positive,"['day', 'week', 'climbs', 'futures', 'gold futures']","gold futures up 0.6% on day, climbs 4.2% on week day week climbs futures gold futures",-1,0.0023084134,-0.40971524
12-06-2012,https://www.moneycontrol.com/news/business/stocks/-1701521.html,geojit comtrade`s 6 trading strategies on gold,0,0,0,0,1,0,none,"['strategies', 'gold', 'comtrade', 'trading strategies', 'geojit']",geojit comtrade`s 6 trading strategies on gold strategies gold comtrade trading strategies geojit,-1,-0.2165442,-0.010841563
12-10-2012,http://www.marketwatch.com/story/gold-futures-wobble-in-european-trading-2012-10-12,gold futures retreat; market awaits spain bailout,0,0,1,0,1,0,negative,"['awaits', 'spain', 'bailout', 'retreat market', 'gold futures']",gold futures retreat; market awaits spain bailout awaits spain bailout retreat market gold futures,-1,-0.14625295,-0.38472986
30-03-2016,http://www.marketwatch.com/story/gold-futures-give-back-more-than-half-of-the-gains-seen-a-day-earlier-2016-03-30,gold futures give back more than half of the gains seen a day earlier,1,0,0,0,1,0,positive,"['seen', 'half', 'day earlier', 'gains', 'gold futures']",gold futures give back more than half of the gains seen a day earlier seen half day earlier gains gold futures,-1,-0.050676197,-0.36757928
27-09-2018,http://www.marketwatch.com/story/gold-adds-to-slight-decline-after-economic-reports-2018-09-27,gold adds to slight decline after economic reports,0,0,1,0,1,0,negative,"['slight', 'adds', 'reports', 'gold', 'decline economic']",gold adds to slight decline after economic reports slight adds reports gold decline economic,-1,-0.04613591,0.18960097
05-10-2017,http://www.marketwatch.com/story/gold-tips-higher-aims-for-second-consecutive-gain-2017-10-05,"Gold settles lower, builds on a weekly loss",0,0,1,0,1,0,negative,"['lower', 'settles', 'gold', 'builds weekly', 'weekly loss']","Gold settles lower, builds on a weekly loss lower settles gold builds weekly weekly loss",-1,0.03895898,-0.0920206
26-06-2006,http://www.marketwatch.com/story/gold-down-1-at-587-in-the-early-going-2006-06-26,gold down $1 at $587 in the early going,0,0,1,0,1,0,negative,"['going', 'early', '587', 'gold', '587 early']",gold down $1 at $587 in the early going going early 587 gold 587 early,-1,0.21971132,0.039267205
28-06-2018,https://www.metalsdaily.com/link/280754/us-scrap-gold-prices-continue-to-decline-in-line-with-comex-gold.htm,us scrap gold prices continue to decline in line with comex gold,0,0,1,0,1,0,negative,"['comex', 'decline line', 'scrap', 'prices continue', 'gold prices']",us scrap gold prices continue to decline in line with comex gold comex decline line scrap prices continue gold prices,-1,-0.044876896,-0.012657374
24-07-2014,http://www.investing.com/news/commodities-news/gold-prices-gain-in-asia-as-geopolitical-events-point-to-volatility-297882,Gold prices gain in Asia as geopolitical events point to volatility,1,0,0,0,1,0,positive,"['events', 'gain', 'point volatility', 'asia geopolitical', 'gold prices']",Gold prices gain in Asia as geopolitical events point to volatility events gain point volatility asia geopolitical gold prices,-1,-0.2115369,0.13489768
22-02-2017,http://www.marketwatch.com/story/gold-prices-get-post-settlement-boost-after-fed-minutes-2017-02-22,Gold prices get post-settlement boost after Fed minutes,1,0,0,0,1,0,positive,"['boost', 'minutes', 'fed', 'prices post settlement', 'gold prices']",Gold prices get post-settlement boost after Fed minutes boost minutes fed prices post settlement gold prices,-1,-0.10143164,-0.031298086
09-09-2014,http://www.investing.com/news/commodities-news/gold-edges-lower-as-dollar-gain-on-fed-interest-rate-expectations-308832,Gold edges lower as dollar gain on Fed interest rate expectations,0,0,1,1,1,0,negative,"['expectations', 'edges', 'dollar', 'gain fed rate', 'gold edges lower']",Gold edges lower as dollar gain on Fed interest rate expectations expectations edges dollar gain fed rate gold edges lower,-1,-0.120056696,0.02995371
26-07-2011,http://www.marketwatch.com/story/oil-drops-13-after-housing-data-gold-holds-2011-07-26,"oil drops 1.3% after housing data, gold holds",0,0,1,1,1,0,negative,"['holds', 'housing data', 'gold', 'drops housing data', 'oil drops']","oil drops 1.3% after housing data, gold holds holds housing data gold drops housing data oil drops",-1,-0.04882405,0.07773624
03-08-2011,http://www.marketwatch.com/story/gold-at-167050-near-days-intraday-record-2011-08-03,"gold at $1,670.50, near day's intraday record",1,0,0,0,1,0,positive,"['near', '670 50', 'record', 'gold', 'day intraday']","gold at $1,670.50, near day's intraday record near 670 50 record gold day intraday",-1,0.18571846,0.10556636
17-05-2016,https://economictimes.indiatimes.com/markets/commodities/news/gold-slips-below-rs-30000-on-weak-global-cues-muted-demand/articleshow/52307938.cms,"gold slips below rs 30,000 on weak global cues, muted demand",0,0,1,0,1,0,negative,"['global cues', 'weak global', '30 000', 'slips rs', 'muted demand']","gold slips below rs 30,000 on weak global cues, muted demand global cues weak global 30 000 slips rs muted demand",19,-0.104903564,0.079271205
17-01-2018,https://www.metalsdaily.com/link/275852/india-gst-other-such-policies-to-boost-gold-demand-says-world-gold-council.htm,"india : gst, other such policies to boost gold demand, says world gold council",0,0,0,0,1,0,none,"['policies boost', 'india', 'demand says', 'says world gold', 'gst policies']","india : gst, other such policies to boost gold demand, says world gold council policies boost india demand says says world gold gst policies",-1,-0.29019588,0.119696505
16-10-2017,https://economictimes.indiatimes.com/markets/commodities/news/gold-eases-amid-firm-dollar-stronger-equities/articleshow/61096492.cms,"gold holds above $1,300 but firm dollar weighs",0,1,0,1,1,0,neutral,"['firm', 'weighs', 'holds 300', 'gold', 'dollar weighs']","gold holds above $1,300 but firm dollar weighs firm weighs holds 300 gold dollar weighs",-1,0.10418886,0.10785174
03-07-2018,http://www.marketwatch.com/story/august-gold-gains-1170-or-09-to-125340oz-2018-07-03,"august gold gains $11.70, or 0.9%, to $1,253.40/oz",1,0,0,0,1,0,positive,"['11 70 253', '40 oz', 'gains', 'gold', 'august']","august gold gains $11.70, or 0.9%, to $1,253.40/oz 11 70 253 40 oz gains gold august",21,0.40331453,0.17966387
28-09-2011,https://www.thehindubusinessline.com/markets/gold/Gold-futures-decline-0.97-on-global-cues/article20341693.ece,Gold futures decline 0.97% on global cues,0,0,1,0,1,0,negative,"['97', 'global', 'cues', 'futures decline', 'gold futures decline']",Gold futures decline 0.97% on global cues 97 global cues futures decline gold futures decline,22,-0.12381426,-0.39136732
16-11-2017,https://economictimes.indiatimes.com/markets/commodities/news/gold-breaks-3-day-rise-down-rs-100-on-global-cues-low-demand/articleshow/61672230.cms,"gold breaks 3-day rise, down rs 100 on global cues, low demand",0,0,1,0,1,0,negative,"['breaks day', 'global cues low', 'rise', 'rs 100', 'gold']","gold breaks 3-day rise, down rs 100 on global cues, low demand breaks day global cues low rise rs 100 gold",-1,-0.1434357,0.104916304
20-06-2013,http://www.marketwatch.com/story/aug-gold-closes-down-8780-at-128620-per-oz-2013-06-20,"aug. gold closes $down $87.80 at $1,286.20 per oz.",0,0,1,0,1,0,negative,"['20', '87 80 286', 'closes', 'aug gold', 'oz']","aug. gold closes $down $87.80 at $1,286.20 per oz. 20 87 80 286 closes aug gold oz",21,0.4449672,0.03629952
17-07-2017,http://www.marketwatch.com/story/gold-settles-at-a-more-than-two-week-high-2017-07-17,Gold settles at a more than two-week high,1,0,0,0,1,0,positive,"['high', 'week', 'settles', 'gold', 'gold settles']",Gold settles at a more than two-week high high week settles gold gold settles,20,0.062253818,-0.065972894
07-12-2014,http://www.investing.com/news/commodities-news/gold---silver---copper-futures---weekly-outlook:-december-8---12-319314,Gold / Silver / Copper futures - weekly outlook: December 8 - 12,0,0,0,1,1,0,none,"['outlook', 'december 12', 'weekly', 'futures', 'silver copper']",Gold / Silver / Copper futures - weekly outlook: December 8 - 12 outlook december 12 weekly futures silver copper,16,-0.058380574,-0.31638834
09-01-2008,http://www.marketwatch.com/story/feb-gold-ends-up-140-at-88170-an-ounce-on-nymex-2008-01-09,feb. gold ends up $1.40 at $881.70 an ounce on nymex,1,0,0,0,1,0,positive,"['40 881 70', 'feb', 'nymex', 'ounce', 'gold ends']",feb. gold ends up $1.40 at $881.70 an ounce on nymex 40 881 70 feb nymex ounce gold ends,21,0.40400946,0.038242787
23-08-2018,https://www.thehindubusinessline.com/markets/gold/gold-falls-as-new-trade-tariffs-rate-hike-view-buoy-dollar/article24760164.ece,"Gold falls as new trade tariffs, rate-hike view buoy dollar",0,0,1,1,1,0,negative,"['view buoy', 'falls new', 'gold', 'rate hike', 'trade tariffs rate']","Gold falls as new trade tariffs, rate-hike view buoy dollar view buoy falls new gold rate hike trade tariffs rate",-1,-0.15878598,0.124388106
18-12-2015,http://www.investing.com/news/commodities-news/gold-regains-ground-on-softer-dollar-376713,gold regains ground on softer dollar,1,0,0,1,1,0,positive,"['regains', 'softer', 'ground', 'dollar', 'gold regains ground']",gold regains ground on softer dollar regains softer ground dollar gold regains ground,-1,-0.042056233,0.12632239
30-09-2016,https://www.thehindubusinessline.com/markets/gold/gold-inches-up-as-stocks-fall-on-deutsche-bank-worries/article9167452.ece,Gold inches up as stocks fall on Deutsche Bank worries,1,0,0,0,1,0,positive,"['inches', 'deutsche', 'gold', 'bank worries', 'stocks fall']",Gold inches up as stocks fall on Deutsche Bank worries inches deutsche gold bank worries stocks fall,-1,-0.10933794,0.10316564
30-04-2014,"http://www.investing.com/news/commodities-news/gold,-silver-decline-as-investors-await-u.s.-gdp-data,-fomc-decision-280652","Gold, silver decline as investors await U.S. GDP data, FOMC decision",0,0,1,1,1,0,negative,"['await gdp data', 'gdp data', 'fomc decision', 'decline investors', 'gold silver']","Gold, silver decline as investors await U.S. GDP data, FOMC decision await gdp data gdp data fomc decision decline investors gold silver",-1,-0.15759277,0.09634724
04-11-2011,https://economictimes.indiatimes.com/markets/commodities/gold-up-by-rs-420-silver-by-rs-1100-on-wedding-season-demand/articleshow/10606149.cms,"gold up by rs 420, silver by rs 1,100 on wedding season demand",1,0,0,1,1,0,positive,"['season demand', 'rs 420', 'gold', 'wedding', '100 wedding']","gold up by rs 420, silver by rs 1,100 on wedding season demand season demand rs 420 gold wedding 100 wedding",-1,0.03616245,0.111636996
22-05-2018,https://www.metalsdaily.com/link/279859/charts-a-hangman-and-a-hammer-are-identified-in-gold-and-the-dollar-index.htm,charts : a hangman and a hammer are identified in gold and the dollar index,0,0,0,1,1,0,none,"['index', 'charts', 'hangman', 'hammer identified', 'gold dollar']",charts : a hangman and a hammer are identified in gold and the dollar index index charts hangman hammer identified gold dollar,-1,-0.052800715,0.17121683
26-08-2009,http://www.marketwatch.com/story/gold-falls-as-dollar-rises-etf-holdings-decline-2009-08-26,"gold falls as dollar strengthens, etf holdings decline",0,0,1,1,1,0,negative,"['strengthens', 'dollar', 'etf', 'holdings decline', 'gold falls']","gold falls as dollar strengthens, etf holdings decline strengthens dollar etf holdings decline gold falls",-1,-0.16109198,0.046617147
23-11-2017,https://economictimes.indiatimes.com/markets/commodities/news/gold-inches-down-amid-fed-inflation-concerns/articleshow/61762464.cms,gold inches down amid fed inflation concerns,0,0,1,0,1,0,negative,"['amid', 'inches', 'fed', 'gold', 'inflation concerns']",gold inches down amid fed inflation concerns amid inches fed gold inflation concerns,-1,-0.007600993,0.0062969327
13-09-2016,http://www.marketwatch.com/story/gold-futures-tip-lower-as-the-us-dollar-strengthens-2016-09-13,Gold futures tip lower as the U.S. dollar strengthens,0,0,1,1,1,0,negative,"['strengthens', 'lower', 'futures', 'tip', 'gold futures']",Gold futures tip lower as the U.S. dollar strengthens strengthens lower futures tip gold futures,-1,-0.0719174,-0.37992185
09-06-2003,http://www.marketwatch.com/story/gold-closes-lower-analysts-cautiously-optimistic-2003-06-09,gold closes lower monday,0,0,1,0,1,0,negative,"['lower', 'gold', 'monday', 'gold closes', 'closes lower monday']",gold closes lower monday lower gold monday gold closes closes lower monday,-1,-0.008526653,-0.108945355
21-09-2017,http://www.marketwatch.com/story/gold-slides-15-falls-below-1300-an-ounce-for-first-time-in-september-2017-09-21,"Gold slides 1.5%, falls below $1,300 an ounce for first time in September",0,0,1,0,1,0,negative,"['time september', 'falls', 'slides', 'gold', '300 ounce time']","Gold slides 1.5%, falls below $1,300 an ounce for first time in September time september falls slides gold 300 ounce time",-1,0.34781396,0.092026725
24-05-2018,https://www.thehindubusinessline.com/opinion/columns/aarati-krishnan/is-indias-gold-rush-coming-to-an-end/article23980218.ece,Is India's gold rush coming to an end?,0,0,0,0,1,0,none,"['coming', 'end', 'rush', 'india', 'india gold']",Is India's gold rush coming to an end? coming end rush india india gold,-1,-0.23944274,0.01462391
01-09-2017,https://economictimes.indiatimes.com/markets/commodities/news/gold-trades-flat-in-morning-deals-silver-down/articleshow/60319737.cms,gold trades flat in morning deals; silver down,0,0,1,1,1,0,negative,"['morning', 'flat', 'trades', 'gold', 'deals silver']",gold trades flat in morning deals; silver down morning flat trades gold deals silver,8,-0.06958942,0.048465937
28-07-2015,http://www.marketwatch.com/story/aug-gold-down-20-cents-to-settle-at-109620oz-on-comex-2015-07-28,"aug. gold down 20 cents to settle at $1,096.20/oz on comex",0,0,1,0,1,0,negative,"['096 20', 'comex', 'oz', 'aug gold', 'cents settle']","aug. gold down 20 cents to settle at $1,096.20/oz on comex 096 20 comex oz aug gold cents settle",-1,0.40896028,0.030971922
17-08-2006,http://www.marketwatch.com/story/dec-gold-drops-7-or-11-to-632oz-in-afternoon-trade-2006-08-17,"dec. gold drops $7, or 1.1%, to $632/oz in afternoon trade",0,0,1,0,1,0,negative,"['632', 'dec', 'oz', 'afternoon trade', 'gold drops']","dec. gold drops $7, or 1.1%, to $632/oz in afternoon trade 632 dec oz afternoon trade gold drops",-1,0.35408175,0.037077315
30-11-2004,http://www.marketwatch.com/story/feb-gold-falls-260-to-end-the-day-at-45320-in-ny-2004-11-30,feb gold falls $2.60 to end the day at $453.20 in ny,0,0,1,0,1,0,negative,"['453 20 ny', 'falls', '60 end day', 'gold', 'feb']",feb gold falls $2.60 to end the day at $453.20 in ny 453 20 ny falls 60 end day gold feb,-1,0.3449725,0.024155665
16-12-2002,http://www.marketwatch.com/story/gold-prices-hit-338-issues-shoot-up-2002-12-16,"gold prices hit $338, issues shoot up",1,0,0,0,1,0,positive,"['hit', 'issues', 'prices', '338 issues shoot', 'gold prices']","gold prices hit $338, issues shoot up hit issues prices 338 issues shoot gold prices",-1,0.05297801,0.0862225
17-08-2016,http://www.marketwatch.com/story/gold-futures-extend-losses-in-electronic-trading-after-fomc-minutes-2016-08-17,Gold futures extend losses in electronic trading after FOMC minutes,0,0,1,0,1,0,negative,"['electronic', 'minutes', 'extend losses', 'fomc', 'gold futures extend']",Gold futures extend losses in electronic trading after FOMC minutes electronic minutes extend losses fomc gold futures extend,-1,-0.14656654,-0.3633735
21-04-2016,https://www.moneycontrol.com/news/business/markets/gold-climbs-rs-400-silver-zooms-rs-2400global-cues-1021445.html,"gold climbs rs 400, silver zooms rs 2,400 on global cues",1,0,0,1,1,0,positive,"['climbs', 'cues', '400 global', 'silver', 'zooms rs']","gold climbs rs 400, silver zooms rs 2,400 on global cues climbs cues 400 global silver zooms rs",-1,-0.18616319,0.09516865
25-08-2011,https://www.thehindubusinessline.com/markets/gold/gold-silver-plunges-on-global-meltdown/article23057665.ece,"Gold, silver plunges on global meltdown",0,0,1,1,1,0,negative,"['global', 'plunges', 'meltdown', 'gold silver', 'gold silver plunges']","Gold, silver plunges on global meltdown global plunges meltdown gold silver gold silver plunges",-1,-0.20503539,0.10793199
25-03-2016,https://economictimes.indiatimes.com/markets/commodities/indian-gold-refining-units-are-now-focusing-on-scrap-jewellery/articleshow/51544567.cms,indian gold refining units are now focusing on scrap jewellery,0,0,0,0,1,0,none,"['units focusing', 'indian', 'gold', 'refining', 'scrap jewellery']",indian gold refining units are now focusing on scrap jewellery units focusing indian gold refining scrap jewellery,-1,-0.23821335,0.08612849
29-05-2018,https://www.metalsdaily.com/link/280023/gold-falls-as-dollar-gains-but-finds-some-support-tied-to-eurozone-concerns.htm,gold falls as dollar gains but finds some support tied to eurozone concerns,0,0,1,1,1,0,negative,"['falls', 'support tied', 'gold', 'dollar gains finds', 'eurozone concerns']",gold falls as dollar gains but finds some support tied to eurozone concerns falls support tied gold dollar gains finds eurozone concerns,-1,-0.14763145,0.036762543
30-10-2017,http://www.investing.com/news/commodities-news/gold-prices-fall-in-asia-after-official-china-pmi-dampens-sentiment-760609,Gold Prices Fall In Asia After Official China PMI Dampens Sentiment,0,0,1,0,1,0,negative,"['fall', 'dampens sentiment', 'pmi dampens', 'asia official china', 'gold prices']",Gold Prices Fall In Asia After Official China PMI Dampens Sentiment fall dampens sentiment pmi dampens asia official china gold prices,-1,-0.21038449,0.13035755
28-08-2017,http://www.investing.com/news/commodities-news/gold-prices-remain-supported-on-weaker-dollar-522966,Gold prices remain supported on weaker dollar,0,1,0,1,1,0,neutral,"['remain', 'supported', 'weaker', 'prices remain', 'gold prices']",Gold prices remain supported on weaker dollar remain supported weaker prices remain gold prices,-1,-0.058607742,0.11759578
20-10-2011,https://www.thehindubusinessline.com/markets/gold/gold-loses-rs-255-silver-rs-1100-on-weak-asian-cues/article23057495.ece,"Gold loses Rs 255, silver Rs 1,100 on weak Asian cues",0,0,1,1,1,0,negative,"['weak asian', 'rs 100', 'cues', 'loses rs 255', 'gold loses']","Gold loses Rs 255, silver Rs 1,100 on weak Asian cues weak asian rs 100 cues loses rs 255 gold loses",-1,-0.17826189,0.15775107
27-11-2014,http://www.investing.com/news/commodities-news/gold-futures-drift-lower;-u.s.-markets-closed-for-thanksgiving-318273,gold futures drift lower; u.s. markets closed for thanksgiving,0,0,1,0,1,0,negative,"['lower', 'drift', 'thanksgiving', 'markets closed', 'gold futures']",gold futures drift lower; u.s. markets closed for thanksgiving lower drift thanksgiving markets closed gold futures,-1,-0.11469683,-0.3705119
21-12-2011,https://economictimes.indiatimes.com/markets/commodities/gold-glitters-with-second-biggest-gain-in-2011-up-by-rs-1025/articleshow/11192962.cms,gold glitters with second biggest gain in 2011; up by rs 1025,1,0,0,0,1,0,positive,"['2011', 'second biggest', 'rs 1025', 'biggest gain', 'gold glitters']",gold glitters with second biggest gain in 2011; up by rs 1025 2011 second biggest rs 1025 biggest gain gold glitters,-1,-0.033380777,0.19266982
07-10-2013,https://www.thehindubusinessline.com/markets/gold/Gold-futures-rise-to-Rs-29000-per-10-gm/article20673213.ece,"Gold futures rise to Rs 29,000 per 10 gm",1,0,0,0,1,0,positive,"['gm', '29', '000 10', 'rise rs', 'gold futures']","Gold futures rise to Rs 29,000 per 10 gm gm 29 000 10 rise rs gold futures",23,-0.047272846,-0.36025208
13-07-2006,http://www.marketwatch.com/story/august-gold-up-560-at-660oz-in-electronic-trading-2006-07-13,august gold up $5.60 at $660/oz in electronic trading,1,0,0,0,1,0,positive,"['60 660', 'august', 'oz', 'gold', 'electronic trading']",august gold up $5.60 at $660/oz in electronic trading 60 660 august oz gold electronic trading,-1,0.35668278,0.099606805
25-11-2009,http://www.marketwatch.com/story/dec-gold-ends-up-18-at-1187-an-ounce-2009-11-25,dec. gold ends up 1.8% at $1187 an ounce,1,0,0,0,1,0,positive,"['1187', 'ends', 'dec', 'gold', 'ounce']",dec. gold ends up 1.8% at $1187 an ounce 1187 ends dec gold ounce,21,0.4602363,0.073136844
23-08-2011,http://www.marketwatch.com/story/oil-up-at-nearly-85-gold-declines-11-2011-08-23,oil up at nearly $85; gold declines 1.1%,0,0,1,1,1,0,negative,"['nearly', '85', 'oil', 'declines', 'gold declines']",oil up at nearly $85; gold declines 1.1% nearly 85 oil declines gold declines,-1,0.16656528,0.06213065
20-07-2016,http://www.marketwatch.com/story/fresnillo-lifts-gold-forecast-warns-on-loss-2016-07-20,fresnillo lifts gold forecast; warns on loss,0,0,0,0,0,1,none,"['loss', 'lifts', 'fresnillo', 'forecast warns', 'gold forecast']",fresnillo lifts gold forecast; warns on loss loss lifts fresnillo forecast warns gold forecast,-1,-0.20457035,-0.11758089
30-12-2011,http://www.marketwatch.com/story/gold-moves-back-up-after-string-of-losses-2011-12-30,gold moves back up after string of losses,1,0,0,0,1,0,positive,"['string', 'moves', 'moves string', 'gold', 'losses']",gold moves back up after string of losses string moves moves string gold losses,-1,-0.12066934,0.08621045
23-06-2004,http://www.marketwatch.com/story/spot-gold-quoted-at-39480-up-005-from-ny-2004-06-23,"spot gold quoted at $394.80, up 0.05% from ny",1,0,0,0,1,0,positive,"['394 80 05', '80', 'quoted', 'ny', 'spot gold']","spot gold quoted at $394.80, up 0.05% from ny 394 80 05 80 quoted ny spot gold",9,0.2570582,0.12691784
16-12-2015,http://www.marketwatch.com/story/gold-rebounds-as-federal-reserve-interest-rate-hike-looms-2015-12-16,"gold slips below $1,070 after fed lifts interest rates",0,0,1,0,1,0,negative,"['070', 'lifts', 'rates', 'fed', 'gold slips']","gold slips below $1,070 after fed lifts interest rates 070 lifts rates fed gold slips",-1,0.0060089827,-0.033207178
21-10-2011,https://www.moneycontrol.com/news/business/markets/-2034449.html,MCX GOLD April contract gains 1%,1,0,0,0,1,0,positive,"['contract', 'gold', 'april', 'gains', 'mcx']",MCX GOLD April contract gains 1% contract gold april gains mcx,1,0.034771487,-0.010283761
24-04-2013,http://www.marketwatch.com/story/gold-futures-at-highest-close-since-april-12-2013-04-24,gold futures at highest close since april 12,1,0,0,0,1,0,positive,"['12', 'highest', 'gold', 'close april', 'futures']",gold futures at highest close since april 12 12 highest gold close april futures,-1,-0.033065826,-0.46637225
10-12-2018,https://www.metalsdaily.com/link/287672/is-an-inverted-yield-curve-bullish-for-the-gold-price.htm,is an inverted yield curve bullish for the gold price?,0,0,0,0,1,0,none,"['curve', 'yield', 'inverted', 'bullish', 'gold price']",is an inverted yield curve bullish for the gold price? curve yield inverted bullish gold price,-1,-0.13228317,0.06441941
17-10-2016,https://www.moneycontrol.com/news/business/markets/gold-futures-rise-rs-34global-cues-956712.html,gold futures rise rs 34 on global cues,1,0,0,0,1,0,positive,"['cues', '34', 'rs', 'global', 'gold futures rise']",gold futures rise rs 34 on global cues cues 34 rs global gold futures rise,22,-0.19055702,-0.24950084
11-08-2014,http://www.marketwatch.com/story/gold-holds-ground-as-equities-power-higher-2014-08-11,gold retreats as stocks extend gains,0,0,1,0,1,0,negative,"['extend', 'gold', 'stocks', 'retreats', 'stocks extend gains']",gold retreats as stocks extend gains extend gold stocks retreats stocks extend gains,-1,-0.26329398,0.0013461038
13-11-2017,https://economictimes.indiatimes.com/markets/commodities/news/gold-prices-inch-lower-as-stronger-dollar-weighs/articleshow/61622056.cms,"gold prices trade in range, but us rate hike view weighs",0,1,0,0,1,0,neutral,"['trade', 'weighs', 'range rate', 'hike view', 'gold prices']","gold prices trade in range, but us rate hike view weighs trade weighs range rate hike view gold prices",-1,-0.124586105,0.08621359
09-06-2017,http://www.marketwatch.com/story/august-gold-falls-810-or-06-to-settle-at-127140oz-2017-06-09,"August gold falls $8.10, or 0.6%, to settle at $1,271.40/oz",0,0,1,0,1,0,negative,"['271 40', 'settle', 'falls', '40 oz', 'august gold']","August gold falls $8.10, or 0.6%, to settle at $1,271.40/oz 271 40 settle falls 40 oz august gold",21,0.5038378,0.07934681
23-04-2004,http://www.marketwatch.com/story/gold-prices-rise-but-end-lower-for-the-week-2004-04-23,"gold prices rise, but end lower for the week",1,0,1,0,1,0,positive,"['end', 'rise end lower', 'week', 'prices rise', 'gold prices']","gold prices rise, but end lower for the week end rise end lower week prices rise gold prices",-1,-0.033051863,-0.030593537
02-01-2001,http://www.marketwatch.com/story/gold-shares-climb-as-prices-inch-lower,gold shares climb as prices fall,1,0,0,0,1,0,positive,"['fall', 'gold', 'shares', 'prices fall', 'shares climb prices']",gold shares climb as prices fall fall gold shares prices fall shares climb prices,-1,-0.11735611,0.08583132
18-10-2017,https://economictimes.indiatimes.com/markets/commodities/news/gold-sparkles-on-diwali-demand-tops-rs-31000/articleshow/61131321.cms,"gold sparkles on diwali demand, tops rs 31,000",1,0,0,0,1,0,positive,"['31', 'tops rs', 'demand', 'diwali', 'gold sparkles']","gold sparkles on diwali demand, tops rs 31,000 31 tops rs demand diwali gold sparkles",-1,-0.030971088,0.11679265
09-11-2016,http://www.marketwatch.com/story/gold-futures-trade-flat-to-lower-less-than-a-half-hour-before-settlement-2016-11-09,Gold futures trade flat to lower less than a half hour before settlement,0,0,1,0,1,0,negative,"['trade', 'flat', 'settlement', 'lower half hour', 'gold futures']",Gold futures trade flat to lower less than a half hour before settlement trade flat settlement lower half hour gold futures,-1,-0.05285999,-0.41337314
24-06-2013,https://www.thehindubusinessline.com/markets/gold/gold-silver-prices-slip-on-fed-outlook/article23112066.ece,"Gold, silver prices slip on Fed outlook",0,0,1,1,1,0,negative,"['slip', 'prices', 'outlook', 'fed', 'gold silver prices']","Gold, silver prices slip on Fed outlook slip prices outlook fed gold silver prices",-1,-0.07379264,-0.02850476
03-06-2010,http://www.marketwatch.com/story/gold-settles-lower-as-sell-off-gathers-momentum-2010-06-03,gold settles lower as sell-off gathers momentum,0,0,1,0,1,0,negative,"['gathers', 'momentum', 'lower', 'sell', 'gold settles']",gold settles lower as sell-off gathers momentum gathers momentum lower sell gold settles,-1,-0.010362104,0.009928547
09-11-2016,https://www.thehindubusinessline.com/markets/gold/gold-rush-keep-jewellers-buzzing-past-midnight/article9323397.ece,Gold rush keep jewellers buzzing past midnight,0,0,0,0,1,0,none,"['past', 'buzzing', 'rush', 'midnight', 'jewellers']",Gold rush keep jewellers buzzing past midnight past buzzing rush midnight jewellers,-1,-0.18573381,0.051425897
31-01-2013,http://www.marketwatch.com/story/gold-futures-slip-back-after-recent-gains-2013-01-31,gold futures fall 1% after two-session climb,0,0,1,0,1,0,negative,"['session', 'fall', 'climb', 'futures', 'gold futures']",gold futures fall 1% after two-session climb session fall climb futures gold futures,-1,-0.016464844,-0.45467347
12-08-2016,http://www.marketwatch.com/story/dec-gold-down-680-or-05-to-settle-at-134320oz-2016-08-12,"Dec. gold down $6.80, or 0.5%, to settle at $1,343.20/oz",0,0,1,0,1,0,negative,"['343', 'dec', 'settle', 'gold 80', '20 oz']","Dec. gold down $6.80, or 0.5%, to settle at $1,343.20/oz 343 dec settle gold 80 20 oz",21,0.49409187,-0.011454448
09-05-2006,http://www.marketwatch.com/story/amex-gold-bugs-index-ends-at-a-record-39328-up-46-2006-05-09,"amex gold bugs index ends at a record 393.28, up 4.6%",1,0,0,0,1,0,positive,"['393 28', 'gold', 'ends record', 'bugs index', 'amex']","amex gold bugs index ends at a record 393.28, up 4.6% 393 28 gold ends record bugs index amex",2,-0.0001784414,-0.046396017
09-08-2018,https://www.thehindubusinessline.com/markets/gold/gold-rate/article24643246.ece,Gold rate,0,0,0,0,1,0,none,[],Gold rate ,-1,0.11147334,0.13015938
12-10-2012,https://www.moneycontrol.com/news/business/stocks/-2009967.html,buy gold on dips around rs 31370: nirmal bang,0,0,0,0,1,0,none,"['31370', 'rs', 'nirmal', 'dips', 'buy gold']",buy gold on dips around rs 31370: nirmal bang 31370 rs nirmal dips buy gold,-1,-0.0007290393,0.15706629
01-11-2018,https://economictimes.indiatimes.com/markets/commodities/news/gold-rate-today-gold-silver-trade-higher-on-raised-demand/articleshow/66458171.cms,"Gold Rate Today: Gold, silver rise on higher demand",1,0,0,1,1,0,positive,"['today', 'rise higher', 'rate', 'demand', 'gold silver']","Gold Rate Today: Gold, silver rise on higher demand today rise higher rate demand gold silver",-1,-0.10048701,0.21136084
14-02-2017,http://www.marketwatch.com/story/april-gold-settles-little-changed-down-40-cents-at-122540oz-2017-02-14,"April gold settles little changed, down 40 cents at $1,225.40/oz",0,0,1,0,1,0,negative,"['little changed', 'april', '40 oz', 'cents 225 40', 'gold settles']","April gold settles little changed, down 40 cents at $1,225.40/oz little changed april 40 oz cents 225 40 gold settles",-1,0.45876932,0.07431119
18-09-2018,https://www.metalsdaily.com/link/283228/chinese-gold-panda-coins-now-trading-on-the-shanghai-gold-.htm,chinese gold panda coins now trading on the shanghai gold ...,0,0,0,0,1,0,none,"['trading', 'gold', 'shanghai', 'coins', 'panda']",chinese gold panda coins now trading on the shanghai gold ... trading gold shanghai coins panda,-1,-0.18811576,0.10329467
18-03-2013,https://www.thehindubusinessline.com/markets/gold/gold-futures-open-higher-at-rs-29440/article20591675.ece1,"Gold futures open higher at Rs 29,440",1,0,0,0,1,0,positive,"['rs', '29', '440', 'open higher', 'gold futures']","Gold futures open higher at Rs 29,440 rs 29 440 open higher gold futures",23,-0.047757372,-0.38419932
16-11-2007,http://www.marketwatch.com/story/dec-gold-ends-down-30-cents-at-787-an-ounce-on-nymex-2007-11-16,dec. gold ends down 30 cents at $787 an ounce on nymex,0,0,1,0,1,0,negative,"['dec', '30', 'nymex', 'cents 787 ounce', 'gold ends']",dec. gold ends down 30 cents at $787 an ounce on nymex dec 30 nymex cents 787 ounce gold ends,21,0.36406785,-0.0069248974
22-11-2016,http://www.marketwatch.com/story/dec-gold-settles-at-121120oz-up-140-or-01-2016-11-22,"Dec. gold settles at $1,211.20/oz, up $1.40, or 0.1%",1,0,0,0,1,0,positive,"['dec', '40', '211 20', 'oz', 'gold settles']","Dec. gold settles at $1,211.20/oz, up $1.40, or 0.1% dec 40 211 20 oz gold settles",21,0.50608414,-0.0129713565
30-07-2015,http://www.marketwatch.com/story/investors-need-to-consider-that-gold-may-fall-to-350-an-ounce-2015-07-29,study predicts gold could plunge to $350 an ounce,1,0,0,0,1,0,positive,"['plunge', '350', 'study predicts', 'gold', 'ounce']",study predicts gold could plunge to $350 an ounce plunge 350 study predicts gold ounce,-1,0.22235237,0.023530029
25-01-2012,http://www.marketwatch.com/story/can-gold-regain-its-glitter-2012-01-24,can gold regain its glitter?,0,0,0,0,0,1,none,"['regain', 'gold', 'gold regain', 'glitter', 'regain glitter']",can gold regain its glitter? regain gold gold regain glitter regain glitter,-1,-0.1078058,0.14214598
08-05-2017,http://www.marketwatch.com/story/june-gold-falls-30-cents-to-trade-at-122660oz-2017-05-08,"June gold falls 30 cents to trade at $1,226.60/oz",0,0,1,0,1,0,negative,"['june', 'trade 226', '60 oz', 'gold falls', 'falls 30 cents']","June gold falls 30 cents to trade at $1,226.60/oz june trade 226 60 oz gold falls falls 30 cents",-1,0.36318403,0.0826447
06-02-2018,https://www.moneycontrol.com/news/business/economy/indias-gold-demand-went-up-by-9-to-727-tonne-in-2017-2500643.html,India's gold demand went up by 9% to 727 tonne in 2017,0,0,0,0,1,0,none,"['went', '2017', '727', 'tonne', 'india gold demand']",India's gold demand went up by 9% to 727 tonne in 2017 went 2017 727 tonne india gold demand,11,-0.06389119,0.16712883
13-06-2017,http://www.marketwatch.com/story/august-gold-off-440-or-04-at-126450oz-2017-06-13,"August gold off $4.40, or 0.4%, at $1,264.50/oz.",0,0,1,0,1,0,negative,"['40 264 50', '50', 'august', 'gold', 'oz']","August gold off $4.40, or 0.4%, at $1,264.50/oz. 40 264 50 50 august gold oz",21,0.5069815,0.13771999
12-07-2018,https://www.metalsdaily.com/link/281144/charts-gold-testing-crucial-level.htm,charts : gold testing crucial level,0,0,0,0,1,0,none,"['crucial', 'level', 'testing', 'charts', 'gold testing']",charts : gold testing crucial level crucial level testing charts gold testing,-1,-0.18790723,0.08986567
25-10-2015,http://www.investing.com/news/commodities-news/gold-prices-down-in-asia-with-central-bank-moves-in-focus-367842,gold prices down in asia with central bank moves in focus,0,0,1,0,1,0,negative,"['central', 'moves focus', 'asia', 'bank moves', 'gold prices']",gold prices down in asia with central bank moves in focus central moves focus asia bank moves gold prices,-1,-0.19666146,0.077076614
23-07-2015,http://www.marketwatch.com/story/an-open-letter-to-investors-who-are-bullish-on-gold-2015-07-23-1210307,an open letter to investors who are bullish on gold,0,0,0,0,1,0,none,"['open', 'letter', 'bullish', 'letter investors', 'investors bullish gold']",an open letter to investors who are bullish on gold open letter bullish letter investors investors bullish gold,-1,-0.18524864,0.12480596
02-08-2017,https://www.moneycontrol.com/news/business/stocks/expect-gold-to-trade-negative-sushil-finance-3-2342651.html,Expect Gold to trade negative: Sushil Finance,0,0,1,0,0,1,negative,"['trade', 'sushil', 'negative', 'finance', 'expect gold']",Expect Gold to trade negative: Sushil Finance trade sushil negative finance expect gold,-1,-0.15903346,0.07324059
30-05-2014,http://www.marketwatch.com/story/comex-gold-down-35-on-week-loses-39-on-month-2014-05-30,"comex gold down 3.5% on week, loses 3.9% on month",0,0,1,0,1,0,negative,"['month', 'loses', 'comex', 'gold', 'week loses month']","comex gold down 3.5% on week, loses 3.9% on month month loses comex gold week loses month",-1,0.05224426,-0.042849228
18-09-2017,http://www.marketwatch.com/story/gold-struggles-at-multiweek-lows-as-stocks-march-yet-higher-2017-09-18,Gold ends at 3-week low as U.S. stock indexes tap record highs,0,0,1,0,1,0,negative,"['week', 'tap record', 'highs', 'stock indexes', 'gold ends']",Gold ends at 3-week low as U.S. stock indexes tap record highs week tap record highs stock indexes gold ends,-1,-0.09024741,-0.033891335
12-02-2004,http://www.marketwatch.com/story/gold-ends-atop-414-on-low-interest-rate-signals-2004-02-12,gold tops $414 on low rate signals,0,0,1,0,1,0,negative,"['414', 'tops', 'rate signals', 'gold', 'low rate signals']",gold tops $414 on low rate signals 414 tops rate signals gold low rate signals,-1,0.010052845,0.110481516
11-09-2017,https://www.moneycontrol.com/news/business/markets/gold-retreats-from-one-year-high-as-dollar-gains-ground-2384111.html,gold retreats from one-year high as dollar gains ground,1,0,0,1,1,0,positive,"['year high', 'ground', 'retreats year', 'gold', 'dollar gains']",gold retreats from one-year high as dollar gains ground year high ground retreats year gold dollar gains,-1,-0.04916966,-0.043850124
29-07-2017,https://economictimes.indiatimes.com/markets/commodities/news/silver-rises-on-global-cues-gold-steady/articleshow/59821040.cms,"silver rises on global cues, gold steady",1,0,0,1,1,0,positive,"['global', 'steady', 'cues', 'rises', 'silver']","silver rises on global cues, gold steady global steady cues rises silver",-1,-0.18770343,0.1788396
04-03-2008,http://www.marketwatch.com/story/april-gold-up-160-at-98580-an-ounce-on-nymex-2008-03-04,april gold up $1.60 at $985.80 an ounce on nymex,1,0,0,0,1,0,positive,"['60', 'nymex', 'gold', 'april', '985 80 ounce']",april gold up $1.60 at $985.80 an ounce on nymex 60 nymex gold april 985 80 ounce,21,0.37559187,0.07400516
23-11-2011,https://economictimes.indiatimes.com/markets/commodities/gold-falls-to-rs-29240-silver-adds-rs-800/articleshow/10842606.cms,"gold falls to rs 29,240; silver adds rs 800",0,0,1,1,1,0,negative,"['800', '29 240', 'falls rs', 'gold falls', 'silver adds']","gold falls to rs 29,240; silver adds rs 800 800 29 240 falls rs gold falls silver adds",-1,0.07877481,0.13963977
11-02-2018,http://www.investing.com/news/commodities-news/gold-prices-gain-in-asia-with-chinese-new-year-trade-in-focus-1229285,gold prices gain in asia with chinese new year trade in focus,1,0,0,0,1,0,positive,"['gain', 'new year', 'trade focus', 'asia chinese', 'gold prices']",gold prices gain in asia with chinese new year trade in focus gain new year trade focus asia chinese gold prices,-1,-0.20650598,0.13246514
12-10-2017,http://www.marketwatch.com/story/gold-rises-tries-to-regain-grip-on-1300-level-2017-10-12,Gold prices tally highest finish in over two weeks,1,0,0,0,1,0,positive,"['finish', 'weeks', 'highest', 'prices tally', 'gold prices']",Gold prices tally highest finish in over two weeks finish weeks highest prices tally gold prices,-1,0.04025574,0.00084569305
0200-04-13,http://www.marketwatch.com/story/spot-gold-quoted-at-59790-in-asia-trade-2006-04-13,spot gold quoted at $597.90 in asia trade,1,0,0,0,1,0,positive,"['quoted', 'trade', '597 90', '90 asia', 'spot gold']",spot gold quoted at $597.90 in asia trade quoted trade 597 90 90 asia spot gold,10,0.059536085,0.1303515
06-01-2017,https://economictimes.indiatimes.com/markets/commodities/news/gold-silver-turn-weak-on-global-cues-slack-demand/articleshow/56373343.cms,"gold, silver turn weak on global cues, slack demand",0,0,1,1,1,0,negative,"['global', 'turn weak', 'cues', 'slack demand', 'gold silver']","gold, silver turn weak on global cues, slack demand global turn weak cues slack demand gold silver",19,-0.23350859,0.17216113
13-09-2012,http://www.marketwatch.com/story/gold-at-highest-in-nearly-seven-months-after-fed-2012-09-13,gold at highest in nearly seven months after fed,1,0,0,0,1,0,positive,"['nearly', 'seven', 'nearly seven months', 'fed', 'gold highest']",gold at highest in nearly seven months after fed nearly seven nearly seven months fed gold highest,-1,-0.052891687,0.05484158
28-08-2008,http://www.marketwatch.com/story/gold-erases-gains-turning-lower-as-the-dollar-gains-2008-08-28,"gold erases gains, turning lower as the dollar gains",1,0,0,1,1,0,positive,"['turning', 'lower', 'erases', 'gold', 'dollar gains']","gold erases gains, turning lower as the dollar gains turning lower erases gold dollar gains",-1,-0.0475567,0.13928446
11-02-2015,https://www.thehindubusinessline.com/markets/commodities/gold-edges-up-as-investors-eye-greek-debt-crisis/article6881808.ece,Gold edges up as investors eye Greek debt crisis,1,0,0,0,1,0,positive,"['edges', 'greek', 'investors eye', 'gold', 'debt crisis']",Gold edges up as investors eye Greek debt crisis edges greek investors eye gold debt crisis,-1,-0.2451565,0.15583885
07-11-2017,https://economictimes.indiatimes.com/markets/commodities/news/gold-rate-today-gold-silver-trade-mix-in-morning-deals/articleshow/61541222.cms,"gold rate today: gold, silver trade mix in morning deals",0,1,0,1,1,0,neutral,"['trade', 'rate today', 'mix morning', 'silver', 'gold rate']","gold rate today: gold, silver trade mix in morning deals trade rate today mix morning silver gold rate",8,-0.015733808,0.057407357
08-06-2017,https://www.thehindubusinessline.com/markets/gold/gold-futures-down-at-rs-29335/article9722662.ece,"Gold futures down at Rs 29,335",0,0,1,0,1,0,negative,"['rs', '29', '335', 'futures', 'gold futures']","Gold futures down at Rs 29,335 rs 29 335 futures gold futures",23,0.016848594,-0.46243644
04-06-2014,"http://www.investing.com/news/commodities-news/gold-prices-steady-to-higher-in-asia,-ecb,-u.s.-jobs-in-focus-288084","Gold prices steady to higher in Asia, ECB, U.S. jobs in focus",1,0,0,0,1,0,positive,"['focus', 'asia', 'ecb jobs focus', 'prices steady', 'gold prices']","Gold prices steady to higher in Asia, ECB, U.S. jobs in focus focus asia ecb jobs focus prices steady gold prices",-1,-0.19103628,0.10344741
26-10-2011,http://www.marketwatch.com/story/crude-eases-back-before-european-outcome-gold-up-2011-10-26,"crude eases back before european outcome, gold up",1,0,0,1,1,0,positive,"['european', 'outcome', 'eases', 'gold', 'crude eases european']","crude eases back before european outcome, gold up european outcome eases gold crude eases european",-1,-0.17845765,-0.04364255
30-09-2010,http://www.marketwatch.com/story/gold-caps-record-setting-month-with-slight-drop-2010-09-30,gold down for first time in seven sessions,0,0,1,0,1,0,negative,"['time', 'seven', 'sessions', 'gold', 'gold time']",gold down for first time in seven sessions time seven sessions gold gold time,-1,-0.027698085,0.010226451
23-09-2015,http://www.marketwatch.com/story/dec-gold-settles-at-113150oz-on-comex-up-670-or-06-2015-09-23,"dec. gold settles at $1,131.50/oz on comex, up $6.70, or 0.6%",1,0,0,0,1,0,positive,"['70', '131 50', 'comex', 'oz', 'dec gold settles']","dec. gold settles at $1,131.50/oz on comex, up $6.70, or 0.6% 70 131 50 comex oz dec gold settles",21,0.47094685,-0.014943302
30-06-2018,https://www.moneycontrol.com/news/business/markets/gold-extends-weakness-on-global-cues-low-demand-2655101.html,"Gold extends weakness on global cues, low demand",0,0,1,0,1,0,negative,"['low', 'cues', 'extends weakness global', 'demand', 'gold extends']","Gold extends weakness on global cues, low demand low cues extends weakness global demand gold extends",-1,-0.242459,0.18569098
26-09-2006,http://www.marketwatch.com/story/dec-gold-falls-190-to-594oz-in-morning-trading-2006-09-26,dec. gold falls $1.90 to $594/oz in morning trading,0,0,1,0,1,0,negative,"['90 594', 'falls', 'oz', 'dec gold', 'morning trading']",dec. gold falls $1.90 to $594/oz in morning trading 90 594 falls oz dec gold morning trading,21,0.36929786,0.007992938
11-08-2015,"http://www.investing.com/news/commodities-news/gold-closes-slightly-higher-in-choppy-trade,-after-china-devalues-yuan-355506","Gold closes slightly higher in choppy trade, after China devalues yuan",1,1,0,0,1,0,positive,"['choppy', 'slightly higher', 'devalues yuan', 'trade china', 'gold closes']","Gold closes slightly higher in choppy trade, after China devalues yuan choppy slightly higher devalues yuan trade china gold closes",-1,-0.1609579,-0.004014477
23-09-2004,http://www.marketwatch.com/story/dec-gold-closes-at-1-mo-high-of-41260-up-360-2004-09-23,"dec gold closes at 1-mo high of $412.60, up $3.60",1,0,0,0,1,0,positive,"['60 60', 'high 412', 'gold', 'dec', 'closes mo']","dec gold closes at 1-mo high of $412.60, up $3.60 60 60 high 412 gold dec closes mo",-1,0.27498668,-0.08570874
18-07-2007,http://www.marketwatch.com/story/august-gold-up-260-at-66850-an-ounce-on-nymex-2007-07-18,august gold up $2.60 at $668.50 an ounce on nymex,1,0,0,0,1,0,positive,"['60 668 50', 'nymex', 'gold', 'august', 'ounce']",august gold up $2.60 at $668.50 an ounce on nymex 60 668 50 nymex gold august ounce,21,0.4045806,0.12329726
06-02-2013,https://economictimes.indiatimes.com/markets/stocks/announcements/world-gold-council-announces-new-managing-director-in-india/articleshow/18364340.cms,world gold council announces new managing director in india,0,0,0,0,1,0,none,"['new', 'india', 'world gold', 'council announces', 'managing director']",world gold council announces new managing director in india new india world gold council announces managing director,-1,-0.3127279,0.0585371
17-01-2018,https://www.metalsdaily.com/link/275781/chinese-physical-gold-investment-demand-surges-while-americans-pile-into-stock-and-crypto-bubbles.htm,chinese physical gold investment demand surges while americans pile into stock and crypto bubbles,0,0,0,0,1,0,none,"['stock', 'surges americans', 'chinese physical', 'crypto bubbles', 'gold investment demand']",chinese physical gold investment demand surges while americans pile into stock and crypto bubbles stock surges americans chinese physical crypto bubbles gold investment demand,-1,-0.24008073,0.20588897
01-08-2011,http://www.marketwatch.com/story/gold-bounces-off-record-to-end-06-lower-2011-08-01,gold bounces off record to end 0.6% lower,0,0,1,0,1,0,negative,"['end', 'lower', 'bounces', 'gold', 'record end lower']",gold bounces off record to end 0.6% lower end lower bounces gold record end lower,-1,-0.006975785,0.0044636577
06-11-2012,https://www.moneycontrol.com/news/business/markets/-1802795.html,invest in gold for target of rs 32000: astromoneyguru,0,0,0,0,1,0,none,"['target', 'rs', '32000', 'astromoneyguru', 'invest gold']",invest in gold for target of rs 32000: astromoneyguru target rs 32000 astromoneyguru invest gold,-1,-0.052567467,0.106466964
24-07-2018,https://www.metalsdaily.com/link/281465/reuters-analysts-slash-gold-price-forecasts-after-second-quarter-plunge.htm,reuters : analysts slash gold price forecasts after second quarter plunge,0,0,1,0,1,0,negative,"['slash', 'plunge', 'forecasts second quarter', 'gold price', 'reuters analysts']",reuters : analysts slash gold price forecasts after second quarter plunge slash plunge forecasts second quarter gold price reuters analysts,-1,-0.16499975,-0.047657788
06-11-2003,http://www.marketwatch.com/story/gold-futures-fall-as-economic-data-lifts-dollar-2003-11-06,gold futures fall as economic data lifts dollar,0,0,1,1,1,0,negative,"['lifts', 'fall', 'dollar', 'economic data', 'gold futures']",gold futures fall as economic data lifts dollar lifts fall dollar economic data gold futures,-1,-0.12131309,-0.23657316
28-12-2006,http://www.marketwatch.com/story/gold-ends-higher-marking-fourth-consecutive-rise-2006-12-28,gold gains for fourth straight session as dollar falls,1,0,0,1,1,0,positive,"['straight', 'session', 'fourth', 'dollar falls', 'gold gains']",gold gains for fourth straight session as dollar falls straight session fourth dollar falls gold gains,-1,0.039430633,0.029960867
02-03-2018,http://www.investing.com/news/commodities-news/gold-prices-remain-supported-in-riskoff-trade-1321977,gold prices remain supported in risk-off trade,0,1,0,0,1,0,neutral,"['supported', 'remain', 'trade', 'risk', 'gold prices']",gold prices remain supported in risk-off trade supported remain trade risk gold prices,-1,-0.11292848,-0.035625532
01-11-2018,https://www.metalsdaily.com/link/286519/wgc-global-september-quarter-gold-demand-steady-on-etf-outflow.htm,wgc : global september quarter gold demand steady on etf outflow,0,0,0,0,1,0,none,"['september quarter', 'gold', 'wgc global', 'etf outflow', 'demand steady']",wgc : global september quarter gold demand steady on etf outflow september quarter gold wgc global etf outflow demand steady,-1,-0.13017341,0.037484355
24-04-2017,http://www.marketwatch.com/story/gold-futures-drop-as-macron-election-win-hits-safety-plays-2017-04-24,Gold ends lower after vote soothes French euro exit fears,0,0,1,0,1,0,negative,"['soothes french', 'ends', 'gold', 'lower vote', 'euro exit fears']",Gold ends lower after vote soothes French euro exit fears soothes french ends gold lower vote euro exit fears,-1,-0.15026623,-0.08530885
05-12-2017,https://www.metalsdaily.com/link/274561/turkey-detains-17-people-in-investigation-related-to-gold-trader-zarrab-agency.htm,turkey detains 17 people in investigation related to gold trader zarrab: agency,0,0,0,0,1,0,none,"['trader', 'zarrab', 'turkey', 'detains 17 people', 'investigation related gold']",turkey detains 17 people in investigation related to gold trader zarrab: agency trader zarrab turkey detains 17 people investigation related gold,-1,-0.19608712,0.13799897
05-09-2017,http://www.marketwatch.com/story/gold-prices-mark-highest-comex-finish-since-sept-22-2017-09-05,Gold prices mark highest Comex finish since Sept. 22,1,0,0,0,1,0,positive,"['finish', 'sept 22', 'comex', 'prices mark highest', 'gold prices']",Gold prices mark highest Comex finish since Sept. 22 finish sept 22 comex prices mark highest gold prices,-1,-0.0011330694,-0.024781898
11-05-2017,http://www.marketwatch.com/story/gold-futures-settle-higher-for-a-second-straight-session-2017-05-11,Gold futures settle higher for a second straight session,1,0,0,0,1,0,positive,"['straight', 'second', 'session', 'gold futures', 'futures settle higher']",Gold futures settle higher for a second straight session straight second session gold futures futures settle higher,-1,-0.041750953,-0.4602633
15-11-2017,https://www.metalsdaily.com/link/272876/incrementum-in-gold-we-trust-2017.htm,incrementum : in gold we trust 2017,0,0,0,0,1,0,none,"['2017', 'trust', 'gold', 'incrementum', 'incrementum gold trust']",incrementum : in gold we trust 2017 2017 trust gold incrementum incrementum gold trust,-1,-0.08436507,0.057128645
26-02-2007,http://www.marketwatch.com/story/april-gold-climbs-190-to-68860oz-after-69180-high-2007-02-26,april gold climbs $1.90 to $688.60/oz after $691.80 high,1,0,0,0,1,0,positive,"['691 80 high', 'april', 'gold', 'climbs', '60 oz']",april gold climbs $1.90 to $688.60/oz after $691.80 high 691 80 high april gold climbs 60 oz,21,0.38633835,0.1031174
18-11-2017,https://www.thehindubusinessline.com/markets/gold/gold-soars-rs-325-on-wedding-season-demand-global-cues/article9966211.ece,"Gold soars Rs 325 on wedding season demand, global cues",1,0,0,0,1,0,positive,"['global cues', 'season demand', '325', 'wedding', 'gold soars rs']","Gold soars Rs 325 on wedding season demand, global cues global cues season demand 325 wedding gold soars rs",-1,-0.055773936,0.08436875
06-09-2013,http://www.marketwatch.com/story/gold-futures-rally-after-us-employment-report-2013-09-06,gold futures rally after u.s. employment report,1,0,0,0,1,0,positive,"['report', 'rally', 'employment report', 'futures', 'gold futures']",gold futures rally after u.s. employment report report rally employment report futures gold futures,-1,-0.1325447,-0.384763
24-09-2014,http://www.investing.com/news/commodities-news/gold-prices-ease-in-asia-with-support-seen-from-india-holiday-demand-310691,Gold prices ease in Asia with support seen from India holiday demand,0,0,0,0,1,0,none,"['holiday', 'seen india', 'asia support', 'prices ease', 'gold prices']",Gold prices ease in Asia with support seen from India holiday demand holiday seen india asia support prices ease gold prices,12,-0.15673414,0.1775173
27-08-2018,https://www.thehindubusinessline.com/markets/gold/gold-hits-rs-31000-mark-on-festive-buying/article24792085.ece,"Gold hits Rs 31,000-mark on festive buying",1,0,0,0,1,0,positive,"['mark', 'festive', 'buying', '31 000', 'gold hits rs']","Gold hits Rs 31,000-mark on festive buying mark festive buying 31 000 gold hits rs",-1,0.074113384,0.18151024
09-04-2012,https://www.moneycontrol.com/news/business/markets/-1955417.html,"commodity bets: expert views on crude, gold, copper, lead",1,0,0,1,1,0,positive,"['expert views', 'views crude', 'copper lead', 'bets', 'commodity']","commodity bets: expert views on crude, gold, copper, lead expert views views crude copper lead bets commodity",0,-0.20621999,-0.023537695
29-03-2017,https://economictimes.indiatimes.com/markets/stocks/news/meet-d-streets-whizkid-investor-who-stays-anonymous-but-strikes-gold-in-stocks/articleshow/57888049.cms,"meet d-street's whizkid investor who stays anonymous, but strikes gold in stocks",0,0,0,0,1,0,none,"['meet street', 'anonymous strikes', 'investor stays', 'whizkid', 'gold stocks']","meet d-street's whizkid investor who stays anonymous, but strikes gold in stocks meet street anonymous strikes investor stays whizkid gold stocks",-1,-0.13202038,0.052432466
27-07-2016,http://www.marketwatch.com/story/gold-futures-up-10-from-the-settlement-as-investors-parse-fed-statement-2016-07-27,Gold futures up $10 from the settlement as investors parse Fed statement,1,0,0,0,1,0,positive,"['parse', '10', 'fed statement', 'settlement investors', 'gold futures']",Gold futures up $10 from the settlement as investors parse Fed statement parse 10 fed statement settlement investors gold futures,-1,0.0050369054,-0.33704656
02-08-2016,http://www.marketwatch.com/story/barrick-gold-started-at-buy-with-29-stock-price-target-at-citigroup-2016-08-02,Barrick Gold started at buy with $29 stock price target at Citigroup,0,0,0,0,1,0,none,"['target citigroup', 'gold started', 'barrick', 'stock price', 'buy 29']",Barrick Gold started at buy with $29 stock price target at Citigroup target citigroup gold started barrick stock price buy 29,-1,0.0970096,0.114904776
03-11-2011,https://economictimes.indiatimes.com/markets/commodities/gold-extends-rally-up-by-rs-50-silver-recovers-by-rs-200/articleshow/10593144.cms,"gold extends rally; up by rs 50, silver recovers by rs 200",1,0,0,1,1,0,positive,"['200', 'silver', 'recovers rs', 'extends rally', 'gold extends']","gold extends rally; up by rs 50, silver recovers by rs 200 200 silver recovers rs extends rally gold extends",-1,-0.13406298,0.1702677
17-11-2016,http://www.marketwatch.com/story/gold-futures-shift-lower-ahead-of-settlement-as-dollar-climbs-2016-11-17,Gold futures shift lower ahead of settlement as dollar climbs,0,0,1,1,1,0,negative,"['climbs', 'gold', 'shift lower', 'futures', 'settlement dollar']",Gold futures shift lower ahead of settlement as dollar climbs climbs gold shift lower futures settlement dollar,-1,-0.072518006,-0.35281157
21-05-2009,https://economictimes.indiatimes.com/articleshow/4559973.cms,gold advances on firm overseas trend,1,0,0,0,1,0,positive,"['trend', 'firm', 'overseas', 'advances', 'gold']",gold advances on firm overseas trend trend firm overseas advances gold,-1,-0.29696852,0.17565393
10-11-2017,http://www.marketwatch.com/story/december-gold-settles-down-13-or-1-at-127420oz-2017-11-10,"CORRECTION: December gold settles down $13.30, or 1%, at $1,274.20/oz.",0,0,1,0,1,0,negative,"['13 30 274', 'correction', 'december', '20 oz', 'gold settles']","CORRECTION: December gold settles down $13.30, or 1%, at $1,274.20/oz. 13 30 274 correction december 20 oz gold settles",21,0.45484585,-0.008457191
05-02-2018,https://www.thehindubusinessline.com/markets/gold/gold-edges-up-to-rs-31270-silver-drops-by-rs-300-per-kg/article22657643.ece,"Gold edges up to Rs 31,270; silver drops by Rs 300 per kg",1,0,0,1,1,0,positive,"['300 kg', 'drops', 'rs 31 270', 'edges rs', 'gold']","Gold edges up to Rs 31,270; silver drops by Rs 300 per kg 300 kg drops rs 31 270 edges rs gold",-1,-3.194809e-05,0.12631206
06-12-2012,https://economictimes.indiatimes.com/markets/commodities/gold-slides-for-third-day-on-stockists-selling-global-cues/articleshow/17505887.cms,"gold slides for third day on stockists selling, global cues",0,0,1,0,1,0,negative,"['day', 'cues', 'stockists', 'selling global', 'slides']","gold slides for third day on stockists selling, global cues day cues stockists selling global slides",-1,-0.1370897,0.09971327
09-11-2017,http://www.marketwatch.com/story/december-gold-up-04-at-128850oz-2017-11-09,"December gold up 0.4% at $1,288.50/oz.",1,0,0,0,1,0,positive,"['50', '288', 'oz', 'december', 'gold']","December gold up 0.4% at $1,288.50/oz. 50 288 oz december gold",21,0.42139876,0.1305909
21-03-2006,http://www.marketwatch.com/story/spot-gold-quoted-at-55250-in-asia-trade-2006-03-21,spot gold quoted at $552.50 in asia trade,1,0,0,0,1,0,positive,"['quoted', '552 50', 'trade', 'asia', 'spot gold']",spot gold quoted at $552.50 in asia trade quoted 552 50 trade asia spot gold,10,0.065738946,0.14150438
17-01-2017,http://www.marketwatch.com/story/gold-futures-finish-at-a-2-month-high-2017-01-17,Gold futures finish at a 2-month high,1,0,0,0,1,0,positive,"['high', 'finish', 'month', 'futures', 'gold futures']",Gold futures finish at a 2-month high high finish month futures gold futures,-1,-0.09320657,-0.50857633
01-12-2005,http://www.marketwatch.com/story/dec-gold-climbs-740-or-15-to-trade-at-502oz-2005-12-01,"dec gold climbs $7.40, or 1.5%, to trade at $502/oz",1,0,0,0,1,0,positive,"['dec', 'climbs', 'oz', 'gold', '40 trade 502']","dec gold climbs $7.40, or 1.5%, to trade at $502/oz dec climbs oz gold 40 trade 502",-1,0.36024547,0.08128704
27-11-2017,https://www.metalsdaily.com/link/274265/gold-price-forever-$1200.htm,gold price forever $1200,0,1,0,0,1,0,neutral,"['forever', 'price', 'gold', '1200', 'gold price']",gold price forever $1200 forever price gold 1200 gold price,-1,0.18325482,0.03528378
03-03-2010,http://www.marketwatch.com/story/april-gold-falls-360-to-113970oz-on-globex-2010-03-03,"april gold falls $3.60 to $1,139.70/oz on globex",0,0,1,0,1,0,negative,"['60 139', 'falls', 'globex', '70 oz', 'april gold']","april gold falls $3.60 to $1,139.70/oz on globex 60 139 falls globex 70 oz april gold",21,0.4025179,0.09384871
09-05-2013,https://www.thehindubusinessline.com/markets/gold/wgc-partners-with-india-post-reliance-money-to-offer-7-discount-on-gold-coin/article20612650.ece1,"WGC partners with India Post, Reliance Money to offer 7% discount on gold coin",0,0,0,0,1,0,none,"['wgc', 'money offer discount', 'gold coin', 'partners india post', 'reliance']","WGC partners with India Post, Reliance Money to offer 7% discount on gold coin wgc money offer discount gold coin partners india post reliance",-1,-0.11440147,0.029224042
06-07-2004,http://www.marketwatch.com/story/dollar-advances-vs-yen-drifts-vs-euro-on-ism-details-2004-07-06,"dollar aided by gold's fall, service data",0,0,1,1,1,0,negative,"['fall', 'service data', 'fall service data', 'dollar', 'aided gold']","dollar aided by gold's fall, service data fall service data fall service data dollar aided gold",-1,0.033379823,0.18375409
15-02-2018,https://www.metalsdaily.com/link/276809/for-gold-its-goldilocks-inflation-.htm,"for gold, it's goldilocks inflation ",0,0,0,0,1,0,none,"['gold', 'goldilocks', 'gold goldilocks', 'inflation', 'goldilocks inflation']","for gold, it's goldilocks inflation  gold goldilocks gold goldilocks inflation goldilocks inflation",-1,-0.11910826,0.16229162
23-08-2018,https://www.moneycontrol.com/news/business/markets/gold-falls-as-rate-hike-views-steady-dollar-2870531.html,Gold falls as rate hike views steady dollar,0,0,1,1,1,0,negative,"['views', 'gold', 'hike', 'steady dollar', 'falls rate']",Gold falls as rate hike views steady dollar views gold hike steady dollar falls rate,-1,-0.07429072,0.070613176
09-11-2016,http://www.marketwatch.com/story/gold-miner-stocks-soar-in-wake-of-trump-victory-2016-11-09,Gold miner stocks soar in wake of Trump victory,0,0,0,0,1,0,none,"['wake', 'trump', 'soar', 'miner stocks', 'gold miner stocks']",Gold miner stocks soar in wake of Trump victory wake trump soar miner stocks gold miner stocks,-1,-0.25501898,0.027365752
25-02-2002,http://www.marketwatch.com/story/gold-prices-dull-on-newmont-news-2002-02-25,gold prices dull on newmont news,0,0,1,0,1,0,negative,"['news', 'prices', 'dull', 'newmont', 'gold prices']",gold prices dull on newmont news news prices dull newmont gold prices,-1,-0.020590805,0.09317884
04-01-2006,http://www.marketwatch.com/story/feb-gold-trades-modestly-higher-in-late-morning-dealings-2006-01-04,feb gold trades modestly higher in late morning dealings,1,0,0,0,1,0,positive,"['late', 'modestly higher', 'feb', 'morning dealings', 'gold trades modestly']",feb gold trades modestly higher in late morning dealings late modestly higher feb morning dealings gold trades modestly,-1,-0.030062772,0.028708834
13-05-2013,https://www.moneycontrol.com/news/trends/current-affairs-trends/-1708437.html,"gold coins bearing sachin's face, signature launched",0,0,0,0,1,0,none,"['launched', 'bearing', 'face signature', 'sachin', 'gold coins']","gold coins bearing sachin's face, signature launched launched bearing face signature sachin gold coins",-1,-0.13668992,0.14229135
14-03-2018,http://www.marketwatch.com/story/gold-prices-slip-ahead-of-wholesale-inflation-reading-2018-03-14,"gold ends slightly lower as the metal marks 10 years since first topping $1,000",0,0,1,0,1,0,negative,"['ends slightly', 'topping 000', '10 years', 'gold', 'lower metal marks']","gold ends slightly lower as the metal marks 10 years since first topping $1,000 ends slightly topping 000 10 years gold lower metal marks",-1,0.050415367,0.008664489
17-08-2016,http://www.marketwatch.com/story/gold-ends-lower-then-gains-in-electronic-trade-after-fomc-minutes-2016-08-17,"Gold ends lower, then gains in electronic trade after FOMC minutes",1,0,1,0,1,0,positive,"['electronic', 'trade', 'lower gains', 'fomc minutes', 'gold ends']","Gold ends lower, then gains in electronic trade after FOMC minutes electronic trade lower gains fomc minutes gold ends",-1,-0.09594059,-0.03367351
28-01-2016,https://www.moneycontrol.com/news/business/markets/gold-sticks-near-12-week-high-as-fed-eyes-global-economy-1046987.html,gold sticks near 12-week high as fed eyes global economy,1,0,0,0,1,0,positive,"['near 12', 'eyes global', 'sticks', 'week high fed', 'global economy']",gold sticks near 12-week high as fed eyes global economy near 12 eyes global sticks week high fed global economy,-1,-0.12293598,0.08645209
23-05-2017,http://www.marketwatch.com/story/june-gold-down-580-or-05-to-125560oz-2017-05-23,"June gold down $5.80, or 0.5%, to $1,255.60/oz",0,0,1,0,1,0,negative,"['60', '80 255 60', 'june', 'oz', 'gold']","June gold down $5.80, or 0.5%, to $1,255.60/oz 60 80 255 60 june oz gold",21,0.4687974,0.08606744
18-08-2006,http://www.marketwatch.com/story/dec-gold-drops-730-to-a-near-4-wk-low-of-618oz-2006-08-18,dec. gold drops $7.30 to a near 4-wk low of $618/oz,0,0,1,0,1,0,negative,"['near wk', '30', 'low 618', 'oz', 'dec gold drops']",dec. gold drops $7.30 to a near 4-wk low of $618/oz near wk 30 low 618 oz dec gold drops,21,0.38100588,0.036286354
19-05-2017,https://economictimes.indiatimes.com/markets/commodities/news/gold-tops-rs-29000-mark-on-risk-off-sentiment/articleshow/58749417.cms,"gold tops rs 29,000 mark on risk-off sentiment",1,0,0,0,1,0,positive,"['29', '000 mark', 'sentiment', 'risk', 'gold tops rs']","gold tops rs 29,000 mark on risk-off sentiment 29 000 mark sentiment risk gold tops rs",-1,-0.063102975,0.085186966
09-02-2018,https://www.metalsdaily.com/link/276631/ig-gold-beats-the-fad-of-cryptocurrencies.htm,ig : gold beats the 'fad' of cryptocurrencies,0,0,0,0,1,0,none,"['beats', 'ig', 'fad', 'gold', 'cryptocurrencies']",ig : gold beats the 'fad' of cryptocurrencies beats ig fad gold cryptocurrencies,-1,-0.15794267,0.126944
24-11-2004,http://www.marketwatch.com/story/dec-gold-climbs-1-to-44890oz-in-morning-ny-trade-2004-11-24,dec gold climbs $1 to $448.90/oz in morning ny trade,1,0,0,0,1,0,positive,"['morning ny', 'climbs', 'trade', '448 90 oz', 'dec gold']",dec gold climbs $1 to $448.90/oz in morning ny trade morning ny climbs trade 448 90 oz dec gold,21,0.368865,0.05399
18-08-2006,http://www.marketwatch.com/story/gold-futures-close-lower-for-the-session-and-week-2006-08-18,gold futures close lower for the session and week,0,0,1,0,1,0,negative,"['session', 'week', 'lower', 'gold futures', 'futures close lower']",gold futures close lower for the session and week session week lower gold futures futures close lower,-1,-0.059093162,-0.53948
25-06-2001,http://www.marketwatch.com/story/1150am-updatebarrick-gold-gets-bigger,1150am update:barrick gold gets bigger,0,0,0,0,1,0,none,"['gets', 'update', '1150am', 'barrick', 'gold gets bigger']",1150am update:barrick gold gets bigger gets update 1150am barrick gold gets bigger,-1,-0.036429256,0.07943478
30-05-2017,http://www.marketwatch.com/story/gold-cant-yet-extend-1-month-high-scored-last-week-with-payrolls-now-in-focus-2017-05-30,Gold ends lower after 3-week climb as traders look to coming jobs report,0,0,1,0,1,0,negative,"['lower week', 'jobs report', 'climb', 'traders look', 'gold ends']",Gold ends lower after 3-week climb as traders look to coming jobs report lower week jobs report climb traders look gold ends,-1,-0.15410483,-0.09124316
11-05-2009,http://www.marketwatch.com/story/copper-falls-as-economic-worries-return-gold-dips,copper falls as economic worries return; gold dips,0,0,1,1,1,0,negative,"['worries', 'economic', 'falls', 'copper', 'return gold dips']",copper falls as economic worries return; gold dips worries economic falls copper return gold dips,-1,-0.16058725,0.08811343
29-08-2011,https://www.moneycontrol.com/news/business/stocks/-2057473.html,"fundamental view on copper, crude oil, gold, silver: iifl",0,0,0,1,1,0,none,"['iifl', 'crude', 'fundamental view', 'fundamental view copper', 'oil gold silver']","fundamental view on copper, crude oil, gold, silver: iifl iifl crude fundamental view fundamental view copper oil gold silver",-1,-0.16685832,0.03767159
03-08-2017,https://economictimes.indiatimes.com/markets/commodities/news/current-gold-price-track-current-gold-rate-trends-and-news/articleshow/59894023.cms,current gold price: track current gold rate trends and news,0,0,0,0,1,0,none,"['track current', 'rate', 'news', 'trends', 'gold price']",current gold price: track current gold rate trends and news track current rate news trends gold price,-1,-0.05412723,0.13669148
06-10-2010,http://www.marketwatch.com/story/vietnam-may-end-gold-import-ban-spot-prices-climb-2010-10-06,vietnam may end gold-import ban; spot prices climb,1,0,0,0,1,0,positive,"['import', 'ban spot', 'end gold', 'vietnam', 'prices climb']",vietnam may end gold-import ban; spot prices climb import ban spot end gold vietnam prices climb,-1,-0.1440015,0.07469205
30-08-2016,http://www.marketwatch.com/story/gold-futures-log-lowest-finish-since-june-2016-08-30,Gold futures log lowest finish since June,0,0,1,0,1,0,negative,"['finish', 'june', 'log', 'lowest', 'gold futures']",Gold futures log lowest finish since June finish june log lowest gold futures,-1,-0.02200745,-0.46609926
12-01-2017,http://www.marketwatch.com/story/gold-futures-end-under-1200-but-still-mark-7-week-high-2017-01-12,"Gold futures end under $1,200, but still mark 7-week high",1,0,0,0,1,0,positive,"['mark', 'end', '200', 'week high', 'gold futures']","Gold futures end under $1,200, but still mark 7-week high mark end 200 week high gold futures",-1,0.06317656,-0.41956514
12-02-2018,http://www.marketwatch.com/story/2018-winter-olympics-snowboarder-chloe-kim-gets-hangry-grabs-gold-2018-02-12,"2018 winter olympics: snowboarder chloe kim gets 'hangry,' grabs gold",0,0,0,0,1,0,none,"['gold', 'gets hangry grabs', '2018 winter', 'chloe kim', 'olympics snowboarder']","2018 winter olympics: snowboarder chloe kim gets 'hangry,' grabs gold gold gets hangry grabs 2018 winter chloe kim olympics snowboarder",-1,-0.12172812,0.1033302
01-12-2010,http://www.marketwatch.com/story/dec-gold-up-720-at-139220oz-on-globex-2010-12-01,"dec. gold up $7.20 at $1,392.20/oz on globex",1,0,0,0,1,0,positive,"['392 20', 'dec', 'oz', 'gold', 'globex']","dec. gold up $7.20 at $1,392.20/oz on globex 392 20 dec oz gold globex",21,0.35373282,0.10817817
08-05-2017,http://www.marketwatch.com/story/gold-turns-down-a-few-cents-as-us-dollar-index-trades-near-days-high-2017-05-08,Gold turns down a few cents as U.S. dollar index trades near day's high,0,0,1,1,1,0,negative,"['day high', 'index', 'gold', 'trades near', 'turns cents dollar']",Gold turns down a few cents as U.S. dollar index trades near day's high day high index gold trades near turns cents dollar,-1,0.060771003,-0.0014867932
29-11-2011,https://www.moneycontrol.com/news/business/stocks/-1271161.html,"Gold, Silver may trade with negative bias:Angel Commodities",0,0,1,1,0,1,negative,"['angel', 'negative', 'bias', 'commodities', 'gold silver trade']","Gold, Silver may trade with negative bias:Angel Commodities angel negative bias commodities gold silver trade",-1,-0.12282562,0.1312075
19-05-2006,http://www.marketwatch.com/story/cboe-gold-index-closes-at-14118-points-down-04-2006-05-19,"cboe gold index closes at 141.18 points, down 0.4%",0,0,1,0,1,0,negative,"['18', '141', 'gold', 'cboe', 'index closes']","cboe gold index closes at 141.18 points, down 0.4% 18 141 gold cboe index closes",6,-0.011857957,-0.031633154
11-08-2017,http://www.marketwatch.com/story/dec-gold-settles-at-1294oz-up-390-or-03-for-the-session-2017-08-11,"Dec. gold settles at $1,294/oz, up $3.90, or 0.3%, for the session",1,0,0,0,1,0,positive,"['session', 'dec', '90', '294 oz', 'gold settles']","Dec. gold settles at $1,294/oz, up $3.90, or 0.3%, for the session session dec 90 294 oz gold settles",21,0.48430955,-0.039400056
01-09-2013,https://www.thehindubusinessline.com/opinion/columns/gnanasekaar-t/article5082844.ece,Gold futures may go up,1,0,0,0,1,0,positive,[],Gold futures may go up ,-1,-0.052807905,-0.4330014
09-09-2016,http://www.marketwatch.com/story/gold-falls-a-3rd-day-as-fed-commentary-rolls-2016-09-09,Gold ends at 1-week low as Fed talk rattles market,0,0,1,0,1,0,negative,"['talk rattles', 'week', 'market', 'low fed', 'gold ends']",Gold ends at 1-week low as Fed talk rattles market talk rattles week market low fed gold ends,-1,-0.0331361,-0.06658298
23-03-2014,"http://www.investing.com/news/commodities-news/gold-prices-dip-in-asia-on-fed-views,-ahead-of-china-hsbc-flash-pmi-273505","Gold prices dip in Asia on Fed views, ahead of China HSBC flash PMI",0,0,1,0,1,0,negative,"['gold', 'asia', 'fed views ahead', 'hsbc flash pmi', 'prices dip']","Gold prices dip in Asia on Fed views, ahead of China HSBC flash PMI gold asia fed views ahead hsbc flash pmi prices dip",-1,-0.25097388,0.026567802
02-12-2009,http://www.marketwatch.com/story/feds-bullard-oil-gold-spike-not-inflationary-2009-12-02,"fed's bullard - oil, gold spike not inflationary",1,0,0,1,1,0,positive,"['spike', 'fed', 'bullard', 'inflationary', 'oil gold']","fed's bullard - oil, gold spike not inflationary spike fed bullard inflationary oil gold",-1,-0.16954336,0.04701385
09-03-2017,http://www.marketwatch.com/story/gold-heads-toward-8th-straight-loss-as-oil-slides-dollar-steadies-2017-03-09,"Gold ends lower, extends losing streak to 8 sessions",0,0,1,0,1,0,negative,"['lower extends', 'losing', 'sessions', 'streak', 'gold ends']","Gold ends lower, extends losing streak to 8 sessions lower extends losing sessions streak gold ends",-1,-0.050251067,-0.0177816
24-04-2012,https://economictimes.indiatimes.com/markets/commodities/gold-surges-on-akshaya-tritiya-silver-gains/articleshow/12853428.cms,"gold surges on 'akshaya tritiya', silver gains",1,0,0,1,1,0,positive,"['surges', 'gains', 'tritiya', 'silver', 'akshaya']","gold surges on 'akshaya tritiya', silver gains surges gains tritiya silver akshaya",-1,-0.2377831,0.2158165
14-11-2016,http://www.marketwatch.com/story/gold-futures-turn-higher-after-sharp-losses-earlier-in-the-session-2016-11-14,Gold futures turn higher after sharp losses earlier in the session,1,0,0,0,1,0,positive,"['session', 'sharp', 'turn higher', 'losses earlier', 'gold futures']",Gold futures turn higher after sharp losses earlier in the session session sharp turn higher losses earlier gold futures,-1,-0.16930021,-0.38641453
27-11-2018,https://www.moneycontrol.com/news/business/commodities/sell-mcx-gold-crude-december-futures-on-rallies-reliance-commodities-3222171.html,"Sell MCX Gold, Crude December futures on rallies: Reliance Commodities",0,0,0,1,0,1,none,"['sell', 'reliance', 'crude december', 'futures rallies', 'mcx gold']","Sell MCX Gold, Crude December futures on rallies: Reliance Commodities sell reliance crude december futures rallies mcx gold",-1,-0.14528188,-0.23612672
19-02-2004,http://www.marketwatch.com/story/gold-kist-announces-200-mln-note-offiering-2004-02-19,gold kist announces $200 mln note offiering,0,0,0,0,1,0,none,"['announces 200', 'mln', 'note', 'offiering', 'kist announces']",gold kist announces $200 mln note offiering announces 200 mln note offiering kist announces,-1,0.094534695,0.14296818
06-05-2009,http://www.marketwatch.com/story/gold-closes-higher-on-thoughts-of-inflation-ahead,gold closes higher on thoughts of inflation ahead,1,0,0,0,1,0,positive,"['ahead', 'closes', 'higher thoughts', 'inflation', 'gold closes higher']",gold closes higher on thoughts of inflation ahead ahead closes higher thoughts inflation gold closes higher,-1,-0.12890954,-0.015380621
13-01-2017,http://www.marketwatch.com/story/gold-futures-gain-roughly-19-for-the-week-2017-01-13,Gold futures gain roughly 1.9% for the week,1,0,0,0,1,0,positive,"['roughly', 'roughly week', 'gain', 'gold', 'futures']",Gold futures gain roughly 1.9% for the week roughly roughly week gain gold futures,27,0.024385974,-0.3756603
01-09-2016,http://www.marketwatch.com/story/gold-hovers-around-2-month-lows-ahead-of-jobs-report-2016-09-01,Gold ends higher as fall in U.S. manufacturing activity weakens buck,1,0,0,0,1,0,positive,"['higher', 'buck', 'manufacturing activity', 'activity weakens', 'gold ends']",Gold ends higher as fall in U.S. manufacturing activity weakens buck higher buck manufacturing activity activity weakens gold ends,-1,-0.09517221,0.09511267
26-09-2016,http://www.marketwatch.com/story/gold-futures-recoup-most-of-what-they-lost-on-friday-2016-09-26,gold futures recoup most of what they lost on friday,1,0,0,0,1,0,positive,"['friday', 'lost', 'recoup', 'gold futures', 'futures recoup lost']",gold futures recoup most of what they lost on friday friday lost recoup gold futures futures recoup lost,-1,-0.07501716,-0.36279318
12-10-2018,https://economictimes.indiatimes.com/markets/commodities/news/gold-near-highest-in-over-2-months-as-equity-plunge-boosts-safe-haven-appeal/articleshow/66172784.cms,"Gold slips as markets calm, but hovers near 10-week high",1,0,0,0,1,0,positive,"['calm', 'near 10 week', 'week high', 'hovers near', 'gold slips markets']","Gold slips as markets calm, but hovers near 10-week high calm near 10 week week high hovers near gold slips markets",-1,-0.12514038,-0.025076777
02-01-2018,https://www.metalsdaily.com/link/275275/charts-gold-investors-are-fast-asleep.htm,charts : gold investors are fast asleep,0,0,0,0,1,0,none,"['fast', 'asleep', 'charts', 'investors fast asleep', 'gold investors']",charts : gold investors are fast asleep fast asleep charts investors fast asleep gold investors,-1,-0.23619941,0.090766855
15-01-2019,https://www.thehindubusinessline.com/markets/gold/gold-rises-for-second-day-by-rs-25-to-rs-33125/article25999317.ece,"Gold rises for second day to Rs 33,125 ",1,0,0,0,1,0,positive,"['second', 'day', 'rs', '33 125', 'gold rises']","Gold rises for second day to Rs 33,125  second day rs 33 125 gold rises",-1,0.031727448,0.12404032
29-10-2012,http://www.marketwatch.com/story/gold-settles-lower-for-fourth-session-in-five-2012-10-29,gold settles lower for fourth session in five,0,0,1,0,1,0,negative,"['session', 'lower', 'fourth', 'gold', 'gold settles']",gold settles lower for fourth session in five session lower fourth gold gold settles,-1,0.094707504,-0.07298568
27-06-2011,https://www.moneycontrol.com/news/business/markets/-2050529.html,india gold hits 3-week low; physical demand slack,0,0,1,0,1,0,negative,"['week', 'low physical', 'india', 'gold hits', 'demand slack']",india gold hits 3-week low; physical demand slack week low physical india gold hits demand slack,-1,-0.13490398,0.11152003
0201-03-17,http://www.marketwatch.com/story/april-gold-down-630-or-05-at-137270oz-2014-03-17,"april gold down $6.30, or 0.5%, at $1,372.70/oz",0,0,1,0,1,0,negative,"['372 70', '30 372', 'april', 'oz', 'gold']","april gold down $6.30, or 0.5%, at $1,372.70/oz 372 70 30 372 april oz gold",21,0.4879539,0.05761848
05-05-2016,https://www.moneycontrol.com/news/business/markets/gold-firms-after-three-dayslosses-as-stocks-drop-1018033.html,gold firms after three days of losses as stocks drop,0,0,1,0,1,0,negative,"['days', 'gold', 'drop', 'firms', 'losses stocks drop']",gold firms after three days of losses as stocks drop days gold drop firms losses stocks drop,-1,-0.1914497,0.028047219
12-10-2007,http://www.marketwatch.com/story/gold-falls-as-dollar-strengthens-on-retail-sales-2007-10-12,gold falls as dollar strengthens on retail sales,0,0,1,1,1,0,negative,"['strengthens', 'falls', 'dollar', 'gold falls', 'strengthens retail sales']",gold falls as dollar strengthens on retail sales strengthens falls dollar gold falls strengthens retail sales,-1,-0.02756153,0.2495904
21-10-2012,https://www.thehindubusinessline.com/opinion/columns/gnanasekaar-t/gold-futures-may-correct-lower/article20517720.ece,Gold futures may correct lower,0,0,1,0,1,0,negative,"['correct', 'lower', 'gold', 'futures correct lower', 'gold futures']",Gold futures may correct lower correct lower gold futures correct lower gold futures,-1,-0.16758305,-0.44606453
21-10-2016,https://www.thehindubusinessline.com/markets/gold/gold-falls-on-dollars-strength-set-for-first-weekly-gain-in-four/article9250373.ece,Gold falls on dollar's strength; set for first weekly gain in four,0,0,1,1,1,0,negative,"['set', 'gain', 'weekly', 'gold falls', 'falls dollar strength']",Gold falls on dollar's strength; set for first weekly gain in four set gain weekly gold falls falls dollar strength,-1,0.099482015,0.0806635
23-11-2011,https://economictimes.indiatimes.com/markets/commodities/gold-silver-decline-on-lower-off-take/articleshow/10847178.cms,"gold, silver decline on lower off-take",0,0,1,1,1,0,negative,"['lower', 'decline', 'gold', 'decline lower', 'gold silver']","gold, silver decline on lower off-take lower decline gold decline lower gold silver",-1,-0.018457077,0.117637694
17-08-2017,https://www.thehindubusinessline.com/markets/gold/gold-rises-on-fed-caution-palladium-hits-16year-peak/article9820754.ece,Gold rises on Fed caution; palladium hits 16-year peak,1,0,0,1,1,0,positive,"['caution', 'hits 16', 'year peak', 'palladium', 'gold rises fed']",Gold rises on Fed caution; palladium hits 16-year peak caution hits 16 year peak palladium gold rises fed,-1,-0.13978289,0.011582635
14-04-2013,https://economictimes.indiatimes.com/markets/commodities/for-first-time-since-2011-gold-prices-below-rs-28000/articleshow/19537488.cms,"for first time since 2011, gold prices below rs 28,000",0,0,0,0,1,0,none,"['time', '2011', '000', 'prices rs 28', 'gold prices']","for first time since 2011, gold prices below rs 28,000 time 2011 000 prices rs 28 gold prices",-1,0.038483217,0.081246994
20-03-2018,https://www.moneycontrol.com/news/business/markets/gold-edges-lower-ahead-of-fed-rate-decision-2532459.html,Gold edges lower ahead of Fed rate decision,0,0,1,0,1,0,negative,"['ahead', 'edges', 'rate decision', 'fed', 'gold edges lower']",Gold edges lower ahead of Fed rate decision ahead edges rate decision fed gold edges lower,-1,-0.19422415,-0.06161575
17-02-2011,http://www.marketwatch.com/story/gold-marks-highest-closing-level-in-5-weeks-2011-02-17,gold marks highest closing level in 5 weeks,1,0,0,0,1,0,positive,"['weeks', 'marks', 'gold', 'closing level', 'highest closing']",gold marks highest closing level in 5 weeks weeks marks gold closing level highest closing,-1,-0.09123643,-0.08734672
27-07-2013,https://www.thehindubusinessline.com/markets/commodities/gold-surges-to-1-month-high-silver-eases/article20641732.ece1,Gold surges to 1-month high; silver eases,1,0,0,1,1,0,positive,"['eases', 'high', 'month', 'silver eases', 'surges month high']",Gold surges to 1-month high; silver eases eases high month silver eases surges month high,-1,-0.11796295,0.14900248
26-10-2018,https://www.metalsdaily.com/link/286409/societe-generale-cautiously-bullish-on-gold-prices.htm,societe generale 'cautiously bullish' on gold prices,0,0,0,0,1,0,none,"['generale', 'societe', 'cautiously', 'bullish', 'gold prices']",societe generale 'cautiously bullish' on gold prices generale societe cautiously bullish gold prices,-1,-0.15780605,0.031188246
26-07-2018,http://www.marketwatch.com/story/gold-slips-remains-near-lowest-levels-in-a-year-2018-07-26,"gold slips, ends near lowest levels of the year",0,0,1,0,1,0,negative,"['near', 'ends', 'slips', 'gold', 'lowest levels year']","gold slips, ends near lowest levels of the year near ends slips gold lowest levels year",-1,-0.08684358,-0.08352086
08-09-2009,https://economictimes.indiatimes.com/articleshow/4985730.cms,"gold opens to set new peak at rs 16,100 on firm global cues",1,0,0,0,1,0,positive,"['gold', 'global cues', '16 100 firm', 'opens set new', 'peak rs']","gold opens to set new peak at rs 16,100 on firm global cues gold global cues 16 100 firm opens set new peak rs",-1,-0.18152194,0.103336446
10-03-2017,https://economictimes.indiatimes.com/markets/commodities/news/gold-rate-today-check-out-price-trends-and-market-outlook/articleshow/57572989.cms,gold rate today: check out price trends and market outlook,0,0,0,0,1,0,none,"['outlook', 'today', 'check price', 'gold', 'trends market']",gold rate today: check out price trends and market outlook outlook today check price gold trends market,-1,-0.0851248,0.10017057
16-11-2017,http://www.marketwatch.com/story/december-gold-up-210-or-02-at-127980-an-ounce-2017-11-16,"December gold up $2.10, or 0.2%, at $1,279.80 an ounce",1,0,0,0,1,0,positive,"['10 279 80', '10 279', 'december', '80 ounce', 'gold']","December gold up $2.10, or 0.2%, at $1,279.80 an ounce 10 279 80 10 279 december 80 ounce gold",21,0.433106,0.11751321
21-09-2016,http://www.marketwatch.com/story/dec-gold-trades-at-132870oz-vs-the-days-settlement-at-133140-2016-09-21,"Dec. gold trades at $1,328.70/oz vs. the day's settlement at $1,331.40",0,0,0,0,1,0,none,"['trades 328', '70 oz', 'oz vs', 'dec gold', 'vs day settlement']","Dec. gold trades at $1,328.70/oz vs. the day's settlement at $1,331.40 trades 328 70 oz oz vs dec gold vs day settlement",-1,0.36852574,-0.017410994
02-10-2007,http://www.marketwatch.com/story/dec-gold-closes-at-73630oz-down-1780-or-24-2007-10-02,"dec. gold closes at $736.30/oz, down $17.80, or 2.4%",0,0,1,0,1,0,negative,"['30', 'dec', 'oz', 'gold', 'closes 736']","dec. gold closes at $736.30/oz, down $17.80, or 2.4% 30 dec oz gold closes 736",21,0.4281783,-0.042476952
09-05-2018,http://www.marketwatch.com/story/gold-at-risk-of-falling-for-third-day-in-a-row-as-stocks-dollar-diverge-2018-05-09,"gold ends lower, extends losing streak to 3 days",0,0,1,0,1,0,negative,"['lower', 'extends', 'losing', 'streak days', 'gold ends']","gold ends lower, extends losing streak to 3 days lower extends losing streak days gold ends",-1,-0.06258049,-0.004458867
12-03-2018,https://www.thehindubusinessline.com/markets/gold/gold-futures-fall-marginally-on-weak-global-cues/article23052833.ece,Gold futures fall marginally on weak global cues,0,0,1,0,1,0,negative,"['fall', 'cues', 'marginally', 'weak global', 'gold futures']",Gold futures fall marginally on weak global cues fall cues marginally weak global gold futures,22,-0.21381655,-0.3138821
08-04-2003,http://www.marketwatch.com/story/gold-prices-close-higher-with-eyes-on-dollar-iraq-2003-04-08,"gold higher with eyes on dollar, iraq",1,0,0,1,1,0,positive,"['eyes', 'higher', 'iraq', 'gold higher eyes', 'dollar iraq']","gold higher with eyes on dollar, iraq eyes higher iraq gold higher eyes dollar iraq",-1,-0.11597386,0.15460011
04-05-2017,http://www.marketwatch.com/story/gold-tumbles-1-after-fed-signals-confidence-in-the-us-economy-2017-05-04,Gold sinks to a 7-week low,0,0,1,0,1,0,negative,"['low', 'week', 'sinks', 'gold', 'sinks week low']",Gold sinks to a 7-week low low week sinks gold sinks week low,-1,0.027863473,-0.01344008
24-10-2016,http://www.marketwatch.com/story/gold-fields-revenue-per-ounce-rises-20-2016-10-24,Gold Fields revenue per ounce rises 20%,0,0,0,0,1,0,none,"['20', 'rises', 'fields', 'ounce', 'gold fields revenue']",Gold Fields revenue per ounce rises 20% 20 rises fields ounce gold fields revenue,-1,0.11549537,0.18457921
12-01-2018,https://www.metalsdaily.com/link/275728/india-gold-imports-may-drop-to-650-tonnes-this-fiscal.htm,india : gold imports may drop to 650 tonnes this fiscal,0,0,0,0,1,0,none,"['india', 'gold', 'drop 650', 'tonnes fiscal', 'imports drop']",india : gold imports may drop to 650 tonnes this fiscal india gold drop 650 tonnes fiscal imports drop,-1,-0.14476995,0.044486694
05-01-2014,https://www.thehindubusinessline.com/opinion/columns/gnanasekaar-t/article5541924.ece,"Gold to test resistance, slip",0,0,1,0,1,0,negative,"['gold', 'slip', 'test resistance', 'gold test', 'resistance slip']","Gold to test resistance, slip gold slip test resistance gold test resistance slip",-1,-0.1090095,0.050297823
25-07-2012,https://www.moneycontrol.com/news/business/markets/-1202199.html,"buy gold, pressure on rupee to continue: emkay commodities",1,0,0,1,0,1,positive,"['continue', 'emkay', 'commodities', 'pressure rupee', 'buy gold']","buy gold, pressure on rupee to continue: emkay commodities continue emkay commodities pressure rupee buy gold",-1,-0.17530394,0.13733923
31-08-2016,http://www.marketwatch.com/story/december-gold-flat-at-131670oz-2016-08-31,"December gold flat at $1,316.70/oz.",0,1,0,0,1,0,neutral,"['316 70', 'flat', 'oz', 'december', 'gold']","December gold flat at $1,316.70/oz. 316 70 flat oz december gold",-1,0.40462196,0.12182161
28-06-2005,http://www.marketwatch.com/story/gold-futures-trade-at-a-four-session-low-2005-06-28,gold futures trade at a four-session low,0,0,1,0,1,0,negative,"['session', 'trade', 'low', 'futures', 'gold futures trade']",gold futures trade at a four-session low session trade low futures gold futures trade,-1,-0.07313837,-0.44402432
12-04-2012,http://www.marketwatch.com/story/singapore-smx-to-launch-new-gold-silver-contracts-2012-04-12,"singapore smx to launch new gold, silver contracts",0,0,0,1,1,0,none,"['contracts', 'launch new', 'singapore', 'gold silver', 'smx launch new']","singapore smx to launch new gold, silver contracts contracts launch new singapore gold silver smx launch new",-1,-0.17084342,0.02927173
03-01-2013,https://economictimes.indiatimes.com/news/economy/foreign-trade/tackling-current-account-deficit-fm-p-chidambaram-likely-to-place-more-curbs-on-gold-imports/articleshow/17865791.cms,tackling current account deficit: fm p chidambaram likely to place more curbs on gold imports,0,0,0,0,1,0,none,"['deficit fm', 'imports', 'chidambaram likely', 'tackling current account', 'place curbs gold']",tackling current account deficit: fm p chidambaram likely to place more curbs on gold imports deficit fm imports chidambaram likely tackling current account place curbs gold,-1,-0.20376179,0.13152437
24-03-2017,http://www.marketwatch.com/story/april-gold-off-220-or-02-at-1245oz-2017-03-24,"April gold off $2.20, or 0.2%, at $1,245/oz.",0,0,1,0,1,0,negative,"['20 245', '20', 'oz', 'april', 'gold']","April gold off $2.20, or 0.2%, at $1,245/oz. 20 245 20 oz april gold",21,0.4399482,0.073738344
30-06-2014,http://www.investing.com/news/commodities-news/gold-edges-higher-as-dollar-slips-on-mixed-u.s.-data-292233,Gold edges higher as dollar slips on mixed U.S. data,1,0,0,1,1,0,positive,"['mixed', 'slips', 'mixed data', 'dollar', 'gold edges higher']",Gold edges higher as dollar slips on mixed U.S. data mixed slips mixed data dollar gold edges higher,-1,-0.034442298,0.06323818
18-03-2011,http://www.marketwatch.com/story/gold-pares-gain-after-libyan-ceasefire-2011-03-18,gold pares gain after libyan ceasefire,1,0,0,0,1,0,positive,"['gain', 'pares', 'libyan', 'gold', 'ceasefire']",gold pares gain after libyan ceasefire gain pares libyan gold ceasefire,-1,-0.12524906,0.1388579
21-12-2016,http://www.marketwatch.com/story/gold-prices-climb-as-dollar-slips-from-14-year-high-2016-12-21,Gold settles slightly lower as U.S. stock market hovers near records,0,0,1,0,1,0,negative,"['hovers', 'settles slightly', 'gold', 'near records', 'lower stock market']",Gold settles slightly lower as U.S. stock market hovers near records hovers settles slightly gold near records lower stock market,-1,-0.075458206,0.070150726
07-10-2016,http://www.marketwatch.com/story/dec-gold-settles-at-125190oz-down-110-or-01-for-the-session-2016-10-07,"Dec. gold settles at $1,251.90/oz, down $1.10, or 0.1%, for the session",0,0,1,0,1,0,negative,"['dec', '10 session', '251 90', 'oz', 'gold settles']","Dec. gold settles at $1,251.90/oz, down $1.10, or 0.1%, for the session dec 10 session 251 90 oz gold settles",21,0.48863482,-0.049143434
23-08-2013,http://www.marketwatch.com/story/gold-futures-up-18-on-day-gains-19-on-week-2013-08-23,"gold futures up 1.8% on day, gains 1.9% on week",1,0,0,0,1,0,positive,"['day', 'gold', 'futures', 'gains week', 'gold futures']","gold futures up 1.8% on day, gains 1.9% on week day gold futures gains week gold futures",27,-0.008391157,-0.39853626
06-07-2016,http://www.marketwatch.com/story/august-gold-gains-950-or-07-to-1368oz-2016-07-06,"august gold gains $9.50, or 0.7%, to $1,368/oz",1,0,0,0,1,0,positive,"['50 368', 'gains', 'gold', 'august', '368 oz']","august gold gains $9.50, or 0.7%, to $1,368/oz 50 368 gains gold august 368 oz",21,0.39424348,0.20789155
10-07-2013,https://www.thehindubusinessline.com/economy/jewellers-to-stop-selling-gold-bars-coins-to-bring-down-cad/article23099604.ece,"Jewellers to stop selling gold bars, coins to bring down CAD",0,0,0,0,1,0,none,"['stop', 'bars', 'coins bring', 'cad', 'jewellers stop selling']","Jewellers to stop selling gold bars, coins to bring down CAD stop bars coins bring cad jewellers stop selling",-1,-0.070696615,0.0984887
22-08-2014,https://www.thehindubusinessline.com/news/national/Satyug-Gold-to-expand-network/article20849846.ece,Satyug Gold to expand network,0,0,0,0,1,0,none,"['expand', 'gold', 'network', 'expand network', 'satyug']",Satyug Gold to expand network expand gold network expand network satyug,-1,-0.23795217,0.08749647
18-07-2018,http://www.marketwatch.com/story/august-gold-off-02-at-122440oz-2018-07-18,"august gold off 0.2% at $1,224.40/oz.",0,0,1,0,1,0,negative,"['40', '224 40', 'august', 'oz', 'gold']","august gold off 0.2% at $1,224.40/oz. 40 224 40 august oz gold",21,0.46133512,0.17917614
02-08-2011,https://www.thehindubusinessline.com/markets/gold/Gold-rises-to-record-as-slowing-growth-spurs-investor-demand/article20317955.ece,Gold rises to record as slowing growth spurs investor demand,1,0,0,0,1,0,positive,"['record slowing', 'growth spurs', 'rises', 'gold', 'investor demand']",Gold rises to record as slowing growth spurs investor demand record slowing growth spurs rises gold investor demand,-1,-0.1738885,0.23955885
02-12-2005,http://www.marketwatch.com/story/gold-silver-close-at-new-18-year-highs-copper-falls-2005-12-02,"gold, silver close at new 18-year highs; copper falls",0,0,1,1,1,0,negative,"['18 year', 'close new', 'year highs', 'falls', 'copper']","gold, silver close at new 18-year highs; copper falls 18 year close new year highs falls copper",-1,-0.085116334,0.0033878535
13-03-2013,https://economictimes.indiatimes.com/markets/commodities/gold-futures-trade-marginally-lower-on-subdued-demand/articleshow/18950989.cms,gold futures trade marginally lower on subdued demand,0,0,1,0,1,0,negative,"['trade', 'subdued', 'demand', 'marginally lower', 'gold futures']",gold futures trade marginally lower on subdued demand trade subdued demand marginally lower gold futures,-1,-0.075214446,-0.33305746
08-03-2016,http://www.marketwatch.com/story/gold-buoyed-as-stocks-weaken-goldman-others-doubt-the-rally-2016-03-08,gains for gold futures fade as prices settle,1,0,0,0,1,0,positive,"['prices', 'settle', 'gains', 'fade', 'gold futures']",gains for gold futures fade as prices settle prices settle gains fade gold futures,-1,-0.10458638,-0.3376321
18-10-2017,https://www.thehindubusinessline.com/markets/gold/govt-imposes-curbs-on-gold-import-by-4-5-star-export-houses/article9915452.ece,"Govt imposes curbs on gold import by 4, 5 star export houses",0,0,0,0,1,0,none,"['imposes', 'gold', 'govt imposes curbs', 'import star export', 'export houses']","Govt imposes curbs on gold import by 4, 5 star export houses imposes gold govt imposes curbs import star export export houses",-1,-0.22497123,0.14417234
28-12-2018,https://www.metalsdaily.com/link/288033/gold-hits-over-6-month-high-as-investors-flock-to-safety.htm,gold hits over 6-month high as investors flock to safety,1,0,0,0,1,0,positive,"['flock', 'month', 'safety', 'high investors', 'gold hits month']",gold hits over 6-month high as investors flock to safety flock month safety high investors gold hits month,-1,-0.13753104,0.045219317
16-08-2017,https://www.moneycontrol.com/news/business/stocks/gold-prices-to-trade-lower-angel-commodities-14-2361009.html,Gold prices to trade lower: Angel Commodities,0,0,1,0,0,1,negative,"['lower', 'angel', 'trade', 'commodities', 'gold prices']",Gold prices to trade lower: Angel Commodities lower angel trade commodities gold prices,8,-0.07012585,0.17113036
12-08-2016,http://www.marketwatch.com/story/dec-gold-rises-450-or-03-at-135440oz-2016-08-12,"Dec. gold rises $4.50, or 0.3%, at $1,354.40/oz.",1,0,0,0,1,0,positive,"['dec', '50 354 40', 'rises', '40 oz', 'gold']","Dec. gold rises $4.50, or 0.3%, at $1,354.40/oz. dec 50 354 40 rises 40 oz gold",-1,0.3935963,0.1273041
19-07-2002,http://www.marketwatch.com/story/gold-silver-stocks-rise-as-dow-hits-four-year-low-2002-07-19,gold shares up amid blue chips dive,1,0,0,0,1,0,positive,"['amid', 'blue', 'dive', 'chips', 'gold shares']",gold shares up amid blue chips dive amid blue dive chips gold shares,-1,-0.16123807,0.12700222
20-07-2009,http://www.marketwatch.com/story/spot-gold-down-140-to-94770troy-ounce,spot gold down $1.40 to $947.70/troy ounce,0,0,1,0,1,0,negative,"['947 70', '40', 'troy', 'ounce', 'spot gold']",spot gold down $1.40 to $947.70/troy ounce 947 70 40 troy ounce spot gold,-1,0.41324627,0.10757895
20-09-2018,https://www.metalsdaily.com/link/284335/sharps-pixley-will-gold-recover-its-glister.htm,sharps pixley: will gold recover its glister?,1,0,0,0,0,1,positive,"['recover', 'sharps', 'gold', 'pixley', 'recover glister']",sharps pixley: will gold recover its glister? recover sharps gold pixley recover glister,-1,-0.115037166,0.17920652
15-12-2014,http://www.marketwatch.com/story/gold-drops-1480-or-12-to-settle-at-120770oz-2014-12-15,"gold drops $14.80, or 1.2%, to settle at $1,207.70/oz",0,0,1,0,1,0,negative,"['207 70', '14', 'settle', 'oz', 'gold drops']","gold drops $14.80, or 1.2%, to settle at $1,207.70/oz 207 70 14 settle oz gold drops",21,0.44299453,0.016880848
26-06-2007,http://www.marketwatch.com/story/august-gold-drops-to-64550-its-lowest-level-since-jan-17-2007-06-26,"august gold drops to $645.50, its lowest level since jan. 17",0,0,1,0,1,0,negative,"['jan 17', 'gold', 'drops 645 50', 'lowest level', 'august']","august gold drops to $645.50, its lowest level since jan. 17 jan 17 gold drops 645 50 lowest level august",-1,0.24282075,0.041065153
09-02-2012,https://www.thehindubusinessline.com/markets/gold/gold-futures-move-up-to-rs-28632-per-10-grams/article23063332.ece,"Gold futures move up to Rs 28,632 per 10 grams",1,0,0,0,1,0,positive,"['28 632 10', 'rs', 'gold', '10 grams', 'futures']","Gold futures move up to Rs 28,632 per 10 grams 28 632 10 rs gold 10 grams futures",23,0.046167552,-0.30612874
14-02-2013,https://www.moneycontrol.com/news/business/markets/-1379445.html,gold rates slip in major cites india,0,0,1,0,1,0,negative,"['major', 'cites', 'india', 'rates slip', 'gold rates']",gold rates slip in major cites india major cites india rates slip gold rates,-1,-0.1448848,0.01931788
31-08-2016,http://www.marketwatch.com/story/gold-post-first-monthly-decline-since-may-down-34-over-august-2016-08-31,"Gold post first monthly decline since May, down 3.4% over August",0,0,1,0,1,0,negative,"['post', 'august', 'gold', 'decline', 'monthly decline']","Gold post first monthly decline since May, down 3.4% over August post august gold decline monthly decline",-1,0.11708169,0.058654666
28-12-2012,https://www.moneycontrol.com/news/business/stocks/-1764545.html,buy gold around rs 30740; sl below rs 30615: nirmal bang,0,0,0,0,1,0,none,"['30615', 'sl', 'nirmal bang', 'rs', 'buy gold']",buy gold around rs 30740; sl below rs 30615: nirmal bang 30615 sl nirmal bang rs buy gold,3,-0.026388325,0.11827139
20-11-2017,https://economictimes.indiatimes.com/markets/stocks/news/gold-rate-today-gold-down-in-morning-trade-silver-up/articleshow/61720609.cms,"gold rate today: gold down in morning trade, silver up",0,0,1,1,1,0,negative,"['trade', 'today', 'morning', 'silver', 'gold rate']","gold rate today: gold down in morning trade, silver up trade today morning silver gold rate",8,-0.019124426,0.079343036
11-05-2010,http://www.marketwatch.com/story/gold-hits-five-month-highs-as-eu-plan-questioned-2010-05-11,gold hits five-month highs as eu plan questioned,1,0,0,0,1,0,positive,"['questioned', 'hits', 'gold', 'hits month highs', 'eu plan questioned']",gold hits five-month highs as eu plan questioned questioned hits gold hits month highs eu plan questioned,-1,-0.084502555,0.034730714
29-11-2016,http://www.marketwatch.com/story/feb-gold-settles-at-119080oz-down-3-or-03-2016-11-29,"Feb. gold settles at $1,190.80/oz, down $3, or 0.3%",0,0,1,0,1,0,negative,"['feb', '190 80', 'settles', 'gold', 'oz']","Feb. gold settles at $1,190.80/oz, down $3, or 0.3% feb 190 80 settles gold oz",21,0.50057864,0.019255921
06-03-2008,http://www.marketwatch.com/story/april-gold-down-390-to-98460-an-ounce-on-nymex-2008-03-06,april gold down $3.90 to $984.60 an ounce on nymex,0,0,1,0,1,0,negative,"['90 984', 'april', 'nymex', 'gold', '60 ounce']",april gold down $3.90 to $984.60 an ounce on nymex 90 984 april nymex gold 60 ounce,21,0.42402208,0.039046485
09-12-2012,https://www.thehindubusinessline.com/markets/gold/gold-unlikely-to-breach-rs-32k-mark-this-month-experts/article20537633.ece1,Gold unlikely to breach Rs 32k-mark this month: Experts,0,0,1,0,1,0,negative,"['experts', 'breach', 'unlikely', 'mark month', 'rs 32k']",Gold unlikely to breach Rs 32k-mark this month: Experts experts breach unlikely mark month rs 32k,-1,-0.007022321,0.051602498
05-06-2011,https://www.thehindubusinessline.com/opinion/columns/gnanasekaar-t/Gold-futures-to-test-resistance/article20252286.ece,Gold futures to test resistance,0,0,0,0,0,1,none,"['gold', 'resistance', 'futures', 'test resistance', 'gold futures']",Gold futures to test resistance gold resistance futures test resistance gold futures,-1,-0.13579807,-0.41916466
06-06-2007,http://www.marketwatch.com/story/august-gold-falls-230-to-67280oz-in-early-ny-trading-2007-06-06,august gold falls $2.30 to $672.80/oz in early ny trading,0,0,1,0,1,0,negative,"['falls 30 672', 'early ny', 'trading', 'gold', '80 oz']",august gold falls $2.30 to $672.80/oz in early ny trading falls 30 672 early ny trading gold 80 oz,21,0.43508953,0.0996155
28-10-2015,https://www.thehindubusinessline.com/markets/gold/gold-clings-to-gains-but-caution-prevails-ahead-of-fed/article7813206.ece,"Gold clings to gains, but caution prevails ahead of Fed",1,1,0,0,1,0,positive,"['gains', 'prevails ahead', 'caution', 'fed', 'gold clings']","Gold clings to gains, but caution prevails ahead of Fed gains prevails ahead caution fed gold clings",-1,-0.25035706,-0.033982806
24-06-2013,https://www.thehindubusinessline.com/markets/gold/gold-futures-dip-below-27k-level/article20626965.ece1,Gold futures dip below 27K level,0,0,1,0,1,0,negative,"['level', 'dip', '27k', 'futures', 'gold futures']",Gold futures dip below 27K level level dip 27k futures gold futures,-1,-0.041622877,-0.4176222
09-09-2005,http://www.marketwatch.com/story/cboe-gold-index-up-29-to-end-at-9291-up-42-on-wk-2005-09-09,"cboe gold index up 2.9% to end at 92.91, up 4.2% on wk",1,0,0,0,1,0,positive,"['end', '92 91', 'wk', 'cboe', 'gold index']","cboe gold index up 2.9% to end at 92.91, up 4.2% on wk end 92 91 wk cboe gold index",6,-0.016975671,0.04733162
07-02-2012,http://www.marketwatch.com/story/gold-turns-higher-up-1420-at-173910-2012-02-07,"gold turns higher, up $14.20 at $1,739.10",1,0,0,0,1,0,positive,"['turns', '739 10', 'higher', '14 20 739', 'gold']","gold turns higher, up $14.20 at $1,739.10 turns 739 10 higher 14 20 739 gold",-1,0.18339358,0.13722865
24-01-2017,https://economictimes.indiatimes.com/markets/commodities/news/gold-demand-recovery-in-india-seen-delayed-to-2018-on-cash-ban/articleshow/56751811.cms,forget gold this year! demand for yellow metal may return only in 2018,0,0,0,0,1,0,none,"['return', '2018', 'year demand', 'yellow metal', 'forget gold']",forget gold this year! demand for yellow metal may return only in 2018 return 2018 year demand yellow metal forget gold,-1,-0.094157636,0.010208666
15-12-2017,https://economictimes.indiatimes.com/markets/commodities/news/asian-gold-prices-dip-props-up-demand-indians-await-lower-prices/articleshow/62086894.cms,"asian gold prices dip props up demand, indians await lower prices",0,0,1,0,1,0,negative,"['gold', 'asian', 'indians await', 'dip props demand', 'lower prices']","asian gold prices dip props up demand, indians await lower prices gold asian indians await dip props demand lower prices",-1,-0.19627768,0.082218885
03-10-2001,http://www.marketwatch.com/story/metals-issues-lower-gold-prices-climb,metals issues lower; gold prices climb,1,0,0,0,1,0,positive,"['issues', 'lower', 'climb', 'metals issues', 'gold prices']",metals issues lower; gold prices climb issues lower climb metals issues gold prices,-1,-0.16106337,0.09729746
05-06-2015,http://www.marketwatch.com/story/gold-futures-extend-loss-after-jobs-data-2015-06-05,gold futures extend loss after jobs data,0,0,1,0,1,0,negative,"['extend', 'gold', 'jobs data', 'futures', 'extend loss']",gold futures extend loss after jobs data extend gold jobs data futures extend loss,-1,-0.2539696,-0.35455716
21-04-2017,http://www.marketwatch.com/story/gold-logs-a-gain-for-the-session-erases-its-loss-for-the-week-2017-04-21,"Gold logs a gain for the session, erases its loss for the week",1,0,0,0,1,0,positive,"['erases', 'session', 'gold', 'loss week', 'logs gain']","Gold logs a gain for the session, erases its loss for the week erases session gold loss week logs gain",-1,-0.028275058,0.0027844757
15-03-2012,https://www.moneycontrol.com/news/business/markets/-1944471.html,"gold demand improves on price drop, duty fears",0,0,1,0,1,0,negative,"['fears', 'improves', 'price', 'drop duty', 'gold demand improves']","gold demand improves on price drop, duty fears fears improves price drop duty gold demand improves",-1,-0.1476811,0.1026893
23-12-2016,http://www.marketwatch.com/story/gold-settles-higher-but-logs-7th-weekly-loss-2016-12-23,"Gold settles higher, but logs 7th weekly loss",1,0,1,0,1,0,positive,"['gold', '7th weekly', 'settles', 'higher logs', 'weekly loss']","Gold settles higher, but logs 7th weekly loss gold 7th weekly settles higher logs weekly loss",-1,0.02550815,-0.074148774
28-03-2017,https://economictimes.indiatimes.com/markets/commodities/news/gold-prices-steady-near-1-month-high-on-political-economic-uncertainty/articleshow/57875245.cms,"gold prices steady near 1-month high on political, economic uncertainty",0,1,0,0,1,0,neutral,"['high political', 'near month', 'uncertainty', 'prices steady', 'gold prices']","gold prices steady near 1-month high on political, economic uncertainty high political near month uncertainty prices steady gold prices",-1,-0.040920086,0.029388387
10-11-2016,http://www.marketwatch.com/story/gold-holds-gains-after-jobless--claims-report-2016-11-10,Gold holds gains after jobless -claims report,1,0,0,0,1,0,positive,"['holds', 'report', 'jobless', 'gold holds gains', 'jobless claims report']",Gold holds gains after jobless -claims report holds report jobless gold holds gains jobless claims report,-1,-0.14060453,0.18858145
09-06-2016,https://www.thehindubusinessline.com/markets/gold/buy-gold-if-it-dips-to-124548oz/article8710380.ece,"Buy gold if it dips to $1,245-48/oz",0,0,1,0,0,1,negative,"['48', 'dips', '245 48', 'oz', 'buy gold']","Buy gold if it dips to $1,245-48/oz 48 dips 245 48 oz buy gold",15,0.27968603,0.1334494
13-10-2005,http://www.marketwatch.com/story/spot-gold-quoted-at-47140-in-asia-trade-2005-10-13,spot gold quoted at $471.40 in asia trade,0,0,0,0,1,0,none,"['quoted', '471 40', 'trade', 'asia', 'spot gold']",spot gold quoted at $471.40 in asia trade quoted 471 40 trade asia spot gold,10,0.09739153,0.16169748
10-04-2007,http://www.marketwatch.com/story/gold-closes-higher-on-dollar-weakness-trade-tensions-2007-04-10,"gold closes higher on dollar weakness, trade tensions",1,0,0,1,1,0,positive,"['higher', 'trade', 'tensions', 'dollar weakness', 'gold closes']","gold closes higher on dollar weakness, trade tensions higher trade tensions dollar weakness gold closes",-1,-0.14173692,0.09098145
0201-09-27,http://www.marketwatch.com/story/gold-turns-lower-trades-below-1298-an-anounce-2010-09-27,"gold turns lower, trades below $1,298 an anounce",0,0,1,0,1,0,negative,"['anounce', 'turns', '298 anounce', 'lower trades', 'gold turns lower']","gold turns lower, trades below $1,298 an anounce anounce turns 298 anounce lower trades gold turns lower",-1,0.12286107,0.03538409
21-04-2017,http://www.marketwatch.com/story/june-gold-gains-530-or-04-to-settle-at-128910oz-2017-04-21,"June gold gains $5.30, or 0.4%, to settle at $1,289.10/oz",1,0,0,0,1,0,positive,"['289 10', 'settle', '10 oz', 'gains 30', 'june gold']","June gold gains $5.30, or 0.4%, to settle at $1,289.10/oz 289 10 settle 10 oz gains 30 june gold",21,0.40237814,0.044025455
02-10-2017,http://www.marketwatch.com/story/gold-prices-mark-lowest-finish-in-nearly-8-weeks-2017-10-02,Gold prices mark lowest finish in nearly 8 weeks,0,0,1,0,1,0,negative,"['nearly', 'finish', 'weeks', 'prices mark lowest', 'gold prices']",Gold prices mark lowest finish in nearly 8 weeks nearly finish weeks prices mark lowest gold prices,-1,0.072335675,-0.080207914
20-07-2015,http://www.marketwatch.com/story/gold-futures-fall-eight-sessions-in-a-row-2015-07-20,gold futures fall eight sessions in a row,0,0,1,0,1,0,negative,"['row', 'fall', 'sessions', 'gold futures', 'gold futures fall']",gold futures fall eight sessions in a row row fall sessions gold futures gold futures fall,-1,-0.06092456,-0.47955537
27-01-2017,http://www.marketwatch.com/story/april-gold-loses-140-or-01-to-finish-at-119110oz-2017-01-27,"April gold loses $1.40, or 0.1%, to finish at $1,191.10/oz",0,0,1,0,1,0,negative,"['191 10', 'finish', '10 oz', 'april', 'gold loses 40']","April gold loses $1.40, or 0.1%, to finish at $1,191.10/oz 191 10 finish 10 oz april gold loses 40",21,0.38604778,0.022662167
28-03-2012,http://www.marketwatch.com/story/russia-gold-firm-petropavlovsk-11-net-jumps-2012-03-28,russia gold firm petropavlovsk '11 net jumps,1,0,0,0,1,0,positive,"['11', 'russia', 'net jumps', 'gold firm', 'petropavlovsk']",russia gold firm petropavlovsk '11 net jumps 11 russia net jumps gold firm petropavlovsk,-1,-0.18236414,0.14554942
03-06-2002,http://www.marketwatch.com/story/slim-gains-for-nymex-gold-futures-late-fade-for-crude-2002-06-03,slim gains for nymex gold futures,1,0,0,0,1,0,positive,"['slim', 'futures', 'gains', 'nymex', 'gold futures']",slim gains for nymex gold futures slim futures gains nymex gold futures,-1,-0.092935696,-0.35247678
06-05-2016,http://www.marketwatch.com/story/june-gold-soars-after-jobs-report-up-2180-or-17-to-1294oz-2016-05-06,"june gold soars after jobs report, up $21.80, or 1.7%, to $1,294/oz.",1,0,0,0,1,0,positive,"['soars', 'june', 'jobs report', '80 294 oz', 'gold']","june gold soars after jobs report, up $21.80, or 1.7%, to $1,294/oz. soars june jobs report 80 294 oz gold",-1,0.28691328,0.089307174
27-01-2017,http://www.marketwatch.com/story/gold-futures-edge-down-for-the-day-to-finish-14-lower-for-the-week-2017-01-27,Gold futures edge down for the day to finish 1.4% lower for the week,0,0,1,0,1,0,negative,"['finish', 'lower', 'week', 'edge day', 'gold futures']",Gold futures edge down for the day to finish 1.4% lower for the week finish lower week edge day gold futures,-1,0.013148978,-0.46871078
30-08-2011,http://www.marketwatch.com/story/gold-rises-2-to-trade-at-182630-an-ounce-2011-08-30,"gold rises 2% to trade at $1,826.30 an ounce",1,0,0,0,1,0,positive,"['826 30', 'rises', 'trade', 'gold', '30 ounce']","gold rises 2% to trade at $1,826.30 an ounce 826 30 rises trade gold 30 ounce",-1,0.2802121,0.1282841
28-11-2011,https://www.moneycontrol.com/news/business/stocks/-1276865.html,"Buy MCX Gold at Rs 28,600; Target Rs 28,900: IIFL",0,0,0,0,0,1,none,"['gold', '28 600', '28 900 iifl', 'target rs', 'buy mcx']","Buy MCX Gold at Rs 28,600; Target Rs 28,900: IIFL gold 28 600 28 900 iifl target rs buy mcx",4,-0.020457342,0.030540816
05-12-2012,http://www.marketwatch.com/story/goldman-sachs-cuts-gold-outlook-sees-growing-risk-2012-12-05,"goldman sachs cuts gold outlook, sees growing risk",0,0,1,0,0,1,negative,"['sees growing', 'outlook', 'risk', 'sachs', 'cuts gold']","goldman sachs cuts gold outlook, sees growing risk sees growing outlook risk sachs cuts gold",-1,-0.23486745,0.020567097
22-08-2011,http://www.marketwatch.com/story/oil-gold-rise-as-markets-rebound-2011-08-22,"oil, gold rise as markets rebound",1,0,0,1,1,0,positive,"['rebound', 'oil', 'gold', 'rise markets rebound', 'gold rise markets']","oil, gold rise as markets rebound rebound oil gold rise markets rebound gold rise markets",-1,-0.26363125,0.14686902
22-06-2018,http://www.marketwatch.com/story/gold-futures-suffer-a-loss-of-roughly-06-for-the-week-2018-06-22,gold futures suffer a loss of roughly 0.6% for the week,0,0,1,0,1,0,negative,"['roughly week', 'suffer', 'gold', 'loss roughly week', 'futures']",gold futures suffer a loss of roughly 0.6% for the week roughly week suffer gold loss roughly week futures,27,-0.02213443,-0.4356264
02-01-2018,https://www.metalsdaily.com/link/275272/rbc-gold-likely-to-witness-a-steady-rise-in-2018.htm,rbc : gold likely to witness a steady rise in 2018,1,0,0,0,1,0,positive,"['witness', 'likely', '2018', 'steady rise', 'rbc gold likely']",rbc : gold likely to witness a steady rise in 2018 witness likely 2018 steady rise rbc gold likely,-1,-0.15111575,0.022736304
10-07-2014,"http://www.investing.com/news/commodities-news/gold-gains-on-european-bank-fears,-fed-expectations-294265","Gold gains on European bank fears, Fed expectations",1,0,0,0,1,0,positive,"['european', 'expectations', 'gains', 'gold', 'bank fears fed']","Gold gains on European bank fears, Fed expectations european expectations gains gold bank fears fed",-1,-0.20195279,0.011892214
21-04-2009,https://economictimes.indiatimes.com/articleshow/4430904.cms,india likely to import 30 tonnes of gold in april,0,0,0,0,1,0,none,"['likely', 'april', 'india', 'gold', 'import 30 tonnes']",india likely to import 30 tonnes of gold in april likely april india gold import 30 tonnes,-1,-0.049967766,0.040365808
05-12-2016,https://economictimes.indiatimes.com/news/economy/foreign-trade/gold-imports-to-dictate-size-of-current-account-deficit-in-h2-of-fy2017-icra/articleshow/55810514.cms,gold imports to dictate size of current account deficit in h2 of fy2017: icra,0,0,0,0,1,0,none,"['current account', 'imports dictate size', 'icra', 'gold', 'deficit h2']",gold imports to dictate size of current account deficit in h2 of fy2017: icra current account imports dictate size icra gold deficit h2,-1,-0.09849926,0.17430234
13-12-2011,http://www.marketwatch.com/story/gold-ends-03-lower-at-166310-an-ounce-2011-12-13,"gold ends 0.3% lower at $1,663.10 an ounce",0,0,1,0,1,0,negative,"['ends', '663 10', 'lower', 'gold', '10 ounce']","gold ends 0.3% lower at $1,663.10 an ounce ends 663 10 lower gold 10 ounce",21,0.40590954,0.046799604
21-10-2013,http://www.marketwatch.com/story/comex-gold-logs-third-gain-in-four-sessions-2013-10-21,comex gold logs third gain in four sessions,1,0,0,0,1,0,positive,"['gold', 'sessions', 'gain', 'comex', 'logs']",comex gold logs third gain in four sessions gold sessions gain comex logs,-1,-0.10163122,0.010500416
18-01-2018,http://www.investing.com/news/commodities-news/gold-prices-remain-on-the-downside-after-mixed-us-data-1119868,Gold Prices Remain on the Downside after Mixed U.S. Data,0,1,0,0,1,0,neutral,"['remain', 'mixed', 'downside', 'mixed data', 'gold prices']",Gold Prices Remain on the Downside after Mixed U.S. Data remain mixed downside mixed data gold prices,-1,-0.058583178,0.04257653
01-08-2016,http://www.marketwatch.com/story/december-gold-finishes-up-210-or-02-at-135960oz-2016-08-01,"December gold finishes up $2.10, or 0.2%, at $1,359.60/oz.",1,0,0,0,1,0,positive,"['10 359', '60', 'oz', 'december', 'gold finishes']","December gold finishes up $2.10, or 0.2%, at $1,359.60/oz. 10 359 60 oz december gold finishes",21,0.47058517,0.053165775
21-05-2008,http://www.marketwatch.com/story/gold-futures-edge-up-as-dollar-falls-oil-surges-2008-05-21,"gold futures edge up, as dollar falls, oil surges",1,0,0,1,1,0,positive,"['falls', 'edge', 'dollar', 'oil surges', 'gold futures']","gold futures edge up, as dollar falls, oil surges falls edge dollar oil surges gold futures",-1,-0.18871924,-0.2536333
26-12-2014,https://www.thehindubusinessline.com/markets/commodities/gold-inches-up-in-thin-trade-eyes-2nd-straight-weekly-drop/article20938561.ece1,"Gold inches up in thin trade, eyes 2nd straight weekly drop",1,0,0,0,1,0,positive,"['straight', 'trade', 'eyes 2nd', 'weekly drop', 'gold inches']","Gold inches up in thin trade, eyes 2nd straight weekly drop straight trade eyes 2nd weekly drop gold inches",-1,-0.043136925,0.11459434
03-02-2017,http://www.marketwatch.com/story/gold-pares-loss-after-jobs-report-off-260-or-03-121530oz-2017-02-03,"Gold pares loss after jobs report, off $2.60, or 0.3%, $1,215.30/oz.",0,0,1,0,1,0,negative,"['pares', '215 30', 'oz', 'jobs report 60', 'loss jobs report']","Gold pares loss after jobs report, off $2.60, or 0.3%, $1,215.30/oz. pares 215 30 oz jobs report 60 loss jobs report",-1,0.3043247,0.061190784
21-02-2006,http://www.marketwatch.com/story/gold-futures-up-130-at-55590-an-ounce-2006-02-21,gold futures up $1.30 at $555.90 an ounce,1,0,0,0,1,0,positive,"['30 555 90', '30', '90 ounce', 'gold', 'futures']",gold futures up $1.30 at $555.90 an ounce 30 555 90 30 90 ounce gold futures,26,0.29578292,-0.3318958
21-06-2011,http://www.marketwatch.com/story/gold-futures-score-sixth-straight-winning-session-2011-06-21,gold futures score sixth-straight winning session,1,0,0,0,1,0,positive,"['straight', 'session', 'winning', 'futures score', 'gold futures']",gold futures score sixth-straight winning session straight session winning futures score gold futures,-1,-0.041476756,-0.44156992
12-12-2008,http://www.marketwatch.com/story/february-gold-ends-down-610-at-82050-an-ounce-on-nymex-2008-12-12,february gold ends down $6.10 at $820.50 an ounce on nymex,0,0,1,0,1,0,negative,"['10 820 50', 'february', 'nymex', 'ounce', 'gold ends']",february gold ends down $6.10 at $820.50 an ounce on nymex 10 820 50 february nymex ounce gold ends,21,0.37200516,0.025819637
29-12-2008,https://economictimes.indiatimes.com/articleshow/3907821.cms,"gold, base metals futures rally on crude rise",1,0,0,1,1,0,positive,"['rise', 'rally', 'crude', 'gold base metals', 'metals futures']","gold, base metals futures rally on crude rise rise rally crude gold base metals metals futures",-1,-0.15131049,-0.36036694
07-05-2014,"http://www.investing.com/news/commodities-news/gold-inches-higher-with-yellen-testimony,-ukraine-violence-in-focus-282459","gold inches higher with yellen testimony, ukraine violence in focus",1,0,0,0,1,0,positive,"['inches', 'violence focus', 'ukraine', 'gold', 'higher yellen testimony']","gold inches higher with yellen testimony, ukraine violence in focus inches violence focus ukraine gold higher yellen testimony",-1,-0.1445637,0.19927555
09-08-2012,http://www.marketwatch.com/story/gold-drifts-lower-as-market-weighs-china-data-2012-08-09,gold inches higher on hopes of easing,1,0,0,0,1,0,positive,"['hopes', 'inches', 'higher hopes', 'gold', 'easing']",gold inches higher on hopes of easing hopes inches higher hopes gold easing,-1,-0.0027261227,0.094753064
13-04-2010,http://www.marketwatch.com/story/crude-oil-gold-stay-lower-after-trade-data-2010-04-13,"crude oil, gold stay lower after trade data",0,0,1,1,1,0,negative,"['trade', 'data', 'crude', 'stay lower', 'oil gold stay']","crude oil, gold stay lower after trade data trade data crude stay lower oil gold stay",-1,-0.17188986,-0.05371052
11-06-2014,http://www.marketwatch.com/story/gold-futures-log-third-straight-day-of-gains-2014-06-11,gold futures log third straight day of gains,1,0,0,0,1,0,positive,"['straight', 'day', 'gains', 'futures log', 'gold futures']",gold futures log third straight day of gains straight day gains futures log gold futures,-1,-0.11047764,-0.40841746
09-01-2006,http://www.marketwatch.com/story/cboe-gold-index-closes-at-13117-down-06-2006-01-09,"cboe gold index closes at 131.17, down 0.6%",0,0,1,0,1,0,negative,"['17', 'gold', 'cboe', 'closes 131', 'index closes']","cboe gold index closes at 131.17, down 0.6% 17 gold cboe closes 131 index closes",6,0.015677363,-0.053456098
16-08-2013,https://www.thehindubusinessline.com/markets/gold/gold-silver-zoom-on-investors-buying/article20649588.ece1,"Gold, silver zoom on investors' buying",1,0,0,1,1,0,positive,"['zoom', 'gold', 'silver', 'investors buying', 'zoom investors buying']","Gold, silver zoom on investors' buying zoom gold silver investors buying zoom investors buying",-1,-0.15474696,0.15427074
25-09-2018,https://www.moneycontrol.com/news/business/markets/gold-futures-down-0-14-on-weak-global-cues-2983871.html,Gold futures down 0.14% on weak global cues,0,0,1,0,1,0,negative,"['14', 'cues', 'weak global', 'futures', 'gold futures']",Gold futures down 0.14% on weak global cues 14 cues weak global futures gold futures,22,-0.10024603,-0.38698417
26-04-2018,https://www.moneycontrol.com/news/business/gold-falls-on-strong-dollar-higher-us-yields-2557527.html,"gold falls on strong dollar, higher us yields",0,0,1,1,1,0,negative,"['strong', 'falls', 'gold', 'higher yields', 'dollar higher yields']","gold falls on strong dollar, higher us yields strong falls gold higher yields dollar higher yields",-1,-0.09112145,0.10695687
05-06-2006,http://www.marketwatch.com/story/agnico-eagle-to-develop-finland-gold-project-for-135-mln-2006-06-05,agnico-eagle to develop finland gold project for $135 mln,0,0,0,0,1,0,none,"['project 135', 'mln', 'agnico', 'eagle develop', 'develop finland']",agnico-eagle to develop finland gold project for $135 mln project 135 mln agnico eagle develop develop finland,-1,-0.0059209913,0.13063025
13-04-2011,http://www.marketwatch.com/story/june-gold-closes-at-145560oz-up-2-or-01-2011-04-13,"june gold closes at $1,455.60/oz, up $2, or 0.1%",1,0,0,0,1,0,positive,"['455 60', 'closes', 'june', 'oz', 'gold']","june gold closes at $1,455.60/oz, up $2, or 0.1% 455 60 closes june oz gold",21,0.42502224,-0.003201425
22-12-2016,http://www.marketwatch.com/story/gold-holds-modest-losses-after-economic-reports-2016-12-22,Gold holds modest losses after economic reports,0,0,1,0,1,0,negative,"['modest', 'holds', 'gold', 'economic reports', 'losses economic']",Gold holds modest losses after economic reports modest holds gold economic reports losses economic,-1,-0.13451838,0.12309469
17-11-2011,https://www.moneycontrol.com/news/business/markets/-1378427.html,Gold prices trading lower,0,0,1,0,1,0,negative,"['lower', 'gold', 'trading', 'gold prices', 'prices trading lower']",Gold prices trading lower lower gold trading gold prices prices trading lower,-1,-0.1240298,-0.008875407
05-08-2016,http://www.marketwatch.com/story/december-gold-falls-1130-or-09-to-135420oz-2016-08-05,"December gold falls $11.30, or 0.9%, to $1,354.20/oz",0,0,1,0,1,0,negative,"['11 30 354', 'falls', 'december', '20 oz', 'gold']","December gold falls $11.30, or 0.9%, to $1,354.20/oz 11 30 354 falls december 20 oz gold",21,0.45396698,0.07697755
21-12-2016,http://www.marketwatch.com/story/gold-ends-little-changed-as-dow-aims-at-20000-2016-12-21,"Gold ends little-changed as Dow aims at 20,000",0,1,0,0,1,0,neutral,"['000', 'little changed', 'aims 20', 'dow', 'gold ends']","Gold ends little-changed as Dow aims at 20,000 000 little changed aims 20 dow gold ends",-1,-0.032090165,0.049558625
30-01-2017,http://www.marketwatch.com/story/gold-gains-ahead-of-busy-week-from-fed-economic-data-2017-01-30,"Gold marks first gain in 5 sessions as Dow sinks below 20,000",1,0,0,0,1,0,positive,"['sinks', '20', 'gain sessions', 'dow', 'gold marks']","Gold marks first gain in 5 sessions as Dow sinks below 20,000 sinks 20 gain sessions dow gold marks",-1,-0.045004025,0.051446438
13-01-2013,https://www.thehindubusinessline.com/opinion/columns/g-chandrashekhar/Waning-demand-stronger-dollar-take-glitter-off-gold/article20564957.ece,"Waning demand, stronger dollar take glitter off gold",0,0,1,1,1,0,negative,"['stronger', 'waning', 'gold', 'waning demand', 'dollar glitter']","Waning demand, stronger dollar take glitter off gold stronger waning gold waning demand dollar glitter",-1,-0.08034433,0.19257537
26-07-2017,"http://www.investing.com/news/commodities-news/gold-gains-in-asia-as-fed-holds-steady-as-expected,-notes-prices-data-510643","Gold gains in Asia as Fed holds steady as expected, notes prices data",1,0,0,0,1,0,positive,"['expected notes', 'asia', 'gains', 'prices data', 'fed holds steady']","Gold gains in Asia as Fed holds steady as expected, notes prices data expected notes asia gains prices data fed holds steady",-1,-0.20267417,0.12735188
17-04-2013,https://www.moneycontrol.com/news/business/markets/-1066879.html,gold may find long term support at &#36;1250-1270: eastspring,0,0,0,0,0,1,none,"['long', '36 1250 1270', '1250 1270', 'term support', 'eastspring']",gold may find long term support at &#36;1250-1270: eastspring long 36 1250 1270 1250 1270 term support eastspring,-1,-0.11461224,0.006076999
24-08-2011,http://www.marketwatch.com/story/oil-down-more-than-100-as-settlement-approaches-2011-08-24,gold down more than $100 as settlement approaches,0,0,1,0,1,0,negative,"['approaches', '100', 'gold', 'gold 100', 'settlement approaches']",gold down more than $100 as settlement approaches approaches 100 gold gold 100 settlement approaches,-1,0.14841543,-0.07945301
14-12-2004,http://www.marketwatch.com/story/feb-gold-falls-110-to-43920oz-in-morning-ny-trade-2004-12-14,feb gold falls $1.10 to $439.20/oz in morning ny trade,0,0,1,0,1,0,negative,"['ny', 'trade', 'falls 10 439', '20 oz morning', 'feb gold']",feb gold falls $1.10 to $439.20/oz in morning ny trade ny trade falls 10 439 20 oz morning feb gold,21,0.39316761,0.090546094
10-11-2005,http://www.marketwatch.com/story/marshall-ilsley-pays-278-cash-1572-stk-for-gold-banc-2005-11-10,"marshall & ilsley pays $2.78-cash, $15.72 stk for gold banc",0,0,0,0,1,0,none,"['15 72 stk', 'ilsley', 'pays 78 cash', 'marshall', 'gold banc']","marshall & ilsley pays $2.78-cash, $15.72 stk for gold banc 15 72 stk ilsley pays 78 cash marshall gold banc",-1,0.124089286,0.12334892
16-06-2014,"http://www.investing.com/news/commodities-news/gold-prices-ease-in-asia-on-profit-taking,-iraq,-china-data-eyed-289941","Gold prices ease in Asia on profit taking, Iraq, China data eyed",0,0,0,0,1,0,none,"['profit taking', 'gold', 'prices ease', 'asia', 'iraq china data']","Gold prices ease in Asia on profit taking, Iraq, China data eyed profit taking gold prices ease asia iraq china data",-1,-0.25761846,0.20622113
25-09-2014,https://www.thehindubusinessline.com/opinion/columns/gnanasekaar-t/Sell-gold-if-it-rallies-to-1230-35oz/article20873731.ece,"Sell gold if it rallies to $1,230-35/oz",0,0,0,0,0,1,none,"['35', '230', 'rallies', 'oz', 'sell gold']","Sell gold if it rallies to $1,230-35/oz 35 230 rallies oz sell gold",-1,0.27162015,0.1717697
21-07-2017,http://www.marketwatch.com/story/oil-prices-drop-toward-session-lows-but-gold-trades-near-the-days-highs-2017-07-21,"Oil prices drop toward session lows, but gold trades near the day's highs",1,0,0,1,1,0,positive,"['oil', 'day highs', 'drop session lows', 'prices drop', 'gold trades near']","Oil prices drop toward session lows, but gold trades near the day's highs oil day highs drop session lows prices drop gold trades near",-1,-0.085251495,-0.1025648
19-01-2017,https://www.thehindubusinessline.com/markets/gold/gold-under-pressure-as-feds-yellen-backs-gradual-rate-hikes/article9489006.ece,Gold under pressure as Fed's Yellen backs gradual rate hikes,0,0,1,0,0,1,negative,"['yellen', 'hikes', 'fed', 'backs gradual rate', 'gold pressure']",Gold under pressure as Fed's Yellen backs gradual rate hikes yellen hikes fed backs gradual rate gold pressure,-1,-0.16892795,0.12434305
26-06-2014,http://www.investing.com/news/commodities-news/gold-slips-as-fed-official-gives-upbeat-take-on-u.s.-economy-291769,Gold slips as Fed official gives upbeat take on U.S. economy,0,0,1,0,1,0,negative,"['gives', 'official', 'economy', 'gives upbeat', 'gold slips fed']",Gold slips as Fed official gives upbeat take on U.S. economy gives official economy gives upbeat gold slips fed,-1,-0.13594034,0.08395629
18-05-2017,http://www.investing.com/news/commodities-news/gold-gains-in-asia-on-heightened-risk-sentiment-486304,Gold gains in Asia on heightened risk sentiment,1,0,0,0,1,0,positive,"['heightened', 'sentiment', 'asia', 'risk', 'gold gains']",Gold gains in Asia on heightened risk sentiment heightened sentiment asia risk gold gains,-1,-0.27026725,0.1390652
30-05-2017,http://www.marketwatch.com/story/gold-holds-modest-losses-after-consumer-confidence-report-2017-05-30,Gold holds modest losses after consumer-confidence report,0,0,1,0,1,0,negative,"['modest', 'report', 'losses', 'gold holds', 'consumer confidence']",Gold holds modest losses after consumer-confidence report modest report losses gold holds consumer confidence,-1,-0.12025902,0.121238485
18-05-2016,http://www.marketwatch.com/story/gold-futures-fall-from-settlement-level-after-fomc-minutes-2016-05-18,gold futures fall from settlement level after fomc minutes,0,0,1,0,1,0,negative,"['minutes', 'fall', 'fomc', 'settlement level', 'gold futures']",gold futures fall from settlement level after fomc minutes minutes fall fomc settlement level gold futures,-1,-0.059897006,-0.4537235
30-07-2009,http://www.marketwatch.com/story/canadian-shares-rally-led-by-oil-and-gold-2009-07-30,"canadian shares bounce back with oil, gold gains",1,0,0,1,1,0,positive,"['bounce', 'oil', 'canadian', 'shares bounce', 'oil gold gains']","canadian shares bounce back with oil, gold gains bounce oil canadian shares bounce oil gold gains",-1,-0.19646499,0.08283238
08-05-2012,http://www.marketwatch.com/story/comex-gold-falls-23-or-14-in-morning-trade-2012-05-08,"comex gold falls $23, or 1.4% in morning trade",0,0,1,0,1,0,negative,"['23', 'morning', 'falls', 'trade', 'comex gold']","comex gold falls $23, or 1.4% in morning trade 23 morning falls trade comex gold",-1,0.14996003,-0.011435911
13-08-2003,http://www.marketwatch.com/story/gold-futures-at-fresh-two-week-high-2003-08-13,gold futures at fresh two-week high,1,0,0,0,1,0,positive,"['fresh', 'high', 'week', 'futures', 'gold futures']",gold futures at fresh two-week high fresh high week futures gold futures,-1,-0.12467326,-0.50836617
15-04-2013,https://www.moneycontrol.com/news/business/companies/-1075859.html,"gold-related companies' shares crash, muthoot down 13%",0,0,1,0,1,0,negative,"['13', 'companies', 'muthoot', 'gold related', 'shares crash']","gold-related companies' shares crash, muthoot down 13% 13 companies muthoot gold related shares crash",-1,-0.17150483,0.06395286
03-11-2015,https://www.thehindubusinessline.com/markets/gold/gold-stuck-near-4week-low-on-us-rate-hike-view/article7837464.ece,Gold stuck near 4-week low on US rate hike view,0,1,1,0,1,0,negative,"['near week', 'view', 'low rate', 'hike', 'gold stuck']",Gold stuck near 4-week low on US rate hike view near week view low rate hike gold stuck,-1,-0.05874598,-0.016764447
15-02-2006,http://www.marketwatch.com/story/april-gold-falls-230-to-54660oz-after-54350-low-2006-02-15,april gold falls $2.30 to $546.60/oz after $543.50 low,0,0,1,0,1,0,negative,"['543 50 low', 'falls', 'gold', 'april', '60 oz']",april gold falls $2.30 to $546.60/oz after $543.50 low 543 50 low falls gold april 60 oz,21,0.45914984,0.059403125
12-01-2018,https://www.metalsdaily.com/link/275694/india-mmtc-plans-a-full-fledged-portal-for-transaction-of-gold-and-silver.htm,india : mmtc plans a full-fledged portal for transaction of gold and silver,0,0,0,1,1,0,none,"['plans fledged', 'india', 'portal transaction', 'mmtc', 'gold silver']",india : mmtc plans a full-fledged portal for transaction of gold and silver plans fledged india portal transaction mmtc gold silver,-1,-0.21475783,0.061671086
03-10-2016,http://www.marketwatch.com/story/dec-gold-falls-270-or-02-to-131440oz-2016-10-03,"Dec. gold falls $2.70, or 0.2%, to $1,314.40/oz",0,0,1,0,1,0,negative,"['70 314 40', 'dec', 'falls', 'gold', '40 oz']","Dec. gold falls $2.70, or 0.2%, to $1,314.40/oz 70 314 40 dec falls gold 40 oz",21,0.45688695,0.08465938
0200-04-28,http://www.marketwatch.com/story/gold-futures-fall-hold-recent-trading-range-2003-04-28,"gold futures fall, hold recent trading range",0,0,1,0,1,0,negative,"['recent', 'hold', 'fall', 'trading range', 'gold futures']","gold futures fall, hold recent trading range recent hold fall trading range gold futures",-1,-0.10373461,-0.38194415
17-09-2008,http://www.marketwatch.com/story/gold-surges-as-investors-rush-to-safety-2008-09-17-1710308,gold surges as investors rush to safety,1,0,0,0,1,0,positive,"['rush', 'safety', 'surges', 'gold', 'investors rush']",gold surges as investors rush to safety rush safety surges gold investors rush,-1,-0.26643956,0.05959095
28-07-2016,http://www.marketwatch.com/story/why-gold-prices-spiked-after-the-fed-decision-2016-07-27,Why gold prices spiked after the Fed decision,0,0,0,0,1,0,none,"['decision', 'spiked', 'fed', 'prices spiked', 'gold prices']",Why gold prices spiked after the Fed decision decision spiked fed prices spiked gold prices,-1,-0.1708258,0.012705132
26-07-2010,http://www.marketwatch.com/story/gold-futures-down-10-cents-at-118760oz-2010-07-26,gold futures down 10 cents at $1187.60/oz,0,0,1,0,1,0,negative,"['1187 60', '60', 'oz', 'futures', '10 cents']",gold futures down 10 cents at $1187.60/oz 1187 60 60 oz futures 10 cents,26,0.35436815,-0.30621827
12-09-2005,http://www.marketwatch.com/story/gold-futures-close-higher-for-an-eighth-session-2005-09-12,gold futures close higher for an eighth session,1,0,0,0,1,0,positive,"['session', 'eighth', 'gold', 'gold futures', 'futures close higher']",gold futures close higher for an eighth session session eighth gold gold futures futures close higher,-1,-0.0666655,-0.50436044
03-09-2010,http://www.marketwatch.com/story/gold-closes-down-02-at-125110-an-ounce-2010-09-03,"gold closes down 0.2% at $1,251.10 an ounce",0,0,1,0,1,0,negative,"['10', 'closes', 'closes 251', 'gold', 'ounce']","gold closes down 0.2% at $1,251.10 an ounce 10 closes closes 251 gold ounce",21,0.3364483,0.011522993
18-10-2016,https://www.moneycontrol.com/news/business/markets/gold-may-regain-ground2017bumpy-road-ahead-poll-956469.html,gold may regain ground in 2017 but 'bumpy road' ahead: poll,1,0,0,0,1,0,positive,"['bumpy', '2017', 'regain ground', 'road ahead poll', 'gold regain']",gold may regain ground in 2017 but 'bumpy road' ahead: poll bumpy 2017 regain ground road ahead poll gold regain,-1,-0.2154651,-0.007969506
19-06-2014,http://www.investing.com/news/commodities-news/gold-rises-on-fed-rate-outlook-290483,Gold rises on Fed rate outlook,1,0,0,0,1,0,positive,"['rate', 'outlook', 'rises', 'gold', 'rises fed rate']",Gold rises on Fed rate outlook rate outlook rises gold rises fed rate,-1,-0.11791295,0.031174395
31-07-2017,http://www.marketwatch.com/story/gold-slips-but-move-barely-dents-solid-july-performance-2017-07-31,Gold ends marginally lower but books solid July performance,0,0,1,0,1,0,negative,"['marginally', 'performance', 'july', 'gold ends', 'lower books solid']",Gold ends marginally lower but books solid July performance marginally performance july gold ends lower books solid,-1,-0.03512899,-0.027249128
20-02-2018,http://www.investing.com/news/commodities-news/gold-prices-continue-to-drop-on-stronger-dollar-1276694,Gold Prices Continue to Drop on Stronger Dollar,0,0,1,1,1,0,negative,"['continue', 'stronger', 'dollar', 'continue drop', 'gold prices']",Gold Prices Continue to Drop on Stronger Dollar continue stronger dollar continue drop gold prices,-1,-0.016420737,0.09567324
14-02-2012,http://www.marketwatch.com/story/gold-futures-extend-weekly-losses-2012-02-13,"gold ends lower, logs third-straight session loss",0,0,1,0,1,0,negative,"['straight', 'lower', 'logs', 'gold ends', 'session loss']","gold ends lower, logs third-straight session loss straight lower logs gold ends session loss",-1,-0.047027268,-0.06849992
21-03-2017,http://www.marketwatch.com/story/gold-prices-mark-fourth-straight-session-climb-2017-03-21,Gold prices mark fourth straight session climb,1,0,0,0,1,0,positive,"['session', 'prices mark', 'climb', 'fourth straight', 'gold prices']",Gold prices mark fourth straight session climb session prices mark climb fourth straight gold prices,-1,0.024756655,0.033321053
30-08-2017,https://economictimes.indiatimes.com/markets/commodities/news/gold-inches-lower-on-dollar-rebound-as-n-korea-concerns-ease/articleshow/60286023.cms,gold slips on stronger dollar; geopolitical risks support,0,0,1,1,1,0,negative,"['stronger', 'slips', 'risks support', 'dollar', 'geopolitical']",gold slips on stronger dollar; geopolitical risks support stronger slips risks support dollar geopolitical,-1,-0.15655303,0.028474823
31-01-2018,https://www.metalsdaily.com/link/276278/bitcoin-has-gold-lost-its-shine-amid-bitcoins-rise-analyst-takes-a-closer-look.htm,bitcoin : has gold lost its shine amid bitcoin's rise? analyst takes a closer look,0,0,0,1,0,1,none,"['analyst takes closer', 'shine', 'rise analyst takes', 'amid bitcoin', 'bitcoin gold lost']",bitcoin : has gold lost its shine amid bitcoin's rise? analyst takes a closer look analyst takes closer shine rise analyst takes amid bitcoin bitcoin gold lost,-1,-0.18977591,0.19071099
10-04-2012,https://economictimes.indiatimes.com/markets/commodities/gold-rises-by-rs-150-on-firm-demand-silver-loses-rs-400/articleshow/12609517.cms,"gold rises by rs 150 on firm demand, silver loses rs 400",1,0,0,1,1,0,positive,"['demand', '150 firm', 'silver loses', 'gold rises', 'loses rs 400']","gold rises by rs 150 on firm demand, silver loses rs 400 demand 150 firm silver loses gold rises loses rs 400",-1,-0.05164969,0.10477686
23-08-2004,http://www.marketwatch.com/story/dec-gold-ends-at-41280-down-270-for-the-ny-session-2004-08-23,"dec gold ends at $412.80, down $2.70 for the ny session",0,0,1,0,1,0,negative,"['412 80 70', 'ends', 'gold', 'ny session', 'dec']","dec gold ends at $412.80, down $2.70 for the ny session 412 80 70 ends gold ny session dec",-1,0.34499246,-0.05011417
14-04-2014,http://www.investing.com/news/commodities-news/gold-futures-remain-near-3-week-highs-in-risk-off-trade-277299,Gold futures remain near 3-week highs in risk-off trade,0,0,1,0,1,0,negative,"['trade', 'highs', 'risk', 'remain near week', 'gold futures remain']",Gold futures remain near 3-week highs in risk-off trade trade highs risk remain near week gold futures remain,-1,-0.13963307,-0.43080163
06-12-2018,https://www.thehindubusinessline.com/markets/gold/gold-gains-as-risk-aversion-weighs-on-dollar/article25677956.ece,Gold gains as risk aversion weighs on dollar,1,0,0,1,1,0,positive,"['weighs', 'gains', 'dollar', 'aversion', 'gold gains risk']",Gold gains as risk aversion weighs on dollar weighs gains dollar aversion gold gains risk,-1,-0.04528156,0.059622966
19-08-2014,https://www.thehindubusinessline.com/markets/gold/Gold-futures-rise-marginally-to-Rs-28311-silver-up-at-Rs-42667-per-kg/article20846662.ece,"Gold futures rise marginally to Rs 28,311; silver up at Rs 42,667 per kg",1,0,0,1,1,0,positive,"['gold', 'rs 42 667', 'rise marginally rs', '28 311 silver', 'futures rise marginally']","Gold futures rise marginally to Rs 28,311; silver up at Rs 42,667 per kg gold rs 42 667 rise marginally rs 28 311 silver futures rise marginally",-1,-0.018884018,-0.27719548
03-11-2017,http://www.marketwatch.com/story/dec-gold-declines-by-890-or-07-to-settle-at-126920oz-2017-11-03,"Dec. gold declines by $8.90, or 0.7%, to settle at $1,269.20/oz",0,0,1,0,1,0,negative,"['dec', '269 20', 'settle', 'oz', 'gold declines 90']","Dec. gold declines by $8.90, or 0.7%, to settle at $1,269.20/oz dec 269 20 settle oz gold declines 90",21,0.45604712,-0.05970782
23-05-2017,http://www.marketwatch.com/story/gold-pulls-back-from-three-week-high-as-dollar-index-firms-2017-05-23,Gold prices retreat from a 3-week high,1,0,0,0,1,0,positive,"['high', 'week', 'retreat', 'prices retreat', 'gold prices']",Gold prices retreat from a 3-week high high week retreat prices retreat gold prices,-1,0.015553832,-0.08978993
10-02-2016,"http://www.investing.com/news/commodities-news/gold-prices-up-in-asia-after-fed-chief-views,-japan,-china-shut-384191","Gold prices up in Asia after Fed chief views, Japan, China shut",1,0,0,0,1,0,positive,"['prices', 'gold', 'asia', 'fed chief views', 'japan china shut']","Gold prices up in Asia after Fed chief views, Japan, China shut prices gold asia fed chief views japan china shut",-1,-0.25088963,0.08308917
01-11-2011,https://economictimes.indiatimes.com/markets/commodities/silver-dips-further-on-global-fall-gold-eases/articleshow/10570426.cms,"silver dips further on global fall, gold eases",0,0,1,1,1,0,negative,"['global', 'eases', 'dips', 'silver', 'fall gold eases']","silver dips further on global fall, gold eases global eases dips silver fall gold eases",-1,-0.13864812,0.16470033
19-12-2018,https://www.metalsdaily.com/link/287923/gold-pulls-back-from-5-month-top-investors-await-fed-outlook-.htm,"gold pulls back from 5-month top, investors await fed outlook ",0,0,1,0,1,0,negative,"['await', 'month', 'investors', 'outlook', 'gold pulls']","gold pulls back from 5-month top, investors await fed outlook  await month investors outlook gold pulls",-1,-0.13729073,-0.05750248
03-03-2011,http://www.marketwatch.com/story/oil-gold-fall-on-report-gadhafi-mulls-peace-plan-2011-03-03,"oil, gold fall on report gadhafi mulls peace plan",0,0,1,1,1,0,negative,"['fall', 'oil', 'mulls peace plan', 'gold fall report', 'report gadhafi']","oil, gold fall on report gadhafi mulls peace plan fall oil mulls peace plan gold fall report report gadhafi",-1,-0.22624427,0.09913675
22-07-2013,https://www.moneycontrol.com/news/business/markets/-1679137.html,gold rises to 1-month high on weaker us dollar,1,0,0,1,1,0,positive,"['weaker', 'high', 'month', 'dollar', 'gold rises']",gold rises to 1-month high on weaker us dollar weaker high month dollar gold rises,-1,0.007310763,0.11580262
05-10-2010,http://www.marketwatch.com/story/dec-gold-last-up-390-at-134420oz-2010-10-05,"dec. gold last up $3.90 at $1,344.20/oz",1,0,0,0,1,0,positive,"['20', '90 344', 'dec', 'oz', 'gold']","dec. gold last up $3.90 at $1,344.20/oz 20 90 344 dec oz gold",21,0.4177782,0.06185995
01-01-2019,https://www.metalsdaily.com/link/288071/frank-holmes-best-month-for-gold-price-in-2-years.htm,frank holmes : best month for gold price in 2 years,0,0,0,0,1,0,none,"['price', 'frank', 'best month', 'holmes best', 'gold price years']",frank holmes : best month for gold price in 2 years price frank best month holmes best gold price years,-1,0.06377749,0.053349588
23-08-2017,https://economictimes.indiatimes.com/markets/commodities/news/gold-extends-losses-sheds-rs-100-on-muted-demand/articleshow/60190498.cms,"gold extends losses, sheds rs 100 on muted demand",0,0,1,0,1,0,negative,"['100', 'sheds', 'muted', 'demand', 'gold extends losses']","gold extends losses, sheds rs 100 on muted demand 100 sheds muted demand gold extends losses",-1,-0.12042448,0.11583425
13-04-2018,https://www.moneycontrol.com/news/business/gold-steadies-on-track-for-second-week-of-gains-2548229.html,"Gold steadies, on track for second week of gains",1,0,0,0,1,0,positive,"['track second', 'week', 'gold', 'steadies', 'second week gains']","Gold steadies, on track for second week of gains track second week gold steadies second week gains",-1,-0.08549145,0.084951356
07-04-2011,http://www.marketwatch.com/story/oil-lower-gold-higher-after-japans-quake-reports-2011-04-07,"oil lower, gold higher after japan's quake reports",1,0,0,1,1,0,positive,"['reports', 'japan', 'quake', 'oil lower', 'lower gold higher']","oil lower, gold higher after japan's quake reports reports japan quake oil lower lower gold higher",-1,-0.15238422,0.058831975
11-09-2006,http://www.marketwatch.com/story/gold-fields-ltd-down-67-at-1828-2006-09-11,gold fields ltd. down 6.7% at $18.28,0,0,1,0,1,0,negative,"['28', '18', 'fields', 'gold', 'gold fields']",gold fields ltd. down 6.7% at $18.28 28 18 fields gold gold fields,-1,0.11409886,-0.009290926
01-12-2006,http://www.marketwatch.com/story/feb-gold-gains-25-for-the-week-2006-12-01,feb. gold gains 2.5% for the week,1,0,0,0,1,0,positive,"['gold', 'week', 'feb', 'gains week', 'gold gains']",feb. gold gains 2.5% for the week gold week feb gains week gold gains,-1,0.09350453,0.090074465
21-04-2006,http://www.marketwatch.com/story/spot-gold-up-6-at-62090-an-ounce-2006-04-21,spot gold up $6 at $620.90 an ounce,1,0,0,0,1,0,positive,"['90', 'spot', '620', '90 ounce', 'spot gold']",spot gold up $6 at $620.90 an ounce 90 spot 620 90 ounce spot gold,-1,0.35369438,0.101714194
02-01-2015,http://www.marketwatch.com/story/gold-prices-slip-as-dollar-strengthens-2015-01-02,gold prices rebound as stocks slip,1,0,0,0,1,0,positive,"['slip', 'gold', 'rebound', 'gold prices', 'prices rebound stocks']",gold prices rebound as stocks slip slip gold rebound gold prices prices rebound stocks,-1,-0.14755735,0.07124495
20-11-2015,http://www.marketwatch.com/story/december-gold-falls-160-or-01-to-close-at-107630oz-2015-11-20,"december gold falls $1.60, or 0.1%, to close at $1,076.30/oz.",0,0,1,0,1,0,negative,"['60 close', 'falls', 'december', 'gold', '076 30 oz']","december gold falls $1.60, or 0.1%, to close at $1,076.30/oz. 60 close falls december gold 076 30 oz",21,0.46261775,-0.012076549
27-09-2011,https://www.moneycontrol.com/news/business/markets/-2061923.html,gold stages comeback with aid of weak dollar,1,0,0,1,1,0,positive,"['aid', 'stages', 'comeback', 'weak dollar', 'gold stages']",gold stages comeback with aid of weak dollar aid stages comeback weak dollar gold stages,-1,-0.07509595,0.112773076
19-02-2014,https://www.moneycontrol.com/news/business/markets/gold-holds-near-3-12-month-high-as-growth-worries-persist-1139437.html,gold holds near 3-1/2 month high as growth worries persist,1,0,0,0,1,0,positive,"['persist', 'high', 'near month', 'growth worries', 'gold holds near']",gold holds near 3-1/2 month high as growth worries persist persist high near month growth worries gold holds near,-1,-0.026422702,0.09772061
22-11-2017,http://www.marketwatch.com/story/gold-prices-settle-sharply-higher-ahead-of-fomc-minutes-2017-11-22,Gold prices settle sharply higher ahead of FOMC minutes,1,0,0,0,1,0,positive,"['minutes', 'sharply higher ahead', 'fomc', 'prices settle', 'gold prices']",Gold prices settle sharply higher ahead of FOMC minutes minutes sharply higher ahead fomc prices settle gold prices,-1,-0.05379866,-0.08483042
29-03-2017,https://economictimes.indiatimes.com/markets/commodities/news/gold-rate-check-out-the-latest-gold-price-trends-and-market-outlook/articleshow/57886664.cms,"gold rate: check out the latest gold price, trends and market outlook",0,0,0,0,1,0,none,"['latest', 'rate check', 'trends', 'market outlook', 'gold price']","gold rate: check out the latest gold price, trends and market outlook latest rate check trends market outlook gold price",-1,-0.12119052,0.10187228
26-07-2016,http://www.investing.com/news/commodities-news/gold-falls-towards-1-month-low-ahead-of-fed-meeting-416534,gold falls towards 1-month low ahead of fed meeting,0,0,1,0,1,0,negative,"['ahead', 'meeting', 'fed', 'gold falls', 'falls month low']",gold falls towards 1-month low ahead of fed meeting ahead meeting fed gold falls falls month low,-1,-0.0076923072,-0.12301281
12-02-2018,http://www.marketwatch.com/story/april-gold-settles-at-132640oz-up-1070-or-08-2018-02-12,"april gold settles at $1,326.40/oz, up $10.70, or 0.8%",1,0,0,0,1,0,positive,"['326', '10 70', '40 oz', 'april', 'gold settles']","april gold settles at $1,326.40/oz, up $10.70, or 0.8% 326 10 70 40 oz april gold settles",21,0.5238079,0.029397376
02-11-2016,https://www.thehindubusinessline.com/markets/gold/gold-prices-zoom-to-1month-high-of-rs-30950/article9295761.ece,"Gold prices zoom to 1-month high of Rs 30,950",1,0,0,0,1,0,positive,"['30', '950', 'zoom', 'month high', 'gold prices']","Gold prices zoom to 1-month high of Rs 30,950 30 950 zoom month high gold prices",-1,0.027514279,0.018442206
12-11-2018,http://www.marketwatch.com/story/gold-edges-lower-as-dollar-strengthens-to-1-12-year-high-2018-11-12,gold extends loss to a third session as dollar strengthens to 1 -year high,0,0,1,1,1,0,negative,"['strengthens', 'year high', 'extends loss session', 'session dollar', 'gold extends']",gold extends loss to a third session as dollar strengthens to 1 -year high strengthens year high extends loss session session dollar gold extends,-1,0.013110504,0.08169668
12-09-2016,http://www.marketwatch.com/story/dec-gold-loses-890-or-07-to-settle-at-132560oz-2016-09-12,"Dec. gold loses $8.90, or 0.7%, to settle at $1,325.60/oz",0,0,1,0,1,0,negative,"['settle', '325 60', 'loses 90', 'oz', 'dec gold']","Dec. gold loses $8.90, or 0.7%, to settle at $1,325.60/oz settle 325 60 loses 90 oz dec gold",21,0.47187686,0.005398132
22-11-2011,https://www.moneycontrol.com/news/business/markets/-1326157.html,"Spot Gold rates slip in Jaipur, Ahmd, Chennai market",0,0,1,0,1,0,negative,"['spot', 'chennai', 'rates slip', 'jaipur ahmd', 'gold rates']","Spot Gold rates slip in Jaipur, Ahmd, Chennai market spot chennai rates slip jaipur ahmd gold rates",-1,-0.09570204,0.0679955
24-04-2015,https://www.thehindubusinessline.com/markets/gold/soft-us-data-supports-gold-but-weekly-dip-on-the-cards/article7137531.ece,"Soft US data supports gold, but weekly dip on the cards",1,1,0,0,1,0,positive,"['dip', 'weekly', 'cards', 'soft data supports', 'supports gold']","Soft US data supports gold, but weekly dip on the cards dip weekly cards soft data supports supports gold",-1,-0.14795606,0.10961449
20-11-2013,https://www.moneycontrol.com/news/business/markets/gold-rangebound-as-markets-await-fed-minutes-1571703.html,gold rangebound as markets await fed minutes,0,1,0,0,1,0,neutral,"['markets', 'minutes', 'gold', 'rangebound', 'await fed']",gold rangebound as markets await fed minutes markets minutes gold rangebound await fed,-1,-0.16294317,-0.10573308
26-05-2014,"http://www.investing.com/news/commodities-news/gold-rises-with-focus-on-ukraine,-copper-hits-12-week-high-286188","Gold rises with focus on Ukraine, copper hits 12-week high",1,0,0,1,1,0,positive,"['12 week', 'hits 12', 'ukraine', 'rises focus', 'copper']","Gold rises with focus on Ukraine, copper hits 12-week high 12 week hits 12 ukraine rises focus copper",-1,-0.11784136,0.13743751
24-10-2013,https://www.moneycontrol.com/news/business/markets/goldguinea-prices-rise-11october-series-so-far-1643751.html,goldguinea prices rise 11% in october series so far,1,0,0,0,1,0,positive,"['series', 'far', '11 october', 'prices rise', 'goldguinea']",goldguinea prices rise 11% in october series so far series far 11 october prices rise goldguinea,-1,0.07071157,0.07397904
06-02-2006,http://www.marketwatch.com/story/spot-gold-quoted-at-56910-in-asia-trade-2006-02-06,spot gold quoted at $569.10 in asia trade,1,0,0,0,1,0,positive,"['quoted', 'trade', '569 10', 'asia', 'spot gold']",spot gold quoted at $569.10 in asia trade quoted trade 569 10 asia spot gold,10,0.059160158,0.13251612
14-12-2010,https://economictimes.indiatimes.com/markets/commodities/gold-futures-up-on-firm-asian-cues/articleshow/7097840.cms,gold futures up on firm asian cues,1,0,0,0,1,0,positive,"['firm', 'cues', 'asian', 'futures', 'gold futures']",gold futures up on firm asian cues firm cues asian futures gold futures,-1,-0.26524645,-0.37417293
04-03-2013,https://www.moneycontrol.com/news/business/stocks/-1262623.html,mcx gold may slip to rs 29150-27850: mangal keshav,0,0,1,0,1,0,negative,"['27850', 'keshav', 'mangal', 'slip rs', 'mcx gold']",mcx gold may slip to rs 29150-27850: mangal keshav 27850 keshav mangal slip rs mcx gold,-1,-0.07125926,0.032712415
31-01-2018,http://www.investing.com/news/commodities-news/gold-prices-gain-in-asia-as-fed-views-on-economy-seen-more-upbeat-1179803,gold prices gain in asia as fed views on economy seen more upbeat,1,0,0,0,1,0,positive,"['seen upbeat', 'fed views', 'asia', 'prices gain', 'gold prices']",gold prices gain in asia as fed views on economy seen more upbeat seen upbeat fed views asia prices gain gold prices,12,-0.22483571,0.16315778
21-01-2005,http://www.marketwatch.com/story/feb-gold-trades-at-two-week-high-of-42850oz-2005-01-21,feb gold trades at two-week high of $428.50/oz,1,0,0,0,1,0,positive,"['428 50', 'week high', 'oz', 'feb', 'gold trades']",feb gold trades at two-week high of $428.50/oz 428 50 week high oz feb gold trades,-1,0.302773,0.046839237
31-08-2013,https://www.thehindubusinessline.com/markets/gold/gold-rebounds-on-strong-retail-buying/article20653920.ece1,Gold rebounds on strong retail buying,1,0,0,0,1,0,positive,"['strong', 'buying', 'rebounds', 'gold', 'retail buying']",Gold rebounds on strong retail buying strong buying rebounds gold retail buying,-1,-0.16648166,0.24486908
17-10-2018,https://economictimes.indiatimes.com/markets/commodities/news/commodities-outlook-gold-base-metals-pare-gains-crude-oil-sees-a-fresh-spike/articleshow/66256946.cms,"Commodities outlook: Gold, base metals pare gains; crude oil sees a fresh spike",1,0,0,1,1,0,positive,"['base metals', 'outlook gold', 'oil sees fresh', 'pare gains crude', 'commodities']","Commodities outlook: Gold, base metals pare gains; crude oil sees a fresh spike base metals outlook gold oil sees fresh pare gains crude commodities",-1,-0.23588794,0.03903346
09-12-2016,https://www.thehindubusinessline.com/markets/gold/gold-futures-fall-to-rs-27740-per-10-gram/article9419621.ece,"Gold futures fall to Rs 27,740 per 10 gram",0,0,1,0,1,0,negative,"['27', '740 10', 'gram', 'fall rs', 'gold futures']","Gold futures fall to Rs 27,740 per 10 gram 27 740 10 gram fall rs gold futures",23,0.10198417,-0.26906493
16-05-2007,http://www.marketwatch.com/story/gold-futures-drop-13-to-close-at-a-two-month-low-2007-05-16,"gold ends at a 2-month low, down $13 an ounce",0,0,1,0,1,0,negative,"['low', '13', 'ends month', 'ounce', 'gold ends']","gold ends at a 2-month low, down $13 an ounce low 13 ends month ounce gold ends",-1,0.30785948,-0.009502329
30-05-2013,https://www.thehindubusinessline.com/markets/gold/Gold-spurts-further-on-dollar-weakness/article20619134.ece,Gold spurts further on dollar weakness,1,0,0,1,1,0,positive,"['spurts', 'weakness', 'dollar', 'gold', 'dollar weakness']",Gold spurts further on dollar weakness spurts weakness dollar gold dollar weakness,-1,-0.11511595,0.1738683
08-03-2013,https://economictimes.indiatimes.com/markets/commodities/gold-silver-slip-in-dull-trade/articleshow/18867420.cms,"gold, silver slip in dull trade",0,0,1,1,1,0,negative,"['trade', 'slip', 'dull', 'gold', 'gold silver']","gold, silver slip in dull trade trade slip dull gold gold silver",-1,-0.120945245,0.13120408
24-03-2011,http://www.marketwatch.com/story/gold-turns-lower-fresh-record-slips-for-now-2011-03-24,"gold turns lower, fresh record slips for now",0,0,1,0,1,0,negative,"['lower', 'fresh', 'turns', 'record slips', 'gold turns lower']","gold turns lower, fresh record slips for now lower fresh turns record slips gold turns lower",-1,-0.13480285,0.040643107
27-06-2006,http://www.marketwatch.com/story/gold-futures-up-230-at-590-an-ounce-2006-06-27,gold futures up $2.30 at $590 an ounce,1,0,0,0,1,0,positive,"['590', '30', 'ounce', 'futures', 'gold futures']",gold futures up $2.30 at $590 an ounce 590 30 ounce futures gold futures,26,0.28872812,-0.38191128
13-09-2017,http://www.marketwatch.com/story/gold-adds-slightly-to-early-gains-after-ppi-report-2017-09-13,Gold adds slightly to early gains after PPI report,1,0,0,0,1,0,positive,"['slightly', 'adds', 'early', 'report', 'gains ppi report']",Gold adds slightly to early gains after PPI report slightly adds early report gains ppi report,-1,-0.10689223,0.11522387
24-04-2013,http://www.marketwatch.com/story/gold-futures-mark-highest-close-since-april-12-2013-04-24,gold futures mark highest close since april 12,1,0,0,0,1,0,positive,"['12', 'mark', 'gold', 'futures', 'highest close april']",gold futures mark highest close since april 12 12 mark gold futures highest close april,-1,-0.024963245,-0.4031454
09-04-2015,http://www.marketwatch.com/story/gold-remains-on-defensive-after-fed-minutes-2015-04-09,gold extends losses to third session,0,0,1,0,1,0,negative,"['extends', 'session', 'gold', 'losses', 'gold extends losses']",gold extends losses to third session extends session gold losses gold extends losses,-1,-0.14182338,0.014146358
02-09-2011,https://www.thehindubusinessline.com/markets/commodities/gold-futures-rises-to-rs-27253-on-global-cues/article20331193.ece1,"Gold futures rises to Rs 27,253 on global cues",1,0,0,0,1,0,positive,"['rs', 'rises', 'global cues', '27 253', 'gold futures']","Gold futures rises to Rs 27,253 on global cues rs rises global cues 27 253 gold futures",22,-0.16208753,-0.28467232
31-07-2014,https://www.thehindubusinessline.com/markets/commodities/article6268724.ece,"Sell gold if it rises to $1,297-1,300/oz",1,0,0,0,0,1,positive,"['rises', 'oz', '297 300', 'sell', 'sell gold']","Sell gold if it rises to $1,297-1,300/oz rises oz 297 300 sell sell gold",-1,0.2772544,0.18033972
19-09-2011,http://www.marketwatch.com/story/gold-slips-after-an-earlier-a-high-of-183290-2011-09-19,"gold slips after an earlier a high of $1,832.90",0,0,1,0,1,0,negative,"['earlier', 'high', '832 90', 'slips', 'gold']","gold slips after an earlier a high of $1,832.90 earlier high 832 90 slips gold",-1,0.11504571,0.043780126
24-04-2017,http://www.marketwatch.com/story/gold-fields-downgraded-to-underperform-from-sector-perform-at-rbc-capital-2017-04-24,Gold Fields downgraded to underperform from sector perform at RBC Capital,0,0,0,0,1,0,none,"['capital', 'gold', 'perform rbc', 'fields downgraded', 'underperform sector perform']",Gold Fields downgraded to underperform from sector perform at RBC Capital capital gold perform rbc fields downgraded underperform sector perform,-1,-0.26993746,0.112725705
25-05-2018,http://www.marketwatch.com/story/gold-futures-gain-roughly-1-for-the-week-2018-05-25,gold futures gain roughly 1% for the week,1,0,0,0,1,0,positive,"['roughly', 'roughly week', 'gain', 'gold', 'futures']",gold futures gain roughly 1% for the week roughly roughly week gain gold futures,27,0.020693049,-0.36994773
27-06-2017,http://www.marketwatch.com/story/gold-prices-settle-higher-as-us-dollar-drops-equities-weaken-2017-06-27,"Gold prices settle higher as U.S. dollar drops, equities weaken",1,0,0,1,1,0,positive,"['equities', 'weaken', 'drops', 'prices settle higher', 'gold prices']","Gold prices settle higher as U.S. dollar drops, equities weaken equities weaken drops prices settle higher gold prices",-1,-0.08772131,0.12092613
14-11-2018,https://www.thehindubusinessline.com/markets/gold/gold-edges-up-as-dollar-retreats-from-16-month-high/article25492654.ece,Gold edges up as dollar retreats from 16-month high,1,0,0,1,1,0,positive,"['edges', 'retreats 16 month', '16 month high', 'gold', 'dollar retreats']",Gold edges up as dollar retreats from 16-month high edges retreats 16 month 16 month high gold dollar retreats,-1,0.007828638,-0.0008476004
07-12-2007,http://www.marketwatch.com/story/gold-futures-fall-690-after-stronger-jobs-report-2007-12-07,gold futures fall $6.90 after stronger jobs report,0,0,1,0,1,0,negative,"['90', 'stronger', 'fall', 'jobs report', 'gold futures']",gold futures fall $6.90 after stronger jobs report 90 stronger fall jobs report gold futures,-1,0.0070480853,-0.41986114
15-12-2010,http://www.marketwatch.com/story/gold-futures-drop-more-than-10-on-globex-2010-12-15,"gold drops on fed stance, dollar strength",0,0,1,1,1,0,negative,"['strength', 'stance', 'dollar', 'fed', 'gold drops']","gold drops on fed stance, dollar strength strength stance dollar fed gold drops",-1,-0.07030525,0.046952046
28-07-2005,http://www.marketwatch.com/story/aug-gold-closes-at-42740oz-up-260-2005-07-28,"aug gold closes at $427.40/oz, up $2.60",1,0,0,0,1,0,positive,"['427 40', 'closes', 'gold', '40 oz 60', 'aug']","aug gold closes at $427.40/oz, up $2.60 427 40 closes gold 40 oz 60 aug",21,0.4338482,0.053582985
14-12-2011,http://www.marketwatch.com/story/golds-close-below-1600-is-first-since-september-2011-12-14,"gold's close below $1,600 is first since september",0,0,1,0,1,0,negative,"['close', 'september', '600', 'gold', 'close 600 september']","gold's close below $1,600 is first since september close september 600 gold close 600 september",-1,0.17692105,-0.057917178
27-07-2004,http://www.marketwatch.com/story/barrick-gold-q2-earns-decline-but-match-expectations-2004-07-27,"barrick gold q2 earns decline, but match expectations",0,0,1,0,1,0,negative,"['match', 'expectations', 'barrick', 'earns decline', 'gold q2']","barrick gold q2 earns decline, but match expectations match expectations barrick earns decline gold q2",-1,-0.029892609,0.07731948
13-03-2015,https://www.moneycontrol.com/news/business/markets/gold-demandasia-picksdue-to-lower-prices-1148717.html,gold demand in asia picks up due to lower prices,0,0,0,0,1,0,none,"['picks', 'lower', 'prices', 'asia', 'gold demand']",gold demand in asia picks up due to lower prices picks lower prices asia gold demand,12,-0.15720934,0.1516468
02-07-2013,https://www.moneycontrol.com/news/business/markets/-1779973.html,gold continues rebound from three-year low,0,0,1,0,1,0,negative,"['continues', 'year', 'low', 'gold', 'continues rebound year']",gold continues rebound from three-year low continues year low gold continues rebound year,-1,-0.12095112,0.09282509
08-06-2018,https://www.thehindubusinessline.com/markets/gold/gold-futures-fall-to-rs-31144-per-10-gm/article24111642.ece,"Gold futures fall to Rs 31,144 per 10 gm",0,0,1,0,1,0,negative,"['gm', 'fall', 'rs', '31 144 10', 'gold futures']","Gold futures fall to Rs 31,144 per 10 gm gm fall rs 31 144 10 gold futures",23,0.005741492,-0.35300484
29-11-2017,http://www.investing.com/news/commodities-news/gold-prices-turn-lower-as-us-dollar-strengthens-927519,Gold Prices Turn Lower as U.S. Dollar Strengthens,0,0,1,1,1,0,negative,"['turn', 'lower', 'strengthens', 'prices turn lower', 'gold prices']",Gold Prices Turn Lower as U.S. Dollar Strengthens turn lower strengthens prices turn lower gold prices,14,-0.08434126,0.19855183
01-09-2009,https://economictimes.indiatimes.com/articleshow/4960329.cms,"gold reacts downwards, silver recovers",1,0,0,1,1,0,positive,"['recovers', 'downwards', 'reacts', 'gold', 'downwards silver recovers']","gold reacts downwards, silver recovers recovers downwards reacts gold downwards silver recovers",-1,-0.04852899,0.12706141
01-06-2009,https://economictimes.indiatimes.com/articleshow/4604031.cms,"gold rules flat, silver surges by rs 300 on firm global cues",0,1,0,1,1,0,neutral,"['300 firm', 'global cues', 'rules flat', 'surges rs 300', 'silver']","gold rules flat, silver surges by rs 300 on firm global cues 300 firm global cues rules flat surges rs 300 silver",-1,-0.2565578,0.13556425
16-11-2018,https://www.thehindubusinessline.com/markets/gold/gold-edges-higher-amid-brexit-turmoil/article25514601.ece,Gold edges higher amid Brexit turmoil,1,0,0,0,1,0,positive,"['higher amid', 'turmoil', 'gold', 'brexit', 'edges higher']",Gold edges higher amid Brexit turmoil higher amid turmoil gold brexit edges higher,-1,-0.2111332,0.045845233
05-11-2018,https://economictimes.indiatimes.com/markets/commodities/news/dhanteras-gold-at-6-year-high-but-look-before-you-invest-in-it/articleshow/66509062.cms,"Dhanteras: Gold at 6-year high, but look before you invest in it",1,0,0,0,1,0,positive,"['year', 'high look', 'gold', 'look invest', 'dhanteras']","Dhanteras: Gold at 6-year high, but look before you invest in it year high look gold look invest dhanteras",-1,-0.09868392,0.024934396
15-10-2018,https://www.moneycontrol.com/news/business/commodities/gold-futures-rise-0-38-on-fresh-bets-3045771.html,gold futures rise 0.38% on fresh bets,1,0,0,0,1,0,positive,"['38', 'fresh', 'rise', 'bets', 'gold futures']",gold futures rise 0.38% on fresh bets 38 fresh rise bets gold futures,-1,0.022562504,-0.329159
03-08-2005,http://www.marketwatch.com/story/gold-futures-top-440-for-first-time-in-almost-5-weeks-2005-08-03,gold futures top $440 for first time in almost 5 weeks,1,0,0,0,1,0,positive,"['time', 'weeks', '440', 'futures', 'gold futures']",gold futures top $440 for first time in almost 5 weeks time weeks 440 futures gold futures,-1,0.10057129,-0.4508416
22-09-2017,https://economictimes.indiatimes.com/markets/commodities/news/gold-prices-inch-up-amid-north-korea-concerns/articleshow/60788777.cms,"gold gains amid n.korea concerns, but heads for 2nd weekly decline",1,0,0,0,1,0,positive,"['heads 2nd', 'gains amid', 'gold', 'weekly decline', 'korea concerns']","gold gains amid n.korea concerns, but heads for 2nd weekly decline heads 2nd gains amid gold weekly decline korea concerns",-1,-0.15198267,0.03672162
28-05-2014,http://www.investing.com/news/commodities-news/gold-little-changed-near-3-1-2-month-low-amid-bearish-chart-signals-286633,Gold little changed near 3-1/2-month low amid bearish chart signals,0,0,1,0,1,0,negative,"['gold', 'low amid bearish', 'chart signals', 'near month', 'little changed']",Gold little changed near 3-1/2-month low amid bearish chart signals gold low amid bearish chart signals near month little changed,-1,-0.03776601,0.06363232
08-06-2016,https://www.moneycontrol.com/news/business/markets/gold-hits-2-week-highhopes-fed-will-not-raise-rates-soon-991831.html,gold hits 2-week high on hopes fed will not raise rates soon,1,0,0,0,1,0,positive,"['week', 'high hopes', 'rates', 'gold hits', 'fed raise rates']",gold hits 2-week high on hopes fed will not raise rates soon week high hopes rates gold hits fed raise rates,-1,-0.07563979,-0.073809266
24-06-2018,https://www.metalsdaily.com/link/280664/charts-gold-joins-the-global-death-cross-procession.htm,charts : gold joins the global,0,0,0,0,1,0,none,"['joins', 'global', 'joins global', 'gold', 'charts']",charts : gold joins the global joins global joins global gold charts,-1,-0.2541884,0.14667282
16-07-2018,http://www.marketwatch.com/story/august-gold-down-150-or-01-to-settle-at-123970oz-2018-07-16,"august gold down $1.50, or 0.1%, to settle at $1,239.70/oz",0,0,1,0,1,0,negative,"['50 settle', 'august', '70 oz', 'settle 239', 'gold']","august gold down $1.50, or 0.1%, to settle at $1,239.70/oz 50 settle august 70 oz settle 239 gold",21,0.47363997,0.02655967
17-06-2010,http://www.marketwatch.com/story/gold-looking-set-to-post-fresh-closing-record-2010-06-17,gold looking set to post fresh closing record,0,0,0,0,1,0,none,"['looking', 'set post', 'fresh', 'gold looking', 'closing record']",gold looking set to post fresh closing record looking set post fresh gold looking closing record,-1,-0.1470261,0.037970953
25-10-2017,http://www.marketwatch.com/story/gold-ends-with-a-slight-gain-after-trading-lower-for-most-of-the-session-2017-10-25,Gold ends with a slight gain after trading lower for most of the session,1,0,0,0,1,0,positive,"['slight', 'ends', 'lower session', 'gold', 'gain trading']",Gold ends with a slight gain after trading lower for most of the session slight ends lower session gold gain trading,-1,-0.056370445,-0.035676777
20-10-2017,https://economictimes.indiatimes.com/markets/commodities/news/gold-prices-hold-firm-as-dollar-sags/articleshow/61149608.cms,gold dips as dollar gains after u.s. senate clears tax reform hurdle,0,0,1,1,1,0,negative,"['gold', 'dips', 'reform hurdle', 'dollar gains', 'senate clears tax']",gold dips as dollar gains after u.s. senate clears tax reform hurdle gold dips reform hurdle dollar gains senate clears tax,-1,-0.056462973,0.09515875
17-09-2018,https://www.thehindubusinessline.com/markets/gold/gold-futures-jump-to-rs-30600-on-firm-global-cues/article24965863.ece,"Gold futures jump to Rs 30,600 on firm global cues",1,0,0,0,1,0,positive,"['firm', 'jump', 'global cues', 'rs 30 600', 'gold futures']","Gold futures jump to Rs 30,600 on firm global cues firm jump global cues rs 30 600 gold futures",22,-0.14071253,-0.33892983
24-06-2014,https://www.thehindubusinessline.com/markets/gold/gold-prices-fall-to-rs-27610-at-futures-trade/article20804483.ece1,"Gold prices fall to Rs 27,610 at futures trade",0,0,1,0,1,0,negative,"['rs', 'fall', '27 610', 'futures trade', 'gold prices fall']","Gold prices fall to Rs 27,610 at futures trade rs fall 27 610 futures trade gold prices fall",-1,-0.018433645,-0.31599805
13-07-2016,http://www.marketwatch.com/story/sorry-gold-and-silver-lovers-the-partys-almost-over-2016-07-13,"sorry, gold and silver lovers, the party's almost over",0,0,0,1,1,0,none,"['sorry', 'lovers', 'party', 'sorry gold', 'gold silver']","sorry, gold and silver lovers, the party's almost over sorry lovers party sorry gold gold silver",-1,-0.10711023,0.11011879
18-09-2017,http://www.marketwatch.com/story/dec-gold-down-1440-or-11-to-settle-at-131080oz-2017-09-18,"Dec. gold down $14.40, or 1.1%, to settle at $1,310.80/oz",0,0,1,0,1,0,negative,"['settle', 'dec', '310', '80 oz', 'gold 14']","Dec. gold down $14.40, or 1.1%, to settle at $1,310.80/oz settle dec 310 80 oz gold 14",21,0.5257906,0.015322402
14-09-2012,https://www.moneycontrol.com/news/business/markets/-2016813.html,mcx gold december contract trading lower,0,0,1,0,1,0,negative,"['gold', 'december', 'contract trading', 'mcx', 'contract trading lower']",mcx gold december contract trading lower gold december contract trading mcx contract trading lower,1,-0.04599054,-0.09601301
12-08-2008,http://www.marketwatch.com/story/china-increases-gold-medal-lead-phelps-wins-third-2008-08-12,china increases gold medal lead,0,0,0,0,1,0,none,"['increases', 'china', 'lead', 'medal', 'china increases gold']",china increases gold medal lead increases china lead medal china increases gold,-1,-0.33644894,0.24179973
17-11-2017,https://www.moneycontrol.com/news/business/stocks/gold-prices-to-trade-sideways-angel-commodities-10-2441147.html,gold prices to trade sideways: angel commodities,0,1,0,0,0,1,neutral,"['angel', 'sideways', 'trade', 'commodities', 'gold prices']",gold prices to trade sideways: angel commodities angel sideways trade commodities gold prices,8,-0.070879735,0.10019438
07-12-2016,https://economictimes.indiatimes.com/markets/commodities/how-much-gold-will-india-consume-traders-bearish-wgc-bullish/articleshow/55843757.cms,"how much gold will india consume? traders bearish, wgc bullish",0,0,0,0,0,1,none,"['bearish', 'wgc', 'gold', 'consume traders', 'india consume']","how much gold will india consume? traders bearish, wgc bullish bearish wgc gold consume traders india consume",-1,-0.11934645,0.120770186
07-12-2004,http://www.marketwatch.com/story/gold-fields-ceo-says-disappointed-by-vote-2004-12-07,gold fields ceo says disappointed by vote,0,0,0,0,1,0,none,"['fields', 'vote', 'says disappointed', 'ceo says', 'gold fields']",gold fields ceo says disappointed by vote fields vote says disappointed ceo says gold fields,-1,-0.23471999,0.06257267
07-12-2011,https://www.moneycontrol.com/news/business/markets/-1226481.html,MCX GOLDGUINEA Jan contract makes smart gains,1,0,0,0,1,0,positive,"['jan', 'mcx', 'gains', 'goldguinea', 'contract makes smart']",MCX GOLDGUINEA Jan contract makes smart gains jan mcx gains goldguinea contract makes smart,1,-0.14477158,0.0568568
03-10-2003,http://www.marketwatch.com/story/metals-shares-slip-gold-futures-climb-2003-10-03,metals shares slip; gold futures climb,1,0,0,0,1,0,positive,"['climb', 'gold', 'metals', 'futures', 'shares slip']",metals shares slip; gold futures climb climb gold metals futures shares slip,-1,-0.19815493,-0.35022992
13-12-2018,http://www.marketwatch.com/story/feb-gold-settles-at-124740oz-down-260-or-02-2018-12-13,"feb. gold settles at $1,247.40/oz, down $2.60, or 0.2%",0,0,1,0,1,0,negative,"['247 40', 'feb', '60', 'oz', 'gold settles']","feb. gold settles at $1,247.40/oz, down $2.60, or 0.2% 247 40 feb 60 oz gold settles",21,0.53638196,-0.010724708
23-01-2016,https://www.thehindubusinessline.com/markets/gold/over-900-kg-of-gold-mobilised-under-monetisation-scheme/article8145378.ece,Over 900 kg of gold mobilised under monetisation scheme,0,0,0,0,1,0,none,"['900', 'scheme', 'kg', 'mobilised', 'gold mobilised monetisation']",Over 900 kg of gold mobilised under monetisation scheme 900 scheme kg mobilised gold mobilised monetisation,-1,-0.047875866,0.17831661
10-01-2018,https://www.metalsdaily.com/link/275568/silver-lags-gold-price-but-comex-speculators-turn-net-bullish.htm,silver lags gold price but comex speculators turn net bullish,0,0,0,1,1,0,none,"['lags', 'comex', 'bullish', 'speculators turn net', 'gold price']",silver lags gold price but comex speculators turn net bullish lags comex bullish speculators turn net gold price,-1,-0.16020122,0.0692088
29-06-2018,https://www.metalsdaily.com/link/280775/td-securities-too-early-to-write-obituary-for-gold.htm,td securities : too early to write obituary for gold,0,0,0,0,1,0,none,"['write', 'early', 'gold', 'write obituary', 'td securities']",td securities : too early to write obituary for gold write early gold write obituary td securities,-1,-0.14990056,0.018323667
18-05-2018,http://www.marketwatch.com/story/june-gold-climbs-190-or-nearly-02-to-settle-at-129130oz-2018-05-18,"june gold climbs $1.90, or nearly 0.2%, to settle at $1,291.30/oz",1,0,0,0,1,0,positive,"['90 nearly', 'settle 291 30', 'climbs', 'oz', 'june gold']","june gold climbs $1.90, or nearly 0.2%, to settle at $1,291.30/oz 90 nearly settle 291 30 climbs oz june gold",21,0.41031146,0.06588482
01-06-2017,http://www.marketwatch.com/story/gold-holds-on-to-firm-loss-after-jobless-claims-report-2017-06-01,gold holds on to firm loss after jobless-claims report,0,0,1,0,1,0,negative,"['holds', 'report', 'jobless', 'gold holds firm', 'loss jobless claims']",gold holds on to firm loss after jobless-claims report holds report jobless gold holds firm loss jobless claims,-1,-0.13437189,0.110770434
19-11-2011,https://economictimes.indiatimes.com/markets/commodities/gold-silver-rebound-on-low-level-buying-firm-global-cues/articleshow/10792594.cms,"gold, silver rebound on low-level buying; firm global cues",0,0,1,1,1,0,negative,"['low level', 'cues', 'rebound', 'buying firm global', 'gold silver']","gold, silver rebound on low-level buying; firm global cues low level cues rebound buying firm global gold silver",-1,-0.2107377,0.16235888
26-07-2017,http://www.marketwatch.com/story/august-gold-at-125260oz-up-from-the-124940-comex-settlement-2017-07-26,"August gold at $1,252.60/oz, up from the $1,249.40 Comex settlement",1,0,0,0,1,0,positive,"['252 60', 'august', '60 oz', 'gold', 'comex settlement']","August gold at $1,252.60/oz, up from the $1,249.40 Comex settlement 252 60 august 60 oz gold comex settlement",-1,0.4497106,0.030746885
16-02-2011,http://www.marketwatch.com/story/gold-rises-looking-poised-for-third-day-of-gains-2011-02-16,"gold rises, looking poised for third day of gains",1,0,0,0,1,0,positive,"['looking', 'day', 'poised', 'gains', 'gold rises looking']","gold rises, looking poised for third day of gains looking day poised gains gold rises looking",-1,-0.14401878,0.12934443
04-02-2017,https://economictimes.indiatimes.com/markets/commodities/news/silver-regains-strength-on-demand-build-up-gold-steady/articleshow/56970183.cms,"silver regains strength on demand build-up, gold steady",1,0,0,1,1,0,positive,"['regains', 'steady', 'demand build', 'build gold', 'silver regains strength']","silver regains strength on demand build-up, gold steady regains steady demand build build gold silver regains strength",-1,-0.17250721,0.23649898
15-07-2014,http://www.marketwatch.com/story/gold-inches-back-from-2014s-biggest-drop-2014-07-15,gold slips in wake of yellen's senate testimony,0,0,1,0,1,0,negative,"['slips wake', 'senate', 'testimony', 'yellen', 'gold slips']",gold slips in wake of yellen's senate testimony slips wake senate testimony yellen gold slips,-1,-0.1112891,0.052898455
25-05-2017,http://www.marketwatch.com/story/gold-tips-slightly-higher-after-weekly-jobless-claims-trade-data-2017-05-25,"gold tips slightly higher after weekly jobless-claims, trade data",1,0,0,0,1,0,positive,"['tips', 'gold', 'higher weekly jobless', 'tips slightly higher', 'claims trade data']","gold tips slightly higher after weekly jobless-claims, trade data tips gold higher weekly jobless tips slightly higher claims trade data",-1,-0.092142425,0.15338436
26-09-2013,https://www.moneycontrol.com/news/business/markets/-1640881.html,gold to be a safe-haven again; sell crude on rally: barratt,0,0,0,1,0,1,none,"['safe', 'rally', 'barratt', 'gold safe haven', 'sell crude']",gold to be a safe-haven again; sell crude on rally: barratt safe rally barratt gold safe haven sell crude,-1,-0.15197004,0.03177584
03-10-2011,http://www.marketwatch.com/story/ubs-cuts-3-month-gold-silver-price-forecasts-2011-10-03,"ubs cuts 3-month gold, silver price forecasts",0,0,0,1,0,1,none,"['cuts', 'month', 'ubs', 'price forecasts', 'gold silver price']","ubs cuts 3-month gold, silver price forecasts cuts month ubs price forecasts gold silver price",-1,-0.10956401,-0.002110064
27-06-2011,https://www.thehindubusinessline.com/markets/commodities/Gold-declines-on-poor-demand/article20259042.ece,Gold declines on poor demand,0,0,1,0,1,0,negative,"['poor', 'gold', 'demand', 'declines', 'gold declines']",Gold declines on poor demand poor gold demand declines gold declines,-1,-0.029144734,0.17304096
04-07-2017,http://www.investing.com/news/commodities-news/gold-gains-in-asia-ahead-of-release-of-fed-minutes-for-june-meeting-502043,Gold gains in Asia ahead of release of Fed minutes for June meeting,1,0,0,0,1,0,positive,"['minutes june meeting', 'asia', 'gains', 'gold', 'ahead release fed']",Gold gains in Asia ahead of release of Fed minutes for June meeting minutes june meeting asia gains gold ahead release fed,-1,-0.20456946,0.03301172
02-12-2016,http://www.marketwatch.com/story/february-gold-trades-at-680-or-06-at-117620oz-2016-12-02,"February gold trades at $6.80, or 0.6%, at $1,176.20/oz.",0,0,0,0,1,0,none,"['176 20', 'february', 'trades 80', 'oz', 'gold trades']","February gold trades at $6.80, or 0.6%, at $1,176.20/oz. 176 20 february trades 80 oz gold trades",-1,0.35234326,0.06076356
01-11-2017,http://www.marketwatch.com/story/gold-prices-extend-earlier-gains-after-us-ism-manufacturing-data-2017-11-01,Gold prices extend earlier gains after U.S. ISM manufacturing data,1,0,0,0,1,0,positive,"['earlier', 'manufacturing data', 'gains', 'ism', 'gold prices extend']",Gold prices extend earlier gains after U.S. ISM manufacturing data earlier manufacturing data gains ism gold prices extend,-1,-0.1689223,0.12122095
29-11-2004,http://www.marketwatch.com/story/gold-futures-close-above-453-2004-11-29,gold futures close above $453,0,0,0,0,1,0,none,"['close', 'gold', '453', 'futures', 'gold futures close']",gold futures close above $453 close gold 453 futures gold futures close,-1,0.05832839,-0.49429023
01-06-2018,https://www.thehindubusinessline.com/markets/gold/gold-steady-amid-renewed-trade-tensions/article24054196.ece,Gold steady amid renewed trade tensions,0,1,0,0,1,0,neutral,"['renewed', 'trade', 'steady amid', 'gold', 'trade tensions']",Gold steady amid renewed trade tensions renewed trade steady amid gold trade tensions,-1,-0.19073802,0.13869418
22-09-2015,https://www.moneycontrol.com/news/business/markets/mcx-gold-december-contract-trades-higher-1510199.html,mcx gold december contract trades higher,1,0,0,0,1,0,positive,"['contract', 'gold', 'december', 'mcx', 'contract trades higher']",mcx gold december contract trades higher contract gold december mcx contract trades higher,1,-0.0739128,-0.03681258
05-10-2011,http://www.marketwatch.com/story/gold-edges-higher-after-previous-sessions-selloff-2011-10-05,"gold on firmer footing, gains more than 1%",1,0,0,0,1,0,positive,"['gains', 'footing', 'gold', 'firmer', 'gold firmer footing']","gold on firmer footing, gains more than 1% gains footing gold firmer gold firmer footing",-1,-0.042111285,0.061528545
20-11-2017,https://www.metalsdaily.com/link/273912/chinese-buying-more-gold-as-global-demand-falls.htm,chinese buying more gold as global demand falls,0,0,0,0,1,0,none,"['falls', 'global', 'demand falls', 'chinese', 'buying gold']",chinese buying more gold as global demand falls falls global demand falls chinese buying gold,-1,-0.20621198,0.16153958
19-10-2010,http://www.marketwatch.com/story/gold-lower-on-worst-one-day-drop-since-early-july-2010-10-19,gold lower on worst one-day drop since early july,0,0,1,0,1,0,negative,"['worst', 'july', 'gold', 'lower', 'day drop early']",gold lower on worst one-day drop since early july worst july gold lower day drop early,-1,0.07195257,-0.0773468
19-02-2008,http://www.marketwatch.com/story/gold-platinum-soar-in-broad-metals-rally-2008-02-19,"gold, platinum soar in broad metals rally",1,0,0,0,1,0,positive,"['broad', 'soar', 'rally', 'metals', 'gold platinum']","gold, platinum soar in broad metals rally broad soar rally metals gold platinum",-1,-0.17500804,0.059745383
16-05-2017,http://www.marketwatch.com/story/gold-gets-a-boost-from-weaker-dollar-in-wake-of-reported-trump-intelligence-flap-2017-05-16,Gold posts fifth straight gain to hold ground at 2-week high,1,0,0,0,1,0,positive,"['fifth', 'hold ground', 'week high', 'straight gain', 'gold posts']",Gold posts fifth straight gain to hold ground at 2-week high fifth hold ground week high straight gain gold posts,-1,-0.002139166,0.03246919
18-10-2016,http://www.marketwatch.com/story/dec-gold-settles-at-126290oz-up-630-or-05-2016-10-18,"Dec. gold settles at $1,262.90/oz, up $6.30, or 0.5%",1,0,0,0,1,0,positive,"['dec', '30', 'oz', '262 90 oz', 'gold settles']","Dec. gold settles at $1,262.90/oz, up $6.30, or 0.5% dec 30 oz 262 90 oz gold settles",21,0.52545935,-0.013347752
05-04-2018,https://www.thehindubusinessline.com/economy/agri-business/buy-gold-if-it-dips-to-1315oz/article23446648.ece,"Buy gold if it dips to $1,315/oz",0,0,1,0,0,1,negative,"['dips', '315', 'buy', 'oz', 'buy gold']","Buy gold if it dips to $1,315/oz dips 315 buy oz buy gold",15,0.3314432,0.18900192
08-09-2017,http://www.marketwatch.com/story/gold-trades-at-highest-in-a-year-boosted-by-bruised-dollar-and-sinking-treasury-yields-2017-09-08,Gold ends at highest in a year as dollar and Treasury yields sink for the week,1,0,0,1,1,0,positive,"['week', 'yields sink', 'gold', 'ends highest year', 'dollar treasury yields']",Gold ends at highest in a year as dollar and Treasury yields sink for the week week yields sink gold ends highest year dollar treasury yields,-1,-0.08763783,-0.05221443
10-09-2012,http://www.marketwatch.com/story/gold-adds-to-gains-as-fed-easing-hope-lingers-2012-09-09,"gold ends lower on profit-taking, fed worries",0,0,1,0,1,0,negative,"['taking', 'worries', 'fed', 'lower profit taking', 'gold ends']","gold ends lower on profit-taking, fed worries taking worries fed lower profit taking gold ends",-1,-0.10396613,-0.030624777
29-10-2009,http://www.marketwatch.com/story/gold-futures-up-04-after-jobs-claims-data-2009-10-29,"gold futures up 0.4% after jobs, claims data",1,0,0,0,1,0,positive,"['data', 'gold', 'claims', 'futures', 'jobs claims data']","gold futures up 0.4% after jobs, claims data data gold claims futures jobs claims data",-1,-0.060803965,-0.26324522
23-11-2011,https://www.moneycontrol.com/news/business/markets/-1314677.html,MCX GOLDPETAL Jan contract down marginally,0,0,1,0,1,0,negative,"['jan', 'marginally', 'goldpetal', 'mcx', 'contract marginally']",MCX GOLDPETAL Jan contract down marginally jan marginally goldpetal mcx contract marginally,1,-0.06961553,-0.16719192
03-11-2011,https://www.moneycontrol.com/news/business/stocks/-1904035.html,"nirmal bang`s view on gold, silver, copper, lead, crude",0,0,0,1,1,0,none,"['crude', 'bang', 'nirmal', 'copper lead', 'view gold silver']","nirmal bang`s view on gold, silver, copper, lead, crude crude bang nirmal copper lead view gold silver",-1,-0.16195576,0.13585196
26-08-2014,http://www.marketwatch.com/story/gold-holds-gains-after-july-durable-goods-data-2014-08-26,gold holds gains after july durable-goods data,1,0,0,0,1,0,positive,"['july', 'durable', 'gains', 'goods data', 'gold holds']",gold holds gains after july durable-goods data july durable gains goods data gold holds,-1,-0.111260824,0.15431485
22-08-2003,http://www.marketwatch.com/story/gold-futures-end-just-short-of-week-ago-close-2003-08-22,gold futures end just short of week-ago close,0,0,1,0,1,0,negative,"['ago', 'just short', 'week', 'end just', 'gold futures']",gold futures end just short of week-ago close ago just short week end just gold futures,-1,-0.07996969,-0.4563135
18-08-2011,http://www.marketwatch.com/story/gold-extends-record-run-on-growth-fears-2011-08-18,"gold ends at record $1,822 on growth fears",0,0,0,0,1,0,none,"['record', 'fears', '822', 'growth fears', 'gold ends']","gold ends at record $1,822 on growth fears record fears 822 growth fears gold ends",-1,0.10495512,0.06049936
28-07-2016,https://www.thehindubusinessline.com/markets/gold/gold-futures-jump-to-rs-31481-on-positive-global-cues/article8910812.ece,"Gold futures jump to Rs 31,481 on positive global cues",1,0,0,0,1,0,positive,"['31 481', 'global cues', 'positive global', 'jump rs', 'gold futures']","Gold futures jump to Rs 31,481 on positive global cues 31 481 global cues positive global jump rs gold futures",22,-0.12599464,-0.229815
09-11-2012,http://www.marketwatch.com/story/gold-prices-up-for-second-day-2012-11-09,gold futures rise more than 3% for the week,1,0,0,0,1,0,positive,"['rise', 'week', 'gold', 'futures', 'gold futures rise']",gold futures rise more than 3% for the week rise week gold futures gold futures rise,-1,-0.07637071,-0.39868313
27-07-2016,http://www.investing.com/news/commodities-news/gold-futures-edge-lower-ahead-of-fed-outcome-416788,gold futures edge lower ahead of fed outcome,0,0,1,0,1,0,negative,"['ahead', 'lower', 'edge', 'fed outcome', 'gold futures']",gold futures edge lower ahead of fed outcome ahead lower edge fed outcome gold futures,-1,-0.1605984,-0.45751643
19-10-2011,https://www.moneycontrol.com/news/business/markets/-2053919.html,MCX GOLDM Nov contract slips marginally,0,0,1,0,1,0,negative,"['nov', 'marginally', 'goldm', 'mcx', 'contract slips']",MCX GOLDM Nov contract slips marginally nov marginally goldm mcx contract slips,1,-0.13672727,-0.14870802
09-05-2018,https://www.metalsdaily.com/link/279460/golds-slow-motion-bull-market.htm,gold's slow-motion bull market,0,1,0,0,1,0,neutral,"['motion', 'slow', 'bull', 'market', 'gold slow motion']",gold's slow-motion bull market motion slow bull market gold slow motion,-1,-0.15993409,0.10180224
27-02-2017,http://www.marketwatch.com/story/april-gold-edges-up-by-50-cents-to-settle-at-125880oz-2017-02-27,"April gold edges up by 50 cents to settle at $1,258.80/oz",1,0,0,0,1,0,positive,"['258 80', 'oz', 'april', 'gold edges', '50 cents settle']","April gold edges up by 50 cents to settle at $1,258.80/oz 258 80 oz april gold edges 50 cents settle",-1,0.38397944,0.09325865
13-05-2016,https://www.thehindubusinessline.com/markets/gold/gold-eyes-worst-week-since-march-on-dollars-strength/article8593751.ece,Gold eyes worst week since March on dollar's strength,0,0,1,1,1,0,negative,"['strength', 'week', 'worst', 'march dollar', 'gold eyes']",Gold eyes worst week since March on dollar's strength strength week worst march dollar gold eyes,-1,0.008781567,0.090469964
06-05-2016,https://www.thehindubusinessline.com/markets/gold/gold-set-for-weekly-decline-ahead-of-us-jobs-data/article8564502.ece,Gold set for weekly decline ahead of US jobs data,0,0,1,0,1,0,negative,"['ahead', 'set', 'gold', 'jobs data', 'weekly decline']",Gold set for weekly decline ahead of US jobs data ahead set gold jobs data weekly decline,-1,-0.04303302,-0.017868266
19-09-2016,http://www.marketwatch.com/story/gold-prices-jump-1030-or-08-to-132070-an-ounce-in-early-europe-trading-2016-09-19,"Gold prices jump $10.30, or 0.8%, to $1,320.70 an ounce in early Europe trading",1,0,0,0,1,0,positive,"['10 30', 'jump', 'gold', '70 ounce early', 'europe trading']","Gold prices jump $10.30, or 0.8%, to $1,320.70 an ounce in early Europe trading 10 30 jump gold 70 ounce early europe trading",-1,0.27069265,0.023495339
07-01-2016,https://www.moneycontrol.com/news/business/markets/gold-near-7-week-high-as-stocks-retreat-1052145.html,gold near 7-week high as stocks retreat,1,0,0,0,1,0,positive,"['high', 'stocks', 'retreat', 'near week', 'gold near']",gold near 7-week high as stocks retreat high stocks retreat near week gold near,-1,-0.108259246,-0.097188905
27-09-2016,http://www.marketwatch.com/story/gold-futures-settle-at-lowest-level-in-a-week-2016-09-27,gold futures settle at lowest level in a week,0,0,1,0,1,0,negative,"['level', 'week', 'lowest', 'futures settle', 'gold futures settle']",gold futures settle at lowest level in a week level week lowest futures settle gold futures settle,24,0.0015301108,-0.48247564
24-10-2011,https://www.moneycontrol.com/news/business/markets/-2013241.html,investing in gold this dhanteras? expert picks best tools,1,0,0,0,1,0,positive,"['best', 'picks', 'dhanteras', 'best tools', 'investing gold']",investing in gold this dhanteras? expert picks best tools best picks dhanteras best tools investing gold,-1,-0.12820484,0.060989782
23-08-2016,http://www.marketwatch.com/story/gold-silver-tip-cautiously-higher-as-dollar-softens-2016-08-23,Gold futures finish higher in volatile trading,1,0,0,0,1,0,positive,"['higher', 'finish', 'trading', 'volatile', 'gold futures']",Gold futures finish higher in volatile trading higher finish trading volatile gold futures,-1,-0.17614165,-0.44435823
15-03-2018,http://www.marketwatch.com/story/april-gold-slips-by-04-at-131980oz-2018-03-15,"april gold slips by 0.4% at $1,319.80/oz.",0,0,1,0,1,0,negative,"['319 80', 'slips', '80 oz', 'april', 'gold']","april gold slips by 0.4% at $1,319.80/oz. 319 80 slips 80 oz april gold",21,0.37552583,0.0692732
05-10-2012,http://www.marketwatch.com/story/dow-holds-small-gains-after-jobs-report-while-treasurys-dollar-gold-oil-fall-2012-10-05,"dow holds small gains after jobs report while treasurys, dollar, gold, oil fall",0,0,0,1,1,0,none,"['jobs report', 'oil fall', 'gains', 'treasurys dollar gold', 'dow holds small']","dow holds small gains after jobs report while treasurys, dollar, gold, oil fall jobs report oil fall gains treasurys dollar gold dow holds small",-1,-0.20284018,0.07405096
07-12-2006,https://economictimes.indiatimes.com/articleshow/733949.cms,gold loses sheen as dollar shines,0,0,1,1,1,0,negative,"['loses', 'dollar', 'shines', 'sheen', 'gold loses']",gold loses sheen as dollar shines loses dollar shines sheen gold loses,-1,-0.07006694,0.23778939
26-09-2011,https://www.thehindubusinessline.com/markets/commodities/Gold-silver-crash-on-shift-to-cash/article20340975.ece,"Gold, silver crash on shift to $, cash",0,0,1,1,1,0,negative,"['crash', 'gold', 'crash shift', 'silver', 'shift cash']","Gold, silver crash on shift to $, cash crash gold crash shift silver shift cash",-1,-0.051813,0.06239971
28-07-2017,http://www.marketwatch.com/story/gold-climbs-after-first-read-of-second-quarter-gdp-2017-07-28,Gold climbs after first read of second-quarter GDP,1,0,0,0,1,0,positive,"['second', 'quarter', 'climbs read', 'gold', 'gdp']",Gold climbs after first read of second-quarter GDP second quarter climbs read gold gdp,-1,-0.14884466,0.19181946
31-10-2003,http://www.marketwatch.com/story/gold-futures-end-higher-metals-shares-climb-2003-10-31,"gold futures end higher, shares climb",1,0,0,0,1,0,positive,"['higher', 'end', 'shares', 'climb', 'gold futures']","gold futures end higher, shares climb higher end shares climb gold futures",-1,-0.1850996,-0.38313955
24-11-2011,https://www.moneycontrol.com/news/business/markets/-1304463.html,MCX GOLD April contract trading lower,0,0,1,0,1,0,negative,"['gold', 'lower', 'april', 'contract trading', 'mcx']",MCX GOLD April contract trading lower gold lower april contract trading mcx,1,-0.014721632,-0.101680055
01-11-2018,https://www.moneycontrol.com/news/business/commodities/ahead-of-dhanteras-world-gold-council-raises-concerns-on-gold-prices-3115101.html,"Ahead of Dhanteras, WGC raises concerns on gold prices",0,0,0,0,1,0,none,"['ahead', 'raises concerns', 'dhanteras', 'wgc', 'gold prices']","Ahead of Dhanteras, WGC raises concerns on gold prices ahead raises concerns dhanteras wgc gold prices",-1,-0.1483945,0.02915658
18-01-2013,https://www.thehindubusinessline.com/markets/gold/Central-banks-buying-may-buoy-gold-in-H1/article20566271.ece,Central banks buying may buoy gold in H1,0,0,0,0,1,0,none,"['central', 'buoy', 'gold', 'h1', 'banks buying']",Central banks buying may buoy gold in H1 central buoy gold h1 banks buying,-1,-0.08781588,0.13801937
16-05-2014,http://www.marketwatch.com/story/gold-slightly-lower-on-day-up-05-on-week-2014-05-16,"gold slightly lower on day, up 0.5% on week",0,0,1,0,1,0,negative,"['slightly', 'day', 'week', 'slightly lower', 'gold']","gold slightly lower on day, up 0.5% on week slightly day week slightly lower gold",-1,0.13085441,0.07645318
20-04-2018,https://www.metalsdaily.com/link/278779/gold-slips-as-us-rate-rise-hopes-easing-global-tensions-weigh.htm,"gold slips as u.s. rate rise hopes, easing global tensions weigh",0,0,1,0,1,0,negative,"['rate', 'rise hopes', 'gold', 'slips rate', 'global tensions weigh']","gold slips as u.s. rate rise hopes, easing global tensions weigh rate rise hopes gold slips rate global tensions weigh",-1,-0.14479774,0.0851832
06-06-2017,http://www.marketwatch.com/story/august-gold-climbs-1480-or-12-to-settle-at-129750oz-2017-06-06,"august gold climbs $14.80, or 1.2%, to settle at $1,297.50/oz",1,0,0,0,1,0,positive,"['14', 'settle 297 50', '50 oz', 'climbs', 'august gold']","august gold climbs $14.80, or 1.2%, to settle at $1,297.50/oz 14 settle 297 50 50 oz climbs august gold",21,0.42085755,0.12560402
04-08-2014,"http://www.investing.com/news/commodities-news/gold-falls-as-stocks-gain-on-u.s.-earnings,-jobs-report-300621","Gold falls as stocks gain on U.S. earnings, jobs report",0,0,1,0,1,0,negative,"['report', 'falls', 'gold', 'stocks gain', 'gain earnings jobs']","Gold falls as stocks gain on U.S. earnings, jobs report report falls gold stocks gain gain earnings jobs",-1,-0.18028684,0.14457701
22-10-2012,https://www.moneycontrol.com/news/business/stocks/-1929297.html,sell gold below usd 1708; target usd 1680: geojit,0,0,0,0,1,0,none,"['target', '1680', '1708', 'geojit', 'sell gold usd']",sell gold below usd 1708; target usd 1680: geojit target 1680 1708 geojit sell gold usd,-1,0.10330178,0.07896321
18-12-2017,https://www.thehindubusinessline.com/markets/gold/gold-prices-rangebound-as-dollar-holds-firm-on-us-tax-bill-hopes/article9995755.ece,Gold prices range-bound as dollar holds firm on US tax Bill hopes,0,1,0,1,1,0,neutral,"['range bound', 'firm tax', 'tax hopes', 'dollar holds', 'gold prices range']",Gold prices range-bound as dollar holds firm on US tax Bill hopes range bound firm tax tax hopes dollar holds gold prices range,-1,0.0010944158,0.0047747344
02-06-2003,http://www.marketwatch.com/story/gold-mining-stocks-sag-as-dollar-gains-2003-06-02,gold-mining stocks sag as dollar gains,0,0,0,1,1,0,none,"['dollar', 'gains', 'sag', 'mining stocks', 'gold mining stocks']",gold-mining stocks sag as dollar gains dollar gains sag mining stocks gold mining stocks,-1,-0.20679413,0.16095343
27-02-2013,http://www.marketwatch.com/story/gold-futures-settle-below-1600oz-2013-02-27,"gold futures settle below $1,600/oz",0,0,1,0,1,0,negative,"['600', 'gold', 'oz', 'settle', 'futures']","gold futures settle below $1,600/oz 600 gold oz settle futures",-1,0.25506085,-0.4562807
15-06-2017,http://www.marketwatch.com/story/august-gold-down-18-at-125480oz-2017-06-15,"august gold down 1.8% at $1,254.80/oz.",0,0,1,0,1,0,negative,"['254', 'august', 'gold', 'oz', '80 oz']","august gold down 1.8% at $1,254.80/oz. 254 august gold oz 80 oz",21,0.46835208,0.15195307
20-04-2006,http://www.marketwatch.com/story/amex-gold-bugs-index-falls-67-to-close-at-3594-2006-04-20,amex gold bugs index falls 6.7% to close at 359.4,0,0,1,0,1,0,negative,"['falls', '359', 'gold', 'bugs index', 'amex']",amex gold bugs index falls 6.7% to close at 359.4 falls 359 gold bugs index amex,2,0.056737617,-0.08932248
07-05-2013,https://www.thehindubusinessline.com/markets/gold/Gold-futures-open-lower-at-Rs-27040/article20611639.ece,"Gold futures open lower at Rs 27,040",0,0,1,0,1,0,negative,"['040', '27', 'gold', 'lower rs', 'futures open lower']","Gold futures open lower at Rs 27,040 040 27 gold lower rs futures open lower",-1,-0.07443513,-0.42171425
07-09-2006,http://www.marketwatch.com/story/gold-futures-tally-a-two-session-loss-of-22-2006-09-07,gold futures tally a two-session loss of $22,0,0,1,0,1,0,negative,"['22', 'gold', 'tally session', 'session loss', 'futures']",gold futures tally a two-session loss of $22 22 gold tally session session loss futures,-1,0.05890058,-0.40385675
06-02-2017,http://www.marketwatch.com/story/april-gold-settles-at-123210oz-up-1130-or-09-2017-02-06,"April gold settles at $1,232.10/oz, up $11.30, or 0.9%",1,0,0,0,1,0,positive,"['232 10', '11 30', 'april', 'oz', 'gold settles']","April gold settles at $1,232.10/oz, up $11.30, or 0.9% 232 10 11 30 april oz gold settles",21,0.51828086,-0.0009889901
26-10-2017,https://www.thehindubusinessline.com/markets/gold/gold-futures-edge-up-to-rs-29421/article9924968.ece,"Gold futures edge up to Rs 29,421",1,0,0,0,1,0,positive,"['29', '29 421', 'rs', 'edge', 'gold futures']","Gold futures edge up to Rs 29,421 29 29 421 rs edge gold futures",-1,-0.024707682,-0.3605132
20-01-2011,http://www.marketwatch.com/story/dollar-recovers-gold-stays-down-after-claims-fall-2011-01-20,"dollar recovers, gold stays down after claims fall",0,0,1,1,1,0,negative,"['stays', 'fall', 'claims', 'dollar recovers', 'dollar recovers gold']","dollar recovers, gold stays down after claims fall stays fall claims dollar recovers dollar recovers gold",-1,0.06699619,0.14180106
12-08-2004,http://www.marketwatch.com/story/spot-gold-quoted-at-39350-down-40c-from-new-york-2004-08-12,"spot gold quoted at $393.50, down 40c from new york",0,0,1,0,1,0,negative,"['quoted', '393 50', 'york', '50 40c new', 'spot gold']","spot gold quoted at $393.50, down 40c from new york quoted 393 50 york 50 40c new spot gold",9,0.24689727,0.120878465
27-09-2017,http://www.marketwatch.com/story/dec-gold-down-1390-or-11-to-settle-at-128780oz-2017-09-27,"Dec. gold down $13.90, or 1.1%, to settle at $1,287.80/oz",0,0,1,0,1,0,negative,"['dec', '13 90', 'settle 287', 'gold', '80 oz']","Dec. gold down $13.90, or 1.1%, to settle at $1,287.80/oz dec 13 90 settle 287 gold 80 oz",21,0.5096648,-0.010085136
31-10-2011,https://www.moneycontrol.com/news/business/markets/-1955751.html,MCX GOLDGUINEA Oct contract trading lower,0,0,1,0,1,0,negative,"['oct', 'lower', 'goldguinea', 'mcx', 'contract trading']",MCX GOLDGUINEA Oct contract trading lower oct lower goldguinea mcx contract trading,1,-0.003984183,-0.054073066
17-05-2017,http://www.investing.com/news/commodities-news/gold-gains-in-asia-as-trump-probe-widens-with-counsel-appointment-485715,Gold gains in Asia as Trump probe widens with counsel appointment,1,0,0,0,1,0,positive,"['trump', 'probe widens', 'asia', 'counsel appointment', 'gold gains']",Gold gains in Asia as Trump probe widens with counsel appointment trump probe widens asia counsel appointment gold gains,-1,-0.27633333,-0.011358373
27-02-2013,http://www.marketwatch.com/story/gold-price-nearly-triples-during-bernanke-tenure-bespoke-2013-02-27,gold price nearly triples during bernanke tenure: bespoke,0,0,1,0,1,0,negative,"['bespoke', 'nearly', 'triples', 'bernanke tenure', 'gold price']",gold price nearly triples during bernanke tenure: bespoke bespoke nearly triples bernanke tenure gold price,-1,-0.02158726,0.14688553
13-03-2009,http://www.marketwatch.com/story/silvers-discount-to-gold-sticks-out-like-a-sore-thumb-2009-03-13,silver's discount to gold sticks out like sore thumb,0,0,0,0,1,0,none,"['like', 'sticks like sore', 'thumb', 'discount', 'silver discount gold']",silver's discount to gold sticks out like sore thumb like sticks like sore thumb discount silver discount gold,-1,-0.046430103,0.14818016
16-03-2017,http://www.marketwatch.com/story/barrick-gold-stock-price-target-raised-to-23-from-19-at-rbc-capital-2017-03-16,Barrick Gold stock price target raised to $23 from $19 at RBC Capital,1,0,0,0,1,0,positive,"['target', 'raised 23 19', 'barrick', 'rbc capital', 'gold stock price']",Barrick Gold stock price target raised to $23 from $19 at RBC Capital target raised 23 19 barrick rbc capital gold stock price,-1,0.098978624,0.08669853
03-04-2017,https://www.moneycontrol.com/news/business/markets/gold-prices-firm-buoyed-by-tepid-us-economic-data-2251495.html,"gold prices firm, buoyed by tepid us economic data",0,1,0,0,1,0,neutral,"['buoyed', 'tepid', 'firm', 'economic data', 'gold prices']","gold prices firm, buoyed by tepid us economic data buoyed tepid firm economic data gold prices",-1,-0.09407172,0.19117945
15-12-2017,https://www.moneycontrol.com/news/business/economy/gjepc-working-with-dmcc-to-set-up-delivery-standards-for-gold-diamond-trade-official-2462405.html,"GJEPC working with DMCC to set up delivery standards for gold, diamond trade: Official",0,0,0,0,1,0,none,"['gold diamond', 'trade official', 'working dmcc set', 'gjepc working', 'set delivery standards']","GJEPC working with DMCC to set up delivery standards for gold, diamond trade: Official gold diamond trade official working dmcc set gjepc working set delivery standards",-1,-0.19372395,0.01357457
09-08-2011,https://www.moneycontrol.com/news/business/markets/-2129229.html,is it too late for gold fever?,0,0,0,0,0,1,none,"['late', 'gold', 'fever', 'late gold', 'gold fever']",is it too late for gold fever? late gold fever late gold gold fever,-1,-0.10547906,0.04920555
01-07-2014,http://www.investing.com/news/commodities-news/gold-gains-on-expectations-for-fed-policy-to-stay-loose-292560,gold gains on expectations for fed policy to stay loose,1,0,0,0,1,0,positive,"['stay', 'expectations', 'fed', 'policy stay loose', 'gold gains']",gold gains on expectations for fed policy to stay loose stay expectations fed policy stay loose gold gains,-1,-0.14557773,-0.043896377
18-10-2016,http://www.marketwatch.com/story/december-gold-up-05-at-126310oz-2016-10-18,"December gold up 0.5% at $1,263.10/oz.",1,0,0,0,1,0,positive,"['10', '263 10', 'december', 'oz', 'gold']","December gold up 0.5% at $1,263.10/oz. 10 263 10 december oz gold",21,0.42857492,0.13093239
15-10-2018,https://www.moneycontrol.com/news/business/commodities/gold-rises-as-falling-markets-burnish-appeal-3045871.html,Gold rises as falling markets burnish appeal,1,0,0,0,1,0,positive,"['burnish', 'appeal', 'markets', 'gold', 'rises falling']",Gold rises as falling markets burnish appeal burnish appeal markets gold rises falling,-1,-0.17890996,0.12098765
01-02-2018,https://www.metalsdaily.com/link/276340/perth-mint-s-jan-gold-sales-surges-38-pct-mm-silver-jumps-22-pct.htm,"perth mint 's jan gold sales surges 38 pct m/m, silver jumps 22 pct",1,0,0,1,1,0,positive,"['22 pct', 'sales surges', 'jan gold', 'silver jumps', 'perth mint']","perth mint 's jan gold sales surges 38 pct m/m, silver jumps 22 pct 22 pct sales surges jan gold silver jumps perth mint",-1,0.0128193945,0.11485582
12-06-2013,https://www.moneycontrol.com/news/business/markets/-1703187.html,sell gold & crude: sushil finance,0,0,0,1,0,1,none,"['crude', 'sell', 'sushil', 'finance', 'sell gold']",sell gold & crude: sushil finance crude sell sushil finance sell gold,-1,-0.16481619,0.088416144
11-09-2013,http://www.marketwatch.com/story/dec-gold-down-20-cents-ends-at-136380oz-2013-09-11,"dec. gold down 20 cents, ends at $1,363.80/oz",0,0,1,0,1,0,negative,"['363', 'ends', 'dec', '80 oz', 'gold 20 cents']","dec. gold down 20 cents, ends at $1,363.80/oz 363 ends dec 80 oz gold 20 cents",-1,0.44194144,0.0334347
08-01-2016,http://www.marketwatch.com/story/gold-futures-up-36-on-week-biggest-weekly-gain-since-august-2016-01-08,"gold futures up 3.6% on week, biggest weekly gain since august",1,0,0,0,1,0,positive,"['biggest', 'august', 'gain', 'week biggest weekly', 'gold futures']","gold futures up 3.6% on week, biggest weekly gain since august biggest august gain week biggest weekly gold futures",-1,-0.009090826,-0.3515589
01-11-2017,https://economictimes.indiatimes.com/markets/commodities/news/gold-dips-as-dollar-gains-ahead-of-fed-statement/articleshow/61382712.cms,gold dips as dollar gains ahead of fed statement,0,0,1,1,1,0,negative,"['statement', 'ahead', 'dips', 'fed', 'dollar gains']",gold dips as dollar gains ahead of fed statement statement ahead dips fed dollar gains,-1,-0.10570238,0.033258628
18-05-2006,http://www.marketwatch.com/story/gold-futures-tally-a-two-day-loss-of-12-2006-05-18,gold futures tally a two-day loss of $12,0,0,1,0,1,0,negative,"['day', 'tally', 'futures', 'loss 12', 'gold futures']",gold futures tally a two-day loss of $12 day tally futures loss 12 gold futures,-1,0.026668698,-0.4259379
09-10-2014,http://www.investing.com/news/commodities-news/gold-futures-climb-to-2-week-high-on-fed-relief-312338,gold futures climb to 2-week high on fed relief,1,0,0,0,1,0,positive,"['relief', 'week high', 'climb', 'fed', 'gold futures']",gold futures climb to 2-week high on fed relief relief week high climb fed gold futures,-1,-0.14495087,-0.40092695
14-11-2017,https://www.thehindubusinessline.com/markets/gold/gold-silver-futures-weaken-on-profitbooking-global-cues/article9957997.ece,"Gold, silver futures weaken on profit-booking, global cues",0,0,1,1,1,0,negative,"['weaken', 'global cues', 'booking', 'gold silver', 'futures weaken profit']","Gold, silver futures weaken on profit-booking, global cues weaken global cues booking gold silver futures weaken profit",-1,-0.22898144,-0.26967984
25-02-2015,"http://www.investing.com/news/commodities-news/gold-holds-gains-after-new-home-sales-data,-yellen-comments-support-329596","gold holds gains after new home sales data, yellen comments support",1,0,0,0,1,0,positive,"['new home', 'gains', 'sales data', 'yellen comments support', 'gold holds']","gold holds gains after new home sales data, yellen comments support new home gains sales data yellen comments support gold holds",-1,-0.1545645,0.2850183
04-02-2003,http://www.marketwatch.com/story/gold-futures-close-near-380-a-1996-high-2003-02-04,gold futures close near $380 an ounce,0,1,0,0,1,0,neutral,"['near', '380', 'ounce', 'futures close', 'gold futures']",gold futures close near $380 an ounce near 380 ounce futures close gold futures,26,0.24453701,-0.44289893
20-11-2012,https://www.moneycontrol.com/news/business/markets/-1691965.html,"sell gold & crude, buy aluminium says tarang bhanushali",0,0,0,1,1,0,none,"['crude', 'says tarang', 'bhanushali', 'sell gold', 'buy aluminium']","sell gold & crude, buy aluminium says tarang bhanushali crude says tarang bhanushali sell gold buy aluminium",-1,-0.11856908,0.11679031
15-06-2012,https://www.thehindubusinessline.com/markets/gold/MCX-gold-may-touch-Rs-30080-per-10-gm/article20454163.ece,"MCX gold may touch Rs 30,080 per 10 gm",0,0,0,0,1,0,none,"['30 080 10', 'touch rs', 'gm', 'gold', 'mcx']","MCX gold may touch Rs 30,080 per 10 gm 30 080 10 touch rs gm gold mcx",-1,-0.012343451,-0.0038045645
19-01-2005,http://www.marketwatch.com/story/spot-gold-quoted-at-42210-down-30c-from-new-york-2005-01-19-21905853,"spot gold quoted at $422.10, down 30c from new york",0,0,1,0,1,0,negative,"['quoted', '422 10', 'york', '10 30c new', 'spot gold']","spot gold quoted at $422.10, down 30c from new york quoted 422 10 york 10 30c new spot gold",9,0.25311154,0.09670213
01-02-2018,https://www.thehindubusinessline.com/economy/agri-business/buy-comex-gold-if-it-touches-1330-35oz/article22622580.ece,"Buy Comex gold if it touches $1,330-35/oz ",0,0,0,0,0,1,none,"['touches', '330 35', 'oz', 'gold', 'buy comex']","Buy Comex gold if it touches $1,330-35/oz  touches 330 35 oz gold buy comex",-1,0.35193664,0.13655451
02-03-2017,http://www.marketwatch.com/story/gold-holds-losses-after-initial-jobless-claims-report-2017-03-02,Gold holds losses after initial-jobless claims report,0,0,1,0,1,0,negative,"['initial', 'holds', 'report', 'gold holds losses', 'jobless claims report']",Gold holds losses after initial-jobless claims report initial holds report gold holds losses jobless claims report,-1,-0.113264896,0.09165662
18-10-2016,http://www.marketwatch.com/story/polymetals-gold-equivalent-output-falls-5-yoy-2016-10-18,Polymetal's gold-equivalent output falls 5% YOY,0,0,1,0,1,0,negative,"['equivalent', 'falls', 'yoy', 'output falls', 'polymetal gold equivalent']",Polymetal's gold-equivalent output falls 5% YOY equivalent falls yoy output falls polymetal gold equivalent,-1,-0.014744803,0.06138516
17-12-2016,http://www.marketwatch.com/story/peter-schiff-sheds-no-tears-as-a-trump-rally-hammers-gold-stretches-dow-to-20000-2016-12-13,"peter schiff sheds no tears as a trump rally hammers gold, dow nears 20,000",0,0,0,0,1,0,none,"['20 000', 'dow nears', 'peter schiff', 'sheds tears trump', 'rally hammers gold']","peter schiff sheds no tears as a trump rally hammers gold, dow nears 20,000 20 000 dow nears peter schiff sheds tears trump rally hammers gold",-1,-0.110332526,0.027681638
11-12-2018,http://www.investing.com/news/commodities-news/gold-prices-rise-despite-feds-signals-on-neutrality-1718842,gold prices rise despite fed's signals on neutrality,1,0,0,0,1,0,positive,"['despite', 'neutrality', 'fed signals', 'prices rise', 'gold prices rise']",gold prices rise despite fed's signals on neutrality despite neutrality fed signals prices rise gold prices rise,-1,-0.15195686,0.13264221
05-01-2012,https://www.moneycontrol.com/news/business/markets/-1067001.html,"time to shop: buy gold, silver, copper & crude, say experts",0,0,0,1,1,0,none,"['experts', 'crude say', 'time shop buy', 'copper', 'buy gold silver']","time to shop: buy gold, silver, copper & crude, say experts experts crude say time shop buy copper buy gold silver",-1,-0.09656985,0.08221039
30-06-2013,https://www.thehindubusinessline.com/opinion/columns/g-chandrashekhar/gold-silver-crash-further/article20628450.ece1,"Gold, silver crash further",0,0,1,1,1,0,negative,"['crash', 'gold', 'silver', 'gold silver', 'silver crash']","Gold, silver crash further crash gold silver gold silver silver crash",-1,-0.14685021,0.081101894
21-06-2013,https://economictimes.indiatimes.com/markets/commodities/gold-dips-below-rs-28k-level-tumbles-rs-620-on-global-cues/articleshow/20698875.cms,"gold dips below rs 28k level, tumbles rs 620 on global cues",0,0,1,0,1,0,negative,"['global cues', '620', 'tumbles rs', '28k level', 'gold dips']","gold dips below rs 28k level, tumbles rs 620 on global cues global cues 620 tumbles rs 28k level gold dips",-1,-0.11617201,0.07230594
20-02-2018,https://www.metalsdaily.com/link/276917/standard-chartered-indias-annual-budget-good-for-gold-in-long-term.htm,standard chartered : india's annual budget good for gold in long term,0,0,0,0,1,0,none,"['india', 'good gold', 'long term', 'standard chartered', 'annual budget']",standard chartered : india's annual budget good for gold in long term india good gold long term standard chartered annual budget,-1,-0.22218938,0.13047977
02-05-2013,https://www.moneycontrol.com/news/business/mutual-funds/-1763131.html,"don't hold too much gold; shun cyclicals, infra: mirae",0,0,0,0,1,0,none,"['infra', 'shun', 'mirae', 'cyclicals', 'don hold gold']","don't hold too much gold; shun cyclicals, infra: mirae infra shun mirae cyclicals don hold gold",-1,-0.12921739,0.09795104
25-01-2011,https://economictimes.indiatimes.com/markets/commodities/bargain-hunting-may-support-gold/articleshow/7356921.cms,bargain-hunting may support gold,0,0,0,0,1,0,none,"['support', 'hunting support', 'bargain', 'gold', 'bargain hunting']",bargain-hunting may support gold support hunting support bargain gold bargain hunting,-1,-0.090026096,0.10572561
18-12-2017,http://www.investing.com/news/commodities-news/gold-prices-down-slightly-in-asia-with-holiday-range-trade-in-place-1007287,Gold Prices Down Slightly In Asia With Holiday Range Trade In Place,0,0,1,0,1,0,negative,"['slightly', 'range', 'trade', 'asia holiday', 'gold prices']",Gold Prices Down Slightly In Asia With Holiday Range Trade In Place slightly range trade asia holiday gold prices,-1,-0.096909836,0.038585454
14-08-2014,http://www.investing.com/news/commodities-news/gold-surges-to-session-highs-after-jobless-claims-miss-303437,gold surges to session highs after jobless claims miss,1,0,0,0,1,0,positive,"['miss', 'session', 'highs', 'jobless claims', 'gold surges session']",gold surges to session highs after jobless claims miss miss session highs jobless claims gold surges session,-1,-0.1461532,0.03569638
02-01-2017,https://www.moneycontrol.com/news/business/stocks/gold-to-trade27287-27713-range-achiievers-equities-939326.html,gold to trade in 27287-27713 range: achiievers equities,0,1,0,0,0,1,neutral,"['range', '27287 27713', 'achiievers', 'equities', 'gold trade']",gold to trade in 27287-27713 range: achiievers equities range 27287 27713 achiievers equities gold trade,3,0.009012744,0.11058439
02-11-2018,https://economictimes.indiatimes.com/markets/commodities/views/gold-rush-at-central-banks-is-on-even-etfs-are-showing-their-love/articleshow/66478857.cms,Buying by central banks & ETFs set to propel gold prices higher,1,0,0,0,1,0,positive,"['set propel', 'buying', 'central banks', 'etfs set', 'gold prices higher']",Buying by central banks & ETFs set to propel gold prices higher set propel buying central banks etfs set gold prices higher,-1,-0.1647724,0.040011197
14-05-2003,http://www.marketwatch.com/story/gold-futures-rise-to-fresh-two-month-high-2003-05-14,gold futures rise to fresh two-month high,1,0,0,0,1,0,positive,"['fresh', 'high', 'rise', 'month', 'gold futures']",gold futures rise to fresh two-month high fresh high rise month gold futures,-1,-0.12167385,-0.39889514
30-12-2015,https://www.thehindubusinessline.com/markets/gold/gold-inches-up-in-thin-trade/article8045091.ece,Gold inches up in thin trade,1,0,0,0,1,0,positive,"['trade', 'inches', 'gold', 'inches trade', 'gold inches']",Gold inches up in thin trade trade inches gold inches trade gold inches,-1,-0.0035131425,0.16667596
03-01-2017,http://www.marketwatch.com/story/gold-prices-edge-lower-after-upbeat-us-ism-data-2017-01-03,Gold prices settle at a nearly 3-week high,1,0,0,0,1,0,positive,"['nearly', 'high', 'week', 'prices settle', 'gold prices']",Gold prices settle at a nearly 3-week high nearly high week prices settle gold prices,-1,0.044580355,-0.05949655
14-10-2016,http://www.marketwatch.com/story/gold-lower-clinging-to-weekly-gain-ahead-of-consumer-data-yellen-speech-2016-10-14,"Gold futures settle lower, but hang on to small weekly gain",0,0,1,0,1,0,negative,"['small', 'hang', 'weekly gain', 'gold futures', 'futures settle lower']","Gold futures settle lower, but hang on to small weekly gain small hang weekly gain gold futures futures settle lower",-1,-0.029593654,-0.45088756
08-06-2017,https://www.thehindubusinessline.com/markets/gold/gold-holds-steady-as-uk-goes-to-polls-ecb-meeting-in-focus/article9722579.ece,Gold holds steady as UK goes to polls; ECB meeting in focus,0,1,0,0,1,0,neutral,"['meeting focus', 'gold', 'goes polls', 'ecb meeting', 'holds steady uk']",Gold holds steady as UK goes to polls; ECB meeting in focus meeting focus gold goes polls ecb meeting holds steady uk,-1,-0.20676637,0.05509845
09-07-2013,https://www.moneycontrol.com/news/business/markets/-1742677.html,"gold traders eye rs 25,000 price level",1,0,0,0,1,0,positive,"['eye', '25', 'rs', '000 price level', 'gold traders']","gold traders eye rs 25,000 price level eye 25 rs 000 price level gold traders",-1,-0.07069524,0.034260675
05-11-2008,http://www.marketwatch.com/story/dec-gold-ends-at-74240oz-on-nymex-down-1490-or-2-2008-11-05,"dec. gold ends at $742.40/oz on nymex, down $14.90, or 2%",0,0,1,0,1,0,negative,"['90', 'dec', 'nymex', '742 40 oz', 'gold ends']","dec. gold ends at $742.40/oz on nymex, down $14.90, or 2% 90 dec nymex 742 40 oz gold ends",21,0.36524868,-0.027006343
0200-03-15,http://www.marketwatch.com/story/april-gold-climbs-580-to-64830oz-in-ny-2007-03-15,april gold climbs $5.80 to $648.30/oz in ny,1,0,0,0,1,0,positive,"['80 648', 'ny', 'climbs', '30 oz', 'april gold']",april gold climbs $5.80 to $648.30/oz in ny 80 648 ny climbs 30 oz april gold,21,0.37378883,0.11357164
15-11-2016,http://www.marketwatch.com/story/gold-climbs-from-5-month-low-as-dollar-advance-pauses-2016-11-15,Gold prices log first gain in 7 sessions,1,0,0,0,1,0,positive,"['sessions', 'prices', 'gain', 'log', 'gold prices']",Gold prices log first gain in 7 sessions sessions prices gain log gold prices,-1,0.00888598,0.0531212
17-08-2015,https://www.moneycontrol.com/news/business/markets/govt-hikes-tariff-valueimported-gold-silver-1514043.html,"govt hikes tariff value on imported gold, silver",0,0,0,1,1,0,none,"['hikes', 'govt', 'value imported', 'gold silver', 'hikes tariff']","govt hikes tariff value on imported gold, silver hikes govt value imported gold silver hikes tariff",5,-0.21437329,0.18684031
25-01-2017,http://www.marketwatch.com/story/gold-futures-settle-at-a-nearly-two-week-low-2017-01-25,gold futures settle at a nearly two-week low,0,0,1,0,1,0,negative,"['nearly', 'week', 'low', 'futures settle', 'gold futures settle']",gold futures settle at a nearly two-week low nearly week low futures settle gold futures settle,25,-0.0044401735,-0.5311794
29-02-2008,http://www.marketwatch.com/story/gold-futures-up-500-at-97250-an-ounce-2008-02-29,gold futures up $5.00 at $972.50 an ounce,1,0,0,0,1,0,positive,"['50', '00 972', 'ounce', 'futures', 'gold futures']",gold futures up $5.00 at $972.50 an ounce 50 00 972 ounce futures gold futures,26,0.26727396,-0.3995715
09-11-2005,http://www.marketwatch.com/story/gold-futures-look-to-extend-their-winning-streak-to-three-2005-11-09,gold futures look to extend their winning streak to three,0,0,0,0,0,1,none,"['look extend', 'winning', 'streak', 'futures', 'gold futures']",gold futures look to extend their winning streak to three look extend winning streak futures gold futures,-1,-0.20729117,-0.30855936
14-09-2017,https://economictimes.indiatimes.com/markets/commodities/news/gold-falls-to-lowest-in-nearly-2-weeks-us-inflation-data-in-focus/articleshow/60506206.cms,"gold slips to lowest in nearly 2 weeks, us inflation data in focus",0,0,1,0,1,0,negative,"['data focus', 'nearly weeks', 'slips', 'lowest', 'inflation data']","gold slips to lowest in nearly 2 weeks, us inflation data in focus data focus nearly weeks slips lowest inflation data",-1,-0.014161959,0.004548095
23-02-2015,"http://www.investing.com/news/commodities-news/gold-extends-losses-below-$1,200-to-trade-at-7-week-low-329191","Gold extends losses below $1,200 to trade at 7-week low",0,0,1,0,1,0,negative,"['extends', '200', 'trade', 'week low', 'gold extends losses']","Gold extends losses below $1,200 to trade at 7-week low extends 200 trade week low gold extends losses",-1,0.021445796,-0.01715269
24-11-2009,http://www.marketwatch.com/story/gold-futures-extend-gains-into-an-eighth-session-2009-11-24,gold futures extend gains into an eighth session,1,0,0,0,1,0,positive,"['session', 'eighth', 'gold', 'extend gains', 'futures extend']",gold futures extend gains into an eighth session session eighth gold extend gains futures extend,-1,-0.12429554,-0.31113368
02-01-2019,https://www.metalsdaily.com/link/288069/gold-ends-new-years-eve-and-2018-in-the-red-but-books-7-quarterly-gain-as-stocks-swoon.htm,"gold ends new year's eve and 2018 in the red, but books 7% quarterly gain as stocks swoon",0,0,1,0,1,0,negative,"['2018 red', 'new year eve', 'gain stocks swoon', 'books quarterly', 'gold ends']","gold ends new year's eve and 2018 in the red, but books 7% quarterly gain as stocks swoon 2018 red new year eve gain stocks swoon books quarterly gold ends",-1,-0.03256031,0.021456473
27-03-2018,https://www.metalsdaily.com/link/278069/goldman-sachs-forecasts-sharp-rises-in-gold.htm,goldman sachs forecasts sharp rises in gold,0,0,0,0,1,0,none,"['rises', 'gold', 'sharp', 'sachs', 'forecasts']",goldman sachs forecasts sharp rises in gold rises gold sharp sachs forecasts,-1,-0.23064244,0.012091011
25-09-2017,https://www.moneycontrol.com/news/business/stocks/gold-prices-to-trade-lower-angel-commodities-16-2396725.html,Gold prices to trade lower Angel Commodities,0,0,1,0,0,1,negative,"['lower', 'angel', 'trade', 'commodities', 'gold prices']",Gold prices to trade lower Angel Commodities lower angel trade commodities gold prices,8,-0.08556253,0.14363034
11-05-2013,https://economictimes.indiatimes.com/markets/forex/foreign-exchange-reserves-decline-2-bn-on-fall-in-golds-value/articleshow/19994801.cms,foreign exchange reserves decline $2 bn on fall in gold's value,0,0,1,0,1,0,negative,"['bn', 'fall', 'foreign exchange', 'reserves decline', 'gold value']",foreign exchange reserves decline $2 bn on fall in gold's value bn fall foreign exchange reserves decline gold value,-1,-0.035767704,0.1060978
28-04-2016,https://www.thehindubusinessline.com/markets/gold/buy-comex-gold-if-it-dips-to-1245/article8533287.ece,"Buy Comex gold if it dips to $1,245",0,0,0,0,0,1,none,"['dips', 'comex', 'gold', 'buy', '245']","Buy Comex gold if it dips to $1,245 dips comex gold buy 245",15,0.12999325,0.066167355
21-02-2014,http://www.marketwatch.com/story/comex-gold-up-05-on-day-gains-04-on-week-2014-02-21,"comex gold up 0.5% on day, gains 0.4% on week",1,0,0,0,1,0,positive,"['week', 'comex', 'gold', 'gains', 'day gains']","comex gold up 0.5% on day, gains 0.4% on week week comex gold gains day gains",-1,0.038582563,0.063130856
28-09-2015,https://www.thehindubusinessline.com/markets/commodities/traders-can-stay-out-of-mcx-gold/article7699011.ece,Traders can stay out of MCX gold,0,0,0,0,1,0,none,"['stay', 'gold', 'traders', 'mcx', 'traders stay']",Traders can stay out of MCX gold stay gold traders mcx traders stay,-1,-0.20100287,-0.050409913
07-12-2012,https://economictimes.indiatimes.com/articleshow/17522357.cms,"gold swings between gains and drops on dollar, easing outlook",1,0,1,1,1,0,positive,"['swings', 'outlook', 'gains', 'gold', 'drops dollar easing']","gold swings between gains and drops on dollar, easing outlook swings outlook gains gold drops dollar easing",-1,-0.081687465,0.062533066
13-11-2013,https://www.thehindubusinessline.com/markets/gold/govt-cuts-import-tariff-on-gold/article23123517.ece,Govt cuts import tariff on gold,0,0,0,0,1,0,none,"['cuts', 'govt', 'import', 'gold', 'import tariff']",Govt cuts import tariff on gold cuts govt import gold import tariff,5,-0.22710697,0.07528771
02-06-2016,https://www.thehindubusinessline.com/markets/gold/gold-crawls-higher-as-dollar-eases-fed-rate-hike-in-focus/article8681432.ece,Gold crawls higher as dollar eases; Fed rate hike in focus,1,0,0,1,1,0,positive,"['hike', 'crawls higher', 'rate', 'gold', 'dollar eases fed']",Gold crawls higher as dollar eases; Fed rate hike in focus hike crawls higher rate gold dollar eases fed,-1,-0.13383594,0.0909151
29-04-2002,http://www.marketwatch.com/story/gold-dips-after-charge-natural-gas-jumps-2002-04-29,gold dips after strong charge,0,0,1,0,1,0,negative,"['strong', 'charge', 'dips', 'gold', 'dips strong charge']",gold dips after strong charge strong charge dips gold dips strong charge,-1,-0.16720088,0.1103591
30-11-2004,http://www.marketwatch.com/story/feb-gold-down-2-at-45380oz-2004-11-30,feb gold down $2 at $453.80/oz,0,0,1,0,1,0,negative,"['453', '453 80', 'feb', 'gold', 'oz']",feb gold down $2 at $453.80/oz 453 453 80 feb gold oz,21,0.50283235,0.11377616
04-01-2013,https://www.moneycontrol.com/news/business/markets/-1717145.html,mcx goldguinea feb contract declines,0,0,1,0,1,0,negative,"['feb', 'contract', 'goldguinea', 'mcx', 'contract declines']",mcx goldguinea feb contract declines feb contract goldguinea mcx contract declines,1,0.0023421645,-0.050817803
25-08-2011,http://www.marketwatch.com/story/glencore-to-look-at-kazzinc-gold-assets-options-2011-08-25,glencore to look at kazzinc gold assets options,0,0,0,0,1,0,none,"['look', 'gold', 'kazzinc', 'assets options', 'glencore']",glencore to look at kazzinc gold assets options look gold kazzinc assets options glencore,-1,-0.15142228,0.12044223
16-06-2003,http://www.marketwatch.com/story/gold-futures-close-near-360-metals-shares-climb-2003-06-16,gold futures close near $360; metals shares climb,0,0,0,0,1,0,none,"['near 360', 'climb', 'shares', 'metals', 'futures close']",gold futures close near $360; metals shares climb near 360 climb shares metals futures close,-1,-0.049964994,-0.43039578
31-03-2010,http://www.marketwatch.com/story/gold-futures-add-to-gains-after-adp-data-2010-03-31,gold futures add to gains after adp data,1,0,0,0,1,0,positive,"['add', 'gold', 'futures', 'add gains', 'adp data']",gold futures add to gains after adp data add gold futures add gains adp data,-1,-0.16777799,-0.1933985
29-06-2009,http://www.marketwatch.com/story/gold-rises-slightly-as-dollar-weakens,gold rises slightly as dollar weakens,1,0,0,1,1,0,positive,"['slightly', 'weakens', 'rises', 'gold', 'dollar weakens']",gold rises slightly as dollar weakens slightly weakens rises gold dollar weakens,-1,-0.07259352,0.20290115
02-01-2007,http://www.marketwatch.com/story/gold-futures-extend-recent-gains-as-dollar-slips-2007-01-02,gold futures extend winning streak,1,0,0,0,1,0,positive,"['winning', 'extend', 'streak', 'futures extend', 'gold futures']",gold futures extend winning streak winning extend streak futures extend gold futures,-1,-0.19105348,-0.35707974
10-08-2017,http://www.marketwatch.com/story/dalio-urges-investors-to-buy-gold-to-hedge-against-possible-war-with-north-korea-2017-08-10,Dalio urges investors to buy gold to hedge against possible war with North Korea,0,0,0,0,1,0,none,"['gold', 'north korea', 'investors buy', 'hedge possible', 'dalio urges']",Dalio urges investors to buy gold to hedge against possible war with North Korea gold north korea investors buy hedge possible dalio urges,-1,-0.23088875,-0.05986415
05-07-2018,https://www.metalsdaily.com/link/280913/cme-group-gold-volume-shoots-up-29-yy-during-q2.htm,cme group gold volume shoots up 29% y/y during q2,0,0,0,0,1,0,none,"['29', 'shoots', 'q2', 'cme group', 'group gold volume']",cme group gold volume shoots up 29% y/y during q2 29 shoots q2 cme group group gold volume,-1,-0.0026291609,0.07508841
06-12-2004,http://www.marketwatch.com/story/feb-gold-down-330-to-45450oz-after-45650-high-2004-12-06,feb gold down $3.30 to $454.50/oz after $456.50 high,0,0,1,0,1,0,negative,"['454 50', 'high', 'feb', 'oz', 'gold 30']",feb gold down $3.30 to $454.50/oz after $456.50 high 454 50 high feb oz gold 30,21,0.49206817,0.09032409
06-06-2017,https://www.thehindubusinessline.com/markets/gold/gold-up-at-rs-29750-silver-rebounds-to-rs-40840/article9721186.ece,"Gold up at Rs 29,750; silver rebounds to Rs 40,840",1,0,0,1,1,0,positive,"['29 750', 'rs', '40 840', 'gold', 'rebounds']","Gold up at Rs 29,750; silver rebounds to Rs 40,840 29 750 rs 40 840 gold rebounds",-1,0.017597005,0.24627914
26-02-2009,http://www.marketwatch.com/story/gold-ends-just-above-940-an-ounce-as-crude-rises-2009-02-26,gold falls near $940 as crude prices rise,0,0,1,1,1,0,negative,"['crude', '940', 'gold', 'falls near', 'prices rise']",gold falls near $940 as crude prices rise crude 940 gold falls near prices rise,-1,0.06139575,-0.10389392
15-11-2011,https://www.moneycontrol.com/news/business/markets/-1393139.html,"Spot Gold rates trading higher in Chennai, Jaipur market",1,0,0,0,1,0,positive,"['higher', 'chennai', 'spot gold', 'rates trading', 'jaipur']","Spot Gold rates trading higher in Chennai, Jaipur market higher chennai spot gold rates trading jaipur",-1,-0.15245132,0.07931343
08-05-2017,http://www.marketwatch.com/story/june-gold-settles-at-122710oz-up-20-cents-for-the-session-2017-05-08,"June gold settles at $1,227.10/oz, up 20 cents for the session",1,0,0,0,1,0,positive,"['june', '10 oz', 'gold', 'settles 227', 'cents session']","June gold settles at $1,227.10/oz, up 20 cents for the session june 10 oz gold settles 227 cents session",21,0.46141756,0.044261992
01-08-2017,http://www.marketwatch.com/story/gold-challenged-to-hold-seven-week-highs-2017-08-01,Gold settles at nearly 8-week high,1,0,0,0,1,0,positive,"['nearly', 'nearly week', 'week high', 'gold', 'settles']",Gold settles at nearly 8-week high nearly nearly week week high gold settles,20,0.07762547,-0.035871908
27-12-2004,http://www.marketwatch.com/story/gold-prices-near-three-week-high-2004-12-27,gold prices near three-week high,1,0,0,0,1,0,positive,"['near', 'high', 'week', 'prices near week', 'gold prices']",gold prices near three-week high near high week prices near week gold prices,-1,0.003740877,0.012669489
03-08-2016,http://www.marketwatch.com/story/december-gold-down-190-or-01-at-137070oz-2016-08-03,"December gold down $1.90, or 0.1%, at $1,370.70/oz",0,0,1,0,1,0,negative,"['370 70', '90', 'oz', 'december', 'gold']","December gold down $1.90, or 0.1%, at $1,370.70/oz 370 70 90 oz december gold",21,0.43914974,0.057106744
02-06-2005,http://www.marketwatch.com/story/bullish-trend-for-gold-as-history-repeats-itself-2005-06-02,gold's slide reversing,0,0,0,0,1,0,none,"['gold', 'slide', 'reversing', 'slide reversing', 'gold slide']",gold's slide reversing gold slide reversing slide reversing gold slide,-1,-0.12333453,0.10509511
26-10-2017,http://www.marketwatch.com/story/dan-rather-says-trumps-conduct-over-call-to-gold-star-widow-is-unforgivable-2017-10-20,Dan Rather says Trump's conduct over call to Gold Star widow is 'unforgivable',0,0,0,0,1,0,none,"['says', 'star widow', 'conduct gold', 'unforgivable', 'dan says trump']",Dan Rather says Trump's conduct over call to Gold Star widow is 'unforgivable' says star widow conduct gold unforgivable dan says trump,-1,-0.15503651,-0.04778886
15-06-2016,https://www.moneycontrol.com/news/business/markets/gold-slips-aheadfed-statementbrexit-worries-underpin-990157.html,"gold slips ahead of fed statement, but brexit worries underpin",0,0,1,0,1,0,negative,"['worries', 'underpin', 'brexit', 'fed statement', 'gold slips']","gold slips ahead of fed statement, but brexit worries underpin worries underpin brexit fed statement gold slips",-1,-0.17102514,-0.054308325
06-01-2015,https://www.moneycontrol.com/news/business/markets/gold-prices-firm-above-361200safe-haven-bids-1369631.html,"gold prices firm above &#36;1,200 on safe-haven bids",1,0,0,0,1,0,positive,"['haven', 'safe', 'firm', '36 200', 'gold prices']","gold prices firm above &#36;1,200 on safe-haven bids haven safe firm 36 200 gold prices",-1,0.007482812,0.040343247
15-07-2004,http://www.marketwatch.com/story/spot-gold-quoted-at-40360-unchanged-from-new-york-2004-07-15,"spot gold quoted at $403.60, unchanged from new york",0,0,0,0,1,0,none,"['quoted', '403', '60 unchanged new', 'york', 'spot gold']","spot gold quoted at $403.60, unchanged from new york quoted 403 60 unchanged new york spot gold",9,0.2212454,0.080478415
30-03-2006,http://www.marketwatch.com/story/june-gold-jumps-1179-to-25-yr-high-of-59030oz-2006-03-30,june gold jumps $11.79 to 25-yr high of $590.30/oz,1,0,0,0,1,0,positive,"['79 25', 'yr high', 'jumps', '590 30 oz', 'june gold']",june gold jumps $11.79 to 25-yr high of $590.30/oz 79 25 yr high jumps 590 30 oz june gold,-1,0.33544785,0.082176685
04-08-2016,http://www.marketwatch.com/story/december-gold-up-320-or-02-at-136790oz-2016-08-04,"December gold up $3.20, or 0.2%, at $1,367.90/oz.",1,0,0,0,1,0,positive,"['367 90', '20 367', 'oz', 'december', 'gold']","December gold up $3.20, or 0.2%, at $1,367.90/oz. 367 90 20 367 oz december gold",21,0.44194043,0.10950129
03-04-2003,http://www.marketwatch.com/story/gold-futures-sink-to-four-month-low-2003-04-03,gold futures sink to four-month low,0,0,1,0,1,0,negative,"['low', 'month', 'sink', 'futures', 'gold futures']",gold futures sink to four-month low low month sink futures gold futures,-1,-0.04379852,-0.47394156
19-03-2018,https://www.metalsdaily.com/link/277837/dollar-remains-king-while-gold-slips.htm,dollar remains king while gold slips,0,0,1,1,1,0,negative,"['remains', 'slips', 'king', 'gold', 'dollar remains']",dollar remains king while gold slips remains slips king gold dollar remains,-1,-0.02634041,0.068475194
14-02-2014,https://www.moneycontrol.com/news/business/markets/government-raises-tariff-valuegold-silver-1160527.html,"government raises tariff value on gold, silver",0,0,0,1,1,0,none,"['raises', 'government', 'value', 'value gold silver', 'government raises tariff']","government raises tariff value on gold, silver raises government value value gold silver government raises tariff",-1,-0.15176177,0.2063983
14-03-2011,http://www.marketwatch.com/story/gold-futures-rise-as-much-as-11-an-ounce-2011-03-14,gold futures rise as much as $11 an ounce,1,0,0,0,1,0,positive,"['rise', '11', 'ounce', 'futures', 'gold futures']",gold futures rise as much as $11 an ounce rise 11 ounce futures gold futures,-1,0.18073754,-0.39757237
12-04-2010,http://www.marketwatch.com/story/winning-week-leaves-gold-bugs-wary-2010-04-12,"winning week for gold leaves bugs hopeful, wary",0,0,0,0,1,0,none,"['week', 'winning', 'hopeful wary', 'leaves bugs', 'gold leaves']","winning week for gold leaves bugs hopeful, wary week winning hopeful wary leaves bugs gold leaves",-1,-0.14918576,0.08987472
0200-09-10,http://www.marketwatch.com/story/dec-gold-last-up-330-at-713oz-after-a-71550-high-2007-09-10,dec. gold last up $3.30 at $713/oz after a $715.50 high,1,0,0,0,1,0,positive,"['30 713', '715 50 high', 'dec', 'oz', 'gold']",dec. gold last up $3.30 at $713/oz after a $715.50 high 30 713 715 50 high dec oz gold,21,0.4176818,0.08858847
08-05-2014,"http://www.investing.com/news/commodities-news/gold-turns-lower-after-jobless-claims-data,-draghi-comments-282972","Gold turns lower after jobless claims data, Draghi comments",0,0,1,0,1,0,negative,"['lower', 'jobless', 'gold turns', 'claims data', 'data draghi comments']","Gold turns lower after jobless claims data, Draghi comments lower jobless gold turns claims data data draghi comments",-1,-0.14561236,0.12551114
15-08-2017,https://economictimes.indiatimes.com/markets/commodities/news/gold-inches-lower-as-north-korea-tensions-ease/articleshow/60069259.cms,gold inches lower as north korea tensions ease,0,0,1,0,1,0,negative,"['ease', 'lower north', 'inches', 'gold', 'korea tensions ease']",gold inches lower as north korea tensions ease ease lower north inches gold korea tensions ease,-1,-0.11053497,0.104678884
15-08-2008,http://www.marketwatch.com/story/dec-gold-down-2150-or-26-at-793oz-on-nymex-2008-08-15,"dec. gold down $21.50, or 2.6%, at $793/oz on nymex",0,0,1,0,1,0,negative,"['50 793', 'dec', 'oz', 'gold', 'nymex']","dec. gold down $21.50, or 2.6%, at $793/oz on nymex 50 793 dec oz gold nymex",21,0.38464504,0.0018160716
12-07-2011,http://www.marketwatch.com/story/gold-wobbles-between-small-gains-and-losses-2011-07-12,gold wobbles between small gains and losses,1,0,1,0,1,0,positive,"['small', 'wobbles', 'gains', 'losses', 'gold wobbles small']",gold wobbles between small gains and losses small wobbles gains losses gold wobbles small,-1,-0.13883847,0.09557826
21-09-2014,"http://www.investing.com/news/commodities-news/gold-prices-open-week-down-in-asia,-u.s.,-china-data-eyed-310242","gold prices open week down in asia, u.s., china data eyed",0,0,1,0,1,0,negative,"['data eyed', 'week', 'asia china', 'prices open', 'gold prices']","gold prices open week down in asia, u.s., china data eyed data eyed week asia china prices open gold prices",-1,-0.1461021,0.043646682
01-10-2012,https://www.moneycontrol.com/news/business/stocks/-1891325.html,"bulls overcoming hurdle, gold aims high: sharekhan",1,0,0,0,1,0,positive,"['aims high', 'overcoming hurdle', 'gold', 'sharekhan', 'bulls']","bulls overcoming hurdle, gold aims high: sharekhan aims high overcoming hurdle gold sharekhan bulls",-1,-0.2263219,0.12006418
31-03-2011,http://www.marketwatch.com/story/gold-futures-trade-in-record-territory-2011-03-31,"gold settles at record high, adds 1% for quarter",1,0,0,0,1,0,positive,"['adds', 'record high', 'gold', 'quarter', 'settles record']","gold settles at record high, adds 1% for quarter adds record high gold quarter settles record",-1,0.12956332,0.055661745
16-05-2017,https://economictimes.indiatimes.com/markets/commodities/news/gold-advances-as-dollar-edges-lower-on-weak-us-data/articleshow/58693532.cms,gold advances as dollar edges lower on weak us data,0,0,1,1,1,0,negative,"['weak', 'data', 'advances', 'edges lower', 'gold advances dollar']",gold advances as dollar edges lower on weak us data weak data advances edges lower gold advances dollar,-1,-0.10869277,0.16229215
20-02-2018,https://www.moneycontrol.com/news/business/markets/gold-prices-dip-as-dollar-bounces-off-dec-2014-lows-2512221.html,Gold prices dip as dollar bounces off Dec 2014-lows,0,0,1,1,1,0,negative,"['2014', 'bounces dec', 'lows', 'gold prices', 'prices dip dollar']",Gold prices dip as dollar bounces off Dec 2014-lows 2014 bounces dec lows gold prices prices dip dollar,-1,0.06169112,0.064608835
20-07-2015,http://www.investing.com/news/commodities-news/gold-recovers-slightly-in-afternoon-after-crashing-to-new-five-year-low-352095,Gold recovers slightly in afternoon after crashing to new five-year low,0,0,1,0,1,0,negative,"['new', 'slightly afternoon', 'year low', 'crashing', 'gold recovers']",Gold recovers slightly in afternoon after crashing to new five-year low new slightly afternoon year low crashing gold recovers,-1,-0.07344749,0.02141773
02-11-2016,http://www.marketwatch.com/story/gold-futures-end-above-1300oz-mark-highest-finish-in-a-month-2016-11-02,"Gold futures end above $1,300/oz, mark highest finish in a month",1,0,0,0,1,0,positive,"['highest', 'oz mark', '300 oz', 'finish month', 'futures']","Gold futures end above $1,300/oz, mark highest finish in a month highest oz mark 300 oz finish month futures",-1,0.23229815,-0.35886106
14-03-2017,http://www.marketwatch.com/story/gold-tries-for-second-day-of-mild-recovery-ahead-of-fed-decision-2017-03-14,"Gold ends with a loss, clings to $1,200 ahead of Fed decision",0,1,1,0,1,0,negative,"['clings', '200', 'loss', 'ahead fed decision', 'gold ends']","Gold ends with a loss, clings to $1,200 ahead of Fed decision clings 200 loss ahead fed decision gold ends",-1,-0.033606134,-0.10765581
16-02-2017,http://www.marketwatch.com/story/april-gold-settles-at-124160oz-up-850-or-07-2017-02-16,"April gold settles at $1,241.60/oz, up $8.50, or 0.7%",1,0,0,0,1,0,positive,"['241 60', 'settles', 'gold', 'april', '60 oz 50']","April gold settles at $1,241.60/oz, up $8.50, or 0.7% 241 60 settles gold april 60 oz 50",21,0.5150198,0.02911751
23-11-2017,https://www.thehindubusinessline.com/markets/gold/gold-recovers-to-rs-30550-on-wedding-season-demand/article9970616.ece,"Gold recovers to Rs 30,550 on wedding season demand",1,0,0,0,1,0,positive,"['550', 'wedding', 'season demand', 'recovers rs 30', 'gold recovers']","Gold recovers to Rs 30,550 on wedding season demand 550 wedding season demand recovers rs 30 gold recovers",-1,0.0026708096,0.054737374
06-05-2010,http://www.marketwatch.com/story/gold-at-120170-in-post-pit-electronic-trading-2010-05-06,"gold at $1,201.70 in post-pit, electronic trading",0,0,0,0,1,0,none,"['post', 'electronic', '201 70', 'pit', 'electronic trading']","gold at $1,201.70 in post-pit, electronic trading post electronic 201 70 pit electronic trading",-1,0.22077702,0.02591442
27-02-2018,http://www.investing.com/news/commodities-news/gold-prices-move-lower-on-powell-remarks-1314172,Gold Prices Move Lower on Powell Remarks,0,0,1,0,1,0,negative,"['remarks', 'lower', 'prices lower', 'powell', 'gold prices']",Gold Prices Move Lower on Powell Remarks remarks lower prices lower powell gold prices,-1,-0.08041139,0.0863701
24-09-2015,https://www.thehindubusinessline.com/markets/gold/gold-futures-rise-to-rs-26502-per-10-gm/article7684680.ece,"Gold futures rise to Rs 26,502 per 10 gm",1,0,0,0,1,0,positive,"['gm', '502 10', '26', 'rise rs', 'gold futures rise']","Gold futures rise to Rs 26,502 per 10 gm gm 502 10 26 rise rs gold futures rise",23,-0.07161477,-0.33024102
03-08-2017,http://www.marketwatch.com/story/december-gold-off-at-03-at-127470oz-2017-08-03,"December gold off at 0.3% at $1,274.70/oz.",0,0,1,0,1,0,negative,"['274 70', '70', 'oz', 'december', 'gold']","December gold off at 0.3% at $1,274.70/oz. 274 70 70 oz december gold",21,0.43064713,0.10346333
13-07-2017,http://www.marketwatch.com/story/august-gold-settles-at-121730oz-down-180-or-02-2017-07-13,"August gold settles at $1,217.30/oz, down $1.80, or 0.2%",0,0,1,0,1,0,negative,"['217 30', 'settles', 'gold', 'august', '30 oz 80']","August gold settles at $1,217.30/oz, down $1.80, or 0.2% 217 30 settles gold august 30 oz 80",21,0.51038605,0.049679637
28-08-2016,https://www.moneycontrol.com/news/trends/current-affairs-trends/cbi-probe-into-80kgmissing-goldigi-airport-969489.html,cbi probe into 80kg of missing gold from igi airport,0,0,0,0,1,0,none,"['airport', 'igi', '80kg missing', 'missing gold', 'cbi probe']",cbi probe into 80kg of missing gold from igi airport airport igi 80kg missing missing gold cbi probe,-1,-0.039844155,0.0799257
24-10-2017,http://www.marketwatch.com/story/dec-gold-falls-260-or-02-to-settle-at-127830oz-2017-10-24,"Dec. gold falls $2.60, or 0.2%, to settle at $1,278.30/oz",0,0,1,0,1,0,negative,"['dec', '60 settle', 'falls', 'gold', '278 30 oz']","Dec. gold falls $2.60, or 0.2%, to settle at $1,278.30/oz dec 60 settle falls gold 278 30 oz",21,0.47096777,-0.002935201
0200-09-19,http://www.marketwatch.com/story/gold-futures-poised-to-give-back-bulk-of-recent-gains-2006-09-19,gold futures poised to give back bulk of recent gains,1,0,0,0,1,0,positive,"['poised', 'recent', 'bulk', 'gains', 'gold futures']",gold futures poised to give back bulk of recent gains poised recent bulk gains gold futures,-1,-0.13446245,-0.3730123
15-08-2017,http://www.marketwatch.com/story/gold-prices-add-to-early-decline-after-retail-sales-import-price-empire-state-reports-2017-08-15,"Gold prices add to early decline after retail sales, import-price, Empire State reports",0,0,1,0,1,0,negative,"['gold', 'empire state', 'add early decline', 'import price', 'decline retail sales']","Gold prices add to early decline after retail sales, import-price, Empire State reports gold empire state add early decline import price decline retail sales",-1,-0.014900938,0.14266881
07-03-2018,http://www.marketwatch.com/story/april-gold-down-760-or-06-to-settle-at-132760oz-ahead-of-fed-beige-book-2018-03-07,"april gold down $7.60, or 0.6%, to settle at $1,327.60/oz ahead of fed beige book",0,0,1,0,1,0,negative,"['327 60 oz', 'ahead fed', 'april', 'beige book', 'gold 60 settle']","april gold down $7.60, or 0.6%, to settle at $1,327.60/oz ahead of fed beige book 327 60 oz ahead fed april beige book gold 60 settle",-1,0.40726614,-0.0133714825
29-11-2018,http://www.marketwatch.com/story/december-gold-up-330-or-03-at-122690-an-ounce-2018-11-29,"december gold up $3.30, or 0.3%, at $1,226.90 an ounce",1,0,0,0,1,0,positive,"['90', '30 226', 'december', 'gold', 'ounce']","december gold up $3.30, or 0.3%, at $1,226.90 an ounce 90 30 226 december gold ounce",21,0.44791716,0.082390115
01-11-2017,http://www.marketwatch.com/story/gold-on-track-to-rise-the-most-in-three-weeks-as-metals-rally-2017-11-01,"Gold settles higher, then pares in electronic trade after Fed statement",1,0,0,0,1,0,positive,"['pares', 'electronic', 'trade', 'fed statement', 'gold settles higher']","Gold settles higher, then pares in electronic trade after Fed statement pares electronic trade fed statement gold settles higher",-1,-0.08116776,0.059414156
28-07-2014,http://www.investing.com/news/commodities-news/gold-prices-gain-in-asia-with-geopolitical-events-eyed-298529,Gold prices gain in Asia with geopolitical events eyed,1,0,0,0,1,0,positive,"['eyed', 'events', 'prices gain', 'asia geopolitical', 'gold prices']",Gold prices gain in Asia with geopolitical events eyed eyed events prices gain asia geopolitical gold prices,-1,-0.20652705,0.12264821
17-09-2014,http://www.investing.com/news/commodities-news/gold-prices-dip-in-asia-as-fed-rate-hike-prospects-next-year-weigh-309867,Gold prices dip in Asia as Fed rate hike prospects next year weigh,0,0,1,0,1,0,negative,"['year weigh', 'asia', 'gold', 'prices dip', 'fed rate hike']",Gold prices dip in Asia as Fed rate hike prospects next year weigh year weigh asia gold prices dip fed rate hike,-1,-0.19793169,0.028804459
20-12-2016,https://economictimes.indiatimes.com/markets/commodities/news/golds-global-safety-net-fails-as-india-demand-dries-up-on-cash-ban/articleshow/56081363.cms,gold's global safety net fails as india demand dries up on cash ban,0,0,0,0,1,0,none,"['net fails', 'gold', 'global safety', 'india demand', 'dries cash ban']",gold's global safety net fails as india demand dries up on cash ban net fails gold global safety india demand dries cash ban,-1,-0.22881222,0.10438417
19-08-2009,http://www.marketwatch.com/story/us-stocks-pare-losses-as-crude-gold-turn-up-2009-08-19,"u.s. stocks pare losses as crude, gold turn up",0,0,0,1,1,0,none,"['pare', 'crude', 'stocks', 'losses', 'gold turn']","u.s. stocks pare losses as crude, gold turn up pare crude stocks losses gold turn",-1,-0.16625977,0.0034512356
24-07-2012,http://www.marketwatch.com/story/gold-inches-lower-on-euro-zone-fears-dollar-2012-07-24,"gold inches lower on euro zone fears, dollar",0,0,1,1,1,0,negative,"['zone', 'inches', 'gold', 'fears dollar', 'lower euro zone']","gold inches lower on euro zone fears, dollar zone inches gold fears dollar lower euro zone",-1,-0.07398121,-0.036899865
22-04-2016,https://www.thehindubusinessline.com/markets/gold/gold-futures-down-at-rs-29547-per-10-gm/article8508892.ece,"Gold futures down at Rs 29,547 per 10 gm",0,0,1,0,1,0,negative,"['547 10', 'gm', 'rs', '29', 'gold futures']","Gold futures down at Rs 29,547 per 10 gm 547 10 gm rs 29 gold futures",23,0.0132481605,-0.42000848
20-10-2016,https://www.moneycontrol.com/news/business/markets/gold-keeps-upward-trend-hits-two-week-highglobal-cues-955640.html,"gold keeps upward trend, hits two-week high on global cues",1,0,0,0,1,0,positive,"['high', 'hits week', 'global cues', 'upward trend', 'gold keeps']","gold keeps upward trend, hits two-week high on global cues high hits week global cues upward trend gold keeps",-1,-0.18777028,0.1660062
09-01-2015,https://www.moneycontrol.com/news/business/markets/gold-steady-aheadus-jobs-data-poised-for-weekly-gain-1362065.html,"gold steady ahead of us jobs data, poised for weekly gain",1,0,0,0,1,0,positive,"['gain', 'poised', 'weekly', 'jobs data', 'gold steady ahead']","gold steady ahead of us jobs data, poised for weekly gain gain poised weekly jobs data gold steady ahead",-1,-0.15533495,0.05833859
22-08-2017,http://www.marketwatch.com/story/gold-struggles-to-reclaim-1300-despite-safe-haven-underpinnings-2017-08-22,Gold falls back from nearly 3-month high,0,0,1,0,1,0,negative,"['nearly', 'high', 'month', 'gold', 'falls nearly month']",Gold falls back from nearly 3-month high nearly high month gold falls nearly month,-1,-0.021360472,0.053249847
14-11-2016,http://www.marketwatch.com/story/gold-futures-finish-at-lowest-level-in-more-than-5-months-2016-11-14,Gold futures finish at lowest level in more than 5 months,0,0,1,0,1,0,negative,"['level', 'finish', 'lowest', 'months', 'gold futures']",Gold futures finish at lowest level in more than 5 months level finish lowest months gold futures,-1,-0.07250291,-0.476498
30-05-2002,http://www.marketwatch.com/story/gold-stocks-lose-ground-2002-05-30,gold stocks lose ground,0,0,1,0,1,0,negative,"['lose', 'gold', 'ground', 'stocks lose', 'gold stocks']",gold stocks lose ground lose gold ground stocks lose gold stocks,-1,-0.19072056,-0.019509584
20-06-2013,https://economictimes.indiatimes.com/markets/commodities/gold-import-curb-to-hit-west-bengal-artisans/articleshow/20685476.cms,gold import curb to hit west bengal artisans,0,0,0,0,1,0,none,"['hit', 'curb', 'artisans', 'west bengal', 'gold import']",gold import curb to hit west bengal artisans hit curb artisans west bengal gold import,-1,-0.19483492,0.12236202
21-06-2013,http://www.marketwatch.com/story/gold-halts-its-tumble-as-us-dollar-ticks-lower-2013-06-20,gold sheds nearly $100 for the week,1,0,0,0,1,0,positive,"['nearly', 'nearly 100', 'week', 'gold', 'sheds']",gold sheds nearly $100 for the week nearly nearly 100 week gold sheds,-1,0.13213293,0.035868026
11-01-2008,http://www.marketwatch.com/story/gold-timers-giddy-about-golds-new-high-a-contrarian-bad-sign-2008-01-11,"is gold's glass half full, or half empty?",0,0,0,0,1,0,none,"['gold', 'half', 'half half', 'glass', 'gold glass']","is gold's glass half full, or half empty? gold half half half glass gold glass",-1,0.08625911,0.19083913
05-11-2011,https://www.thehindubusinessline.com/markets/commodities/gold-falls-to-rs-28315-on-low-demand/article23070581.ece,"Gold falls to Rs 28,315 on low demand",0,0,1,0,1,0,negative,"['rs', '28 315', 'falls', 'gold', 'low demand']","Gold falls to Rs 28,315 on low demand rs 28 315 falls gold low demand",-1,0.08844109,0.15693052
16-08-2016,https://www.moneycontrol.com/news/business/markets/gold-futures-rise-047global-cues-972732.html,gold futures rise 0.47% on global cues,1,0,0,0,1,0,positive,"['47', 'global', 'cues', 'futures rise', 'gold futures rise']",gold futures rise 0.47% on global cues 47 global cues futures rise gold futures rise,22,-0.12066212,-0.3309212
29-06-2018,https://www.metalsdaily.com/link/280779/petropavlovsk-shareholders-take-fight-for-russian-gold-to-londons-square-mile.htm,petropavlovsk : shareholders take fight for russian gold to london's square mile,0,0,0,0,1,0,none,"['russian', 'london square mile', 'shareholders fight', 'petropavlovsk', 'gold london square']",petropavlovsk : shareholders take fight for russian gold to london's square mile russian london square mile shareholders fight petropavlovsk gold london square,-1,-0.15851927,0.15087466
01-06-2018,http://www.marketwatch.com/story/august-gold-settles-at-129930oz-down-540-or-04-2018-06-01,"august gold settles at $1,299.30/oz, down $5.40, or 0.4%",0,0,1,0,1,0,negative,"['40', '299 30', 'august', 'oz', 'gold settles']","august gold settles at $1,299.30/oz, down $5.40, or 0.4% 40 299 30 august oz gold settles",21,0.5283968,0.031090166
23-10-2018,https://www.thehindubusinessline.com/markets/gold/gold-jumps-to-rs-32350-silver-rallies-by-rs-250-per-kg/article25296936.ece,"Gold jumps to Rs 32,350; silver rallies by Rs 250 per kg",1,0,0,1,1,0,positive,"['rallies', 'jumps', 'rs 32 350', 'silver', '250 kg']","Gold jumps to Rs 32,350; silver rallies by Rs 250 per kg rallies jumps rs 32 350 silver 250 kg",-1,0.008472219,0.1668758
31-03-2011,http://www.marketwatch.com/story/gold-futures-hold-06-gain-after-jobless-claims-2011-03-31,gold futures hold 0.6% gain after jobless claims,0,1,0,0,1,0,neutral,"['hold', 'gain', 'jobless', 'gain jobless claims', 'gold futures']",gold futures hold 0.6% gain after jobless claims hold gain jobless gain jobless claims gold futures,-1,-0.026719637,-0.33860856
23-06-2010,http://www.marketwatch.com/story/gold-heads-lower-changing-direction-2010-06-23,"gold heads lower, changing direction",0,0,1,0,1,0,negative,"['lower', 'gold', 'heads', 'lower changing', 'changing direction']","gold heads lower, changing direction lower gold heads lower changing changing direction",-1,-0.14342402,0.029644527
20-06-2008,http://www.marketwatch.com/story/august-gold-ends-the-week-with-a-gain-of-35-2008-06-20,august gold ends the week with a gain of 3.5%,1,0,0,0,1,0,positive,"['ends', 'gain', 'week', 'gold', 'august']",august gold ends the week with a gain of 3.5% ends gain week gold august,-1,0.1426497,0.08224527
19-06-2017,https://economictimes.indiatimes.com/markets/commodities/news/gold-plunges-to-nearly-3-week-low-of-rs-29100/articleshow/59217209.cms,"gold plunges to nearly 3-week low of rs 29,100",0,0,1,0,1,0,negative,"['nearly week', 'plunges', '29 100', 'gold', 'low rs']","gold plunges to nearly 3-week low of rs 29,100 nearly week plunges 29 100 gold low rs",-1,0.014191672,0.0030676275
20-02-2018,https://www.thehindubusinessline.com/markets/gold/gold-falls-to-rs-31700-silver-plunges-by-rs-535-per-kg/article22805913.ece,"Gold falls to Rs 31,700; silver plunges by Rs 535 per kg",0,0,1,1,1,0,negative,"['falls', 'plunges rs', 'rs 31 700', 'gold', '535 kg']","Gold falls to Rs 31,700; silver plunges by Rs 535 per kg falls plunges rs rs 31 700 gold 535 kg",17,0.07387443,0.14774019
05-07-2012,http://www.marketwatch.com/story/gold-ends-lower-on-higher-dollar-low-volumes-2012-07-05,"gold ends lower on higher dollar, low volumes",0,0,1,1,1,0,negative,"['ends', 'lower higher', 'dollar', 'low volumes', 'gold ends']","gold ends lower on higher dollar, low volumes ends lower higher dollar low volumes gold ends",-1,0.03794667,0.046437193
26-05-2010,http://www.marketwatch.com/story/gold-futures-up-1440-at-121260-an-ounce-2010-05-26,"gold futures up $14.40 at $1,212.60 an ounce",1,0,0,0,1,0,positive,"['40 212 60', '14', 'futures', 'ounce', 'gold futures']","gold futures up $14.40 at $1,212.60 an ounce 40 212 60 14 futures ounce gold futures",26,0.31924188,-0.31004685
30-03-2011,https://economictimes.indiatimes.com/markets/commodities/gold-buying-in-india-set-to-rise-15/articleshow/7821374.cms,gold buying in india set to rise 15%,1,0,0,0,1,0,positive,"['set', 'rise', '15', 'india', 'gold buying india']",gold buying in india set to rise 15% set rise 15 india gold buying india,-1,-0.038786985,0.12131433
11-10-2012,https://economictimes.indiatimes.com/opinion/interviews/expect-silver-to-outperform-gold-over-next-2-3-years-juerg-kiener-swiss-asia-capital/articleshow/16767372.cms,"expect silver to outperform gold over next 2-3 years: juerg kiener, swiss asia capital",0,0,0,1,1,0,none,"['asia capital', 'swiss', 'juerg kiener', 'gold years', 'expect silver outperform']","expect silver to outperform gold over next 2-3 years: juerg kiener, swiss asia capital asia capital swiss juerg kiener gold years expect silver outperform",-1,-0.18745613,0.097914055
02-07-2014,http://www.investing.com/news/commodities-news/gold-steady-near-3-month-high-ahead-of-u.s.-data-292669,Gold steady near 3-month high ahead of U.S. data,1,0,0,0,1,0,positive,"['ahead', 'high', 'data', 'month', 'gold steady near']",Gold steady near 3-month high ahead of U.S. data ahead high data month gold steady near,-1,-0.056463927,0.04631571
03-05-2016,http://www.marketwatch.com/story/june-gold-settles-4-or-03-lower-at-129180oz-2016-05-03,"june gold settles $4, or 0.3%, lower at $1,291.80/oz.",0,0,1,0,1,0,negative,"['lower', '291 80', 'june', '80 oz', 'gold settles']","june gold settles $4, or 0.3%, lower at $1,291.80/oz. lower 291 80 june 80 oz gold settles",21,0.47745955,-0.00016071647
03-07-2012,http://www.marketwatch.com/story/gold-closes-15-higher-at-162180-an-ounce-2012-07-03,"gold closes 1.5% higher at $1,621.80 an ounce",1,0,0,0,1,0,positive,"['higher', '621 80', 'closes', 'ounce', 'gold closes']","gold closes 1.5% higher at $1,621.80 an ounce higher 621 80 closes ounce gold closes",21,0.31959546,0.023460645
08-03-2010,http://www.marketwatch.com/story/gold-dips-as-dollar-finds-some-support-2010-03-08,gold dips as dollar finds some support,0,0,1,1,1,0,negative,"['finds support', 'support', 'dips', 'gold', 'dollar finds']",gold dips as dollar finds some support finds support support dips gold dollar finds,-1,-0.004330978,0.14703311
17-09-2008,http://www.marketwatch.com/story/gold-rises-as-deepening-financial-turmoil-triggers-purchase-2008-09-17,gold rises as deepening financial turmoil triggers purchase,1,0,0,0,1,0,positive,"['deepening', 'turmoil', 'financial', 'triggers purchase', 'gold rises']",gold rises as deepening financial turmoil triggers purchase deepening turmoil financial triggers purchase gold rises,-1,-0.17482218,0.17770718
04-09-2015,http://www.marketwatch.com/story/gold-prices-turn-positive-after-jobs-report-2015-09-04,"gold prices turn positive after jobs report,",1,0,0,0,1,0,positive,"['turn', 'report', 'jobs', 'prices turn positive', 'gold prices']","gold prices turn positive after jobs report, turn report jobs prices turn positive gold prices",-1,-0.119206354,0.15476754
18-04-2017,http://www.marketwatch.com/story/gold-holds-early-loss-after-march-housing-start-data-2017-04-18,Gold holds early loss after March housing start data,0,0,1,0,1,0,negative,"['early', 'start data', 'housing', 'loss march', 'gold holds']",Gold holds early loss after March housing start data early start data housing loss march gold holds,-1,-0.09430343,0.029441759
06-04-2018,https://www.metalsdaily.com/link/278315/sharps-pixley-chinas-sge-gold-withdrawals-higher-in-q1.htm,sharps pixley: china's sge gold withdrawals higher in q1,0,0,0,0,1,0,none,"['q1', 'china', 'sharps pixley', 'withdrawals higher', 'sge gold']",sharps pixley: china's sge gold withdrawals higher in q1 q1 china sharps pixley withdrawals higher sge gold,-1,-0.15903172,0.21507743
06-08-2018,https://www.metalsdaily.com/link/281929/commerzbank-gold-etf-outflows-continue-at-start-of-august.htm,commerzbank : gold etf outflows continue at start of august,0,0,0,0,1,0,none,"['continue start', 'gold', 'august', 'commerzbank', 'etf outflows']",commerzbank : gold etf outflows continue at start of august continue start gold august commerzbank etf outflows,-1,-0.12357052,-0.011954591
24-03-2004,http://www.marketwatch.com/story/placer-dome-sees-892k-oz-of-gold-product-in-04,placer dome sees 892k oz. of gold product in '04,0,0,0,0,1,0,none,"['04', 'oz', 'sees 892k', 'gold product', 'placer dome sees']",placer dome sees 892k oz. of gold product in '04 04 oz sees 892k gold product placer dome sees,-1,0.1462069,0.17435086
01-10-2014,"http://www.investing.com/news/commodities-news/gold-prices-ease-in-asia-on-dollar-prospects,-hk-china-markets-shut-311538","gold prices ease in asia on dollar prospects, hk china markets shut",1,0,0,1,1,0,positive,"['asia', 'prices ease', 'hk', 'china markets shut', 'gold prices']","gold prices ease in asia on dollar prospects, hk china markets shut asia prices ease hk china markets shut gold prices",-1,-0.19175221,0.07046774
03-06-2013,https://www.thehindubusinessline.com/economy/world-gold-council-sets-up-full-fledged-local-unit/article23112753.ece,World Gold Council sets up full-fledged local unit,0,0,0,0,1,0,none,"['sets', 'fledged', 'local', 'council', 'world gold']",World Gold Council sets up full-fledged local unit sets fledged local council world gold,-1,-0.21635365,0.15433234
22-03-2006,http://www.marketwatch.com/story/april-gold-falls-150-to-end-at-over-1-wk-low-of-55170oz-2006-03-22,april gold falls $1.50 to end at over 1-wk low of $551.70/oz,0,0,1,0,1,0,negative,"['50 end', 'falls', 'wk low 551', '70 oz', 'april gold']",april gold falls $1.50 to end at over 1-wk low of $551.70/oz 50 end falls wk low 551 70 oz april gold,21,0.41458,0.026410185
20-07-2018,https://www.metalsdaily.com/link/281379/standard-chartered-summer-lull-is-lowering-the-floor-in-gold-prices-.htm,standard chartered : summer lull is lowering the floor in gold prices,0,0,1,0,1,0,negative,"['standard', 'chartered', 'summer', 'lull lowering floor', 'gold prices']",standard chartered : summer lull is lowering the floor in gold prices standard chartered summer lull lowering floor gold prices,-1,-0.087712266,0.074292526
06-05-2008,http://www.marketwatch.com/story/barrick-gold-board-hikes-quarterly-dividend-by-33-2008-05-06,barrick gold board hikes quarterly dividend by 33%,0,0,0,0,1,0,none,"['33', 'hikes', 'barrick', 'gold board', 'quarterly dividend']",barrick gold board hikes quarterly dividend by 33% 33 hikes barrick gold board quarterly dividend,-1,-0.06426263,0.08617979
27-12-2013,https://www.thehindubusinessline.com/markets/stock-markets/gold-turns-a-wealth-destroyer-bites-dust/article20704586.ece1,"Gold: Turns a wealth destroyer, bites dust",0,0,0,0,1,0,none,"['bites', 'turns', 'destroyer', 'dust', 'gold turns wealth']","Gold: Turns a wealth destroyer, bites dust bites turns destroyer dust gold turns wealth",-1,-0.19513139,0.27391526
01-12-2017,http://www.investing.com/news/commodities-news/gold-prices-edges-higher-as-dollar-softens-939084,Gold Prices Edges Higher as U.S. Dollar Softens,1,0,0,1,1,0,positive,"['higher', 'edges', 'prices', 'softens', 'gold prices']",Gold Prices Edges Higher as U.S. Dollar Softens higher edges prices softens gold prices,-1,-0.12861569,0.14171666
29-07-2016,http://www.marketwatch.com/story/gold-futures-gain-28-for-the-month-2016-07-29,Gold futures gain 2.8% for the month,1,0,0,0,1,0,positive,"['gain', 'gold', 'month', 'gain month', 'futures']",Gold futures gain 2.8% for the month gain gold month gain month futures,-1,0.024527937,-0.35594487
16-11-2015,http://www.investing.com/news/commodities-news/gold-prices-hold-gains-in-asia-on-risk-after-deadly-paris-attacks-371549,"Gold prices head lower in Asia, but find risk support",0,0,1,0,1,0,negative,"['support', 'risk', 'asia', 'prices head lower', 'gold prices']","Gold prices head lower in Asia, but find risk support support risk asia prices head lower gold prices",-1,-0.22021067,-0.0075165853
26-05-2015,https://www.thehindubusinessline.com/markets/gold/gold-steady-just-above-1200oz-as-dollar-jumps-to-fresh-1month-high/article7247108.ece,"Gold steady just above $1,200/oz as dollar jumps to fresh 1-month high",0,1,0,1,1,0,neutral,"['fresh month', 'steady just', 'just 200 oz', 'gold', 'dollar jumps']","Gold steady just above $1,200/oz as dollar jumps to fresh 1-month high fresh month steady just just 200 oz gold dollar jumps",-1,0.26715362,0.10560773
09-11-2017,http://www.marketwatch.com/story/gold-suffers-weakest-third-quarter-global-demand-in-8-years-2017-11-09,gold suffers weakest third-quarter global demand in 8 years,0,0,1,0,1,0,negative,"['years', 'quarter', 'weakest', 'gold suffers', 'global demand']",gold suffers weakest third-quarter global demand in 8 years years quarter weakest gold suffers global demand,-1,-0.1268101,0.14541706
19-10-2002,http://www.marketwatch.com/story/is-americas-great-real-estate-gold-rush-in-trouble-2002-10-19,is america's great real estate gold rush in trouble?,0,0,0,0,1,0,none,"['trouble', 'real', 'rush', 'america great', 'estate gold']",is america's great real estate gold rush in trouble? trouble real rush america great estate gold,-1,-0.17382489,0.104105785
19-10-2016,https://www.thehindubusinessline.com/markets/gold/gold-holds-gains-on-weak-dollar-rising-stocks-cap-gains/article9238832.ece,Gold holds gains on weak dollar; rising stocks cap gains,1,1,0,1,1,0,positive,"['rising', 'gold', 'weak dollar', 'stocks cap', 'stocks cap gains']",Gold holds gains on weak dollar; rising stocks cap gains rising gold weak dollar stocks cap stocks cap gains,-1,-0.13362747,0.12563312
27-04-2018,https://www.thehindubusinessline.com/markets/gold/gold-futures-fall-to-rs-31167/article23693502.ece,"Gold futures fall to Rs 31,167 per 10 gm",0,0,1,0,1,0,negative,"['gm', '31 167 10', 'fall', 'rs', 'gold futures']","Gold futures fall to Rs 31,167 per 10 gm gm 31 167 10 fall rs gold futures",23,0.03635417,-0.33119285
06-12-2011,http://www.marketwatch.com/story/gold-settles-02-lower-at-173180-an-ounce-2011-12-06,"gold settles 0.2% lower at $1,731.80 an ounce",0,0,1,0,1,0,negative,"['731 80', 'lower', 'gold', 'settles', '731 80 ounce']","gold settles 0.2% lower at $1,731.80 an ounce 731 80 lower gold settles 731 80 ounce",21,0.47356153,0.054223225
13-06-2017,http://www.marketwatch.com/story/august-gold-down-30-cents-to-settle-at-126860oz-2017-06-13,"August gold down 30 cents to settle at $1,268.60/oz",0,0,1,0,1,0,negative,"['settle', '268 60', 'oz', 'august', 'gold 30 cents']","August gold down 30 cents to settle at $1,268.60/oz settle 268 60 oz august gold 30 cents",21,0.48426306,0.073614664
02-11-2016,http://www.marketwatch.com/story/dec-gold-at-130720oz-in-electronic-trading-down-from-130820-settlement-2016-11-02,"Dec. gold at $1,307.20/oz in electronic trading, down from $1,308.20 settlement",0,0,1,0,1,0,negative,"['308 20', 'oz', 'settlement', 'electronic trading', 'dec gold']","Dec. gold at $1,307.20/oz in electronic trading, down from $1,308.20 settlement 308 20 oz settlement electronic trading dec gold",21,0.34682584,0.0065882653
02-03-2004,http://www.marketwatch.com/story/philadelphia-gold-silver-index-falls-22-2004-03-02,philadelphia gold & silver index falls 2.2%,0,0,1,1,1,0,negative,"['falls', 'index', 'gold', 'philadelphia', 'gold silver index']",philadelphia gold & silver index falls 2.2% falls index gold philadelphia gold silver index,7,0.015621617,0.06253125
24-01-2018,https://www.metalsdaily.com/link/276120/another-positive-year-ahead-for-gold-says-the-world-gold-council.htm,another positive year ahead for gold says the world gold council,0,0,0,0,1,0,none,"['says', 'ahead', 'council', 'positive year', 'gold says world']",another positive year ahead for gold says the world gold council says ahead council positive year gold says world,-1,-0.19294825,0.10685066
11-10-2017,http://www.marketwatch.com/story/dec-gold-at-128880oz-in-electronic-trading-after-128890-comex-settlement-2017-10-11,"Dec. gold at $1,288.80/oz in electronic trading after $1,288.90 Comex settlement",0,0,0,0,1,0,none,"['oz', '288 80 oz', 'electronic trading', 'comex settlement', 'dec gold']","Dec. gold at $1,288.80/oz in electronic trading after $1,288.90 Comex settlement oz 288 80 oz electronic trading comex settlement dec gold",21,0.370925,0.013831086
04-01-2018,http://www.investing.com/news/commodities-news/gold-prices-still-lower-but-downside-seen-limited-1062010,Gold Prices Still Lower But Downside Seen Limited,0,1,1,0,1,0,negative,"['seen', 'downside', 'limited', 'prices lower', 'gold prices']",Gold Prices Still Lower But Downside Seen Limited seen downside limited prices lower gold prices,-1,-0.09523574,0.015069462
08-06-2007,http://www.marketwatch.com/story/gold-falls-on-stronger-dollar-higher-bond-yields-2007-06-08,"gold falls on stronger dollar, higher bond yields",0,0,1,1,1,0,negative,"['stronger', 'dollar', 'falls', 'gold', 'higher bond yields']","gold falls on stronger dollar, higher bond yields stronger dollar falls gold higher bond yields",-1,-0.15549198,0.06938955
29-01-2013,https://economictimes.indiatimes.com/markets/commodities/gold-silver-recover-modestly-on-fresh-buying/articleshow/18241123.cms,"gold, silver recover modestly on fresh buying",1,0,0,1,1,0,positive,"['fresh', 'modestly', 'recover', 'buying', 'gold silver']","gold, silver recover modestly on fresh buying fresh modestly recover buying gold silver",-1,-0.097561374,0.20550826
23-02-2018,http://www.marketwatch.com/story/gold-closes-lower-for-the-session-to-post-weekly-loss-of-17-2018-02-23,gold closes lower for the session to post weekly loss of 1.7%,0,0,1,0,1,0,negative,"['session post', 'weekly', 'gold', 'closes lower', 'weekly loss']",gold closes lower for the session to post weekly loss of 1.7% session post weekly gold closes lower weekly loss,-1,0.06775969,-0.14221865
30-09-2012,https://www.thehindubusinessline.com/opinion/columns/g-chandrashekhar/gold-silver-firming-up-but-roadblocks-ahead/article20507194.ece1,"Gold, silver firming up; but roadblocks ahead",1,0,0,1,1,0,positive,"['ahead', 'roadblocks', 'firming', 'silver', 'gold silver']","Gold, silver firming up; but roadblocks ahead ahead roadblocks firming silver gold silver",-1,-0.17699379,0.071410514
03-03-2017,http://www.marketwatch.com/story/gold-prices-fall-for-the-day-lose-25-for-the-week-2017-03-03,"Gold prices fall for the day, lose 2.5% for the week",0,0,1,0,1,0,negative,"['day', 'week', 'lose', 'gold prices', 'prices fall']","Gold prices fall for the day, lose 2.5% for the week day week lose gold prices prices fall",-1,0.06669973,0.0139700025
17-10-2005,http://www.marketwatch.com/story/spot-gold-quoted-at-474-in-asia-trade-2005-10-17,spot gold quoted at $474 in asia trade,1,0,0,0,1,0,positive,"['quoted', 'trade', '474', 'asia', 'spot gold']",spot gold quoted at $474 in asia trade quoted trade 474 asia spot gold,10,0.023784444,0.11957852
08-03-2017,http://www.marketwatch.com/story/gold-prices-drop-for-7th-straight-session-2017-03-08,Gold prices drop for 7th straight session,0,0,1,0,1,0,negative,"['straight', 'session', '7th', 'prices drop', 'gold prices']",Gold prices drop for 7th straight session straight session 7th prices drop gold prices,-1,0.075192615,-0.006661013
10-11-2013,https://economictimes.indiatimes.com/opinion/et-commentary/our-bullion-dollar-troubles-can-end-if-india-goes-for-gold/articleshow/25538428.cms,our bullion-dollar troubles can end if india goes for gold,0,0,0,1,1,0,none,"['end', 'india', 'bullion', 'goes gold', 'dollar troubles']",our bullion-dollar troubles can end if india goes for gold end india bullion goes gold dollar troubles,-1,-0.085971825,0.06206122
18-10-2011,https://www.moneycontrol.com/news/business/markets/-2061383.html,"Gold prices down in Mumbai, Delhi, Ahmedabad market",0,0,1,0,1,0,negative,"['market', 'ahmedabad', 'gold', 'prices mumbai delhi', 'gold prices']","Gold prices down in Mumbai, Delhi, Ahmedabad market market ahmedabad gold prices mumbai delhi gold prices",-1,-0.05235949,0.023560584
21-01-2010,http://www.marketwatch.com/story/gold-losses-moderate-after-philly-fed-lei-data-2010-01-21,"gold losses moderate after philly fed, lei data",0,0,1,0,1,0,negative,"['moderate', 'data', 'philly', 'fed lei data', 'gold losses']","gold losses moderate after philly fed, lei data moderate data philly fed lei data gold losses",-1,-0.144826,-0.0075894594
15-04-2013,https://www.moneycontrol.com/news/business/markets/-1076845.html,avoid buying gold for next 2-3 months: barratt,0,0,0,0,1,0,none,"['avoid', 'months', 'buying', 'barratt', 'avoid buying gold']",avoid buying gold for next 2-3 months: barratt avoid months buying barratt avoid buying gold,-1,-0.07920873,0.073466025
21-01-2016,https://www.moneycontrol.com/news/business/markets/gold-price-climb-tames-buyingchina-blunts-demandindia-1048652.html,"gold price climb tames buying in china, blunts demand in india",1,0,0,0,1,0,positive,"['china', 'gold', 'climb tames buying', 'buying china blunts', 'demand india']","gold price climb tames buying in china, blunts demand in india china gold climb tames buying buying china blunts demand india",-1,-0.23435983,0.173724
17-04-2014,http://www.investing.com/news/commodities-news/gold-prices-gain-slightly-in-asia-in-muted-holiday-trade-278292,Gold prices gain slightly in Asia in muted holiday trade,1,0,0,0,1,0,positive,"['muted', 'gain', 'holiday', 'slightly asia', 'gold prices']",Gold prices gain slightly in Asia in muted holiday trade muted gain holiday slightly asia gold prices,-1,-0.11626957,0.14436741
20-03-2013,http://www.marketwatch.com/story/gold-falls-more-oil-adds-to-gains-after-fomc-2013-03-20,"gold falls more, oil adds to gains after fomc",0,0,1,1,1,0,negative,"['adds', 'falls', 'gold', 'fomc', 'oil adds gains']","gold falls more, oil adds to gains after fomc adds falls gold fomc oil adds gains",-1,-0.09905738,0.023201834
12-09-2018,https://www.metalsdaily.com/link/283053/sharps-pixley-watch-gld-for-gold-price-guidance.htm,sharps pixley: watch gld for gold price guidance,0,0,0,0,1,0,none,"['watch', 'sharps', 'pixley', 'price guidance', 'gld gold price']",sharps pixley: watch gld for gold price guidance watch sharps pixley price guidance gld gold price,-1,-0.051334873,0.1477684
25-08-2016,http://www.marketwatch.com/story/sibanye-gold-profit-up-85-on-year-revenue-up-44-2016-08-25,"Sibanye Gold profit up 85% on year, revenue up 44%",1,0,0,0,1,0,positive,"['44', 'gold', 'profit 85', 'year revenue', 'sibanye']","Sibanye Gold profit up 85% on year, revenue up 44% 44 gold profit 85 year revenue sibanye",-1,-0.018450722,0.23683226
08-06-2009,http://www.marketwatch.com/story/june-gold-ends-down-10-or-1-at-95170,"june gold ends down $10, or 1%, at $951.70",0,0,1,0,1,0,negative,"['10 951', '10 951 70', 'ends', 'june', 'gold']","june gold ends down $10, or 1%, at $951.70 10 951 10 951 70 ends june gold",21,0.30640203,-0.0489327
28-03-2011,https://www.thehindubusinessline.com/markets/commodities/A-Chennai-housewife-forecasts-gold-price-for-major-producer/article20114179.ece,A Chennai housewife forecasts gold price for major producer,0,0,0,0,0,1,none,"['major', 'producer', 'chennai', 'housewife forecasts', 'gold price']",A Chennai housewife forecasts gold price for major producer major producer chennai housewife forecasts gold price,-1,-0.067018025,0.057064373
17-12-2013,https://economictimes.indiatimes.com/markets/commodities/price-of-black-gold-eases-as-fssai-releases-pepper-stock/articleshow/27494015.cms,price of 'black gold' eases as fssai releases pepper stock,0,0,0,0,1,0,none,"['stock', 'releases pepper', 'fssai', 'gold eases', 'price black']",price of 'black gold' eases as fssai releases pepper stock stock releases pepper fssai gold eases price black,-1,-0.010022864,0.108545244
25-10-2017,http://www.marketwatch.com/story/gold-turns-a-bit-higher-as-ice-us-dollar-index-trades-near-session-lows-2017-10-25,Gold turns a bit higher as ICE U.S. Dollar Index trades near session lows,1,0,0,1,1,0,positive,"['session lows', 'ice', 'trades near', 'gold turns', 'dollar index']",Gold turns a bit higher as ICE U.S. Dollar Index trades near session lows session lows ice trades near gold turns dollar index,-1,0.014041647,0.024846043
11-02-2018,https://www.thehindubusinessline.com/markets/gold/gold-etfs-see-rs-679-cr-outflow-in-10-months/article22721147.ece,Gold ETFs see Rs 679 cr outflow in 10 months,0,0,0,0,1,0,none,"['outflow 10', 'months', 'rs', '679', 'gold etfs']",Gold ETFs see Rs 679 cr outflow in 10 months outflow 10 months rs 679 gold etfs,-1,-0.16287328,-0.013536468
06-01-2017,https://www.thehindubusinessline.com/markets/gold/gold-futures-fall-to-rs-27861-per-10-gm/article9463173.ece,"Gold futures fall to Rs 27,861 per 10 gm",0,0,1,0,1,0,negative,"['27 861 10', 'gm', 'fall', 'rs', 'gold futures']","Gold futures fall to Rs 27,861 per 10 gm 27 861 10 gm fall rs gold futures",23,0.014050305,-0.38251227
0200-04-28,http://www.marketwatch.com/story/sweeter-than-gold-or-oil-2006-04-28,sweeter than gold or oil,0,0,0,1,1,0,none,"['gold', 'oil', 'sweeter', 'gold oil', 'sweeter gold']",sweeter than gold or oil gold oil sweeter gold oil sweeter gold,-1,-0.15517452,0.20983797
13-06-2017,https://economictimes.indiatimes.com/markets/commodities/news/gold-silver-slip-ahead-of-us-fed-policy-meet/articleshow/59121042.cms,"gold, silver slip ahead of us fed policy meet",0,0,1,1,1,0,negative,"['meet', 'policy', 'slip', 'gold silver', 'ahead fed policy']","gold, silver slip ahead of us fed policy meet meet policy slip gold silver ahead fed policy",-1,-0.147528,-0.044222936
15-11-2004,http://www.marketwatch.com/story/gold-futures-lose-ground-in-late-morning-trade-2004-11-15,gold futures lose ground in late morning trade,0,0,1,0,1,0,negative,"['lose', 'trade', 'ground', 'late morning', 'gold futures']",gold futures lose ground in late morning trade lose trade ground late morning gold futures,-1,-0.124629766,-0.4033587
11-02-2009,http://www.marketwatch.com/story/tokyo-shares-fall-after-holiday-gold,tokyo shares fall after holiday; gold miners up in sydney,0,0,0,0,1,0,none,"['miners', 'sydney', 'tokyo', 'holiday gold', 'shares fall']",tokyo shares fall after holiday; gold miners up in sydney miners sydney tokyo holiday gold shares fall,-1,-0.08694886,0.04905952
01-11-2013,https://www.moneycontrol.com/news/business/markets/see-gold-around-rs-23k-24k10gm-next-diwali-anand-rathi-1620219.html,see gold around rs 23k-24k/10gm next diwali: anand rathi,0,0,0,0,0,1,none,"['rs', 'gold', 'rathi', '23k 24k', '10gm diwali']",see gold around rs 23k-24k/10gm next diwali: anand rathi rs gold rathi 23k 24k 10gm diwali,-1,-0.09571534,0.051633056
13-10-2017,http://www.investing.com/news/commodities-news/gold-prices-move-higher-with-us-inflation-data-in-focus-541012,Gold Prices Move Higher with U.S. Inflation Data in Focus,1,0,0,0,1,0,positive,"['focus', 'data focus', 'gold', 'prices higher', 'inflation data']",Gold Prices Move Higher with U.S. Inflation Data in Focus focus data focus gold prices higher inflation data,-1,-0.11611138,0.11019455
28-09-2017,http://www.marketwatch.com/story/gold-settles-modestly-higher-after-touching-lowest-levels-since-mid-august-2017-09-28,Gold settles modestly higher after touching lowest levels since mid-August,0,0,1,0,1,0,negative,"['mid august', 'levels', 'gold', 'higher touching lowest', 'settles modestly']",Gold settles modestly higher after touching lowest levels since mid-August mid august levels gold higher touching lowest settles modestly,-1,0.055668354,0.0069898516
19-05-2017,http://www.marketwatch.com/story/gold-prices-climb-more-than-2-for-the-week-2017-05-19,Gold prices climb more than 2% for the week,1,0,0,0,1,0,positive,"['prices', 'climb', 'week', 'gold', 'gold prices climb']",Gold prices climb more than 2% for the week prices climb week gold gold prices climb,-1,0.013580635,0.057331935
06-11-2017,https://www.moneycontrol.com/news/business/economy/gold-creeps-back-above-1270oz-as-dollar-steadies-yields-slip-2430995.html,"Gold creeps back above $1,270/oz as dollar steadies, yields slip",1,0,0,1,1,0,positive,"['steadies', 'creeps', 'gold', 'yields slip', '270 oz dollar']","Gold creeps back above $1,270/oz as dollar steadies, yields slip steadies creeps gold yields slip 270 oz dollar",-1,0.120330855,0.01629138
14-03-2016,http://www.marketwatch.com/story/april-gold-settles-at-124510oz-down-1430-or-11-2016-03-14,"april gold settles at $1,245.10/oz, down $14.30, or 1.1%",0,0,1,0,1,0,negative,"['245 10', '30', 'april', '10 oz', 'gold settles']","april gold settles at $1,245.10/oz, down $14.30, or 1.1% 245 10 30 april 10 oz gold settles",21,0.5140611,-0.021466099
17-05-2017,http://www.marketwatch.com/story/gold-futures-mark-highest-settlement-since-april-28-2017-05-17,Gold futures mark highest settlement since April 28,1,0,0,0,1,0,positive,"['28', 'mark', 'april', 'highest settlement', 'gold futures']",Gold futures mark highest settlement since April 28 28 mark april highest settlement gold futures,24,0.009702325,-0.35408545
07-08-2006,http://www.marketwatch.com/story/gold-closes-higher-as-oil-price-rises-copper-hit-by-strike-2006-08-07,gold closes higher as oil price rises; copper hit by strike,1,0,0,1,1,0,positive,"['closes', 'hit strike', 'price rises', 'copper', 'higher oil price']",gold closes higher as oil price rises; copper hit by strike closes hit strike price rises copper higher oil price,-1,-0.08586385,-0.042032897
04-10-2012,http://www.marketwatch.com/story/crude-gold-futures-extend-gains-after-data-2012-10-04,"crude, gold futures extend gains after data",1,0,0,1,1,0,positive,"['data', 'gold', 'crude', 'extend gains', 'futures extend']","crude, gold futures extend gains after data data gold crude extend gains futures extend",-1,-0.23196904,-0.22302866
17-11-2017,http://www.marketwatch.com/story/dec-gold-gains-1830-or-14-to-settle-at-129650oz-2017-11-17,"Dec. gold gains $18.30, or 1.4%, to settle at $1,296.50/oz",1,0,0,0,1,0,positive,"['18 30', 'oz', 'gains', 'settle 296 50', 'dec gold']","Dec. gold gains $18.30, or 1.4%, to settle at $1,296.50/oz 18 30 oz gains settle 296 50 dec gold",21,0.45526564,0.02773555
14-12-2006,http://www.marketwatch.com/story/feb-gold-falls-150-to-close-at-63090oz-in-ny-2006-12-14,feb. gold falls $1.50 to close at $630.90/oz in ny,0,0,1,0,1,0,negative,"['ny', '50 close 630', '90 oz', 'falls', 'gold']",feb. gold falls $1.50 to close at $630.90/oz in ny ny 50 close 630 90 oz falls gold,21,0.39789903,0.0124613345
24-04-2012,https://www.moneycontrol.com/news/business/markets/-1827701.html,"akshaya tritiya: are you buying coins, bars or gold etfs?",0,0,0,0,0,1,none,"['tritiya', 'akshaya', 'etfs', 'bars gold', 'buying coins']","akshaya tritiya: are you buying coins, bars or gold etfs? tritiya akshaya etfs bars gold buying coins",-1,-0.12276277,0.17936006
17-01-2014,http://www.marketwatch.com/story/comex-gold-closes-at-highest-since-dec-11-2014-01-17,comex gold closes at highest since dec. 11,1,0,0,0,1,0,positive,"['11', 'dec', 'highest', 'comex', 'gold closes']",comex gold closes at highest since dec. 11 11 dec highest comex gold closes,-1,-0.07788683,-0.10323197
20-07-2007,http://www.marketwatch.com/story/gold-silver-and-copper-futures-climb-to-multi-week-highs-2007-07-20,"gold, silver and copper futures climb to multi-week highs",1,0,0,1,1,0,positive,"['week', 'highs', 'climb multi', 'futures', 'gold silver copper']","gold, silver and copper futures climb to multi-week highs week highs climb multi futures gold silver copper",-1,-0.17109549,-0.31346634
12-08-2008,https://economictimes.indiatimes.com/articleshow/3356218.cms,precious metals led by gold plunge to over 7-month lows,0,0,1,0,1,0,negative,"['lows', 'month', 'plunge', 'precious', 'metals led']",precious metals led by gold plunge to over 7-month lows lows month plunge precious metals led,-1,-0.0838992,0.03351503
24-07-2018,https://www.metalsdaily.com/link/281431/the-case-for-gold-is-not-about-price.htm,the case for gold is not about price,0,0,0,0,1,0,none,"['case', 'price', 'gold', 'case gold', 'gold price']",the case for gold is not about price case price gold case gold gold price,-1,-0.082344435,0.11367534
19-03-2012,https://www.moneycontrol.com/news/business/markets/-1918205.html,"commodity complex: get tips to trade gold, silver, crude",1,0,0,1,1,0,positive,"['tips', 'crude', 'trade', 'gold silver', 'commodity complex']","commodity complex: get tips to trade gold, silver, crude tips crude trade gold silver commodity complex",-1,-0.18347947,0.107717365
10-05-2018,https://www.moneycontrol.com/news/business/gold-extends-gains-on-global-cues-jewellers-buying-2566179.html,"Gold extends gains on global cues, jewellers' buying",1,0,0,0,1,0,positive,"['extends', 'buying', 'cues', 'extends gains global', 'jewellers']","Gold extends gains on global cues, jewellers' buying extends buying cues extends gains global jewellers",-1,-0.25578275,0.20544991
05-05-2017,http://www.marketwatch.com/story/gold-briefly-turns-negative-after-jobs-report-2017-05-05,Gold briefly turns negative after jobs report,0,0,1,0,1,0,negative,"['briefly', 'jobs', 'negative', 'gold briefly turns', 'negative jobs report']",Gold briefly turns negative after jobs report briefly jobs negative gold briefly turns negative jobs report,-1,-0.1599886,0.11110215
27-07-2005,http://www.marketwatch.com/story/aug-gold-rises-120-to-42470oz-in-ny-2005-07-27,aug gold rises $1.20 to $424.70/oz in ny,1,0,0,0,1,0,positive,"['20 424 70', 'ny', '70 oz', 'aug', 'gold rises']",aug gold rises $1.20 to $424.70/oz in ny 20 424 70 ny 70 oz aug gold rises,-1,0.35961515,0.14981827
18-03-2013,https://www.moneycontrol.com/news/business/markets/-1185149.html,mcx gold june contract advances,1,0,0,0,1,0,positive,"['advances', 'gold', 'contract', 'june', 'mcx']",mcx gold june contract advances advances gold contract june mcx,1,-0.07024814,-0.026854038
13-08-2010,http://www.marketwatch.com/story/canadian-stocks-turn-lower-gold-materials-weigh-2010-08-13,"canadian stocks turn lower; gold, materials weigh",0,0,0,0,1,0,none,"['turn lower', 'canadian', 'materials weigh', 'gold materials', 'stocks turn']","canadian stocks turn lower; gold, materials weigh turn lower canadian materials weigh gold materials stocks turn",-1,-0.16965055,0.09594491
31-01-2007,http://www.marketwatch.com/story/april-gold-last-up-1-or-660-at-657oz-2007-01-31,"april gold last up 1%, or $6.60, at $657/oz",1,0,0,0,1,0,positive,"['60 657', '60', 'oz', 'gold', 'april']","april gold last up 1%, or $6.60, at $657/oz 60 657 60 oz gold april",21,0.37976652,0.07920885
28-08-2017,https://economictimes.indiatimes.com/markets/commodities/news/gold-rate-today-track-gold-price-in-india-and-market-outlook/articleshow/60254418.cms,gold rate today: track gold price in india and market outlook,0,0,0,0,1,0,none,"['today track', 'rate', 'india', 'market outlook', 'gold price']",gold rate today: track gold price in india and market outlook today track rate india market outlook gold price,-1,-0.10352071,0.11480604
05-02-2018,https://www.moneycontrol.com/news/business/economy/january-gold-imports-plunge-to-17-month-low-on-subdued-demand-gfms-2499903.html,January gold imports plunge to 17-month low on subdued demand: GFMS,0,0,0,0,1,0,none,"['gfms', 'plunge 17 month', 'imports', 'low subdued demand', 'january gold']",January gold imports plunge to 17-month low on subdued demand: GFMS gfms plunge 17 month imports low subdued demand january gold,-1,-0.04763426,0.07537152
01-09-2006,http://www.marketwatch.com/story/gold-silver-futures-end-the-week-higher-2006-09-01,"gold, silver futures end the week higher",1,0,0,1,1,0,positive,"['higher', 'week', 'end', 'futures', 'gold silver']","gold, silver futures end the week higher higher week end futures gold silver",-1,-0.097176865,-0.4136654
19-11-2014,http://www.investing.com/news/commodities-news/gold-dips-on-expectations-that-fed-remains-set-to-raise-rates-next-year-317392,gold dips on expectations that fed remains set to raise rates next year,0,0,1,0,1,0,negative,"['expectations', 'gold', 'dips', 'fed remains set', 'raise rates year']",gold dips on expectations that fed remains set to raise rates next year expectations gold dips fed remains set raise rates year,-1,-0.12460113,-0.036592074
30-06-2010,http://www.marketwatch.com/story/gold-turns-modestly-lower-2010-06-30,gold turns modestly lower,0,0,1,0,1,0,negative,"['turns', 'lower', 'modestly', 'gold', 'gold turns modestly']",gold turns modestly lower turns lower modestly gold gold turns modestly,-1,-0.09741844,0.18758048
25-02-2013,http://www.marketwatch.com/story/ubs-is-predicting-a-major-gold-rally-this-year-2013-02-25,ubs is predicting a 'major gold rally' this year,0,0,0,0,1,0,none,"['year', 'predicting major', 'ubs', 'rally', 'predicting major gold']",ubs is predicting a 'major gold rally' this year year predicting major ubs rally predicting major gold,-1,-0.17227799,0.07164228
06-02-2013,https://www.moneycontrol.com/news/business/markets/-1762017.html,indian gold importers await price direction,0,0,0,0,1,0,none,"['await', 'gold', 'indian', 'importers', 'price direction']",indian gold importers await price direction await gold indian importers price direction,-1,-0.19211923,0.04119808
01-02-2017,http://www.marketwatch.com/story/gold-cautiously-adds-to-january-gain-as-fed-update-awaited-2017-02-01,Gold prices edge up after Fed holds steady on rates,1,0,0,0,1,0,positive,"['holds', 'edge', 'fed', 'steady rates', 'gold prices']",Gold prices edge up after Fed holds steady on rates holds edge fed steady rates gold prices,-1,-0.12661323,0.016911075
09-08-2016,http://www.marketwatch.com/story/gold-nears-multiweek-low-as-bias-tilts-to-higher-interest-rates-2016-08-09,Gold futures post modest gains to end two-session skid,1,0,0,0,1,0,positive,"['post modest', 'end session', 'gains', 'skid', 'gold futures']",Gold futures post modest gains to end two-session skid post modest end session gains skid gold futures,-1,-0.09842272,-0.34832647
05-03-2013,https://economictimes.indiatimes.com/news/economy/indicators/high-inflation-prompting-more-gold-buys-says-rbi-governor-d-subbarao/articleshow/18809466.cms,"high inflation prompting more gold buys, says rbi governor d subbarao",1,0,0,0,1,0,positive,"['governor', 'subbarao', 'says rbi', 'prompting gold buys', 'high inflation prompting']","high inflation prompting more gold buys, says rbi governor d subbarao governor subbarao says rbi prompting gold buys high inflation prompting",-1,-0.1143474,0.103678726
17-12-2014,http://www.investing.com/news/commodities-news/gold-edges-lower-ahead-of-federal-reserve-statement-320667,Gold edges lower ahead of Federal Reserve statement,0,0,1,0,1,0,negative,"['ahead', 'edges', 'federal', 'reserve statement', 'gold edges lower']",Gold edges lower ahead of Federal Reserve statement ahead edges federal reserve statement gold edges lower,-1,-0.13950604,0.008649468
25-06-2012,http://www.marketwatch.com/story/hedge-funds-short-stocks-bid-up-gold-2012-06-25,"hedge funds short stocks, bid up gold",0,0,0,0,1,0,none,"['short', 'gold', 'stocks bid', 'hedge', 'funds short stocks']","hedge funds short stocks, bid up gold short gold stocks bid hedge funds short stocks",-1,-0.24814512,-0.05609922
03-07-2014,http://www.marketwatch.com/story/gold-futures-log-first-loss-in-five-sessions-2014-07-03,gold futures log first loss in five sessions,0,0,1,0,1,0,negative,"['sessions', 'gold', 'futures', 'log loss', 'gold futures']",gold futures log first loss in five sessions sessions gold futures log loss gold futures,-1,-0.07876719,-0.49309254
05-07-2007,http://www.marketwatch.com/story/gold-futures-edge-lower-in-morning-trading-2007-07-05,gold futures edge lower in morning trading,0,0,1,0,1,0,negative,"['lower', 'morning', 'trading', 'edge', 'gold futures']",gold futures edge lower in morning trading lower morning trading edge gold futures,-1,-0.12439127,-0.4517287
27-02-2018,https://www.metalsdaily.com/link/277138/saxo-bank-optimistic-about-gold-price.htm,saxo bank optimistic about gold price,0,0,0,0,1,0,none,"['price', 'optimistic', 'bank', 'saxo', 'gold price']",saxo bank optimistic about gold price price optimistic bank saxo gold price,-1,-0.034318857,0.034023963
06-08-2011,https://www.thehindubusinessline.com/markets/commodities/Gold-at-a-new-high-of-Rs-2477010-grams/article20317958.ece,"Gold at a new high of Rs 24,770/10 grams",1,0,0,0,1,0,positive,"['high', '24 770 10', 'rs', '10 grams', 'gold new']","Gold at a new high of Rs 24,770/10 grams high 24 770 10 rs 10 grams gold new",-1,0.06358732,0.18958426
04-01-2017,http://www.marketwatch.com/story/gold-futures-inch-up-in-electronic-trading-after-fomc-minutes-2017-01-04,Gold futures inch up in electronic trading after FOMC minutes,1,0,0,0,1,0,positive,"['electronic', 'inch', 'minutes', 'trading fomc', 'gold futures']",Gold futures inch up in electronic trading after FOMC minutes electronic inch minutes trading fomc gold futures,-1,-0.09316853,-0.33911008
12-02-2009,http://www.marketwatch.com/story/spdr-gold-holdings-hit-new-record,spdr gold holdings hit new record above 900 tons,0,0,0,0,1,0,none,"['tons', 'gold', 'record 900', 'holdings hit new', 'spdr']",spdr gold holdings hit new record above 900 tons tons gold record 900 holdings hit new spdr,-1,-0.18506354,0.109325975
03-10-2018,https://economictimes.indiatimes.com/markets/commodities/news/gold-silver-price-climb-on-safe-haven-demand/articleshow/66050681.cms,"Gold rate today: Gold, silver price climb on safe-haven demand",1,0,0,1,1,0,positive,"['climb safe', 'rate today', 'demand', 'safe haven', 'gold silver price']","Gold rate today: Gold, silver price climb on safe-haven demand climb safe rate today demand safe haven gold silver price",-1,-0.07814345,0.10628357
11-08-2003,http://www.marketwatch.com/story/nymex-gold-closes-above-363-an-ounce-2003-08-11,gold contract tops $363 an ounce,1,0,0,0,1,0,positive,"['tops', '363', 'contract', 'gold', 'tops 363 ounce']",gold contract tops $363 an ounce tops 363 contract gold tops 363 ounce,-1,0.34359318,0.050421096
02-04-2018,https://www.thehindubusinessline.com/markets/gold/gold-rises-on-renewed-concerns-over-us-china-trade-war/article23412125.ece,Gold rises on renewed concerns over US-China trade war,1,0,0,0,1,0,positive,"['renewed', 'trade', 'china', 'concerns china trade', 'gold rises']",Gold rises on renewed concerns over US-China trade war renewed trade china concerns china trade gold rises,-1,-0.2208049,0.080188215
06-10-2005,http://www.marketwatch.com/story/dec-gold-climbs-390-to-two-week-high-at-47320oz-2005-10-06,dec gold climbs $3.90 to two-week high at $473.20/oz,1,0,0,0,1,0,positive,"['high 473 20', 'oz', 'dec', 'gold', 'climbs 90 week']",dec gold climbs $3.90 to two-week high at $473.20/oz high 473 20 oz dec gold climbs 90 week,21,0.33535075,0.0628641
